source,shared_from,date,text,reactions,likes,ahah,love,wow,sigh,grrr,comments,post_id,url
Yana for Wyo,,2020-02-01 09:42:21,"Trials have witnesses. This is a sham. If the Senate won't do its job, we need to throw them out and replace them with people who will.",27,15,,,,,12,,503301780561819,/story.php?story_fbid=503301780561819&id=337963610428971
Yana for Wyo,,2020-02-01 09:37:48,Destroying the environment for profit is bad for everyone. Even the profiteers need to breathe.,15,5,,,,5,5,,503298027228861,/story.php?story_fbid=503298027228861&id=337963610428971
Yana for Wyo,,2020-01-31 14:20:49,,30,21,,9,,,,,502813390610658,/story.php?story_fbid=502813390610658&id=337963610428971
Yana for Wyo,,2020-01-31 13:13:08,"Headline is a bit misleading, as it isn't on Trump's desk yet, but the gist is that Republicans appear poised to kill this needed protection one way or another. This is a classic example of the profits over people mentality I'm out to change in DC.",22,3,,,1,3,15,,502783293947001,/story.php?story_fbid=502783293947001&id=337963610428971
Yana for Wyo,,2020-01-30 12:13:09,,8,7,,,1,,,,502120297346634,/story.php?story_fbid=502120297346634&id=337963610428971
Yana for Wyo,,2020-01-29 22:33:09,"Support from the scientific community and many economists, and love of my kids are primary reasons I back Sanders Green New Deal.",17,9,,1,2,,5,,501743954050935,/story.php?story_fbid=501743954050935&id=337963610428971
Yana for Wyo,,2020-01-29 00:14:39,Wyomingites: take note of who our public lands candidates are.,18,15,,3,,,,,501179080774089,/story.php?story_fbid=501179080774089&id=337963610428971
Yana for Wyo,,2020-01-27 10:52:12,Vote for the person you believe is best on the issues. Electability measures are an utterly subjective speculation about other people's utterly subjective speculations. Vote for what is real in your life. #PresidentSanders,24,18,,6,,,,,500234027535261,/story.php?story_fbid=500234027535261&id=337963610428971
Yana for Wyo,,2020-01-27 01:13:33,,14,13,,1,,,,,499964794228851,/story.php?story_fbid=499964794228851&id=337963610428971
Yana for Wyo,,2020-01-26 17:15:24,This is a very interesting short read. Do you trust capitalism and the elites? Why or why not?,31,25,,1,,5,,,499773467581317,/story.php?story_fbid=499773467581317&id=337963610428971
Yana for Wyo,,2020-01-25 11:57:01,"Welcome, Merav Ben-David, to the primary process! I'm pleased that my first Dem ""opponent"" in this race is also a climate action advocate. One of my sub-goals in running for office was to make sure that climate could not be ignored, and Merav's entry into the race helps make that much more likely to be real.  I look forward to the kind of primary that focuses on honest differences, collegial consideration of how to solve the problems we both agree are real, and where voters really get to indicate what kind of leadership they want, based on policy. From everything I've learned about Merav, she's a woman with a lot of integrity and intelligence.  Looking forward to digging in to productive debate!",21,16,,5,,,,,498950697663594,/story.php?story_fbid=498950697663594&id=337963610428971
Yana for Wyo,,2020-01-25 10:56:13,"It may feel like the caucus in Wyoming is a long way off, and the primary even further away. But best check on this early, friends!",14,11,,3,,,,,498911271000870,/story.php?story_fbid=498911271000870&id=337963610428971
Yana for Wyo,,2020-01-22 16:40:45,,13,11,,2,,,,,497104687848195,/story.php?story_fbid=497104687848195&id=337963610428971
Yana for Wyo,,2020-01-23 10:51:21,In case there is any doubt in as anyone's mind about where I stand on this: privatizing the post office is a terrible idea.,30,30,,,,,,,497587557799908,/story.php?story_fbid=497587557799908&id=337963610428971
"Yana for Wyo,Danny Hernández",,2020-01-19 11:46:04,,13,11,,2,,,,,495088244716506,/story.php?story_fbid=495088244716506&id=337963610428971
Yana for Wyo,,2020-01-17 08:55:43,"I first came to Wyoming in 1994, and on that trip declared this to be the most beautiful state in the country.  I'm still a believer.",33,25,,8,,,,,493610034864327,/story.php?story_fbid=493610034864327&id=337963610428971
Yana for Wyo,,2020-01-16 18:25:46,"Wyoming's ""leadership"" continues to blow it when it comes to coal miners. My letter to the editor calling them out.",8,8,,,,,,,493221964903134,/story.php?story_fbid=493221964903134&id=337963610428971
"Yana for Wyo,Yana Ludwig",,2020-01-16 14:31:12,Yana makes it official: her choice for US President is Senator Bernie Sanders.,35,24,,11,,,,,493093861582611,/story.php?story_fbid=493093861582611&id=337963610428971
Yana for Wyo,,2020-01-16 14:08:01,,1,1,,,,,,,493080258250638,/story.php?story_fbid=493080258250638&id=337963610428971
Yana for Wyo,,2020-01-16 09:57:23,"Looks like Cynthia Lummis remains the woman to beat in this race. We need to organize, friends.  We have the numbers to win this seat, but we need to be active, talk to people about wanting something better for Wyoming and the US, and make sure to get people to the polls.",41,33,,8,,,,,492902601601737,/story.php?story_fbid=492902601601737&id=337963610428971
Yana for Wyo,,2020-01-15 14:45:10,"This looks like clear misuse of government funds to me. The Department of Justice is supposed to be pro-justice not against it. And their environmental division should NOT be siding with companies that destroy the environment, and are against the interests of the people. This is wrong on so many levels.",35,7,,,2,6,20,,492251861666811,/story.php?story_fbid=492251861666811&id=337963610428971
Yana for Wyo,,2020-01-15 10:18:06,"Human are struggling right now on a lot of fronts-- economically, socially, ecologically-- and it can be hard to think beyond our immediate struggles. Some of our industries have ""business as usual"" practices that would be hard to change. I get all of that. And... we share this planet, this state, these lands with other creatures. They too have a right to exist. And when it comes down to it, our fates are closely tied together. Human policies that lead to the destruction of other species will ultimately lead to the destruction of humanity. Science needs to lead land use planning policy, not profit. Period.",9,6,,,,2,1,,492082805017050,/story.php?story_fbid=492082805017050&id=337963610428971
Yana for Wyo,,2020-01-14 20:57:05,"Let's replace Senator Enzi with someone who actually cares about consumer protection, and reining in financial institutions who abuse people.",20,17,,1,2,,,,491618918396772,/story.php?story_fbid=491618918396772&id=337963610428971
Yana for Wyo,,2020-01-14 13:08:52,,16,11,,5,,,,,491366581755339,/story.php?story_fbid=491366581755339&id=337963610428971
"Yana for Wyo,femifesto",,2020-01-12 15:26:16,"I don't normally repost twitter threads, but this is really good. Young people have been handed a bad setup and expected to perform to a standard that is unreachable for most of them. We need people in power who understand that and are willing to be partners to change the game. I'm down for that ride.",26,22,,4,,,,,491215648437099,/story.php?story_fbid=491215648437099&id=337963610428971
"Yana for Wyo,No Dem Left Behind",,2020-01-13 11:10:48,"Big thanks to No Dem Left Behind for their endorsement today and their partnership moving forward!  I'm grateful to be part of a coalition focused on rural Democrats running in red states. We are bridging gaps not normally bridged, and I'm grateful to be recognized as a worthy candidate by this group.Today we are happy to announce an addition to our coalition: Yana Ludwig, candidate for U. S. Senate in Wyoming. Read more about why Yana is running, and we we have added her to the coalition below.",22,15,,7,,,,,490626895162641,/story.php?story_fbid=490626895162641&id=337963610428971
Yana for Wyo,,2020-01-13 11:17:18,Thanks to the Rocket Miner for this great profile piece of Yana!,39,28,,11,,,,,490457481846249,/story.php?story_fbid=490457481846249&id=337963610428971
Yana for Wyo,,2020-01-13 11:10:18,"We have a serious problem in Wyoming with suicide. Economic security is a suicide prevention factor.  This is one of the many reasons why I favor programs like raising the minimum wage, Medicare for All, and the empowerment of unions and worker owned cooperatives. These are all examples of initiatives that increase our material security, and decrease our despair.",21,21,,,,,,,490452461846751,/story.php?story_fbid=490452461846751&id=337963610428971
Yana for Wyo,,2020-01-13 10:55:04,"This is horrifying for all the reasons mentioned in the article: the loss of a beloved public institution, the ""drill baby drill"" mindset that is killing the planet, the de-education of our populace around science, the loss of wildlife, and the profiteering at public expense. And you know who has supported these moves away from federal lands programs? Both Cynthia Lummis and Liz Cheney. So much for having Wyoming's best interests at heart.",36,1,,,,13,22,,490442358514428,/story.php?story_fbid=490442358514428&id=337963610428971
,,2020-01-10 10:12:05,,19,15,,3,,,,,2487318348203504,/events/2487318348203504?view=permalink&id=2487318351536837
Yana for Wyo,,2020-01-09 21:26:14,"Here's an article for all the ""how will we pay for it"" skeptics. Insurance is an added expense that provides no real benefit and for most of us is a ginormous pain in the butt... and amounts to 1/3 of our ""healthcare"" costs. This is why I say we have a #profitcare system, not a healthcare system. #M4A  #MedicareForAll",24,18,,,2,2,2,,487236825501648,/story.php?story_fbid=487236825501648&id=337963610428971
Yana for Wyo,,2020-01-09 16:16:46,Would love to connect with the 1/2 of Republicans who are with us on universal health care!,11,9,,2,,,,,487071925518138,/story.php?story_fbid=487071925518138&id=337963610428971
Yana for Wyo,,2020-01-08 08:54:59,"I'm learning a lot of history right now and it is making me more angry. This piece I've now seen from multiple sources,  and I trust the Zinn Project so I am finally sharing it. The gist is that US involvement with Iran began when Iran decided to socialize their oil fields rather than have them owned by foreign companies. Let that sink in. We decided to mess with a country that was taking care of their people with their own resources, rather than letting wealthy American and British interests use them. That was the start of this whole mythology around American interests being threatened. It wasn't about American lives. It was about American corporate interests. That's our legacy there.  And you can trace all of the hostilities toward us (which are real) back to this, and to acts like this. So when do we stop the cycle? When do we stop spending over half of our budget on the military, on these kinds of 1% manufactured ""interests""? When do we stop spending our children's lives like they are pawns in corporate chess. I say now. #NoWarOnIran #USComeHome #ThePeoplesImpeachment",28,26,,,,2,,,485949988963665,/story.php?story_fbid=485949988963665&id=337963610428971
"Yana for Wyo,Yana Ludwig",,2020-01-07 12:15:49,"I'm outside the Albany County Commissioners meeting with dozens of my neighbors. I've already been in and spoken against, and everyone who has spoken has been against.Just joined dozens of my neighbors in showing up to the Albany County Commissioners meeting to oppose zoning changes to let businesses open on top of our sensitive aquifer. All of us who have spoken are against. This is the view from the hallway outside a packed room. When I arrived, a guy told me I was #45 who couldn't get in the room. #WaterIsLife",7,5,,2,,,,,485273405697990,/story.php?story_fbid=485273405697990&id=337963610428971
Yana for Wyo,,2020-01-07 11:14:23,"Our ""leaders"" are ""conspicuously missing"" from the list of supporters because ""coal"" to them means owners and profiteers, not working people. And I'm far more interested in the well-being of the real people doing the work than I am in the well-being of profits.",11,10,,,1,,,,485232212368776,/story.php?story_fbid=485232212368776&id=337963610428971
"Yana for Wyo,Yana Ludwig",,2020-01-07 09:48:38,"Last night, I participated in an extraordinary call of candidates and other activists all over the country. We are forming the core of The People's Impeachment movement, to turn the momentum away from a war on Iran, and to demand President Trump's resignation. This is not a chance to sign more petitions: it is a chance to get involved with a coordinated effort of local activism. Will you join me?",14,12,,2,,,,,485172819041382,/story.php?story_fbid=485172819041382&id=337963610428971
Yana for Wyo,,2020-01-06 09:27:09,"1) What Rep. Cheney fails to mention is that Iran recently discovered a very rich new oil field. Coincidence? I think not. https://apnews.com/a6adb7b30adb444998541b1b5aca4332  2) I don't believe for a second that this is about someone being a war-monger, given that this is coming from a Cheney. 3) My sons are not your cannon fodder, Liz. Your family isn't going to have their young people at risk because that's not how the 1% rolls. 4) Meeting violence with violence doesn't work.",31,10,,,1,3,17,,484324719126192,/story.php?story_fbid=484324719126192&id=337963610428971
Yana for Wyo,,2020-01-06 08:56:18,"If your fundamental belief is that killing people is a viable problem solving tool, then the details are not as important as the fact that you will reach for the death another human being as a tool.  I believe in the deepest part of me that violence is not a viable answer to anything. I believe this about war, I believe it about the police, and I believe it about your abusive partner or parent. Violence does not solve things.",23,19,,2,,2,,,484302382461759,/story.php?story_fbid=484302382461759&id=337963610428971
Yana for Wyo,,2020-01-05 19:51:32,"Pete Gosar is one of the best local officials we have. If you are in Laramie and are available Tuesday morning, consider heeding his call and showing up to protect our waters at this week's County Commission meeting.",4,3,,1,,,,,483870135838317,/story.php?story_fbid=483870135838317&id=337963610428971
Yana for Wyo,,2020-01-05 16:33:35,Big Pharma is trying to kill you while pretending to heal you. We need radical reform of our healthcare system.  #MedicareForAll #DeprivatizePharma,27,11,,1,2,2,11,,483768925848438,/story.php?story_fbid=483768925848438&id=337963610428971
Yana for Wyo,,2020-01-05 15:23:08,"Every time I have a conversation with a young person in Wyoming about politics, I'm left a little in awe of how smart and engaged you all are. Thank you.",32,29,,3,,,,,483728802519117,/story.php?story_fbid=483728802519117&id=337963610428971
Yana for Wyo,,2020-01-04 21:47:55,Time to repost this.,49,35,,3,1,7,3,,483067595918571,/story.php?story_fbid=483067595918571&id=337963610428971
Yana for Wyo,,2020-01-04 21:15:30,"To the gentleman who yelled out his car window at us today, ""So it's OK for Iran to kill Americans?"" the answer is ""Of course not."" Tit for tat is no basis for international relations. It would be refreshing if our foreign policy involved a basic ethic of being adults, and ending cycles of violence instead of feeding them.",20,20,,,,,,,483049625920368,/story.php?story_fbid=483049625920368&id=337963610428971
Yana for Wyo,,2020-01-04 21:11:24,"THIS is actual free speech, not money that gets dumped into elections. We must protect people's rights to speak out and protest, and the threat of losing one's job should be offensive to anyone who values liberty.",19,3,,,,3,13,,483046849253979,/story.php?story_fbid=483046849253979&id=337963610428971
Yana for Wyo,,2020-01-04 15:34:31,"#WhatsYourSign? Post pictures of you with your anti-war message here! And if you want to start this on your own page, let's all use these hashtags, and please tag us! #WhatsYourSign #NoWarWithIran #EndUSWars #WWIII Yana for Wyo",16,14,,2,,,,,482866672605330,/story.php?story_fbid=482866672605330&id=337963610428971
,,2020-01-04 14:27:21,Anti war protest in Laramie,57,42,,15,,,,,2466955143516993,/story.php?story_fbid=2466955143516993&id=337963610428971
Yana for Wyo,,2020-01-04 10:43:41,"No War with Iran action, today at noon, corner of Third and Grand in Laramie. I will be there. These actions are happening all over the country. If you know of other similar protests happening today in Wyoming, please drop them into the comments. Let's show up Wyoming!",6,5,,1,,,,,482684132623584,/story.php?story_fbid=482684132623584&id=337963610428971
Yana for Wyo,,2020-01-04 01:26:09,I support this.,42,34,,8,,,,,482337672658230,/story.php?story_fbid=482337672658230&id=337963610428971
Yana for Wyo,,2020-01-03 10:40:11,"There are so many things I want to say about my country killing one of the most important Iranian military officers last night. A huge chunk of what I do professionally involves helping people find solutions other than violence to their problems.  The US government keeps getting this wrong. This isn't about me not ""supporting the troops"". I don't believe sending people to needless deaths is ""support"". We've lost almost 4,500 troops, and have wounded and permanently psychologically scarred tens of thousands more, and spent trillions of dollars on this war. If I wouldn't be willing to send my own son into it, I'm sure as hell not willing to send other people's children into it. Trump's dangerous escalation is just leading us down the path to more of the same. I'm not interested in more dead soldiers. I'm not interested in intensified war zones that do more ecological damage to the planet and to the local places where they are happening.  I am far more interested in my tax dollars and yours being spent to care for people than to kill people. Trump promised to end endless wars, but we are calling out that lie today: his careless, violent tendencies are only making us more warlike. Enough.",35,30,,,,1,4,,481834852708512,/story.php?story_fbid=481834852708512&id=337963610428971
Yana for Wyo,,2020-01-02 23:13:57,Wyomingites who believe that it is none of the government's damn business if someone gets an abortion or not have no one representing them in DC right now. Let's change that.,44,22,,,2,,20,,481425286082802,/story.php?story_fbid=481425286082802&id=337963610428971
Yana for Wyo,,2020-01-02 15:35:25,You shouldn't be taxed until you've made enough to cover the basics. And you sure as hell shouldn't be taxed more than the top tiers of income earners. #TaxTheRich,31,25,,5,1,,,,481179192774078,/story.php?story_fbid=481179192774078&id=337963610428971
Yana for Wyo,,2020-01-02 09:59:20,"This is offensive in large part because it is paternalistic. Wealthy people always want to tell working people what we ""should"" do with our lives, and how they have the best ideas to ""fix"" us.   Coal miners are a diverse group of humans with diverse interests. How about we create an economy based on worker ownership and with a diversity of industries, and let people figure out what they want their own lives to look like?",18,15,,1,,,2,,480971746128156,/story.php?story_fbid=480971746128156&id=337963610428971
Yana for Wyo,,2020-01-02 09:32:33,"I'm running for all of us who know this story far too intimately.  I read somewhere recently that in a long term study of poverty in the US, they found it generally takes a full 20 years of nothing going wrong to actually get out of poverty and have enough of a cushion to stay there. Think back to the last 20 years of your life when nothing went wrong.... Exactly. It doesn't happen. What we need is a new economic system that isn't driven by profit at the expense of people's real lives. That's why I'm here.",53,38,,6,1,7,1,,480950562796941,/story.php?story_fbid=480950562796941&id=337963610428971
Yana for Wyo,,2020-01-01 14:02:46,"""...market logic dictates that rather than take the financial hit that comes with cutting profits, it's more reasonable to find a way to make money off the boiling ocean. Nothing illustrates this phenomenon better than the burgeoning climate-change investment industry. According to Bloomberg, investors are looking to make money off of everything from revamped food production to hotels for people fleeing increasingly hurricane-ravaged areas."" This is what Naomi Klein calls Disaster Capitalism: create a business plan to make money off of other people's suffering and desperation. In order to effectively address climate disruption, we need to understand that the enemy is the ultra-wealthy, and their allies are the politicians they buy.  I'm not for sale.",23,19,,,,,4,,480273796197951,/story.php?story_fbid=480273796197951&id=337963610428971
Yana for Wyo,,2020-01-01 10:31:55,It's 2020. Let's do this!,21,17,,4,,,,,480140246211306,/story.php?story_fbid=480140246211306&id=337963610428971
Yana for Wyo,,2019-12-31 15:17:34,"Wyoming has been steadily losing population for a long time. Perhaps this is a solution? I get asked the question in interviews about how I'm going to develop the Wyoming economy, and I have thoughts about that for sure. But local communities should be supported in answering those questions for themselves, and refugees have an excellent track record for starting new businesses that employ local people. Why not bring new, creative, dedicated energy in and let it develop organically?",40,31,,9,,,,,479345706290760,/story.php?story_fbid=479345706290760&id=337963610428971
"Yana for Wyo,Yana Ludwig",,2019-12-31 13:16:28,"For folks interested in my personal reflections on the journey that has been my last decade, here ya go. Wishing everyone a very happy new year! 2020 is going to be an amazing year of growth and change, and I'm happy to be in this with all of you.I'm looking back on a decade ago, as we are wont to do when these things come to a close.  10 years ago, I was in my very first week of doctors' appointments for what would turn into a 10 month mystery search to understand why I was incredibly sick and getting sicker. It seems like longer than a decade, honestly. Maybe because I lost the bulk of the first three years of it to chronic Lyme disease. But I got better. I'm very, very lucky on that front. Many of the people who I met during those years are still home-bound, bed bound. Some have died, and a few are lucky like me and are back on our feet and doing our lives. Lyme taught me that my worth and my ability to make money are not the same thing. It taught me that I could survive and even find the strength to be an agent of my own survival when things were incredibly hard to even get out of bed. It also taught me that my time here is precious and limited, and I sure as hell better be doing something good with it. So the rest of the decade has been better, though really hard at many moments: I've stretched myself in ways I could never have imagined and have gone places (literally and figuratively) I never thought I'd go. But I've done my best to heed the ""do something good with your time"" lesson.  In 2013, I did a TEDx talk called ""Sustainable is Possible! (And it doesn't suck...)"" and became the first Executive Director of the Center for Sustainable and Cooperative Culture. In 2014, I was part of a fledging anti-racism group in rural Missouri, while leading the development of that nonprofit from an incredibly barebones operation to a thriving organization. Also, it was my year of the empty nest as my son started college. In 2015, I spent half of the year on the road doing a national speaking tour about community building and climate disruption, got divorced from my second husband, and met Matt J Stannard. In 2016, I moved to Wyoming, left Dancing Rabbit Ecovillage where I had lived for over 8 years and built my own strawbale home, become the Executive Director of Commonomics USA, and went to my first New Economy Coalition gathering. In 2017, I published ""Together Resilient: Building Community in the Age of Climate Disruption"" which later that year won the Communal Studies Association Book of the Year Award. Somewhere in there, I did a research study on success factors in cooperative living with Zach Rubin and Don Willis, which later resulted in my first publication in an academic journal. Perhaps most importantly, I married Matt and officially because the step-mom to some amazing kids. In 2018, after three years of organizing work, the Solidarity Collective found its home outside of Laramie on 3 acres of land and in one of the oldest still-standing buildings in Wyoming, becoming Wyoming's only commune. I was also a founding member of Albany County for Proper Policing, and worked as a professional organizer for the first time for Showing Up for Racial Justice. In 2019, I became a member of the Democratic Socialists of America, and launched my US Senate campaign. My consulting practice that focuses on cooperative culture and economics also took off after years of being a minor piece of my work scene, and I was able to stop working $10/hour retail jobs to get by.  Always this decade, I've been either a Board or staff member of the Foundation for Intentional Community. I've facilitated hundreds of meetings, and participated in even more. I've had a lot of students this decade, and have discovered that I love chickens. And I'm blessed with friends all over the country, and an increasing number of friends all over Wyoming.  Thanks for being on this journey with me.",4,3,,1,,,,,479253932966604,/story.php?story_fbid=479253932966604&id=337963610428971
Yana for Wyo,,2019-12-31 10:34:55,"Help our campaign end the year on a high note! Yana is running against big fossil fuel money, and years of political inertia. Can you chip in $3-30 to help her make a go of it in 2020? https://secure.actblue.com/donate/yana-for-wyo-1?utf8=%E2%9C%93&amount=&commit=Contribute",6,1,,5,,,,,479093499649314,/story.php?story_fbid=479093499649314&id=337963610428971
