source,shared_from,date,text,reactions,likes,ahah,love,wow,sigh,grrr,comments,post_id,url
Yana for Wyo,,2020-03-12 17:45:00,"This is playing games with people's lives, and with the stability of our economy. We need Medicare for All, and paid sick leave. I wish this was not happening, but corona virus is making the case for both in real time and space. #MedicareForAll #FlipTheSenate",31,7,,,,5,19,,529615067930490,/story.php?story_fbid=529615067930490&id=337963610428971
Yana for Wyo,,2020-03-09 17:52:03,"We are getting a sudden peek under the rug of economic realities in this country and how they intersect with public health. I'm aching knowing that many working people will die as a result of this... and many others will be blamed for ""encouraging"" the spread of coronavirus by simply doing what they have to do to survive. #MedicareForAll #PaidSickLeave #LivingWagesNow",36,28,,4,,4,,,528074731417857,/story.php?story_fbid=528074731417857&id=337963610428971
Yana for Wyo,,2020-03-09 10:51:38,There are many things Medicare for All will eliminate: Copays Deductibles Premiums Hours long phone calls begging for coverage  Suprise bills Someone gatekeeping you going to the doctor Tortured decisions about which tests to get run Coworkers not getting treated for contagious diseases.... And this crap.,22,10,,5,2,1,4,,527460428145954,/story.php?story_fbid=527460428145954&id=337963610428971
Yana for Wyo,,2020-03-08 11:08:21,This is pretty interesting. I'm glad Americans are starting to explore different voting methods.,1,1,,,,,,,526826958209301,/story.php?story_fbid=526826958209301&id=337963610428971
"Yana for Wyo,Cindy Upchurch,Progressive Views OUR REVOLUTION",,2020-03-05 23:20:32,"End the death penalty now. This is horrible and unfortunately non-unique.""Woods' co-defendant, who has confessed to being the triggerman and denies Woods was complicit, implored for his execution to be stopped.""",30,2,,1,,18,9,,525128598379137,/story.php?story_fbid=525128598379137&id=337963610428971
Yana for Wyo,,2020-03-05 17:47:38,"When I talk about economic insecurity, I am talking about representing folks for whom FINALLY being able to put bills on autopay because you know there will be the money there to cover it would be HUGE. I'm talking representing the working poor as part of my constituency.",20,13,,7,,,,,524999568392040,/story.php?story_fbid=524999568392040&id=337963610428971
"Yana for Wyo,Wyoming Democratic Women's Caucus",,2020-03-04 13:56:24,"Voting is a basic right. If you have that right, please vote! (Plus you can test fly the nifty new ranked choice voting system our state party has worked hard to put together for us.)Uodate** LAST DAY TO GET A BALLOT! Mail in caucus voting for those registered D by 3/20. Visit wyodems.org to request a ballot. 💙💙💙",12,11,,1,,,,,524991118392885,/story.php?story_fbid=524991118392885&id=337963610428971
Yana for Wyo,,2020-03-05 14:48:38,Cynthia Lummis sure has some odd notions about what good governance looks like. Here's my response to a recent interview she did.,7,4,,2,1,,,,524922701733060,/story.php?story_fbid=524922701733060&id=337963610428971
Yana for Wyo,,2020-03-05 14:43:54,"Great conversation with the Rocket Miner staff about the changing landscape of politics in Wyoming, the role of compassion, and getting the shame out of our healthcare system.",18,15,,3,,,,,524920375066626,/story.php?story_fbid=524920375066626&id=337963610428971
"Yana for Wyo,BuzzFeed",,2020-03-05 14:05:43,"This is literally the most regressive tax we could come up with. And this from a state legislature that won't tax big box companies that make millions (or more) of dollars a year for their CEOs and shareholders. Policy that hates on the poor will never have my support.A senator's annual stipend for office furniture is $40,000. That's more than what half of Americans make in a year.",14,2,,,2,2,8,,524903535068310,/story.php?story_fbid=524903535068310&id=337963610428971
Yana for Wyo,,2020-03-05 14:02:38,"Will you join me in being part of this team for Wyoming? I'm here for all people in Wyoming, whether we agree or disagree on politics. I'm going to stand for your rights to a workable life, and to a stable environment.",12,9,,3,,,,,524902148401782,/story.php?story_fbid=524902148401782&id=337963610428971
Yana for Wyo,,2020-03-03 16:44:57,Wyoming ranchers for wind. Nice.,22,22,,,,,,,523669161858414,/story.php?story_fbid=523669161858414&id=337963610428971
Yana for Wyo,,2020-03-03 10:27:33,"One candidate has a movement that is much bigger than himself. I want women in power-- many women. And I want people of color in power-- many people of color. The President is not the only office we are deciding how to fill with this election-- it also also hundreds of other jobs. Is it odd that I think the guy who has surrounded himself with women and people of color is the most likely to usher in a cabinet, judges and a host of other jobs that would be the most diverse the US has ever seen? Is it odd that I think the guy who lost family to the holocaust has a solid understanding of the importance of resisting fascism and knows that a robust, diverse leadership group is one key part of resisting that? On the fence? Vote Bernie.",13,8,,5,,,,,523487001876630,/story.php?story_fbid=523487001876630&id=337963610428971
Yana for Wyo,,2020-03-02 11:15:03,"This interview is mostly about my sustainability and community work, so if you've been curious about that, check it out. There is a bit about the campaign as well, which could give you more context about why I'm running. https://www.buzzsprout.com/892552/2864086-ep-1-yana-ludwig?fbclid=IwAR3t5UWORBibUaDUhGsnGs1cUI_xkBFCepe1clNsttl0JGgCRAPq7ya2oh8",8,8,,,,,,,522838031941527,/story.php?story_fbid=522838031941527&id=337963610428971
Yana for Wyo,,2020-03-02 09:26:32,Violence against trans people is on the rise. Trans women of color in particular are the most likely people to be murdered. I stand with my trans sibs in condemning this violence.,61,6,,,2,13,40,,522777258614271,/story.php?story_fbid=522777258614271&id=337963610428971
Yana for Wyo,,2020-03-02 09:12:59,"Conventional wisdom is that candidates need to do hours of ""call time"" a day, calling people for donations. For working people, this is impossible. Instead, we rely on things like our social media feeds to bring donations in.  Can you chip in $10 today? https://secure.actblue.com/donate/yana-for-wyo-1?utf8=%E2%9C%93&amount=&commit=Contribute",5,5,,,,,,,522769495281714,/story.php?story_fbid=522769495281714&id=337963610428971
"Yana for Wyo,U.S. Senator Bernie Sanders",,2020-02-28 16:34:04,"This administration continues to target already vulnerable populations. Here, it is the elderly, children, people with disabilities. This is why we need a movement in response that brings all of us together to fight back.",2,,,,,,2,,522745168617480,/story.php?story_fbid=522745168617480&id=337963610428971
Yana for Wyo,,2020-03-01 20:53:00,"I'm much more interested in actual advocacy and action on climate and on behalf of marginalized groups than I am in tone policing. If you are afraid of what is coming, or angry about how things have been, you don't have to make it polite and politic for me to take it seriously.  Because ya know what? I'm afraid and angry, too.",8,7,,1,,,,,522441418647855,/story.php?story_fbid=522441418647855&id=337963610428971
Yana for Wyo,,2020-03-01 20:07:25,"This dynamic of secrecy will be very familiar to folks who read Jeff Lockwood's excellent book Behind the Carbon Curtain. One of the weird things for me when I moved here is how much the fact that fossil fuels run Wyoming is just out on the table and blatant, and this kind of in your face withholding of information from the public is just accepted. It's never stopped feeling to me like being in an abusive, non-consensual relationship with corporate big fossil fuels though.",23,4,,,1,4,14,,522423075316356,/story.php?story_fbid=522423075316356&id=337963610428971
Yana for Wyo,,2020-03-01 13:50:00,"California might not surprise folks, but that bastion of liberalism, Texas...",16,12,,1,3,,,,522259235332740,/story.php?story_fbid=522259235332740&id=337963610428971
Yana for Wyo,,2020-03-01 12:03:49,"Delighted to announce that Dana Pertermann has expanded her role with the campaign and is now our new Campaign Manager! Dana's combination of excitement about Yana's candidacy and many years of grounding in Wyoming campaigns has already been a huge boost to the campaign. One of Dana's first pet projects has been creating a Vets for Yana page, and we are honored to have the veteran's community showing their support in this way. (We will drop a link in the comments if you'd like to join!) Dana is a wife and mother who wants to help make Wyoming a better place to live for all Wyomingites. Having served in the Army for 8 years, she’s concerned about endless wars and support for Veterans of all branches. Having volunteered for the campaigns of Kerry, Obama, Sanders, and Clinton, as well has having worked for the Wyoming Democratic Party as a Field Organizer, she’s now excited to take on this new role in Yana Ludwig’s campaign! Please join me in welcoming Dana!",62,47,,14,1,,,,522166872008643,/story.php?story_fbid=522166872008643&id=337963610428971
Yana for Wyo,,2020-03-01 09:56:41,Important Sunday thought. Hope you enjoy the rest of the weekend!,29,25,1,3,,,,,522093065349357,/story.php?story_fbid=522093065349357&id=337963610428971
Yana for Wyo,,2020-02-29 23:54:59,"I've gotten to introduce a lot of folks in Wyoming to the concept of worker ownership through this campaign. Here's a sweet example of one that highlights humane conditions, the latinx community, and disability inclusion.",23,13,,10,,,,,521775005381163,/story.php?story_fbid=521775005381163&id=337963610428971
Yana for Wyo,,2020-02-29 17:03:08,"I've gotten pushback when I have s as I'd that $15/hour is a good start, but not sufficient in many places.  Here's some hard data to back that up in Wyoming. The lowest living wage by county in the state is over $14.  Raise the minimum wage, and eliminate all the exceptions to it. Peg minimum wages to a living wage calculator.  Mandate a wage ratio so that CEOs are no longer able to make hundreds of times what their employees make. Pass Medicare for All. Forgive student loans, and make public education free. Have a federal childcare guarantee. Make is easier for labor to organize. Now THAT would be a good start.",32,20,,11,,1,,,521600728731924,/story.php?story_fbid=521600728731924&id=337963610428971
Yana for Wyo,,2020-02-29 16:34:48,"I like this kind of news.  I once played a game with some friends that we dubbed, ""I will believe that corporations are people when Texas executes one."" Guess who we decided should go first?",32,27,,5,,,,,521589595399704,/story.php?story_fbid=521589595399704&id=337963610428971
Yana for Wyo,,2020-02-29 15:24:06,"I don't like wall street or mega-corporations. I don't like that CEOs make on average 360X what workers make in the US. What do I like? I like small, locally owned businesses that treat their employees well and are responsive to the needs of their local communities. I like strong unions that give workers the power to negotiate for better wages, benefits and treatment. And I especially like worker-owned cooperatives, where the workers themselves manage, decide and get the full value of their labor because they are the ones keeping the profits. All of these lead to a more democratized economy.",11,10,,1,,,,,521561028735894,/story.php?story_fbid=521561028735894&id=337963610428971
Yana for Wyo,,2020-02-29 11:50:13,"""Viruses and infectious diseases don’t check your deductibles, co-pays and network access before they strike. Doubters may claim that our nation can’t afford Medicare-for-all, but it’s increasingly likely that we are about to discover just how costly our current system really is."" #M4A",34,30,,3,1,,,,521459598746037,/story.php?story_fbid=521459598746037&id=337963610428971
Yana for Wyo,,2020-02-29 11:41:46,My respect for Rep. Mike Yin continues to grow.,18,18,,,,,,,521455145413149,/story.php?story_fbid=521455145413149&id=337963610428971
Yana for Wyo,,2020-02-29 09:11:26,"I've really like Rep. Stan Blake the couple times I've met him. Among other things, like being smart and funny, we share a love of trains and unions.  Thank you Rep. Blake, and thank you Wyoming House!",5,5,,,,,,,521369898755007,/story.php?story_fbid=521369898755007&id=337963610428971
Yana for Wyo,,2020-02-28 22:22:27,"I may have lost a vote today of someone I really respect. On the long drive home, I thought about it a fair bit. Essentially me short-handing where I stand on a bunch of stuff by saying I am ""the Bernie Sanders in the race"" is hard for some people who are still hurting from the hard stuff that went down around the 2016 race between Sanders and Clinton. I want to say that I get it. 2016 was messy from a LOT of angles, and trust has not been fully restored between the different groups. And people are nervous about a repeat and it is leaving a lot of folks on edge. (This despite a pretty major leadership and systems reboot within the Wyoming party.) I also want to say this: I'm owning that I believe in  Bernie Sanders, both as a man of integrity and also that I think his policy approaches are the most compassionate, inclusive and responsible of all of the candidates, and that my own policy stances are the most closely aligned with his of all the presidential candidates. When I say I'm a Sanders Dem, it is shorthand for many things. I also want that statement to be helpful. We are going to have a real primary, and I believe in democracy. That means that I want you to vote for the person in the primary that you sincerely believe-- based on being informed-- is holding both the vision and the policy that will best support you, your family and the communities you care about to get the world you need to survive, and that fires your imagination for a really GOOD future. So I'm going to be honest. You are going to know what I believe, even if we all know some of that is a stretch for many people. You are going to know who and what I stand for. And if we disagree, I'm going to stay in the conversation with you long enough for us to understand our differences and where they are coming from.  This isn't political gamesmanship on my part. It is an attempt to be that thing that we all want and are mostly deeply skeptical about: an honest candidate. And it is an attempt to support actual informed democracy. I tell ya what: let's make a deal. I will be as fully honest as I can be, and encourage the other candidates in the race to be as well. In return, will you please NOT check your discernment at the door? Will you please look at the candidates in terms of policy and vote accordingly?  I think if we each do that, we are doing our best by the values of democracy.",61,45,,16,,,,,521088288783168,/story.php?story_fbid=521088288783168&id=337963610428971
Yana for Wyo,,2020-02-25 11:26:52,Yana will be live tonight at 8:30 pm (Mountain!) on the Rick Smith Show.,,,,,,,,,518894075669256,/story.php?story_fbid=518894075669256&id=337963610428971
Yana for Wyo,,2020-02-28 10:41:24,Come and talk to Yana Ludwig at Western Wyoming Community College’s Pendulum today until 11:30am!,6,4,,2,,,,,520779855480678,/story.php?story_fbid=520779855480678&id=337963610428971
Yana for Wyo,,2020-02-27 14:14:09,"Don't forget tonight's event, if you're in the Rock Springs area!",3,3,,,,,,,520236352201695,/story.php?story_fbid=520236352201695&id=337963610428971
Yana for Wyo,,2020-02-27 10:10:50,"Rough couple of days ahead :) Drive across the state to Rock Springs, jams blaring. Do an interview on the Rocket Miner's brand spankin' new podcast. Meet with my new campaign manager... (stay tuned for announcement!) Bowl, pizza and beer with voters. Sleep! Table tomorrow morning at Western Wyoming Community College, and give some t shirts and Zines away. Lunch with Sweetwater County Dems, play some Yana Bingo. Drive across the state home, jams blaring. #CampaignLife",9,8,,1,,,,,520112858880711,/story.php?story_fbid=520112858880711&id=337963610428971
,,2020-02-27 08:56:06,,12,10,,2,,,,,2593470380942455,/events/2593470380942455?view=permalink&id=2593470384275788
Yana for Wyo,,2020-02-26 22:32:23,There is no universe in which Mike Pence is qualified to oversee a pandemic response.,45,39,1,,,5,,,519810688910928,/story.php?story_fbid=519810688910928&id=337963610428971
"Yana for Wyo,Wyoming Sportsmen for Federal Lands",,2020-02-25 20:45:25,"People should have the right to vote for whoever they want to in the primary. This party loyalty thing is fundamentally anti-democratic.HB209 PASSES FIRST READING IN THE HOUSE! HB209, which prohibits changing major parties within two weeks of  primary election day, passed first reading in the House of Representatives. Because it was a voice vote, we were unable to tell how many voted for it. But it sounded close. Click here to see the bill: https://www.wyoleg.gov/Legislation/2020/HB0209?fbclid=IwAR3WxR5Cu2BnS1TgjRPIFu5GwlhfcJBk1RlgKGF6O5rmgxLvjcBjVYaRCDI A representative from Laramie County made the argument that campaigning should also be prohibited two weeks before the primary because voters would no longer have the option to change their mind. It was an excellent point that fell on deaf ears.  The bill must still pass 2nd and 3rd readings by Thursday. We encourage you to contact your representative and ask him/her to vote ""no"" on the next step.  This bill amounts to voter suppression, and the citizens of Wyoming should not tolerate it! The only hope we have of killing it is if A LOT of people contact their legislators. Find your legislator here: https://www.wyoleg.gov/Legislators/2020/H",15,13,,1,1,,,,519540282271302,/story.php?story_fbid=519540282271302&id=337963610428971
Yana for Wyo,,2020-02-25 23:05:50,"Yana's interview starts about an hour and a half in to this show. Talk about the Green New Deal, wage ratios, planned obsolescence, Medicare for All, and the multi-racial working class shift in American politics. https://twitter.com/RickSmithShow/status/1232485515804299264",5,5,,,,,,,519198842305446,/story.php?story_fbid=519198842305446&id=337963610428971
Yana for Wyo,,2020-02-25 16:53:12,We do not need more fossil fuel infrastructure or drilling. And other species are not ours to sacrifice on the altar of profits.,15,3,,1,,,11,,519047568987240,/story.php?story_fbid=519047568987240&id=337963610428971
Yana for Wyo,,2020-02-25 11:16:09,,3,3,,,,,,,518888845669779,/story.php?story_fbid=518888845669779&id=337963610428971
Yana for Wyo,,2020-02-25 11:09:33,,6,5,,1,,,,,518885785670085,/story.php?story_fbid=518885785670085&id=337963610428971
Yana for Wyo,,2020-02-25 10:23:13,"This dual endorsement makes a lot of sense to me. My friends in the Movement for Black Lives, Showing Up for Racial Justice, Indigenous resistance movements, and other racial justice spaces are almost all advocating for either Sanders or Warren, and for good reason. Both are among the strongest racial justice candidates we've ever seen for this office.",44,33,,11,,,,,518859835672680,/story.php?story_fbid=518859835672680&id=337963610428971
Yana for Wyo,,2020-02-25 08:51:41,"This is the best high level summary I've read of why, far from being pie in the sky, the proposals Sanders and Warren are making are essential. Both Republicans and more moderate Democrats tend to only give you part of the equation: the cons of being bold and pros of being timid. But perhaps the most important piece of the puzzle is the ginormous cons of incrementalism.",19,10,,9,,,,,518807805677883,/story.php?story_fbid=518807805677883&id=337963610428971
Yana for Wyo,,2020-02-22 09:58:20,"Ban fracking. It is short term gain for the rich at the expense of long term damage to water, air and climate stability.",28,20,,8,,,,,516869539205043,/story.php?story_fbid=516869539205043&id=337963610428971
Yana for Wyo,,2020-02-21 09:18:26,I'm trying to be a true leftist. As in the left side of this chart :),48,28,,20,,,,,516176669274330,/story.php?story_fbid=516176669274330&id=337963610428971
Yana for Wyo,,2020-02-20 22:29:40,"This move by the principal was bad, but I love the organizing work these students are doing. And their awareness of the class implications is amazing.  Wyoming's youth are organizing around climate, gun safety, LGBTQ rights, and now this... and those are just the ones I'm aware of. You may not agree with all of their points, but seeing young people finding their voices should be incredibly inspiring to all of us.  The future is smart and engaged.",25,17,,7,,1,,,515863135972350,/story.php?story_fbid=515863135972350&id=337963610428971
Yana for Wyo,,2020-02-20 16:30:25,Isn't it weird that most of Cynthia Lummis' big donors are from the segments of the Wyoming population where most of the wealth has accrued...?   I don't suppose that has any effect on how she sees the world. And votes.  Nah. Nothing to see here.,17,14,2,1,,,,,515723069319690,/story.php?story_fbid=515723069319690&id=337963610428971
"Yana for Wyo,Sweetwater County Sheriff's Office",,2020-02-19 16:07:42,"“ICE remains committed to removing dangerous, recidivist criminals from our communities and restoring integrity to our nation’s immigration system,” said ICE Public Affairs Officer Alethea Smock. I wasn't aware that our immigration system was on even passing terms with ""integrity"". Note that several of the people this press releasing is referencing had warrants for pretty minor offenses. Their main ""crime"" seems to be being brown people, and the punishment is completely out of proportion.Sheriff's Office addresses recent ""ICE holds"" at Detention Center On Fri., Feb. 14, 2020, Sweetwater County Detention Center temporarily housed 11 out-of-state inmates who were pending transfer into federal custody by U.S. immigration authorities. Given some of the corresponding publicity surrounding local media coverage of these particular jail bookings, we find it prudent in our statutory duty as custodian of the county jail to take this opportunity to clarify and educate the community about this aspect of jail operations. The Detention Center is authorized by existing inter-governmental contracts and memoranda of understanding to house inmates on behalf of a variety of local, state and federal law enforcement and public safety organizations including U.S. Immigration and Customs Enforcement, U.S. Marshals Service, Bureau of Indian Affairs, Wyoming Department of Family Services, Wyoming Department of Corrections and a growing regional network of neighboring Wyoming counties and municipalities. Built in 2005, the Detention Center is a state-of-the-art county correctional facility featuring a maximum prisoner capacity of over 200 inmates.  It is currently one of only four facilities across the state with a separate juvenile holding unit, which is legally required to house juvenile inmates.  The Detention Center represents a large and complex operation, which is staffed by over 50 Sheriff’s Office employees including approximately 20 state-certified detention officers, 10 control room operators (for around-the-clock coverage) and numerous support staff (such as various administrative, transport and medical personnel). While the housing of local prisoners always takes precedence, when vacancy permits, temporarily accommodating inmates-in-transit from these outside organizations helps offset the costs of jail operations by offering an added source of revenue for the County’s general fund.  Depending on the contract or MOU, the County is compensated $60 to $80 per inmate per day for a total of $350,000 to $500,000 annually.   With respect to “ICE holds” specifically, according to their annual operations report for Fiscal Year 2019, ICE removed or returned a total of 267,000 illegal immigrants.  Their Enforcement and Removal Operations arrested 143,000 individuals, more than 86% of whom had criminal convictions, pending criminal charges or previously issued final orders. “ICE remains committed to removing dangerous, recidivist criminals from our communities and restoring integrity to our nation’s immigration system,” said ICE Public Affairs Officer Alethea Smock. According to the Sheriff’s Office public relations officer, Deputy Jason Mower, “In each case at our Detention Center, these inmates are either previously convicted or currently facing criminal charges and awaiting transfer into federal custody by ICE for additional alleged immigration violations.” Mower continued, “While we do work in conjunction with ICE to identify those arrested for criminal activity who may also be subject to deportation or other immigration proceedings, we do not possess the lawful authority to enforce federal immigration law nor to detain anyone indefinitely absent pending or formal criminal charges.”",8,4,,,,2,2,,515686129323384,/story.php?story_fbid=515686129323384&id=337963610428971
Yana for Wyo,,2020-02-20 00:20:33,"2 best moments of tonight's Dem Debate: Warren's epic takedown of Bloomberg's sexist ass over nondisclosure agreements,  and Bernie's matter of fact take down of Bloomberg's classist ass over not crediting workers as the source of his wealth.",45,41,,4,,,,,515257679366229,/story.php?story_fbid=515257679366229&id=337963610428971
Yana for Wyo,,2020-02-19 22:36:16,This is the crux of this whole election cycle.,5,4,,1,,,,,515216489370348,/story.php?story_fbid=515216489370348&id=337963610428971
Yana for Wyo,,2020-02-19 22:13:09,This #DemDebate is jungle ball and Bloomberg looks bad. Best tweet I've seen: https://twitter.com/bpmehlman/status/1230322298051342338?s=19,19,13,6,,,,,,515206029371394,/story.php?story_fbid=515206029371394&id=337963610428971
