source,shared_from,date,text,reactions,likes,ahah,love,wow,sigh,grrr,comments,post_id,url
"Yana for Wyo,1 Million Women",,2020-05-01 00:13:33,We are being given the opportunity to stitch a new garment. 🌱,16,10,,6,,,,,563675434524453,/story.php?story_fbid=563675434524453&id=337963610428971
Yana for Wyo,,2020-05-01 21:52:20,Criminal justice reform now.,3,3,,,,,,,563285577896772,/story.php?story_fbid=563285577896772&id=337963610428971
"Yana for Wyo,Michelle Hutt,COVID-19 Community Needs | Laramie",,2020-04-30 17:28:23,"Please don't be this jerk. Servers make less than minimum wage unless you tip them. Folks are putting themselves at risk to bring you your food. Please treat them like human beings who deserve both respect AND to be able to feed themselves.Last night as we were waiting curbside at Born in A Barn, we witnessed the waiter deliver food, CURBSIDE to a large SUV.  As he was walking away, he was shaking his head and chuckling.  We rolled our window down and offered him encouragement and that although he looked exhausted, he was doing a great job running food curbside.  He shared with us that he just delivered $80 worth of food CURBSIDE to that SUV and they didn’t tip him.  He stated that he was still working off of server wages and people just aren’t tipping right now.  When I paid (earlier) I gave a 30% tip and to know that others who are blessed and have the funds to eat “out” during this time are not (especially on an $80 ticket) was heartbreaking.  We covered the tip for that $80 ticket and hope and pray that whomever was in that SUV pays in forward, some how, some way, in the future.  Please remember our servers during this time!  While they’re putting food on our tables (at home), let’s make sure they have enough to put food on their tables too.",20,17,,,3,,,,562501927975137,/story.php?story_fbid=562501927975137&id=337963610428971
,,2020-04-30 14:10:26,"Yana talks about the post office in particular, and the move to privatize all the things in general.",10,5,,4,,1,,,863982477401081,/story.php?story_fbid=863982477401081&id=337963610428971
Yana for Wyo,,2020-04-30 08:55:26,"Join Yana at 12:30 today for our Thursday FB live on why killing the Post Office is a terrible, bad, no good idea, and on Sunday for our 1pm Town Hall looking at the 3 Core Questions that drive our campaign.",1,,,1,,,,,562249404667056,/story.php?story_fbid=562249404667056&id=337963610428971
Yana for Wyo,,2020-04-28 15:46:14,My interview with Destiny. This was fun. https://www.youtube.com/watch?v=aLQUuui7ThA,17,12,,4,1,,,,561168531441810,/story.php?story_fbid=561168531441810&id=337963610428971
Yana for Wyo,,2020-04-28 09:29:44,Jackie Grimes started this petition for Wyoming to use mail in ballots.  Will you join me in signing?,11,10,,1,,,,,560979708127359,/story.php?story_fbid=560979708127359&id=337963610428971
Yana for Wyo,,2020-04-26 16:15:58,"Student loan forgiveness Town Hall.  Note that Yana misread her own notes at one point and said $4.5B instead of $4.5T. Her comment makes a lot more sense with the right number! Here's a quote from the Common Dreams articel she got hat number from: ""More than $4 trillion of that estimate is predicated on using $454 billion of CARES Act money to back Federal Reserve-based corporate loans. The Fed has the magical power to leverage, or multiply, money it receives from the Treasury up to 10 times over. In the end, according to the president, that could mean $4.5 trillion in support for big banks and corporate entities versus something like $1.4 trillion for regular Americans, small businesses, hospitals, and local and state governments. That 3.5 to 1 ratio signals that, as in 2008, the Treasury and the Fed are focused on big banks and large corporations, not everyday Americans.""",15,10,,1,1,,3,,559813351577328,/story.php?story_fbid=559813351577328&id=337963610428971
Yana for Wyo,,2020-04-26 12:01:37,Yana's Town Hall today at 1pm is on student loan forgiveness. Tune in with your questions and stories! https://us02web.zoom.us/j/8480420625,1,1,,,,,,,559690488256281,/story.php?story_fbid=559690488256281&id=337963610428971
Yana for Wyo,,2020-04-23 19:09:16,"This was a fun interview with the Rocket Miner staff. I really appreciate that we were able to have conversations about a lot of real stuff for Wyoming. What does freedom mean, what are the big issues that are ""up"" right now and why is Yana a good match with the current moment? It's all in here.",10,9,,1,,,,,557922555099741,/story.php?story_fbid=557922555099741&id=337963610428971
Yana for Wyo,,2020-04-23 17:32:35,A Senator for the rest of us.,21,17,,4,,,,,557879641770699,/story.php?story_fbid=557879641770699&id=337963610428971
,,2020-04-23 14:19:57,Is Yana more for gun rights or gun control?  Today's FB live holds the answer.,6,6,,,,,,,565264197455420,/story.php?story_fbid=565264197455420&id=337963610428971
Yana for Wyo,,2020-04-22 19:00:59,I think it is time for folks to hear from me about guns. So let's do that tomorrow for this week's Thursday facebook live session. Tune in here at 12:30 or catch the video afterward.,4,3,,,1,,,,557240278501302,/story.php?story_fbid=557240278501302&id=337963610428971
"Yana for Wyo,Charles Pelkey",,2020-04-22 18:59:27,"I will be very interested in the Governor's message tomorrow. And glad to hear the general tone will be leaning toward science and public health and not caving in to pressure to jump the gun.We - other legislators and I - just completed the latest in a series of conference calls with Governor Gordon. He says he wants to err on the side of caution and rely on health experts to say when this state can ease restrictions on businesses and individuals around the state of Wyoming. Our conversation was fairly short on detail, but the governor will be holding a press conference tomorrow at 3:00 p.m., which will be streamed on WyomingPBS.org. I urge all of you to tune in and then follow-up with your concerns to ""governor@wyo.gov"". Governor Gordon is working to balance competing interests and he agrees that the health of our citizens should remain on the top of all of our lists. Tune in tomorrow to see what his plans are for our state. Keep in mind that the governor is suddenly under a lot of pressure to ""reopen"" the economy no matter what the recommendations from health officials might be. He appears to be inclined to follow the science and not the politics. I respect that. Thankfully, it was the governor who pointed out that the 1918 Spanish flu pandemic had a brief decline in fatalities, which led first to a loosening of restrictions and then an even greater spike in the number of dead that followed.  Please, let's not allow history to repeat itself. Let's watch out for the health and safety of ALL of Wyoming's citizens. Tune in tomorrow.",11,9,,2,,,,,557239338501396,/story.php?story_fbid=557239338501396&id=337963610428971
Yana for Wyo,,2020-04-22 09:32:15,"If you would like to be a delegate to the state Democratic convention, here's the page where you will find the link to apply. I just applied... join me?  https://albanycountywyodems.org/2020-caucus",7,7,,,,,,,556940145197982,/story.php?story_fbid=556940145197982&id=337963610428971
Yana for Wyo,,2020-04-22 09:10:57,One of the most popular pieces of public infrastructure in the country... an institution that is literally one of the best examples of a democratic economy... gets the shaft while we bail out mega corporations. This is why I'm an increasingly loud socialist.,27,6,,,,2,19,,556928581865805,/story.php?story_fbid=556928581865805&id=337963610428971
"Yana for Wyo,Bernie Sanders",,2020-04-20 12:18:04,"Workers who are on the frontlines of this crisis — including those who work in grocery stores, warehouses, paramedics, nurses, pharmacies, domestic workers, postal workers, farm workers, public transit, truck drivers and janitors – must have hazard pay, childcare and a safe and secure workplace.",5,3,,2,,,,,556401478585182,/story.php?story_fbid=556401478585182&id=337963610428971
Yana for Wyo,,2020-04-20 09:49:08,Here's Yana's Town Hall on Socialism and why she's not touting Vote Blue No Matter Who. Please share this one widely!,4,4,,,,,,,555672481991415,/story.php?story_fbid=555672481991415&id=337963610428971
Yana for Wyo,,2020-04-19 14:29:15,"Join us today at 1pm for Yana's talk on what socialism actually is, and how Vote Blue No Matter Who is damaging our democracy. Virtual Town Hall style on zoom! https://us02web.zoom.us/j/8480420625 If you need a code to get in, use this: 213313 See you soon!",1,1,,,,,,,555190192039644,/story.php?story_fbid=555190192039644&id=337963610428971
"Yana for Wyo,Colleen BigSpring,Wyoming Supporters of Indigenous Rights,Our Revolution Casper",,2020-04-17 23:45:15,"Racism is alive and well in Wyoming. This land is Indigenous land. I condemn the deep lack of both respect and recognition of humanity that these acts communicate to my Native friends and the whole Wind River community.https://m.facebook.com/story.php?story_fbid=10220489565542424&id=1630968620Governor Mark Gordon, what are you doing about the threat to public safety posed by the bigots trying to turn Wyoming into their pure white ethnostate? True, the First Amendment protects free speech in traditional public forums and the best way to defeat hate speech is with better speech. But your silence is deafening. In 1989, Republicans marched with Democrats in Casper to kick the skinheads out of Casper. In 2020, they dogwhistle and court their votes.",21,6,,,,8,7,,554412712117392,/story.php?story_fbid=554412712117392&id=337963610428971
Yana for Wyo,,2020-04-17 15:51:52,Cancel all student debt.,30,25,,5,,,,,553862972172366,/story.php?story_fbid=553862972172366&id=337963610428971
Yana for Wyo,,2020-04-17 09:14:57,"As the article says... there will be life after this crisis. What public officials do now should absolutely be remembered.  Who used this crisis to profit personally? Who showed up to support their communities and who sold them out? Who pushed for change that benefited the people and who lobbied for more for the rich? Those are the kinds of analyses that will be made once this is over. Unfortunately not all of these answers are breaking along party lines, so we actually need to pay attention.",17,2,,,7,1,7,,553656725526324,/story.php?story_fbid=553656725526324&id=337963610428971
Yana for Wyo,,2020-04-16 19:30:56,"There has been a recent uptick in Wyoming elected officials attacking their own constituents (interestingly enough, all intelligent women who do actual work in our communities to help people) by posting enough information about them that they can be easily harassed by people who disagree with them.  This is incredibly irresponsible. On top of that, these same men seem deeply confused about the difference between Democrats, socialists and communists.  So here's my invitation, guys. Why don't you come to my town hall this Sunday to learn about what socialism actually is? I can't do much about making you actually listen to the people you are supposed to represent, nor can I curb your misogynistic tendencies. But perhaps I can at least offer a chance for you to get a slightly better grasp on reality. Bouchard? Clem? Anyone else?",49,36,,10,2,,1,,553262092232454,/story.php?story_fbid=553262092232454&id=337963610428971
,,2020-04-16 14:27:34,"Public Lands is the focus of Yana’s April 16 FB live. When it comes to recreation and climate security, Cynthia Lummis is not our friend. We need to elect someone who will go to bat for both.",14,11,,2,,,1,,772229629851652,/story.php?story_fbid=772229629851652&id=337963610428971
Yana for Wyo,,2020-04-16 12:25:20,Friday night fun! Yana will be live streaming with Glass Beach.,13,11,,2,,,,,553049865587010,/story.php?story_fbid=553049865587010&id=337963610428971
Yana for Wyo,,2020-04-15 21:37:03,"Join me Thursday at 12:30 right here for our weekly facebook live! This week's topic is Public Lands, including the abysmal voting and advocacy record of Cynthia Lummis.",6,6,,,,,,,552627708962559,/story.php?story_fbid=552627708962559&id=337963610428971
Yana for Wyo,,2020-04-14 15:13:21,"Deep respect for Antonio Serrano and everyone at #WyoSayNo. I was honored to have Antonio introduce me the day I announced this run for the senate. My running has meant I have been far less available for this particular fight than I'd like, and I'm celebrating this win with all my heart.",18,13,,5,,,,,551710665720930,/story.php?story_fbid=551710665720930&id=337963610428971
Yana for Wyo,,2020-04-14 09:57:13,"The post office is an important source of employment for women,  people of color and veterans. Let's have their backs.  (Practical way to show your support: Have you ordered stamps recently? This awesome entity called the post office will deliver them right to your door!)",36,28,,8,,,,,551544369070893,/story.php?story_fbid=551544369070893&id=337963610428971
Yana for Wyo,,2020-04-14 08:50:23,Let's join this effort.  Green New Deal plus Medicarefor All would be excellent paths to health and economic wellbeing for the US.,20,14,,6,,,,,551501439075186,/story.php?story_fbid=551501439075186&id=337963610428971
Yana for Wyo,,2020-04-13 17:58:49,"Neoliberal capitalism says everything should be privatized. We disagree. USPS is one of the most egalitarian and user friendly systems we have in the US, and a huge union employer.",19,17,,1,,,1,,551032372455426,/story.php?story_fbid=551032372455426&id=337963610428971
Yana for Wyo,,2020-04-13 15:54:48,"It's taken a little time to catch up, but I now have a pretty full schedule for politics. This week: Monday 2pm record The Movement Podcast Interview Monday 6pm Next Steps for Wyoming Online meeting  Tuesday & Weds... my weekend apparently Thursday 12:30 Y4W FB Live Thursday 6pm Online Town Hall with Alyssa Milano and No Dem Left Behind candidates Friday 6-9pm live streaming with Glass Beach Saturday teach a facilitation training Sunday 1pm Y4W Virtual Town Hall Sunday 2pm SE Wyoming DSA meeting Perhaps I'll connect with you somewhere?",6,2,,4,,,,,550980085793988,/story.php?story_fbid=550980085793988&id=337963610428971
Yana for Wyo,,2020-04-11 19:38:01,Bidding is now open for our online art auction. Come join us and browse art for political change in Wyoming!,,,,,,,,,549703355921661,/story.php?story_fbid=549703355921661&id=337963610428971
Yana for Wyo,,2020-04-13 14:54:14,"It's a sad say in Wyoming, particularly for his family and community. Please keep up the social distancing and quarantine if you have either been exposed or show any symptoms at all. Our individual choices in this case DO make a difference.",10,,,,,10,,,550952989130031,/story.php?story_fbid=550952989130031&id=337963610428971
Yana for Wyo,,2020-04-12 22:57:50,"Easter Sunday Town Hall on  suicide and the opioid crisis with Yana Ludwig, US Senate candidate from Wyoming. Content warning: we got trolled by racists and misogynists toward the end. Our campaign will always stand against that nonsense! But up until then, we had a great conversation.",4,1,,3,,,,,550504902508173,/story.php?story_fbid=550504902508173&id=337963610428971
Yana for Wyo,,2020-04-12 22:54:01,"Today's Virtual Town Hall got a little hairy at the end... content warning: we got trolled by some racists and misogynists. But up until then, we had a great conversation about suicide and the opioid crisis. And I will always stand against this kind of nonsense.",9,7,,,1,1,,,550506132508050,/story.php?story_fbid=550506132508050&id=337963610428971
Yana for Wyo,,2020-04-12 10:20:41,"VIRTUAL TOWN HALL TODAY: SUICIDE AND OPIOIDS I'd like to invite everyone to a special Virtual Town Hall today. We will be talking about Wyoming's dual crises with suicide and opioids. While most of my Town Halls have been heavy on me sharing my thoughts, today I'd like to hear much more of yours. I'm making this invitation in part because the opioid crisis is one that has not touched my life directly. Everything else I have talked about, from climate to economic hardships to disability, I have had much more direct experience with and that experiences has grounded my policy thinking. That's not true with opioids, and so I need your help to understand, at a human impacts level, what I need to know. I will still offer some statistics and background information as I know it, but today I am asking for your stories. I will share mine with some of the suicides I have experience with, including losing a really close friend here in Wyoming who could not get what they needed in terms of mental health support. So please join me today at 1pm Mountain time, on zoom. Bring your stories as well as your thoughts. Our zoom room information: Room ID if you like to get in that way: 848-042-0625 Direct link if you prefer this: https://us02web.zoom.us/j/8480420625 If it asks for an access code or password, use this: 213313",1,1,,,,,,,550125349212795,/story.php?story_fbid=550125349212795&id=337963610428971
Yana for Wyo,,2020-04-11 10:18:01,"We are witnessing the collapse of capitalism and its true colors are showing: always it is the workers who are most hurt. The treatment of miners by their own industry continues to be appalling. ""The coal industry is taking advantage of the country's current circumstances to advocate for policies that are completely unrelated to the current crisis, policies that would in fact set back efforts to improve the health and lives of people across the country,"" the lawmakers wrote. ""At a time when the country is facing a pandemic due to a respiratory illness, it is particularly egregious for the coal industry to advocate reducing the Black Lung Excise Tax.""",27,5,,,,5,17,,549432605948736,/story.php?story_fbid=549432605948736&id=337963610428971
"Yana for Wyo,Yana for Wyo,Virtual Art Action for Yana for Wyo!",,2020-04-11 00:06:05,"A few ""teasers"" for tomorrow's auction!",2,1,,1,,,,,549173179308012,/story.php?story_fbid=549173179308012&id=337963610428971
Yana for Wyo,,2020-04-10 22:25:05,This is a great breakdown of what responsive leadership looks like in a crisis.,17,14,,3,,,,,549130065978990,/story.php?story_fbid=549130065978990&id=337963610428971
Yana for Wyo,,2020-04-10 19:43:36,What are your top 3 issues you want the US Senate to take up in 2021? Asking for 300 million friends.,8,8,,,,,,,549064479318882,/story.php?story_fbid=549064479318882&id=337963610428971
Yana for Wyo,,2020-04-10 11:02:40,Remember the art action tomorrow at 5pm! We’ll be posting pieces for auction bids starting at noon!,2,,,2,,,,,548803462678317,/story.php?story_fbid=548803462678317&id=337963610428971
,,2020-04-09 15:57:38,"April 9th: a brief look at Covid-19, domestic violence and police violence.",10,8,,,,2,,,652204115354331,/story.php?story_fbid=652204115354331&id=337963610428971
Yana for Wyo,,2020-04-09 09:35:20,"Hey everyone! Minor emergency... this will be delayed today until 2:00 pm Tune in for today's FB live with Yana at 2:00! She will be doing the weekly Covid-19 update, and talking about the culture of violence in the US: domestic violence and police violence in particular, and the relationship between the two.  This Sunday's Virtual Town Hall at 1pm will focus on two Wyoming epidemics: suicide and opioids.",3,3,,,,,,,548091589416171,/story.php?story_fbid=548091589416171&id=337963610428971
Yana for Wyo,,2020-04-08 23:59:05,Excellent news! Congratulations to all the activists who have been fighting this.,28,21,,7,,,,,547852569440073,/story.php?story_fbid=547852569440073&id=337963610428971
Yana for Wyo,,2020-04-08 17:52:00,"Yana's response to Senator Sanders announcement that he is dropping out of the Presidential race. If you are able to make a donation today, that would help us to keep on with this fight for working people. https://secure.actblue.com/donate/yana-for-wyo-1?utf8=%E2%9C%93&amount=&commit=Contribute",23,11,,10,,2,,,547706049454725,/story.php?story_fbid=547706049454725&id=337963610428971
Yana for Wyo,,2020-04-08 13:02:48,"Now, more than ever, we need to win. Contact us to volunteer, or make a donation to the campaign. We can do this with your help.",14,11,,2,,1,,,547577162800947,/story.php?story_fbid=547577162800947&id=337963610428971
Yana for Wyo,,2020-04-08 10:18:15,,14,2,,,,,12,,547491002809563,/story.php?story_fbid=547491002809563&id=337963610428971
Yana for Wyo,,2020-04-07 20:22:40,"Hey Wyoming artists! This Saturday, Yana for Wyo is doing an online art auction as a campaign fundraiser. If you are supporting my Senate run and would like to donate a piece or two, let me know!",4,3,,1,,,,,547124749512855,/story.php?story_fbid=547124749512855&id=337963610428971
Yana for Wyo,,2020-04-07 08:31:35,Hey Rock Springs! Yana will be interviewed on KUGR this morning at 10:10. Looking forward to a chat with Al Harris.,8,8,,,,,,,546789369546393,/story.php?story_fbid=546789369546393&id=337963610428971
"Yana for Wyo,Taj James",,2020-04-06 09:47:01,"Interesting.  The possible reading of this is that not feeling fear is somehow more enlightened or the right answer. As someone whose pre-Carona life is constructed mainly for those two outer rungs (re climate and ending oppressions of all kinds) I assure you that fear (and anger) are regular guests at my table.  In fact, welcoming them makes growth and action possible and far more sustainable. If we aren't connected to our real emotions, it is very, very hard to have real compassion for other people's suffering. But we can't let fear run us.  The world needs us in growth and action modes right now. This is always what this campaign has been about. Compassionate, effective solidarity building for a world that genuinely works for all of us.Grace. No shame.   In one day or in one moment  you may be in all four zones Resit the urge to accomplish or achieve anything Just be  Just be in relationship  Just breathe and listen to your heart  Grace 💔🦋✊🏾🌍💜 KEY FOCUS IN THE ACTION ZONE: March #The4Bridges to a New World! Keep fighting for a #PeoplesBailout Get ready for a #GeneralStrike Keep demanding that #TrumpResignNow Demand Congress #ImpeachAndRemove —- Thanks and praises to Kenyan Doctor Anne Mwangi who created this and encouraged people to evolve and adapt it and Mr. Godfrey Okuma who shares it with all of us.  A powerful compass to navigate these difficult times!",3,3,,,,,,,546192989606031,/story.php?story_fbid=546192989606031&id=337963610428971
Yana for Wyo,,2020-04-05 18:03:20,"Check out Yana's Climate Town Hall. Thanks to the folks who came and participated. We will have one of these every Sunday at 1pm. If you have a topic you want Yana to cover, please suggest!",7,4,,3,,,,,545781426313854,/story.php?story_fbid=545781426313854&id=337963610428971
Yana for Wyo,,2020-04-05 13:34:16,"Coming up at 1pm Mountain time today: my Virtual Town Hall on Climate. Join us on Zoom, and bring your thoughts and questions. Follow this link: https://us02web.zoom.us/j/8480420625… And use this password: 213313",3,1,,2,,,,,545664949658835,/story.php?story_fbid=545664949658835&id=337963610428971
Yana for Wyo,,2020-04-04 21:59:15,"It's almost Virtual Town Hall Sunday! Don't forget that tomorrow you and I have a date at 1 pm to talk Green New Deal. Meet me on zooooom!  Follow this link: https://us02web.zoom.us/j/8480420625?pwd=c1l1N25EUVk1ci9HV3FDaGhFRm81Zz09 And use this password: 213313 It's where ALL the kids, cool or otherwise, are hanging out :)",2,2,,,,,,,545211089704221,/story.php?story_fbid=545211089704221&id=337963610428971
Yana for Wyo,,2020-04-04 12:18:47,,4,4,,,,,,,544963219729008,/story.php?story_fbid=544963219729008&id=337963610428971
Yana for Wyo,,2020-04-03 20:18:23,"I'm looking at John Barrasso on this one... you're in half of the pictures with Trump, right behind him. Surely you can get this moving, Sen./Dr. Barrasso? Turn some of your ass kissing for something good for your state? Your people are going to start dying over here.",25,9,,,1,7,8,,544554776436519,/story.php?story_fbid=544554776436519&id=337963610428971
,,2020-04-02 14:32:56,,3,2,,1,,,,,246776506360753,/events/246776506360753?view=permalink&id=246776513027419
,,2020-04-02 14:26:47,April 2nd FB LIve: Yana talks about disability rights and the Rose Caucus platform on disability.,12,7,,4,1,,,,241391873929030,/story.php?story_fbid=241391873929030&id=337963610428971
Yana for Wyo,,2020-04-02 10:12:03,"Today's FB live session (at 12:30) will focus on disability rights, after a quick Covid-19 update. Please join Yana to discuss some key aspects of the Rose Caucus platform for the largest ""minority"" group in the US!",3,3,,,,,,,543637453194918,/story.php?story_fbid=543637453194918&id=337963610428971
"Yana for Wyo,NowThis Politics",,2020-04-01 19:15:12,‘Preparedness is a choice. And poor preparedness is a choice.’ — Meet the gov’t official who created the pandemic playbook that Trump chose to ignore,4,4,,,,,,,543591699866160,/story.php?story_fbid=543591699866160&id=337963610428971
Yana for Wyo,,2020-04-01 16:59:56,"Got community? I hope so. This isolation stuff can be rough. Here's some resources if you are finding your mental health suffering. BTW the Casper Star Tribune has been offering all of their Covid-19 related stories free of charge. They've been doing a solid job of printing relevant, up to date stuff. Check it out if you have not already!",3,3,,,,,,,543189069906423,/story.php?story_fbid=543189069906423&id=337963610428971
Yana for Wyo,,2020-04-01 14:02:37,This is terrific news. The courts have done some amazing good protecting basic civil rights in recent years.,28,23,,5,,,,,543108749914455,/story.php?story_fbid=543108749914455&id=337963610428971
