source,shared_from,date,text,reactions,likes,ahah,love,wow,sigh,grrr,comments,post_id,page_id,url
Captain Mark Kelly,,2020-03-06 14:44:47,Washington is doing nothing to lower the cost of health care for Arizonans. We need leaders who will protect those with pre-existing conditions and work to drive down costs.,246,193,0,3,2,37,11,26,2746388938749680,CaptMarkKelly,/story.php?story_fbid=2746388938749680&id=163148530407080
"Captain Mark Kelly,NASA - National Aeronautics and Space Administration",NASA - National Aeronautics and Space Administration,2020-02-11 16:15:17,"This is your reminder that applications are now open for the next class of NASA - National Aeronautics and Space Administration astronauts. If you think you’ve got what it takes then send in that application. After all, they let my brother in (NASA Astronaut Scott Kelly) so it can’t be that hard. #BeAnAstronautNeed some space? We’ve got the job for you! 👩‍🚀🚀🌕 We’re accepting applications March 2-31 for the next class of #Artemis Generation astronauts. Find out if you have what it takes to #BeAnAstronaut: https://go.nasa.gov/2vkC1F7",227,173,36,17,1,0,0,5,2744613795593861,CaptMarkKelly,/story.php?story_fbid=2744613795593861&id=163148530407080
Captain Mark Kelly,,2020-03-04 15:36:58,"‪Yesterday, I joined Francisco Heredia to meet with small business owners in Mesa’s Asian District. Locally owned businesses like these play a vital role in Arizona’s economy and communities, and I’m always interested to hear what can be done to support them.",525,459,2,62,2,0,0,9,2742301332491774,CaptMarkKelly,/story.php?story_fbid=2742301332491774&id=163148530407080
Captain Mark Kelly,,2020-03-04 11:31:03,"Our state needs a senator that fights for Arizona — not corporations. So, I’m not taking a dime of corporate PAC money. Instead, I'm counting on support from grassroots donors like you. If you can, chip in below to help provide some rocket fuel for our people-powered campaign.",354,303,5,40,5,1,0,17,2741928172529090,CaptMarkKelly,/story.php?story_fbid=2741928172529090&id=163148530407080
Captain Mark Kelly,,2020-03-03 10:10:22,"This court case could raise health care costs, end the expansion of AHCCCS, and eliminate protections for Arizonans with pre-existing conditions — the same protections Senator McSally has voted to gut repeatedly. Arizonans deserve better.",421,198,3,3,12,74,131,52,2739787976076443,CaptMarkKelly,/story.php?story_fbid=2739787976076443&id=163148530407080
Captain Mark Kelly,,2020-03-02 13:14:58,"If you told me when I was 16 that I’d reach my dream of being a Navy pilot and astronaut, I wouldn’t have believed you. Now, my hope for Arizona is that everybody gets a chance to achieve their own American dream.",727,602,1,121,3,0,0,36,2738053059583268,CaptMarkKelly,/story.php?story_fbid=2738053059583268&id=163148530407080
Captain Mark Kelly,,2020-03-01 13:47:22,‪I’ve said it before and I’ll say it again: Dreamers are just as American as my own kids. The only difference? A piece of paper. It’s past time we provide them with a clear path to citizenship.,1200,1000,4,214,7,0,2,52,2736093843112523,CaptMarkKelly,/story.php?story_fbid=2736093843112523&id=163148530407080
"Captain Mark Kelly,The Daily Caller",,2020-02-27 14:41:18,"It’s clear Arizona families need a senator who knows how to push through party politics to get the job done. I want to be that senator, but I can’t do it alone. Join our campaign and help me fix what is broken. #FullSpeedAheadWould you want to live here?",406,350,1,50,3,0,2,27,2729689120419662,CaptMarkKelly,/story.php?story_fbid=2729689120419662&id=163148530407080
Captain Mark Kelly,,2020-02-26 20:29:50,"The Grand Canyon is a treasure not just for the state of Arizona, but for the planet. It’s up to us to protect and preserve it so future generations can continue to enjoy its beauty for decades to come — and that includes protecting it from uranium mining.",1100,987,1,190,4,1,1,27,2728142860574288,CaptMarkKelly,/story.php?story_fbid=2728142860574288&id=163148530407080
Captain Mark Kelly,,2020-02-26 11:41:29,"Happy Birthday to one of the world's greatest treasures, the Grand Canyon National Park.",485,403,0,78,4,0,0,14,2727436673978240,CaptMarkKelly,/story.php?story_fbid=2727436673978240&id=163148530407080
"Captain Mark Kelly,Gabby Giffords",Gabby Giffords,2020-02-25 18:36:03,"Mark and I think about Gabe Zimmerman all the time, but especially on days like today, what would’ve been his 40th birthday. Gabe was my Outreach Director when he was killed by my side on January 8, 2011. Gabe made a profound impact everywhere he went—one that is remembered in so many meaningful ways: scholarships, a room in the US Capitol named for him, a trailhead just outside of Tucson, the Gabe Zimmerman Triple Crown race and Beyond-Tucson.  And today, his friends and family are at UC Santa Cruz to celebrate his life as they name a room in the student library for him. Elizabeth Cowell, the university’s librarian, put it thoughtfully: “We hope to give Gabe’s inspired life a home on the campus that he loved so much.” Gabe always strived to make peoples’ lives better. That’s just who he was. And we hope his memory inspires generations of students to go on to serve their communities. Just as Gabe would have wanted us all to do.",1800,993,1,381,2,446,4,42,2726183990770175,CaptMarkKelly,/story.php?story_fbid=2726183990770175&id=163148530407080
Captain Mark Kelly,,2020-02-25 11:27:18,"I’m not taking a dime of corporate PAC money. For too long, corporate influence has ruled Washington. We’ve got to change that.",945,784,2,151,4,0,4,58,2725419084179999,CaptMarkKelly,/story.php?story_fbid=2725419084179999&id=163148530407080
Captain Mark Kelly,,2020-02-23 12:24:21,"With our public schools aging and left in disrepair, it’s Arizona children that are feeling the consequences. Building the best future for Arizona means investing in the next generation and doing what it takes to give them the best education possible.",358,266,0,6,3,72,11,45,2721345131254061,CaptMarkKelly,/story.php?story_fbid=2721345131254061&id=163148530407080
Captain Mark Kelly,,2020-02-21 17:00:27,"Happy birthday to my *younger* twin brother, NASA Astronaut Scott Kelly. Looks like mom knew we’d look good in NASA blue even before we did.",5900,4400,35,1400,19,0,0,511,2717223388332902,CaptMarkKelly,/story.php?story_fbid=2717223388332902&id=163148530407080
Captain Mark Kelly,,2020-02-20 07:54:32,"If you told me when I was 16 that I’d reach my dream of being a Navy pilot and astronaut, I wouldn’t have believed you. Now, my hope for Arizona is that everybody gets a chance to achieve their own American dream.",1000,851,4,219,4,1,4,111,2713647105357197,CaptMarkKelly,/story.php?story_fbid=2713647105357197&id=163148530407080
Captain Mark Kelly,,2020-02-19 21:42:23,"Party politics have broken Washington and divided our country. I’m running for Senate to push past the games and solve the problems Arizonans care about — but I can’t do it alone. If you believe in our mission, chip in to fuel our campaign.",363,322,4,33,2,0,2,26,2713487478706493,CaptMarkKelly,/story.php?story_fbid=2713487478706493&id=163148530407080
Captain Mark Kelly,,2020-02-19 16:31:38,"I’m running to be an independent voice for Arizona because we need leaders focused on solutions — solutions like lowering the cost of health care, giving our children a quality education, and raising wages for working families.",918,767,3,144,3,0,1,51,2713084082080166,CaptMarkKelly,/story.php?story_fbid=2713084082080166&id=163148530407080
Captain Mark Kelly,,2020-02-18 21:42:43,"This afternoon I toured West-MEC, a career and technical education school, to learn how they’re preparing students to enter our workforce. Many fields have openings for skilled workers, and I'm impressed with how effectively they’re training students to fill them.‬",394,363,1,26,2,0,2,11,2711388638916377,CaptMarkKelly,/story.php?story_fbid=2711388638916377&id=163148530407080
Captain Mark Kelly,,2020-02-18 12:57:59,"As a Navy vet, it hurts me to say this — but if we’re going to win this November, we’re going to need an army. Mission For Arizona is the army we need. Join the mission at MissionForArizona.com.",476,404,10,60,1,0,1,26,2710675465654361,CaptMarkKelly,/story.php?story_fbid=2710675465654361&id=163148530407080
Captain Mark Kelly,,2020-02-17 12:31:46,Thank you to Arizona Women's Basketball Team for giving Gabby Giffords and me a behind-the-scenes look yesterday at what it takes to be one of the best women’s basketball teams in the country! #BearDown 🐻⬇️,1000,861,1,172,7,0,0,26,2708589285862979,CaptMarkKelly,/story.php?story_fbid=2708589285862979&id=163148530407080
Captain Mark Kelly,,2020-02-15 20:06:36,He volado 39 misiones de combate y cuatro misiones al espacio — pero la misión más importante de mi vida será arreglar los problemas en Washington.,473,380,2,89,2,0,0,19,2704986362889938,CaptMarkKelly,/story.php?story_fbid=2704986362889938&id=163148530407080
Captain Mark Kelly,,2020-02-15 12:43:51,"It was a busy Valentine’s Day, but there was no way I was going to miss getting Gabby her favorite flowers.",1700,1000,2,762,3,0,0,99,2704307946291113,CaptMarkKelly,/story.php?story_fbid=2704307946291113&id=163148530407080
"Captain Mark Kelly,Jill Weintraub Klausen",,2020-02-14 16:57:19,"I had a great time this morning with State Representative Cesar Chavez touring the Goodwill of Central and Northern Arizona Distribution Center and Chicanos Por La Causa - CPLC Community Center to learn more about what they’re doing to make sure workers have the skills they need and revitalize the local Maryvale economy.BERNIE SANDERS IS THE TRUE CENTRIST WHO CAN BEAT TRUMP ""The inconvenient truth that our lazy media elites do so much to ignore is that Ocasio-Cortez, Sanders,...",343,300,1,40,2,0,0,9,2702572996464608,CaptMarkKelly,/story.php?story_fbid=2702572996464608&id=163148530407080
Captain Mark Kelly,,2020-02-13 16:33:50,"Can you do me a favor? Send the link below to five of your friends in Arizona to help us qualify for the ballot this November. With your help, I know we’ll get it done in no time. #FullSpeedAhead",162,143,1,16,1,0,1,25,2700026570052584,CaptMarkKelly,/story.php?story_fbid=2700026570052584&id=163148530407080
Captain Mark Kelly,,2020-02-13 10:39:19,I had a great time in Flagstaff last month meeting with small business leaders who are using their businesses to support their local community.,523,452,4,65,2,0,0,28,2699399080115333,CaptMarkKelly,/story.php?story_fbid=2699399080115333&id=163148530407080
Captain Mark Kelly,,2020-02-11 13:15:28,"When the median salary of Arizona teachers ranks 49th in the nation, it’s no wonder our schools are struggling to fill teaching positions. Raising teacher salaries is one of the most important things we can do for our students.",786,583,4,18,21,141,19,63,2695443107177597,CaptMarkKelly,/story.php?story_fbid=2695443107177597&id=163148530407080
Captain Mark Kelly,,2020-02-09 13:04:12,"‪This is an attempt to cut AHCCCS funding, which would lead to fewer Arizonans having health insurance. It must be stopped.",285,134,1,1,6,58,85,16,2691417537580154,CaptMarkKelly,/story.php?story_fbid=2691417537580154&id=163148530407080
Captain Mark Kelly,,2020-02-08 18:44:23,"John McCain was a hero of mine as a young pilot and I was lucky to get to meet him later in life. As a senator, he served with integrity and always stood up for what he believed was right. I’m happy to see his legacy honored at Sky Harbor.",3300,2600,4,662,6,2,2,86,2689730444415530,CaptMarkKelly,/story.php?story_fbid=2689730444415530&id=163148530407080
Captain Mark Kelly,,2020-02-07 15:22:59,Last weekend I had the pleasure of meeting with Mayor Uribe in Douglas. We had a great lunch and talked about the importance of the port of entry in Douglas and economic development across Southern Arizona. I’m looking forward to working together in the future.,618,575,2,39,2,0,0,16,2687413834647191,CaptMarkKelly,/story.php?story_fbid=2687413834647191&id=163148530407080
Captain Mark Kelly,,2020-02-04 12:51:49,"My time at NASA and in the Navy taught me that when lives are on the line, you can’t let politics get in the way of getting the job done. It shouldn’t be any different in Washington.",707,598,3,103,3,0,0,33,2681150615273513,CaptMarkKelly,/story.php?story_fbid=2681150615273513&id=163148530407080
Captain Mark Kelly,,2020-02-05 11:52:53,For too long corporate influence in Washington has stood in the way of solving the problems Arizonans face every day. That’s why I’m refusing to take a dime of corporate PAC money. Support my people-powered campaign by chipping in below.,217,188,1,27,1,0,0,16,2683040155084559,CaptMarkKelly,/story.php?story_fbid=2683040155084559&id=163148530407080
Captain Mark Kelly,,2020-02-10 12:43:12,"In the year 2020, no one should be denied services because of who they are. As senator, I’ll proudly stand alongside Arizona equality advocates and work to pass the Equality Act to protect all Americans from this kind of discrimination.",310,270,3,31,3,3,0,13,2693386524049922,CaptMarkKelly,/story.php?story_fbid=2693386524049922&id=163148530407080
Captain Mark Kelly,,2020-02-04 19:26:19,"Rosa Parks taught us that when we stand up to injustice, we create opportunities to change our world for the better — just like she did. #BlackHistoryMonth",739,559,2,176,2,0,0,18,2681672485221326,CaptMarkKelly,/story.php?story_fbid=2681672485221326&id=163148530407080
Captain Mark Kelly,,2020-02-06 15:15:26,"Congratulations, NASA Astronaut Christina Hammock Koch, on your record-setting mission! Thank you for the sacrifices you've made on behalf of science and our space program. Your service will motivate and inspire kids across the country to reach for the stars.",1400,1100,1,333,16,0,0,23,2685322678189640,CaptMarkKelly,/story.php?story_fbid=2685322678189640&id=163148530407080
Captain Mark Kelly,,2020-02-06 12:36:18,"Navajo Code Talkers like Joe Vandever Sr. played a critical role in WWII by developing a code that was never broken by our enemies. The whole world owes Joe their thanks, and we’ll never forget these heroes.",2500,1000,3,467,9,1000,2,152,2685097681545473,CaptMarkKelly,/story.php?story_fbid=2685097681545473&id=163148530407080
Captain Mark Kelly,,2020-02-03 19:00:48,"On this day 25 years ago, Eileen Marie Collins piloted the Space Shuttle Discovery on an eight-day mission to the Russian space station Mir and back, becoming the first woman space shuttle pilot.",1400,1100,1,258,13,2,0,29,2679590125429562,CaptMarkKelly,/story.php?story_fbid=2679590125429562&id=163148530407080
Captain Mark Kelly,,2020-02-03 14:29:52,"What we’re seeing is the long term failure to properly fund Arizona schools. For the next generation to succeed, we must invest in our schools and teachers.",272,185,0,9,4,63,11,17,2679256788796229,CaptMarkKelly,/story.php?story_fbid=2679256788796229&id=163148530407080
Captain Mark Kelly,,2020-02-02 11:24:17,"‪As the country shifts to renewable resources and sustainability, Arizonans continue to lead the way. The containers designed by Planet Footprint will go a long way in reducing waste at today’s Super Bowl.‬",241,223,1,15,2,0,0,8,2676940545694520,CaptMarkKelly,/story.php?story_fbid=2676940545694520&id=163148530407080
Captain Mark Kelly,,2020-02-01 19:01:43,"Rick, Willie, Mike, Kalpana, Dave, Laurel, and Ilan. I’ll never forget that day 17 years ago when we lost seven friends and co-workers aboard the Space Shuttle Columbia. We honor their memory by answering the call to learn, discover, explore, and serve just like they did.",1500,632,0,237,2,662,0,31,2675600262495215,CaptMarkKelly,/story.php?story_fbid=2675600262495215&id=163148530407080
Captain Mark Kelly,,2020-01-31 12:32:53,"Por mucho tiempo, la influencia de grandes corporaciones en Washington se ha interpuesto en el camino a resolver los problemas que afectan a Arizonenses. Por eso no acepto donaciones de comités de acción política corporativas. ¡Apoya nuestro movimiento y done aquí!",146,125,2,19,0,0,0,8,2672953306093244,CaptMarkKelly,/story.php?story_fbid=2672953306093244&id=163148530407080
Captain Mark Kelly,,2020-01-30 19:21:37,I can't help but feel immense gratitude to the men and women that came before me. The work they accomplished and the advances they made are the reason I made it home safely — and I will never forget that. #NASARemembers,427,324,0,92,2,9,0,13,2671583882896853,CaptMarkKelly,/story.php?story_fbid=2671583882896853&id=163148530407080
Captain Mark Kelly,,2020-01-30 12:20:59,"I need your help, Arizona. To qualify for the ballot this November, we need signatures from registered voters across the state. Luckily, the online petition makes it easy. Just click on the link below to add your name. Thanks for your help! #FullSpeedAhead",318,281,0,35,1,0,1,52,2671006542954587,CaptMarkKelly,/story.php?story_fbid=2671006542954587&id=163148530407080
Captain Mark Kelly,,2020-01-28 18:13:00,"Our space program is defined by its successes, but we’ve also always learned from our failures.  Today, I’m thinking of the families of the seven explorers who perished when Space Shuttle Challenger exploded just after takeoff 34 years ago.",2000,680,0,268,11,1100,0,119,2667463389975569,CaptMarkKelly,/story.php?story_fbid=2667463389975569&id=163148530407080
Captain Mark Kelly,,2020-01-28 12:53:02,"Making Arizona a leader in renewable energy will lead to more good-paying jobs, cleaner air, and real progress towards combating climate change. It’s also common sense when we have more than 300 days of sunshine per year. I’m glad to see this important step that APS has taken by committing to making sure all of its energy comes from carbon-free sources by 2050.",299,258,3,36,2,0,0,13,2667036590018249,CaptMarkKelly,/story.php?story_fbid=2667036590018249&id=163148530407080
Captain Mark Kelly,,2020-01-27 19:55:47,"In the wake of rising anti-Semitism across the globe, I hope our country reflects today on #HolocaustRemembranceDay and remembers what happens when we allow hate to go unchecked. We vowed never again — today we renew that vow.",608,499,1,96,1,10,1,21,2665679343487307,CaptMarkKelly,/story.php?story_fbid=2665679343487307&id=163148530407080
Captain Mark Kelly,,2020-01-24 19:12:20,I've got a message for Arizonans: I will protect Social Security and Medicare. Period.,1600,1300,2,240,4,3,5,80,2659564917432083,CaptMarkKelly,/story.php?story_fbid=2659564917432083&id=163148530407080
Captain Mark Kelly,,2020-01-23 15:25:40,I’m proud to have the support of Human Rights Campaign and HRC Arizona in our mission to ensure all Arizonans can achieve their American dream free from discrimination. #FullSpeedAhead,1000,872,2,172,3,0,0,24,2657472684307973,CaptMarkKelly,/story.php?story_fbid=2657472684307973&id=163148530407080
Captain Mark Kelly,,2020-01-22 12:00:10,No veteran should ever have to jump through hoops to get the care they were promised in return for their service. This is unacceptable.,557,292,0,6,6,137,116,24,2655148501207058,CaptMarkKelly,/story.php?story_fbid=2655148501207058&id=163148530407080
Captain Mark Kelly,,2020-01-20 20:55:07,"As long as Arizona teachers are forced to work second jobs to cover their bills, we’ll never fill the teacher shortage — and the education of our children will continue to suffer because of it.",519,327,1,17,10,154,10,41,2652063428182232,CaptMarkKelly,/story.php?story_fbid=2652063428182232&id=163148530407080
Captain Mark Kelly,,2020-01-20 14:04:49,"“There comes a time when one must take a position that is neither safe, nor politic, nor popular, but he must take it because conscience tells him it is right.” Honoring Dr. Martin Luther King, Jr. and his life today. #MLKDay",906,703,0,197,4,2,0,18,2651565438232031,CaptMarkKelly,/story.php?story_fbid=2651565438232031&id=163148530407080
Captain Mark Kelly,,2020-01-19 14:01:51,"Mi misión #ParaArizona sólo funciona con el apoyo de todos ustedes. Si apoyan mi campaña, únanse a nuestro equipo hoy!",172,141,2,28,1,0,0,9,2649696328418942,CaptMarkKelly,/story.php?story_fbid=2649696328418942&id=163148530407080
Captain Mark Kelly,,2020-01-18 13:08:17,‪Proud doesn’t even begin to cover how I feel about Gabby Giffords.      ‬ ‪Spoiler: Check out #15 in the political leaders section.,244,189,0,53,2,0,0,10,2647667058621869,CaptMarkKelly,/story.php?story_fbid=2647667058621869&id=163148530407080
Captain Mark Kelly,,2020-01-17 14:14:38,"I have to say: Between the newest group of graduates and star interns like Wolf, the future of NASA - National Aeronautics and Space Administration is in great hands.",424,345,0,69,10,0,0,8,2645840402137868,CaptMarkKelly,/story.php?story_fbid=2645840402137868&id=163148530407080
Captain Mark Kelly,,2020-01-16 23:14:46,"Today's my mom's birthday, and I can't help but miss her. She was the one who really taught me what it means to be a public servant.",1000,782,0,248,4,1,0,55,2644569275598314,CaptMarkKelly,/story.php?story_fbid=2644569275598314&id=163148530407080
Captain Mark Kelly,,2020-01-16 20:21:28,"Arizona seniors have paid into Social Security and Medicare and depend on them to cover basic expenses and ensure healthy, dignified retirements. It’s critical that we protect and defend these programs.",392,346,0,45,1,0,0,10,2644340742287834,CaptMarkKelly,/story.php?story_fbid=2644340742287834&id=163148530407080
Captain Mark Kelly,,2020-01-16 12:50:59,"I spent my entire career at NASA and in the Navy using science, data, and facts to solve difficult problems. Arizona needs independent leadership in the United States Senate. If you agree, then join this mission #ForArizona.",894,755,2,135,2,0,0,98,2643638182358090,CaptMarkKelly,/story.php?story_fbid=2643638182358090&id=163148530407080
"Captain Mark Kelly,NASA - National Aeronautics and Space Administration",NASA - National Aeronautics and Space Administration,2020-01-10 20:54:37,"Congratulations, Turtles. Welcome to the best job in and out of this world.They studied. They trained. They graduated! 👩‍🚀🎓👨‍🚀 Chosen from a record-setting pool of more than 18,000 applicants, our #NewAstronauts completed two years of basic training to become the first class of astronauts to graduate since we announced our #Artemis program. They will help develop spacecraft, support the teams currently in space and ultimately join the ranks of only about 500 people who have had the honor of going into space. Prepare to be inspired: https://go.nasa.gov/2QJN82F",276,234,0,37,5,0,0,11,2642220039166571,CaptMarkKelly,/story.php?story_fbid=2642220039166571&id=163148530407080
Captain Mark Kelly,,2020-01-14 17:36:37,"Happy Birthday, Claud Dog.",464,418,1,44,1,0,0,21,2639844609404114,CaptMarkKelly,/story.php?story_fbid=2639844609404114&id=163148530407080
Captain Mark Kelly,,2020-01-14 11:53:32,"NEWS: Thanks to your support, we raised nearly $6.3 million between October and December — and more than $20.2 million for the year! But that's not even the best part. Our average donation was $43! This is truly a people-powered campaign #ForArizona and I couldn't be more proud.",683,580,0,100,3,0,0,44,2639311766124065,CaptMarkKelly,/story.php?story_fbid=2639311766124065&id=163148530407080
Captain Mark Kelly,,2020-01-12 12:45:00,"My mission #ForArizona is powered by everyday Arizonans pitching in time and volunteering. If you support our campaign, sign up to volunteer today.",280,239,1,39,1,0,0,18,2634994879889087,CaptMarkKelly,/story.php?story_fbid=2634994879889087&id=163148530407080
Captain Mark Kelly,,2020-01-11 13:42:29,I bring a different set of experiences to the table than most in Washington — experience that’s taught me you can’t let politics get in the way of doing the right thing.,650,546,4,97,3,0,0,37,2632862020102373,CaptMarkKelly,/story.php?story_fbid=2632862020102373&id=163148530407080
Captain Mark Kelly,,2020-01-10 14:17:40,"The future of our planet depends on new ideas, invention, and innovation. Great to see some problem solving using our favorite plant — the cactus! 🌵",1000,829,1,127,44,0,1,22,2630701710318404,CaptMarkKelly,/story.php?story_fbid=2630701710318404&id=163148530407080
Captain Mark Kelly,,2020-01-09 19:21:49,Ensuring everyone is counted in this year’s census is critical to making sure tribal communities receive the federal support they deserve.,277,247,0,29,1,0,0,15,2628949740493601,CaptMarkKelly,/story.php?story_fbid=2628949740493601&id=163148530407080
Captain Mark Kelly,,2020-01-09 11:16:11,"Public school teachers are heroes, but they can’t do their job without supplies. Until we better fund our public school programs, I’m proud to see local groups like @Treasures4Teach working to give teachers and students the tools they need to succeed.",144,131,0,10,3,0,0,8,2628252670563308,CaptMarkKelly,/story.php?story_fbid=2628252670563308&id=163148530407080
Captain Mark Kelly,,2020-01-08 16:12:34,"19 times this bell rang today — six for the people we lost on January 8, 2011, and 13 for those who were injured. Thank you to the first responders and medical professionals who answered the call that day and continue to keep our community safe.",882,485,0,163,0,234,0,20,2626677487387493,CaptMarkKelly,/story.php?story_fbid=2626677487387493&id=163148530407080
Captain Mark Kelly,,2020-01-08 10:12:51,"‪Christina-Taylor Green‬ ‪Dorothy Morris‬ ‪Judge John Roll‬ ‪Phyllis Schneck‬ ‪Dorwin Stoddard‬ ‪Gabe Zimmerman‬ ‪Nine years ago the Tucson community lost six friends and loved ones to an act of senseless violence that injured 13 others. Today, we honor their memory.",2200,770,2,424,9,1000,6,97,2626111360777439,CaptMarkKelly,/story.php?story_fbid=2626111360777439&id=163148530407080
