source,shared_from,date,text,reactions,likes,ahah,love,wow,sigh,grrr,comments,post_id,page_id,url
Captain Mark Kelly,,2020-01-07 12:27:38,From the bottom of my heart: Thank you. We can’t do this without your support. #FullSpeedAhead,409,346,0,61,1,0,1,12,564501591065600,CaptMarkKelly,/story.php?story_fbid=564501591065600&id=163148530407080
Captain Mark Kelly,,2020-01-06 14:48:27,Why do drug prices continue to skyrocket while pharmaceutical companies receive more cash from tax breaks than the Arizona families who need those medications?  Because Washington is broken.,122,53,0,2,8,6,53,12,2622473877807854,CaptMarkKelly,/story.php?story_fbid=2622473877807854&id=163148530407080
Captain Mark Kelly,,2020-01-06 10:31:43,"If you think we did a lot in 2019, just wait until you see what we get done in 2020! #FullSpeedAhead",676,545,9,119,1,0,2,117,2621210811267494,CaptMarkKelly,/story.php?story_fbid=2621210811267494&id=163148530407080
Captain Mark Kelly,,2020-01-04 18:57:10,Arizona needs independent leaders who are driven to solve the problems Arizonans face every day. #FullSpeedAhead,754,648,6,95,4,0,1,28,2618522948202947,CaptMarkKelly,/story.php?story_fbid=2618522948202947&id=163148530407080
Captain Mark Kelly,,2020-01-02 13:51:29,My campaign wouldn’t be where it is today without volunteers pitching in and building this operation from the ground up. Join our people-powered campaign. #FullSpeedAhead,211,187,2,21,1,0,0,6,2613714695350439,CaptMarkKelly,/story.php?story_fbid=2613714695350439&id=163148530407080
Captain Mark Kelly,,2020-01-01 17:51:42,"Six years ago today, it became illegal for insurance companies to discriminate against you because of a pre-existing condition. We cannot go back to a time where millions of Arizonans with pre-existing conditions, like myself, were forced to pay unaffordable rates or go uninsured.",1100,1000,2,78,2,15,6,46,2611958905526018,CaptMarkKelly,/story.php?story_fbid=2611958905526018&id=163148530407080
Captain Mark Kelly,,2020-01-01 12:19:29,"It’s time, Arizona. #FullSpeedAhead",808,641,1,160,4,1,1,40,2611463342242241,CaptMarkKelly,/story.php?story_fbid=2611463342242241&id=163148530407080
Captain Mark Kelly,,2019-12-31 16:40:23,We’re less than a day away from 2020 and we’re moving #FullSpeedAhead. Join our people-powered campaign by purchasing our new team sticker below. 🚀,76,66,0,10,0,0,0,2,2609433989111843,CaptMarkKelly,/story.php?story_fbid=2609433989111843&id=163148530407080
Captain Mark Kelly,,2019-12-31 12:16:10,"If you can, please get your flu shot this season. Other Arizonans are counting on you.",1100,559,2,16,9,472,64,53,2608953795826529,CaptMarkKelly,/story.php?story_fbid=2608953795826529&id=163148530407080
Captain Mark Kelly,,2019-12-30 13:24:25,"NEWS: If we’re going to have the resources to win the election in November, we need to get as many donations as we can before the end of the year. Can Gabby Giffords and I count on you to chip in $5 before the end of the month? Chip in here: http://bit.ly/2MEguNh",462,375,1,82,2,1,1,32,756096428235813,CaptMarkKelly,/story.php?story_fbid=756096428235813&id=163148530407080
Captain Mark Kelly,,2019-12-29 15:53:30,"Partisanship and corporate PAC money have brought Washington to a standstill. That’s why I’m refusing to take a dime of corporate PAC money. If you believe it’s time to elect a Senator who fights #ForArizona, then chip in now and help power this campaign.",142,124,0,16,2,0,0,11,2605022912886284,CaptMarkKelly,/story.php?story_fbid=2605022912886284&id=163148530407080
Captain Mark Kelly,,2019-12-27 16:36:11,"Just weeks ago, the House passed a bill to allow Medicare to negotiate down the price of prescription drugs, but partisan politics in the Senate will likely stop it from becoming law. It’s time to elect senators who can get the job done.",716,594,0,47,13,9,53,49,2600940376627871,CaptMarkKelly,/story.php?story_fbid=2600940376627871&id=163148530407080
Captain Mark Kelly,,2019-12-24 20:36:45,Gabby Giffords and I have visited The USS Arizona Memorial in Pearl Harbor. It is a powerful reminder of our history. It will be good to see a ship bearing our state’s name once again as an active member of the fleet.,337,288,0,42,5,2,0,15,2594983967223512,CaptMarkKelly,/story.php?story_fbid=2594983967223512&id=163148530407080
Captain Mark Kelly,,2019-12-24 14:24:38,"OK, Arizona. Who thinks they can top our ugly Christmas sweaters? 🛸",2400,1700,280,468,13,1,0,182,2594484043940171,CaptMarkKelly,/story.php?story_fbid=2594484043940171&id=163148530407080
Captain Mark Kelly,,2019-12-22 20:56:34,"‪Happy Hanukkah, Arizona! We lit the menorah. We ate some tamales — hey, it’s Arizona after all. We hope everyone who is celebrating tonight is enjoying time with family and friends. We are.‬",2200,1800,13,404,6,0,0,90,2590933207628588,CaptMarkKelly,/story.php?story_fbid=2590933207628588&id=163148530407080
Captain Mark Kelly,,2019-12-20 12:08:01,"The Grand Canyon is a treasure for Arizona and the planet, and I’m grateful for Kyrsten Sinema’s leadership in working to protect it from uranium mining.  This is an Arizona priority and something Arizona’s senators should support — I know I do.",521,471,0,50,0,0,0,14,2586046664783909,CaptMarkKelly,/story.php?story_fbid=2586046664783909&id=163148530407080
Captain Mark Kelly,,2019-12-18 20:04:26,Two things you need to know: 1. This lawsuit still threatens the well-being of seniors and Arizonans with pre-existing conditions.  2. I'll stand up to anyone who comes after Arizonans' health care.,211,160,2,8,6,8,27,18,2582553055133270,CaptMarkKelly,/story.php?story_fbid=2582553055133270&id=163148530407080
Captain Mark Kelly,,2019-12-17 17:00:57,"Innovation has always been a part of the American Dream, but getting the job done? That’s just the American way. Happy Wright Brothers Day, Arizona. ✈️🚀",878,745,3,125,4,0,1,23,2580311152024127,CaptMarkKelly,/story.php?story_fbid=2580311152024127&id=163148530407080
Captain Mark Kelly,,2019-12-16 16:27:05,"I had a blast volunteering at St. Mary's Food Bank and Community Food Bank of Southern Arizona before Thanksgiving. If you're looking for ways to give back to your community this holiday season, consider volunteering at your local food bank. Use this link to find the one nearest you: http://www.azfoodbanks.org/index.php/foodbank/",446,400,0,46,0,0,0,8,2578244898897419,CaptMarkKelly,/story.php?story_fbid=2578244898897419&id=163148530407080
Captain Mark Kelly,,2019-12-15 12:06:47,"We’ve already accomplished so much this year as a campaign, but trust me when I say we’re only getting started.  Help propel this people-powered campaign into the new year by chipping in $5 here: https://secure.actblue.com/donate/mek-social?refcode=20191215fb",125,115,0,10,0,0,0,12,2575742575814318,CaptMarkKelly,/story.php?story_fbid=2575742575814318&id=163148530407080
Captain Mark Kelly,,2019-12-14 18:41:04,"Thanks, Boilermakers Local 627, for letting me change things up a little and get my hands dirty last week.",114,107,2,4,1,0,0,6,2574211912634051,CaptMarkKelly,/story.php?story_fbid=2574211912634051&id=163148530407080
Captain Mark Kelly,,2019-12-13 16:43:51,It was great to meet with small business owners in the GPGLCC - Greater Phoenix Gay & Lesbian Chamber of Commerce. Ending discrimination in the workplace for the #LGBTQ community is essential to building an economy that works for all Arizonans. Glad to be in this fight together.,397,348,0,46,3,0,0,12,2571940652861177,CaptMarkKelly,/story.php?story_fbid=2571940652861177&id=163148530407080
Captain Mark Kelly,,2019-12-13 11:26:53,"🚨 ATTN: Arizona 🚨 There are only two days left to enroll in the health care exchange for next year. If you need coverage and haven't enrolled yet, use the link below to #GetCovered. https://insurance.az.gov/health-insurance-marketplace-healthcaregov",45,40,0,5,0,0,0,5,2571468576241718,CaptMarkKelly,/story.php?story_fbid=2571468576241718&id=163148530407080
Captain Mark Kelly,,2019-12-12 20:48:40,"Choosing between a growing economy and protecting our environment is a false choice. In fact, investing in renewable energy would create more economic opportunities across Arizona.  Rejoining the #ParisAgreement will help save our planet *and* strengthen our economy.",407,368,3,34,2,0,0,19,2570106313044611,CaptMarkKelly,/story.php?story_fbid=2570106313044611&id=163148530407080
Captain Mark Kelly,,2019-12-11 20:07:52,"This is great news for Arizona. #USMCA will allow Arizona dairy farmers to compete in new markets, and I’m glad the agreement was strengthened with improved protections for workers.",120,107,0,13,0,0,0,1,2567808256607750,CaptMarkKelly,/story.php?story_fbid=2567808256607750&id=163148530407080
Captain Mark Kelly,,2019-12-10 13:58:30,"One of the biggest obstacles to lowering prescription drug prices is corporate PACs and their influence in our political system. The sooner we get corporate PAC money out of politics, the sooner we can keep more money in the pockets of hardworking Arizonans.",175,151,1,21,0,2,0,11,2563249417063634,CaptMarkKelly,/story.php?story_fbid=2563249417063634&id=163148530407080
Captain Mark Kelly,,2019-12-08 17:00:01,"Dreamers are Americans in every way except for a piece of paper. It's been nine years to the day since the House voted to give them a path to citizenship, so why hasn't the Senate voted to do the same?",140,117,1,19,0,1,2,10,2560903450631564,CaptMarkKelly,/story.php?story_fbid=2560903450631564&id=163148530407080
Captain Mark Kelly,,2019-12-08 14:21:46,"Over their lifetimes, workers and small businesses have contributed into Social Security and Medicare so Arizonans could have a secure retirement that includes health care. I won't let those earned benefits be gambled on the stock market or turned into a voucher system.",309,285,0,24,0,0,0,10,2560738640648045,CaptMarkKelly,/story.php?story_fbid=2560738640648045&id=163148530407080
Captain Mark Kelly,,2019-12-07 13:06:16,"On the 78th anniversary of the attack on #PearlHarbor, we honor the memory of those brave servicemembers who lost their lives defending our country — over a thousand of whom were aboard the USS Arizona.",860,538,0,106,16,200,0,17,2558336654221577,CaptMarkKelly,/story.php?story_fbid=2558336654221577&id=163148530407080
Captain Mark Kelly,,2019-12-06 15:32:00,"Pensacola was the first stop on my journey to becoming a naval aviator that included a brief stop in Pearl Harbor. There are dedicated sailors, civilians, and military families on these bases, and they need to be kept safe. Thank you to the first responders who arrived on scene.",412,287,0,41,1,83,0,14,2556416181080291,CaptMarkKelly,/story.php?story_fbid=2556416181080291&id=163148530407080
Captain Mark Kelly,,2019-12-05 14:33:47,"Eighteen years ago today, the crew of #STS108 and I launched on the Space Shuttle Endeavour. It was my first trip into space. See how the shuttle glides through the sky? Well, let's just say it doesn't feel all that smooth from the inside.",380,295,2,61,22,0,0,23,2554062191315690,CaptMarkKelly,/story.php?story_fbid=2554062191315690&id=163148530407080
Captain Mark Kelly,,2019-12-04 17:25:30,I'm excited to see what NASA - National Aeronautics and Space Administration and The University of Arizona can learn about the Sun from the Parker Solar Probe.,135,122,0,8,5,0,0,0,2552078874847355,CaptMarkKelly,/story.php?story_fbid=2552078874847355&id=163148530407080
Captain Mark Kelly,,2019-12-03 18:52:47,"Until we get skyrocketing drug prices under control, nearly one in four seniors will struggle to afford their prescription drugs — drugs they desperately need.",149,100,0,0,0,45,4,13,2549982261723683,CaptMarkKelly,/story.php?story_fbid=2549982261723683&id=163148530407080
Captain Mark Kelly,,2019-12-01 13:54:25,My campaign is not taking a dime of corporate PAC money. Period. Arizonans will know that I'm accountable to them. #ForArizona,407,357,1,47,1,1,0,20,2544984995556743,CaptMarkKelly,/story.php?story_fbid=2544984995556743&id=163148530407080
Captain Mark Kelly,,2019-11-28 22:31:00,"From our family to yours, Happy Thanksgiving! Thankful to be surrounded by friends and family today.",2700,2200,4,493,6,0,0,109,2539003099488266,CaptMarkKelly,/story.php?story_fbid=2539003099488266&id=163148530407080
Captain Mark Kelly,,2019-11-28 12:19:42,"Thinking back to the time NASA Astronaut Scott Kelly and I almost burnt down the garage, but clearly burnt the turkey. Promise it won't happen this year, Gabby Giffords!",1100,695,369,61,9,0,0,61,2538030639585512,CaptMarkKelly,/story.php?story_fbid=2538030639585512&id=163148530407080
Captain Mark Kelly,,2019-11-27 12:12:28,There are common sense steps we can take right now to lower prescription drug costs like allowing Medicare to negotiate down the price of prescription drugs for Arizona seniors.,151,137,0,13,1,0,0,8,2535911356464107,CaptMarkKelly,/story.php?story_fbid=2535911356464107&id=163148530407080
Captain Mark Kelly,,2019-11-26 20:48:29,Today we visited Community Food Bank of Southern Arizona and learned more about the work they do for our community. We also pitched in and lent a helping hand in advance of the holiday. Thank you for all of the work you do!,570,486,1,79,4,0,0,16,2534510453270864,CaptMarkKelly,/story.php?story_fbid=2534510453270864&id=163148530407080
Captain Mark Kelly,,2019-11-25 18:10:05,"Dreamers are Americans in every way except a piece of paper. They're part of our community, they contribute to our economy. Congress should act and provide Dreamers with an earned path to citizenship.",103,88,2,12,0,0,1,2,2532027606852482,CaptMarkKelly,/story.php?story_fbid=2532027606852482&id=163148530407080
Captain Mark Kelly,,2019-11-24 17:16:43,"In Arizona, Native American women die from pregnancy related issues at a rate four times higher than white women. We need to fully fund the Indian Health Service and ensure Native American communities have access to quality maternal health care.",490,382,1,53,5,48,1,19,2529565693765340,CaptMarkKelly,/story.php?story_fbid=2529565693765340&id=163148530407080
Captain Mark Kelly,,2019-11-23 19:43:43,Gabby Giffords and I had a great time riding in El Tour de Tucson. I can’t think of a better representation of Tucson than thousands of people coming together outdoors to help raise money for the causes they care about.,2100,1700,2,421,11,0,0,35,2527456387309604,CaptMarkKelly,/story.php?story_fbid=2527456387309604&id=163148530407080
Captain Mark Kelly,,2019-11-22 19:46:17,"Service and giving back to our community is so important. That's why we took our mission #ForArizona to the St. Mary's Food Bank today to volunteer and package meals for the holidays. Our shift packed more than 1,400 boxes of food!",510,430,0,78,1,1,0,14,2523952430993333,CaptMarkKelly,/story.php?story_fbid=2523952430993333&id=163148530407080
Captain Mark Kelly,,2019-11-21 14:44:01,"Nearly 2.8 million Arizonans have a pre-existing condition, myself included. We can't turn back the clock and allow people with pre-existing conditions to be denied coverage or face unaffordable costs.",272,230,1,18,14,8,1,20,2521225857932657,CaptMarkKelly,/story.php?story_fbid=2521225857932657&id=163148530407080
Captain Mark Kelly,,2019-11-20 18:56:45,"Today is #LatinaEqualPayDay. The Latina wage gap is a justice issue, a family issue, and an issue for our economy here in Arizona. We've got to take it head on.",70,55,1,1,0,13,0,10,2519392808115962,CaptMarkKelly,/story.php?story_fbid=2519392808115962&id=163148530407080
Captain Mark Kelly,,2019-11-20 15:47:16,"Thanks to all of the participants for their important work to make Arizona and our planet a more sustainable place to live. Climate change is a threat, but it's also an opportunity for Arizona to lead in the transition to a renewable economy and create good-paying jobs.",106,94,1,9,2,0,0,7,2519135068141736,CaptMarkKelly,/story.php?story_fbid=2519135068141736&id=163148530407080
Captain Mark Kelly,,2019-11-19 11:44:38,Happy #AmericanEducationWeek! I'm a proud product of public education. This week is a great chance to thank teachers for the difference they make in students' lives and ensuring every kid is prepared to succeed.,128,111,0,16,1,0,0,6,2516589911729585,CaptMarkKelly,/story.php?story_fbid=2516589911729585&id=163148530407080
Captain Mark Kelly,,2019-11-18 11:19:26,"Sadly, Arizona has one of the highest rates of veteran suicide in the country. There is an urgent need to improve the quality and timeliness of care - particularly mental health care - that our veterans receive.",278,73,0,2,2,182,19,26,2514516305270279,CaptMarkKelly,/story.php?story_fbid=2514516305270279&id=163148530407080
Captain Mark Kelly,,2019-11-16 20:49:39,Today I joined former Navy SEAL Jimmy Hatch and Arizona veterans to discuss veterans health care and ensuring veterans with traumatic brain injuries get the care and community support they need.,462,418,0,42,2,0,0,23,2510997345622175,CaptMarkKelly,/story.php?story_fbid=2510997345622175&id=163148530407080
Captain Mark Kelly,,2019-11-15 21:20:08,Enjoyed touring the Ak-Chin community and meeting with tribal leadership today. Thank you to Chairman Miguel and council members for your time.,308,274,0,32,2,0,0,13,2508895915832318,CaptMarkKelly,/story.php?story_fbid=2508895915832318&id=163148530407080
Captain Mark Kelly,,2019-11-15 11:11:51,I've seen the work being done at places like MANA House in Phoenix and others around Arizona to tackle the issue of homelessness among veterans. Our mission isn't over until every veteran receives the support they need after their military service.,133,54,0,3,1,59,16,12,2507975602591016,CaptMarkKelly,/story.php?story_fbid=2507975602591016&id=163148530407080
Captain Mark Kelly,,2019-11-13 16:37:53,"Congratulations to Kyrsten Sinema on being named to TIME's 100 Next List! Arizona is lucky to have her representing us in the Senate, and it was quite an honor to write this entry. #TIME100Next",815,702,3,87,8,2,13,65,2504192242969352,CaptMarkKelly,/story.php?story_fbid=2504192242969352&id=163148530407080
Captain Mark Kelly,,2019-11-13 12:04:00,I've seen the work being done at places like Mana House in Phoenix and others around Arizona to tackle the issue of homelessness among veterans. Our mission isn't over until every veteran receives the support they need after their military service.,324,131,0,10,7,155,21,20,2503769393011637,CaptMarkKelly,/story.php?story_fbid=2503769393011637&id=163148530407080
Captain Mark Kelly,,2019-11-12 09:35:28,"The Supreme Court is hearing a case today that could eliminate #DACA. Instead of waiting around, the Senate should fix this right now by providing Dreamers with an earned pathway to citizenship.",661,562,0,77,2,9,11,39,2501477579907485,CaptMarkKelly,/story.php?story_fbid=2501477579907485&id=163148530407080
Captain Mark Kelly,,2019-11-11 20:37:06,Happy Veterans Day from Tucson! Had a great time with fellow veterans marching in the 100th Annual Tucson #VeteransDay Parade.,716,614,0,100,2,0,0,13,2500389140016329,CaptMarkKelly,/story.php?story_fbid=2500389140016329&id=163148530407080
Captain Mark Kelly,,2019-11-11 10:33:00,"Happy #VeteransDay, Arizona! Military service and taking care of our veterans is ingrained in Arizona's DNA. Thank you to all of our veterans and their families for your service and sacrifice.",290,244,0,46,0,0,0,18,2497633740291869,CaptMarkKelly,/story.php?story_fbid=2497633740291869&id=163148530407080
Captain Mark Kelly,,2019-11-10 18:57:30,"Happy anniversary, Gabby Giffords! You're still the closest to heaven that I've ever been.",8200,4900,4,3200,16,0,0,437,2497288356993074,CaptMarkKelly,/story.php?story_fbid=2497288356993074&id=163148530407080
Captain Mark Kelly,,2019-11-10 16:19:43,"Even a Navy guy like me has to say happy birthday, U.S. Marine Corps. From the first Marines, to the Navajo Code Talkers, to those wearing the uniform today: thank you for your service.",567,485,0,80,2,0,0,24,2494510123937564,CaptMarkKelly,/story.php?story_fbid=2494510123937564&id=163148530407080
Captain Mark Kelly,,2019-11-10 11:31:04,Sat down with John Hook Fox 10 last week for a conversation about this Mission #ForArizona and the issues that I've heard about traveling to all 15 counties in Arizona.,269,243,0,25,0,1,0,5,2493046747417235,CaptMarkKelly,/story.php?story_fbid=2493046747417235&id=163148530407080
Captain Mark Kelly,,2019-11-09 11:18:00,"From serving in the Navy for 25 years to being an astronaut, I’ve been a problem solver and a public servant my entire adult life. Now I’m ready to serve the state of Arizona in the U.S. Senate.",282,230,0,52,0,0,0,10,2493043714084205,CaptMarkKelly,/story.php?story_fbid=2493043714084205&id=163148530407080
Captain Mark Kelly,,2019-11-08 11:21:40,"We need a secure border, an immigration system that works and reflects our values, and ports of entry that are modern and efficient. Tackling these challenges will benefit communities like Yuma and all of Arizona.",514,459,0,52,3,0,0,21,2492285550826688,CaptMarkKelly,/story.php?story_fbid=2492285550826688&id=163148530407080
Captain Mark Kelly,,2019-11-07 16:03:53,"If we take advantage of this opportunity, the transition to renewable energy will mean good-paying jobs and economic growth for Arizona.",121,107,1,12,0,0,1,9,2490557944332782,CaptMarkKelly,/story.php?story_fbid=2490557944332782&id=163148530407080
Captain Mark Kelly,,2019-11-07 10:33:56,Enjoyed talking with Jenny Day at KYMA-TV about our mission #ForArizona and my visit to Yuma last week.,441,374,1,63,3,0,0,12,2488680287853881,CaptMarkKelly,/story.php?story_fbid=2488680287853881&id=163148530407080
Captain Mark Kelly,,2019-11-06 19:21:43,Good luck to NAU Basketball and A Players Program in the opening game of the season tonight! Any guesses for who we’re rooting for in Tucson? #BearDown,47,43,0,3,1,0,0,3,2488677927854117,CaptMarkKelly,/story.php?story_fbid=2488677927854117&id=163148530407080
Captain Mark Kelly,,2019-11-06 15:24:22,"Native American history, culture, and art are foundational to the history and identity of Arizona. This #NativeAmericanHeritageMonth, we reaffirm our commitment to advance the rights of Native Americans in Arizona and across the country.",422,341,1,79,1,0,0,9,2488339581221285,CaptMarkKelly,/story.php?story_fbid=2488339581221285&id=163148530407080
Captain Mark Kelly,,2019-11-05 23:42:02,Tucson made history today and elected the city's first Latina mayor. Congratulations to Regina Romero on her historic win. Our city is in great hands.,2700,2100,0,561,22,0,1,49,2486937961361447,CaptMarkKelly,/story.php?story_fbid=2486937961361447&id=163148530407080
Captain Mark Kelly,,2019-11-05 16:35:13,"Today is Election Day in Tucson. If you haven't mailed in your ballot already, find out where to drop it off here:",139,129,0,10,0,0,0,12,2486320838089826,CaptMarkKelly,/story.php?story_fbid=2486320838089826&id=163148530407080
Captain Mark Kelly,,2019-11-03 18:32:30,We’re one year out from Election Day 2020! Thanks to everyone who came to see Gabby Giffords and me in Phoenix. And thanks to everyone who signed up to volunteer. We need your help! Join this Mission #ForArizona here:  https://markkelly.com/get-involved/,728,626,0,100,2,0,0,31,2482277385160838,CaptMarkKelly,/story.php?story_fbid=2482277385160838&id=163148530407080
Captain Mark Kelly,,2019-11-01 15:33:11,"I stand with the more than 25,000 #DREAMers who call Arizona home. DREAMers were brought here as children, went to school here, and are contributing to our communities. They deserve a path to citizenship.",631,529,0,100,2,0,0,17,2475563519165558,CaptMarkKelly,/story.php?story_fbid=2475563519165558&id=163148530407080
Captain Mark Kelly,,2019-11-01 12:22:43,These Mesa students were told to dress up as their superheroes for spirit week and they chose to dress up as their teacher. Teachers are heroes!,402,314,0,85,3,0,0,3,2475560849165825,CaptMarkKelly,/story.php?story_fbid=2475560849165825&id=163148530407080
Captain Mark Kelly,,2019-10-31 19:01:35,¡Feliz Día de los Muertos a todos los que celebran!Happy Day of the Dead to all who celebrate!,196,169,0,26,1,0,0,8,2475552239166686,CaptMarkKelly,/story.php?story_fbid=2475552239166686&id=163148530407080
Captain Mark Kelly,,2019-10-31 14:55:13,Happy Halloween Arizona! Have fun trick-or-treating and stay safe!,288,255,1,29,3,0,0,6,2475545665834010,CaptMarkKelly,/story.php?story_fbid=2475545665834010&id=163148530407080
Captain Mark Kelly,,2019-10-29 16:02:30,"The #GrandCanyon is a treasure not just for Arizona, but for the planet. I support this proposal to continue to protect the Grand Canyon area from uranium mining. #KeepitGrand",741,652,1,83,4,1,0,17,2471543942900849,CaptMarkKelly,/story.php?story_fbid=2471543942900849&id=163148530407080
Captain Mark Kelly,,2019-10-28 16:21:40,"While traveling across Arizona, I’ve had the chance to meet little astronauts who are up for the mission. With Halloween right around the corner, I can’t wait to see more future astronauts trick-or-treating. Share your space themed costumes here!",860,712,3,139,6,0,0,25,2469563606432216,CaptMarkKelly,/story.php?story_fbid=2469563606432216&id=163148530407080
Captain Mark Kelly,,2019-10-27 12:03:12,Wishing a joyful Diwali to all those celebrating the festival of lights in Arizona and around the world.,432,386,0,45,1,0,0,6,2467087073346536,CaptMarkKelly,/story.php?story_fbid=2467087073346536&id=163148530407080
Captain Mark Kelly,,2019-10-26 19:25:00,"Gabby Giffords and I are ready to get the vote out for Regina Romero. Councilwoman Romero was the first Latina elected to the city council, and now she’s about to be Tucson’s first Latina mayor. Our city will be in good hands after she wins in November.",532,467,1,59,5,0,0,9,2465648200157090,CaptMarkKelly,/story.php?story_fbid=2465648200157090&id=163148530407080
