source,shared_from,date,text,reactions,likes,ahah,love,wow,sigh,grrr,comments,post_id,page_id,url
Ed Markey,,2020-02-13 18:26:26,Clearview’s facial recognition app is a clear and egregious violation of privacy and civil liberty. Clearview is secretly mining all our images without consent and handing them over to law enforcement and other clients for profit. This will destroy public anonymity as we know it.  This software puts everyone’s privacy at risk. Who will it hurt the most? Minors. Domestic abuse survivors. Immigrants. Protestors. People of color.  We cannot and will not stand by while our privacy rights are stripped away.,118,67,0,3,16,1,31,12,2162205997216389,EdMarkeyforMA,/story.php?story_fbid=2162205997216389&id=303167829786891
"Ed Markey,WGBH",WGBH,2020-02-13 16:30:00,"Join Team Markey at the Boston Public Library Tuesday night for a watch party of the Massachusetts Senate Debate and get involved with our people-powered movement. RSVP: http://to.wgbh.org/60141cRqgWe’re hosting a watch party for the first U.S. Senate Primary Debate and you’re invited! Join us at WGBH’s Boston Public Library studio for a remote broadcast of the face-off between Democratic candidates Sen. Edward Markey and Rep. Joseph Kennedy III. Learn more about each candidate as Boston Public Radio hosts Jim Braude and Margery Eagan lead the conversation on Tuesday, February 18 at 7pm. Analysis follows with Peter Kadzis and Adam Reilly, hosts of the Massachusetts politics podcast, The Scrum. A limited number of tickets are still available here: http://to.wgbh.org/61881cRSE",52,46,2,4,0,0,0,7,2162528293850826,EdMarkeyforMA,/story.php?story_fbid=2162528293850826&id=303167829786891
Ed Markey,,2020-02-13 14:43:50,We have successfully forced a vote on a War Powers Resolution that defies Trump's reckless push for a war with Iran and makes clear that the president must have Congressional authorization before taking military action.,131,112,2,13,0,0,4,15,2162327280537594,EdMarkeyforMA,/story.php?story_fbid=2162327280537594&id=303167829786891
Ed Markey,,2020-02-13 12:12:35,"Antarctica just hit 69 degrees, the hottest temperature ever recorded on the continent. The climate crisis is happening now. We need a Green New Deal.",228,89,1,1,21,85,31,24,2162091570561165,EdMarkeyforMA,/story.php?story_fbid=2162091570561165&id=303167829786891
Ed Markey,,2020-02-13 10:58:31,"Every year, President Trump proposes dangerous funding cuts to crucial medical research funded by the National Institutes of Health. These proposed cuts clearly show this administration’s carelessness toward patients and families praying for cures and better treatments every day, and would undermine decades of scientific progress.  Medical research is a symbol of hope for millions of Americans, and I will continue working to ensure the medical research community has the support and resources it needs.",102,23,1,0,1,11,66,13,2161954457241543,EdMarkeyforMA,/story.php?story_fbid=2161954457241543&id=303167829786891
"Ed Markey,Paul Bo",Paul Bo,2020-02-12 20:07:31,"In 2019 I re-introduced my bill to restrict US first-use of nuclear weapons. But my history with the nuclear non-proliferation movement goes way back to my sophomore year science fair at Malden Catholic.  One day my father brought me to work with him at the Hood Milk company. There was a whole science lab set up on the roof where scientists were testing the milk for radioactive isotopes. This was back in 1962, in the middle of the Cold War.  Because of atmospheric nuclear testing by the US and USSR, strontium-90 was being deposited into the clouds. The Sr-90 would fall to the ground in rain, cows would eat contaminated grass, and Sr-90—this radioactive particle—was showing up in the milk supply.  So because of nuclear testing, children across the country and all over the planet were drinking dangerous, radioactive isotopes in their milk.  Around that time, Linus Pauling began a public health movement to persuade President Kennedy to end atmospheric nuclear testing. He was already a Nobel Prize winner. I was a high school sophomore, so the largest audience I could appeal to was the Malden Catholic science fair.  My views on nuclear proliferation and environmental contamination started right there with this science project. I saw that children were being poisoned and the government was complicit. The year after this science fair, in 1963, Khrushchev and Kennedy signed the atmospheric nuclear test ban. Underground tests were still going on—until 20 years later when I wrote and passed an amendment in Congress to shut that down.Radioactive milk, kids, and a science fair project. Ed Markey talks about how he got involved in the anti-nuke movement as a teen on a bus to NH this weekend",55,44,1,8,1,0,1,5,2160668954036760,EdMarkeyforMA,/story.php?story_fbid=2160668954036760&id=303167829786891
Ed Markey,,2020-02-12 18:32:53,¡Los caucus demócraticos de Massachusetts empiezan esta semana! ¿Qué son y por qué son importantes? Nuestro equipo está aquí para ayudar. Inscríbete en el enlace para más información: http://bit.ly/markey-caucusesMassachusetts democratic caucus starts this week! What are they and why are they important? Our team is here to help. Enroll the link for more info: http://bit.ly/markey-caucuses,26,16,1,9,0,0,0,6,2160398024063853,EdMarkeyforMA,/story.php?story_fbid=2160398024063853&id=303167829786891
Ed Markey,,2020-02-12 16:48:47,The Massachusetts Democratic Caucuses start this week! What are they and why are they important? Our organizers are here to help. Sign up to caucus with Team Markey: http://bit.ly/markey-caucuses.,74,61,0,13,0,0,0,9,2160316747405314,EdMarkeyforMA,/story.php?story_fbid=2160316747405314&id=303167829786891
Ed Markey,,2020-02-12 14:13:21,"At a time when our democracy and planet are at stake, it will take all of us to fight for a better future. I am thrilled to have the support of the grassroots organizers in the Hingham Democratic Town Committee in this fight.",109,90,5,12,2,0,0,7,2160181447418844,EdMarkeyforMA,/story.php?story_fbid=2160181447418844&id=303167829786891
Ed Markey,,2020-02-12 12:23:21,"Donald Trump’s FCC is attacking community TV stations and media centers, but we are standing strong, defending local voices, and fighting to preserve their funding.",84,65,4,11,2,1,1,21,2159858390784483,EdMarkeyforMA,/story.php?story_fbid=2159858390784483&id=303167829786891
Ed Markey,,2020-02-12 11:45:56,"Today is the last day to register to vote in the Massachusetts Presidential Primary. If you are a US citizen in Massachusetts and will be 18 years  old by election day on March 3rd, you can register to vote right now.",62,58,0,4,0,0,0,11,2159925814111074,EdMarkeyforMA,/story.php?story_fbid=2159925814111074&id=303167829786891
"Ed Markey,Elizabeth Warren",Elizabeth Warren,2020-02-11 09:10:04,"Today is the day, New Hampshire. It’s time to choose hope over fear, courage over cynicism. It’s time to elect Elizabeth Warren as our nominee for president. To all the incredible volunteers out in the cold today knocking doors and getting out the vote-- thank you. This is what democracy looks like.New Hampshire, here’s everything you need to know to vote in your primary election today!",57,43,2,11,0,0,1,11,2157806200989702,EdMarkeyforMA,/story.php?story_fbid=2157806200989702&id=303167829786891
Ed Markey,,2020-02-10 16:07:15,"Donald Trump’s disdain for the most vulnerable Americans is once again on full display. This budget is immoral, indefensible, and unacceptable.",238,86,0,1,4,14,133,40,2156058957831093,EdMarkeyforMA,/story.php?story_fbid=2156058957831093&id=303167829786891
Ed Markey,,2020-02-10 11:58:15,Fossil fuel companies have been getting benefits and tax breaks for years at the expense of renewable energy and our planet. It’s time to level the playing field. Elizabeth Warren and I are calling on the U.S. Government Accountability Office (GAO) to put an end to the double standard.,86,68,0,15,2,0,1,18,2155712981199024,EdMarkeyforMA,/story.php?story_fbid=2155712981199024&id=303167829786891
Ed Markey,,2020-02-10 09:01:00,"If you want Elizabeth Warren to become our next president, please do everything you can to get out the vote in New Hampshire: https://elizabethwarren.com/call",101,79,2,18,0,0,2,17,2154370351333287,EdMarkeyforMA,/story.php?story_fbid=2154370351333287&id=303167829786891
Ed Markey,,2020-02-09 11:42:23,"Elizabeth Warren is a fighter for the climate, for students, for patients, and for everyone committed to the integrity of our democracy. Let's GOTV and help elect our first woman president.",105,83,7,14,0,0,1,19,2153421221428200,EdMarkeyforMA,/story.php?story_fbid=2153421221428200&id=303167829786891
Ed Markey,,2020-02-08 14:21:21,"I'm with #TeamWarren in New Hampshire this morning to knock doors and rally for our anti-corruption, progressive champion Elizabeth Warren! #NHforWarren",240,198,1,39,1,1,0,27,2151387378298251,EdMarkeyforMA,/story.php?story_fbid=2151387378298251&id=303167829786891
"Ed Markey,No More Deaths/No Más Muertes",No More Deaths/No Más Muertes,2020-02-05 17:26:10,"Providing humanitarian aid is not a crime, it’s the right and moral thing to do. Congratulations No More Deaths/No Más Muertes on winning your appeal and thank you for your commitment to protecting immigrants and refugees.Judge Márquez said prosecutors appeared to be claiming that without clean water and food, there would be more deaths and therefore fewer people willing to cross the border illegally. “This gruesome logic is profoundly disturbing,” she wrote. Officials from the Department of Justice did not respond to requests for comment https://www.nytimes.com/2020/02/05/us/tucson-border-activists-conviction-reversed.html",231,170,1,57,2,0,1,10,2150978938339095,EdMarkeyforMA,/story.php?story_fbid=2150978938339095&id=303167829786891
Ed Markey,,2020-02-07 17:32:56,There is no question that the president was guilty. The Republicans who voted to acquit him without hearing from a single witness have failed our country and our moral standards for governing.,188,162,1,12,1,6,6,42,2149304651839857,EdMarkeyforMA,/story.php?story_fbid=2149304651839857&id=303167829786891
Ed Markey,,2020-02-07 15:32:51,"‪A year ago today, Alexandria Ocasio-Cortez and I introduced the Green New Deal. Together, with Sunrise Movement and activists all over the world, we have mobilized a revolution for a just and sustainable future for all.",151,118,5,24,2,0,2,21,2149238915179764,EdMarkeyforMA,/story.php?story_fbid=2149238915179764&id=303167829786891
Ed Markey,,2020-02-07 13:00:35,"We know that the effects of the climate crisis aren’t distributed equally. That’s why when Alexandria Ocasio-Cortez and I introduced the Green New Deal one year ago today, we created a vision for environmental justice.  As a kid, I witnessed firsthand the impact of environmental inequality. I remember walking along the Malden River and seeing a toxic purple haze on the water. It was clear that the effects of pollution and contamination were concentrated in working class neighborhoods like ours.  I made it my mission to ensure that everyone, regardless of zip code or income or nation of origin, had clean air and water in their community. That’s what the Green New Deal is about.",81,63,3,14,1,0,0,20,2149038765199779,EdMarkeyforMA,/story.php?story_fbid=2149038765199779&id=303167829786891
Ed Markey,,2020-02-07 11:20:02,"Tina Chéry is a teacher, a healer, a change agent, and one of the greatest forces for breaking the cycle of violence in Massachusetts and across the country. While our neighborhood streets suffer from the scourge of gun violence, Tina wages peace. It was an honor to invite her as my guest to the State of the Union this week.",25,22,0,3,0,0,0,2,2148869535216702,EdMarkeyforMA,/story.php?story_fbid=2148869535216702&id=303167829786891
Ed Markey,,2020-02-06 17:27:37,"Gun violence has impacted people everywhere in Massachusetts. This Gun Violence Survivors Week, join me in lifting up the voices of those who bravely share their stories. We must listen to survivors and pass national, comprehensive gun control legislation.",26,19,1,6,0,0,0,11,2147097328727256,EdMarkeyforMA,/story.php?story_fbid=2147097328727256&id=303167829786891
Ed Markey,,2020-02-06 15:08:09,"The only way we begin the work of ending corruption in Washington and restoring faith in our democracy is not just by defeating Trump, but by electing the most progressive president, Senate, and House in history. Join us and help lead that movement.",232,184,3,41,0,0,4,46,2147086072061715,EdMarkeyforMA,/story.php?story_fbid=2147086072061715&id=303167829786891
"Ed Markey,National Park Service",National Park Service,2020-02-05 09:54:25,"The National Park Service stewards iconic places that preserve African American stories of empowerment, education, social change and perseverance. Through the lens of national parks, explore places for health and healing while honoring the beauty, experiences and values of African American culture that have shaped the nation.  Learn more at https://www.nps.gov/subjects/africanamericanheritage/twenty-and-odd.htm #TwentyandOdd #AfricanAmericanHeritage #FindYourPark Credit/Author: National Park Service/Mathew John Director: Mathew John Producers: Christian Bacon, Kayla Diallo, Kayla Hall, Rhea Warren, Ridasian Moore, Subria Spencer Directors of Photography: Will and Jim Pattiz",12,11,0,1,0,0,0,1,2146795828757406,EdMarkeyforMA,/story.php?story_fbid=2146795828757406&id=303167829786891
Ed Markey,,2020-02-05 19:33:57,This is a humanitarian disaster. The Trump administration must restore TPS immediately and stop deportations.,230,61,0,0,2,88,79,27,2145324398904549,EdMarkeyforMA,/story.php?story_fbid=2145324398904549&id=303167829786891
Ed Markey,,2020-02-05 12:54:26,"Donald Trump’s FCC is threatening local media like the Somerville Media Center. I am fighting back because in this period of media consolidation, it’s more important than ever that we lift up local voices.",64,63,0,1,0,0,0,1,2144802618956727,EdMarkeyforMA,/story.php?story_fbid=2144802618956727&id=303167829786891
Ed Markey,,2020-02-03 18:07:03,Team Markey is making calls and sending texts urging Iowans to #CaucusForWarren and help elect Elizabeth Warren as our Democratic nominee for president! MAKE CALLS: elizabethwarren.com/call,102,83,4,13,0,1,1,13,2140898292680493,EdMarkeyforMA,/story.php?story_fbid=2140898292680493&id=303167829786891
Ed Markey,,2020-02-03 15:40:50,The coronavirus will not be the last biothreat the US faces. We must ensure that we are prepared to deal with these potential epidemics. I am calling on President Trump to appoint a Global Health Chief to coordinate this effort at the highest levels of government.,66,60,3,2,0,0,1,19,2140718309365158,EdMarkeyforMA,/story.php?story_fbid=2140718309365158&id=303167829786891
Ed Markey,,2020-02-03 13:19:57,"Happy birthday Ayanna Pressley. You are an inspiration to us all. Thank you for your fearlessness, your advocacy, and your unshakeable commitment to justice.",442,368,2,68,2,1,1,17,2140525766051079,EdMarkeyforMA,/story.php?story_fbid=2140525766051079&id=303167829786891
Ed Markey,,2020-02-03 09:14:21,It is a special honor to be invited into a place of worship to hear directly from community members threatened by the Trump administration. Thank you City Councilor Gerly Adrien for Everett for welcoming me to the Church of God of Unity yesterday and for your commitment to the people of Everett always.,87,72,0,15,0,0,0,10,2140046762765646,EdMarkeyforMA,/story.php?story_fbid=2140046762765646&id=303167829786891
Ed Markey,,2020-02-02 18:41:27,‪Celebrated Super Bowl Sunday and Speaker Bob DeLeo’s campaign launch with our friends in Winthrop this morning!‬,38,36,0,2,0,0,0,2,2138716069565382,EdMarkeyforMA,/story.php?story_fbid=2138716069565382&id=303167829786891
Ed Markey,,2020-02-02 16:57:49,We must listen to the people and communities that are closest to the pain and let them guide our movement. Thank you to the Haitian community in Everett at the Church of God of Unity and most especially City Councilor Gerly Adrien for Everett for having me for this morning's service. We stand together in the fight to make Temporary Protected Status permanent and secure a pathway to citizenship for all.,67,60,0,7,0,0,0,5,2138594819577507,EdMarkeyforMA,/story.php?story_fbid=2138594819577507&id=303167829786891
Ed Markey,,2020-02-01 19:42:41,"It feels like January has lasted a lifetime. To give some perspective, here’s a recap of what Team Markey has been up to in 2020. We criss-crossed the state meeting with hundreds of voters, volunteers, and community leaders in over 25 cities and towns. We called for a new agenda to create a just and sustainable future. In Pittsfield, we celebrated FDR’s legacy and introduced a new Four Freedoms: freedom from climate change, gun violence, social injustice, and war. And on MLK weekend, we outlined a program for racial justice, including righting the wrongs of the failed War on Drugs.  Some personal favorite moments: I read in the Moby-Dick Marathon in New Bedford and was interviewed by a young journalist from the Kids Press Corps in Hopkinton.  Meanwhile, our team has been growing. We have organizers in every corner of the state building our grassroots movement for a Green New Deal, universal healthcare, peace, justice, and equality.",130,114,0,15,0,0,1,7,2136542849782704,EdMarkeyforMA,/story.php?story_fbid=2136542849782704&id=303167829786891
Ed Markey,,2020-02-01 18:11:52,"Climate justice is the cornerstone of the Green New Deal. It is a national disgrace how Black and Brown communities have been exposed to polluted air and water for generations. That injustice must end.  Thank you Reverend Mariama for your passion, your dedication, and your lifelong activism. We are lucky to have such a strong advocate fighting alongside us.",44,38,2,3,0,0,1,10,2136425209794468,EdMarkeyforMA,/story.php?story_fbid=2136425209794468&id=303167829786891
Ed Markey,,2020-02-01 10:31:54,"We celebrate the history of Black Americans, all those who stood tall against systematic discrimination and bigotry, who found joy and hope in community, and who inspired each of us to build a more inclusive, compassionate, and just society for all. We have a responsibility as allies to follow their example and amplify the voices of Black people in our movement. #BlackHistoryMonth",42,37,0,5,0,0,0,3,2135729433197379,EdMarkeyforMA,/story.php?story_fbid=2135729433197379&id=303167829786891
Ed Markey,,2020-01-31 15:15:20,The president and his Republican allies in the Senate are hiding the truth. They have failed their constitutional responsibility to the American people.,133,97,2,1,1,17,15,24,2133847233385599,EdMarkeyforMA,/story.php?story_fbid=2133847233385599&id=303167829786891
Ed Markey,,2020-01-30 17:16:01,"Trans rights are not up for debate. Right now, there is a concerted effort to rob transgender people of their rights happening in state legislatures across the country. This bill that just passed the South Dakota House is an appalling and unacceptable attack on the safety of young trans people. Similar bills have also been introduced in other states including Kentucky, Florida, and New Hampshire.  We must protect trans kids. We must allow them to be who they are and never let anyone make them feel unsafe. We must stand with trans people everywhere and say that trans rights are human rights.",121,55,0,4,2,13,47,18,2131043083666014,EdMarkeyforMA,/story.php?story_fbid=2131043083666014&id=303167829786891
Ed Markey,,2020-01-30 13:58:23,Abortion is a constitutional right. I stand with  to defend reproductive freedom for all people and am very grateful to have earned their support.,187,159,0,25,1,0,2,29,2130760073694315,EdMarkeyforMA,/EdMarkeyforMA/photos/a.303486423088365/2130760073694315
Ed Markey,,2020-01-30 09:47:18,Boston City Councilor Annissa Essaibi-George understands that we have a responsibility to children everywhere to leave them a planet that is healthy and habitable. Her commitment to Boston’s families and support for our movement is greatly appreciated.,40,38,0,2,0,0,0,2,2129977677105888,EdMarkeyforMA,/story.php?story_fbid=2129977677105888&id=303167829786891
"Ed Markey,Climate Justice Alliance",Climate Justice Alliance,2020-01-29 14:37:43,"Frontline communities must be at the front and center of the Green New Deal movement. In the words of Ayanna Pressley ""the people closest to the pain should be closest to the power."" There is no climate justice without youth voices, black and brown voices, or working class voices.Climate Justice Alliance’ newest video: Frontline Youth: Fighting for Climate Justice is out now!  This year marks the 50th anniversary of Earth Day and 528 years of Colonialism. It also signals the acceleration of some of the most systemic challenges that we and future generations will face in our lifetime with the rise of right wing threats, the decline of our ecological balance and a historically unprecedented rollback of over 95 federal environmental regulations including the recent Waters of the US rule. We know who suffers most from water, land, and climate pollution. That’s why it is important that Black and Brown youth speak for themselves to tell their stories as a part of an intergenerational movement for liberation from all extractive systems and industries.   For more information, visit http://ClimateJusticeAlliance.org/youth",40,34,1,3,0,0,2,2,2127501540686835,EdMarkeyforMA,/story.php?story_fbid=2127501540686835&id=303167829786891
Ed Markey,,2020-01-29 16:46:46,I worked hard and drove an ice cream truck to put myself through college. It wasn’t until 10 years after being elected that I finally paid off my student loans. Today the cost of college is 31x what it was then.  We need to make public colleges tuition free.,350,299,1,45,2,1,2,58,2127326057371050,EdMarkeyforMA,/story.php?story_fbid=2127326057371050&id=303167829786891
Ed Markey,,2020-01-29 15:03:08,I'm running on my record of delivering for people and communities everywhere in Massachusetts. That record has earned our movement the support of some of the most passionate leaders in our state and I am honored to have them fighting alongside us.,193,166,2,23,2,0,0,11,2127169290720060,EdMarkeyforMA,/story.php?story_fbid=2127169290720060&id=303167829786891
Ed Markey,,2020-01-29 11:41:52,These leaders are at the heart of the progressive movement in Massachusetts and across our country. It is an honor to have earned their support in this race.,132,110,2,19,0,0,1,14,2126358884134434,EdMarkeyforMA,/story.php?story_fbid=2126358884134434&id=303167829786891
Ed Markey,,2020-01-29 09:39:19,"“Ed Markey is somebody who cares deeply about this state and what it is and who its people are.""",356,312,8,31,3,0,2,19,2126218574148465,EdMarkeyforMA,/story.php?story_fbid=2126218574148465&id=303167829786891
Ed Markey,,2020-01-28 22:14:45,👔😄🍦🐟 . . Credit to Liana Ascolese at Ed Markey’s Dank Meme Stash #DollyPartonchallange,174,112,46,15,1,0,0,12,2124620344308288,EdMarkeyforMA,/story.php?story_fbid=2124620344308288&id=303167829786891
Ed Markey,,2020-01-28 09:15:26,"Michael and Kitty Dukakis are the embodiment of the bold, progressive values that have made the Democratic Party what it is today. I could not be more grateful for their support.",847,747,1,99,0,0,0,53,2120962158007440,EdMarkeyforMA,/story.php?story_fbid=2120962158007440&id=303167829786891
Ed Markey,,2020-01-27 19:15:00,A trial without witnesses is a cover up.,169,147,4,17,0,0,1,28,2121421697961486,EdMarkeyforMA,/story.php?story_fbid=2121421697961486&id=303167829786891
Ed Markey,,2020-01-27 15:12:48,"After President Trump's reckless military strike against Iran, it is clear now more than ever that we need a vote on the War Powers Act. No president, especially not this one, should have the ability to unilaterally start war or unleash nuclear destruction.",162,89,3,1,4,15,50,35,2121022204668102,EdMarkeyforMA,/story.php?story_fbid=2121022204668102&id=303167829786891
Ed Markey,,2020-01-27 14:43:47,"We must never become a country which turns away the sick, the hungry, the poor, and all those yearning to breathe free. This 5-4 decision is a disgrace and empowers President Trump in his racist mission to erase immigrants from the United States. We must reject this bigoted administration, welcome immigrants and refugees, and stand with people everywhere who see our nation as a beacon of hope and opportunity. That is our duty as Americans.",465,180,2,8,7,69,199,49,2121096531327336,EdMarkeyforMA,/story.php?story_fbid=2121096531327336&id=303167829786891
Ed Markey,,2020-01-27 11:52:17,"On Holocaust Remembrance Day, we remember the genocide of more than 6 million Jews and the millions of LGBTQ, disabled, and other innocent people targeted by the Nazi regime. We must stand firm against the rising threat of hate and anti-semitism in our country and around the world.  As we pledge ""never again"", we must reckon with the rise of anti-semitic attacks today. In Monsey, in Pittsburgh at the Tree of Life, in Charlottesville, and in Charleston, we are being torn apart by hate. We pray for the victims of these acts of terror, for their families, and for all communities living in fear. In the face of intolerance and violence, we send a message to our Jewish brothers and sisters that we stand with you in pursuit of a peaceful, tolerant world.",131,60,0,3,0,53,15,13,2120824744687848,EdMarkeyforMA,/story.php?story_fbid=2120824744687848&id=303167829786891
Ed Markey,,2020-01-26 22:10:08,I learned my values at the kitchen table where my mother paid the bills and balanced the checkbook. Tonight I spoke with Cambridge Democrats about how those values guide my work in the Senate and are centered in the movement we are building across Massachusetts.,119,106,0,12,1,0,0,16,2119558298147826,EdMarkeyforMA,/story.php?story_fbid=2119558298147826&id=303167829786891
