source,shared_from,date,text,reactions,likes,ahah,love,wow,sigh,grrr,comments,post_id,page_id,url
Ed Markey,,2020-01-26 17:32:52,"I am grateful to have the support of my friends and colleagues in the Cambridge delegation. These leaders are fighting climate change, lifting up our students, and working to create a more progressive future for Massachusetts. Thank you State Senator Sal DiDomenico, Senator Pat Jehlen, State Rep. Mike Connolly, Marjorie Decker, Representative Jonathan Hecht, Jay Livingstone, and Dave Rogers.",159,140,2,16,1,0,0,10,2119243384845984,EdMarkeyforMA,/story.php?story_fbid=2119243384845984&id=303167829786891
Ed Markey,,2020-01-24 23:51:01,"‪Happy Lunar New Year to all celebrating this joyous occasion in Massachusetts and around the world. As families gather to welcome new beginnings with the Year of the Rat, I wish everyone health, happiness, good fortune, and prosperity.‬",64,55,0,7,1,0,1,7,2116092151827774,EdMarkeyforMA,/story.php?story_fbid=2116092151827774&id=303167829786891
Ed Markey,,2020-01-23 17:55:45,Lo que escuchamos la semana pasada fue una severísima acusación del presidente Trump. Sobre 6000 familias en Puerto Rico han sido desplazadas y ahora viven en campos de béisbol. La respuesta del presidente es inaceptable.,45,34,4,3,1,1,2,18,2113887508714905,EdMarkeyforMA,/story.php?story_fbid=2113887508714905&id=303167829786891
Ed Markey,,2020-01-22 19:47:28,Our campaign is a people-powered movement. Thank you to everyone who is fighting alongside us and sharing why they are #StickingWithEd.,184,152,1,28,2,0,1,15,2111969745573348,EdMarkeyforMA,/story.php?story_fbid=2111969745573348&id=303167829786891
Ed Markey,,2020-01-22 18:39:53,"As we call for reproductive freedom, we also demand reproductive justice. Black and Native women should not be three times more likely to die from pregnancy-related issues than white women.‬ ‪We need Medicare For All to guarantee every American comprehensive, quality health care.‬",41,22,0,2,0,7,10,10,2112126862224303,EdMarkeyforMA,/story.php?story_fbid=2112126862224303&id=303167829786891
Ed Markey,,2020-01-22 17:12:58,"Roe v. Wade is a landmark 1973 case that established an individual’s constitutional right to make their own reproductive health care decisions, including the right to an abortion.  Despite the fact that over 70% of Americans support Roe and access to abortion, anti-choice politicians have unleashed unprecedented attacks on abortion rights in recent years.  In 2019, several states passed laws effectively banning abortion. The proponents of those laws publicly stated that their goal is to challenge Roe in court. Since 2011, state legislatures have passed nearly 450 abortion restrictions.  The Trump-Pence Administration has also forced Planned Parenthood and other abortion providers out of the Title X program, the country’s only national program dedicated to family planning and a key provider of care for low-income women. The restrictions that have been placed on abortion rights fall hardest on young people, low-income people, Black, indigenous, and other people of color, and marginalized communities. As these attacks on reproductive freedom continue, we must stand together to uphold the Constitution, protect abortion rights, and work tirelessly to make comprehensive reproductive care safe and affordable for everyone.",50,46,1,3,0,0,0,17,2112111808892475,EdMarkeyforMA,/story.php?story_fbid=2112111808892475&id=303167829786891
"Ed Markey,NARAL Pro-Choice Massachusetts",NARAL Pro-Choice Massachusetts,2020-01-21 09:34:44,"‪As abortion rights are under attack across the country, it is crucial that we lead in Massachusetts and codify the protections enshrined in Roe v. Wade. We must stand with our tireless allies Planned Parenthood Advocacy Fund of Massachusetts, NARAL Pro-Choice Massachusetts, and ACLU of Massachusetts and pass the Roe Act now.Today we remember decades of advocacy, activism, suffering, and loss that culminated in the landmark decision in Roe v. Wade. Generations that came after this decision owe a tremendous debt to the activists who fought for reproductive freedom. We are repaying our debt by continuing the fight. By working to preserve and expand access to safe, legal abortion. By breaking down stigma associated with abortion. By pushing back against the expectation that women are meant to be mothers and have to choose between a career and a family. By electing leaders who will defend our rights from an Administration that is hellbent on taking them away from us.  In Massachusetts, we can repay this debt by passing the ROE Act. And by ensuring that our young people are part of the conversation. Help us continue the fight by contacting your legislators and telling them that you support youth access to abortion.  https://actionnetwork.org/letters/support-the-roe-act/",42,37,0,2,2,0,1,10,2111767762260213,EdMarkeyforMA,/story.php?story_fbid=2111767762260213&id=303167829786891
Ed Markey,,2020-01-22 10:21:41,"Today is the 47th anniversary of Roe v. Wade. The fight to protect the constitutional right to abortion and guarantee every woman equality, autonomy, and dignity continues.",72,61,0,10,0,0,1,7,2111521232284866,EdMarkeyforMA,/story.php?story_fbid=2111521232284866&id=303167829786891
"Ed Markey,Peace Action",Peace Action,2020-01-21 12:02:07,"Throughout my career, I have championed education over annihilation, Medicaid over missiles. From advocating for cuts to our nation’s bloated nuclear weapons program, to promoting diplomacy to end conflict, I carry with me the values of Peace Action. I am grateful to have Peace Action standing beside me as we continue that commitment to peace by preventing Donald Trump from leading the United States into an illegal war. I am honored to receive their endorsement.Peace Action is thrilled to endorse Ed Markey in his re-election for Senator in Massachusetts. From taking on the climate crisis to promoting nuclear disarmament, his pro-peace leadership in Congress is critical! #PeaceVoter2020  Support him today ➡️➡️➡️ https://buff.ly/30FL27i",91,76,5,8,1,0,1,9,2111488338954822,EdMarkeyforMA,/story.php?story_fbid=2111488338954822&id=303167829786891
Ed Markey,,2020-01-21 20:02:26,Women's rights are non-negotiable. Thank you Planned Parenthood Action for supporting our people-powered campaign to protect reproductive freedom for all.,158,122,0,30,3,0,3,18,2110227909080865,EdMarkeyforMA,/story.php?story_fbid=2110227909080865&id=303167829786891
Ed Markey,,2020-01-21 17:28:52,"Our government belongs to the people, not to corporations and special interests. That’s why I’m proud of my A+ rating from End Citizens United and am committed to fighting the influence of big money in politics and bringing power back to the people.",86,72,2,10,1,0,1,8,2110427269060929,EdMarkeyforMA,/story.php?story_fbid=2110427269060929&id=303167829786891
"Ed Markey,Planned Parenthood Advocacy Fund of Massachusetts",Planned Parenthood Advocacy Fund of Massachusetts,2020-01-21 15:04:54,"Whether it is state legislatures trying to restrict access to health clinics, the confirmation of anti-choice judges, or the assault on Title X funding, reproductive freedom is under attack. I'm fighting back and standing shoulder to shoulder with Planned Parenthood Action to protect the constitutional right to abortion.Today, Planned Parenthood Action endorsed Ed Markey for re-election in 2020! From supporting the Affordable Care Act’s no co-pay birth control benefit and saving Title X to fighting to repeal the global gag rule and the Hyde Amendment, Senator Markey fiercely fights for the health, rights, and dignity of every person in Massachusetts, throughout the country, and across the globe. Planned Parenthood patients need a champion like Senator Markey.",74,60,0,11,1,2,0,18,2110371682399821,EdMarkeyforMA,/story.php?story_fbid=2110371682399821&id=303167829786891
Ed Markey,,2020-01-21 14:28:31,"10 years ago, the Supreme Court unleashed dark money, Super PACs, and unlimited campaign contributions on our elections. We need a Constitutional Amendment to overturn Citizens United and ensure that every person has an equal say in our democracy.",40,37,0,3,0,0,0,13,2110202925750030,EdMarkeyforMA,/story.php?story_fbid=2110202925750030&id=303167829786891
Ed Markey,,2020-01-20 21:05:41,We do not live in a just society. We must acknowledge that truth and do everything we can to dismantle structural and systemic racism in all its forms.,50,40,0,8,2,0,0,14,2108963472540642,EdMarkeyforMA,/story.php?story_fbid=2108963472540642&id=303167829786891
Ed Markey,,2020-01-20 17:36:45,"We still have a lot of work to do to achieve the vision of Dr. King, Coretta Scott King, and all those who marched alongside them. At Boston University today, we celebrated the hope and joy inspired by their legacy.",41,37,0,4,0,0,0,11,2108741919229464,EdMarkeyforMA,/story.php?story_fbid=2108741919229464&id=303167829786891
Ed Markey,,2020-01-20 11:30:23,‪Elizabeth Warren gives me hope. She is a champion for climate justice and a fearless fighter for the progressive future we know is possible. Congratulations Elizabeth Warren on earning this New York Times endorsement. ‬,328,246,19,53,0,6,4,57,2108217159281940,EdMarkeyforMA,/story.php?story_fbid=2108217159281940&id=303167829786891
Ed Markey,,2020-01-20 10:55:02,"‪It is up to us to honor Dr. Martin Luther King Jr. with action — to march for environmental justice, to demand equal pay for our Black brothers and sisters, and to fight for justice for those incarcerated in the failed war on drugs. #MLKBreakfastBOS #MLKDay ‬",49,44,0,5,0,0,0,8,2108212265949096,EdMarkeyforMA,/story.php?story_fbid=2108212265949096&id=303167829786891
Ed Markey,,2020-01-19 20:59:47,This is a reflection of the hard fought victories we've delivered for Massachusetts and the bold future that we are fighting for together. Thank you all for joining our movement.,160,137,4,16,1,1,1,13,2107243086046014,EdMarkeyforMA,/story.php?story_fbid=2107243086046014&id=303167829786891
Ed Markey,,2020-01-19 18:53:29,‪We joined together in worship tonight at Zion Church Ministries in Everett and celebrated the life and legacy of Dr. Martin Luther King. ‬,32,24,0,7,1,0,0,0,2107114809392175,EdMarkeyforMA,/story.php?story_fbid=2107114809392175&id=303167829786891
Ed Markey,,2020-01-19 16:59:29,"‪This campaign starts at the grassroots. It was a pleasure to join the Yarmouth Democratic Town Committee to answer questions, share my vision for the future, and discuss how we will build our movement together.‬ ‪Thank you to all who made it out last night despite snow and ice!☃️ ‬",33,27,1,5,0,0,0,2,2106997062737283,EdMarkeyforMA,/story.php?story_fbid=2106997062737283&id=303167829786891
Ed Markey,,2020-01-19 15:36:23,"It is my promise that I will uphold my constitutional duty as a juror. The American people deserve answers, and the only way we will get to the truth is through a fair trial in the Senate.",58,44,0,12,0,1,1,21,2106899846080338,EdMarkeyforMA,/story.php?story_fbid=2106899846080338&id=303167829786891
Ed Markey,,2020-01-19 11:05:33,‪This is a people-powered campaign and we are going to win by organizing activists and voters everywhere in Massachusetts. Thank you to everyone who joined us this morning in Brewster and thank you State Rep. Sarah Peake for your support! ‬,49,41,1,5,1,0,1,1,2106543982782591,EdMarkeyforMA,/story.php?story_fbid=2106543982782591&id=303167829786891
Ed Markey,,2020-01-19 10:15:54,We must have justice for Black mothers who do not receive the same health care as white mothers and who are paid just 63 cents to a white man's dollar.,110,95,0,13,1,1,0,26,2106472496123073,EdMarkeyforMA,/story.php?story_fbid=2106472496123073&id=303167829786891
Ed Markey,,2020-01-18 17:00:01,"We owe a national apology to the Black men and women who were targeted, harassed, and incarcerated in the failed war on drugs.",231,201,0,24,1,5,0,34,2105257332911256,EdMarkeyforMA,/story.php?story_fbid=2105257332911256&id=303167829786891
Ed Markey,,2020-01-18 14:50:05,‪MLK had a vision in which all people share the wealth of the world. Our mission today is to fulfill his progressive vision. We shared that mission today with the North Shore Black Women's Association in honor of Dr. King. ‬,75,68,0,6,0,0,1,10,2105105426259780,EdMarkeyforMA,/story.php?story_fbid=2105105426259780&id=303167829786891
Ed Markey,,2020-01-18 12:33:22,What we heard yesterday is a scalding indictment of President Trump. Over 6000 families in Puerto Rico have been displaced and are sleeping in tents. The president's response to this tragedy is unacceptable.,109,58,1,0,2,30,18,22,2103680293068960,EdMarkeyforMA,/story.php?story_fbid=2103680293068960&id=303167829786891
Ed Markey,,2020-01-18 12:27:07,‪The legacy of Dr. Martin Luther King Jr. is as powerful and relevant today as it has ever been. It is that legacy that we celebrated this morning with the Brockton Area NAACP.,42,39,0,3,0,0,0,5,2104920046278318,EdMarkeyforMA,/story.php?story_fbid=2104920046278318&id=303167829786891
Ed Markey,,2020-01-18 08:16:21,I applaud Virginia on becoming the 38th and final state to ratify the Equal Rights Amendment. This victory is a long time coming. Congratulations to all the dedicated and hard-working women who have been driving this effort for decades.,271,221,0,49,1,0,0,10,2103558793081110,EdMarkeyforMA,/story.php?story_fbid=2103558793081110&id=303167829786891
Ed Markey,,2020-01-18 08:02:00,"At the Four Freedoms Rally in Pittsfield Sunday, I called for a new Four Freedoms for 2020: freedom from war, freedom from the climate crisis, freedom from gun violence, and freedom from social injustice and inequality. When we stand together and fight for these freedoms, we are building a better future for us and for generations to come.",91,77,0,12,0,0,2,25,2103524799751176,EdMarkeyforMA,/story.php?story_fbid=2103524799751176&id=303167829786891
Ed Markey,,2020-01-17 20:47:28,This is what structural and systemic racism looks like. Elizabeth Warren and I are fighting back.,193,86,1,2,9,36,59,37,2103567666413556,EdMarkeyforMA,/story.php?story_fbid=2103567666413556&id=303167829786891
Ed Markey,,2020-01-17 20:05:00,"No one is too young to be a climate warrior. Join the Sunrise Movement, demand climate action, and fight for a Green New Deal at sunrisemovement.org/hubs.",77,64,1,10,0,1,1,9,2103563929747263,EdMarkeyforMA,/story.php?story_fbid=2103563929747263&id=303167829786891
Ed Markey,,2020-01-17 18:22:25,We will not rest until Puerto Rico receives the billions of dollars in aid it needs to recover and rebuild with dignity. No vamos a descansar hasta que Puerto Rico reciba los billones de dólares en ayuda que necesita para recuperar y reconstruir con dignidad.,244,199,1,32,0,8,4,19,2103614183075571,EdMarkeyforMA,/story.php?story_fbid=2103614183075571&id=303167829786891
Ed Markey,,2020-01-17 16:07:42,Today I attended a community meeting on disaster relief for Puerto Rico. The island needs help and needs it now. I promise to be a strong voice for Puerto Rican brothers and sisters and ensure these resources are released immediately by the Trump administration. #PuertoRico #PrayForPuertoRico #PuertoRicoEarthquake,142,131,0,10,0,0,1,16,2103468526423470,EdMarkeyforMA,/story.php?story_fbid=2103468526423470&id=303167829786891
Ed Markey,,2020-01-17 12:03:00,"Mitch McConnell cannot be allowed to cover up the truth and protect Donald Trump. The Senate must hear directly from John Bolton, Mick Mulvaney, and Lev Parnas.",106,92,1,11,0,1,1,20,2103011883135801,EdMarkeyforMA,/story.php?story_fbid=2103011883135801&id=303167829786891
Ed Markey,,2020-01-17 08:50:43,"I thank Shannon Liss-Riordan for her significant contributions to this primary election. Her commitment on behalf of workers needing a stronger voice has fundamentally changed their lives for the better and will continue to be a powerful message we all must heed and act upon.  The fact that Shannon participated in the primary’s first debate on climate issues demonstrated that she knows we need to fight hard, not only to save the planet, but for justice and equity. We continue to need her voice and strength in this climate crisis movement and in Massachusetts politics. I wish her and her family well as she continues her efforts in public service.",145,129,1,13,2,0,0,8,2102870673149922,EdMarkeyforMA,/story.php?story_fbid=2102870673149922&id=303167829786891
Ed Markey,,2020-01-16 19:32:09,"Student athletes’ only concern should be winning their games, not surviving a shooting.  It’s time to treat this crisis like the public health epidemic it is. I’m grateful that I was able to secure $25 million for the CDC to research the root causes of gun violence.  This is the first time in 25 years that Congress has approved federal funding to study gun violence. While this is a huge victory in the fight against gun violence, it’s only a first step. We need common sense gun control.",7,7,0,0,0,0,0,0,2101635846606738,EdMarkeyforMA,/story.php?story_fbid=2101635846606738&id=303167829786891
Ed Markey,,2020-01-16 16:45:21,"This weekend, I joined hundreds of people marching in support of FDR’s Four Freedoms: freedom from fear, freedom from want, freedom of speech, and freedom of religion. These freedoms are the compass points of our democracy. Thank you to everyone who showed up and marched with us.",85,74,1,9,0,0,1,3,2101711483265841,EdMarkeyforMA,/story.php?story_fbid=2101711483265841&id=303167829786891
Ed Markey,,2020-01-16 14:41:17,"I was just sworn in to serve as an impartial juror in the impeachment trial of President Trump. We, the Senators of the United States, have a duty to hold the president accountable to the Constitution. No one is above the law.",408,354,5,45,0,0,4,51,2101550183281971,EdMarkeyforMA,/story.php?story_fbid=2101550183281971&id=303167829786891
Ed Markey,,2020-01-15 18:30:30,"We are in the middle of a climate emergency. We cannot continue to negotiate trade deals using frameworks from the past that ignore that reality. The USMCA trade deal is a profound environmental and climate failure. Since NAFTA went into effect 26 years ago, we have lived through the 2 hottest decades in recorded history. We see the effects of the climate crisis every day, with floods, hurricanes, wildfires, and rising seas all worsening as we fail to act. The USMCA trade deal fails to even mention climate change. It has no climate or environmental standards, and includes explicit giveaways for the fossil fuel industry.  We cannot afford another 26 days—let alone years—of business as usual where fossil fuel companies get to play by their own rules. Trade deals must reflect the urgency of our time and implement the strategic vision necessary for our planet’s survival.",58,41,4,0,1,1,11,16,2099810803455909,EdMarkeyforMA,/story.php?story_fbid=2099810803455909&id=303167829786891
Ed Markey,,2020-01-15 12:03:15,"Claire is a member of the Scholastic Kids Press Corps. She is a brilliant and enthusiastic young journalist, and it was a joy being interviewed by her on Saturday. Our future is in good hands. http://kpcnotebook.scholastic.com/post/senator-markey-runs-re-election",81,68,0,13,0,0,0,1,2099357366834586,EdMarkeyforMA,/story.php?story_fbid=2099357366834586&id=303167829786891
Ed Markey,,2020-01-15 10:32:13,"The health effects of pollution are not felt equally. Historically, Black and Brown communities have breathed different air and drank different water than white communities. The president's rollback of environmental protections reinforces these injustices. There is no justice without environmental justice. We will stand against President's Trump's latest attack on communities of color and fight like hell for a Green New Deal that guarantees jobs and justice for all.",89,42,1,1,1,10,34,15,2097810386989284,EdMarkeyforMA,/story.php?story_fbid=2097810386989284&id=303167829786891
Ed Markey,,2020-01-14 18:20:13,"It is the responsibility of every single one of us to protect the core values of our democracy, stand up for those who are marginalized and disenfranchised, and to lead our country from peril to progress.",49,43,0,5,0,0,1,8,2097772300326426,EdMarkeyforMA,/story.php?story_fbid=2097772300326426&id=303167829786891
Ed Markey,,2020-01-14 15:21:14,"The Massachusetts coast is the fastest warming body of water behind the Arctic. Every day that we delay climate action, we put more homes, wildlife, and communities at risk. We need the Green New Deal now.",45,26,1,0,2,13,3,15,2097673220336334,EdMarkeyforMA,/story.php?story_fbid=2097673220336334&id=303167829786891
Ed Markey,,2020-01-14 12:57:38,The people of Massachusetts demand that President Trump be held accountable to the Constitution. Congress must reclaim its authority to declare war.,91,78,3,9,1,0,0,21,2097482277022095,EdMarkeyforMA,/story.php?story_fbid=2097482277022095&id=303167829786891
Ed Markey,,2020-01-13 15:20:50,"When I say we need a new Four Freedoms, what I am calling for is a future that is more fair, more healthy, more prosperous, and more peaceful for Massachusetts, the United States, and the world.",139,109,6,21,1,0,2,21,2095715873865402,EdMarkeyforMA,/story.php?story_fbid=2095715873865402&id=303167829786891
Ed Markey,,2020-01-12 20:02:06,Bob Massie is a progressive champion who has been working to protect our planet for decades. I am very grateful to have his support.,345,164,1,24,3,148,5,32,2089826001121056,EdMarkeyforMA,/story.php?story_fbid=2089826001121056&id=303167829786891
Ed Markey,,2020-01-12 16:45:08,"What I am proposing today is that we apply FDR’s Four Freedoms to a new vision that will address today’s challenges and move our country from peril to progress. We must have a new Four Freedoms, to guide us now and in the years ahead.  FREEDOM FROM WAR ‪  We cannot escalate tensions in Iran and the Middle East. Certainly not without Congressional authorization. Our goal always must be peace and security.‬ ‪  FREEDOM FROM OUR CLIMATE CRISIS ‪  This is the economic, national security, health, and moral issue of our time. That’s why I partnered with Congresswoman  on the Green New Deal, a resolution based on FDR’s second inaugural address.‬ ‪We must have jobs and justice and avert global disaster.‬   FREEDOM FROM GUN VIOLENCE ‪  We must ban assault weapons, pass universal background checks, and close the gun show loophole. ‬ ‪Together, we will make NRA stand for Not Relevant Anymore!‬ ‪  FREEDOM FROM SOCIAL INJUSTICE AND INEQUALITY ‪  There is an assault on our shared values of justice and equality. That assault is led by forces fueled by lies, racism, sexism, xenophobia, and fear.‬ ‪We must stand together, reject hate, and demand equality and justice for all.‬   This election, we must recommit ourselves to the freedoms that truly matter in Massachusetts. The freedoms that we fought for in the past and that are being challenged today. Now is our time to strive for “a better life, a better world, beyond the horizon.”‬",153,127,2,23,0,0,1,21,2093904124046577,EdMarkeyforMA,/EdMarkeyforMA/photos/a.303486423088365/2093904124046577
Ed Markey,,2020-01-12 14:19:24,"‪In 1941, President Franklin Delano Roosevelt laid out the Four Freedoms that constitute the core values of our democracy: Freedom of Speech, Freedom of Religion, Freedom from Want, and Freedom from Fear.‬ ‪Today in Pittsfield, we marched for those Four Freedoms and for a new progressive vision for our country.‬",91,79,0,10,0,0,2,16,2093710480732608,EdMarkeyforMA,/story.php?story_fbid=2093710480732608&id=303167829786891
Ed Markey,,2020-01-12 12:34:14,"‪Representative Tricia Farley-Bouvier is a champion in the State House for the elderly, for students, for our environment, and for the Berkshires. Her leadership is invaluable to the progressive movement in Massachusetts and I will always stand with her. ‬",59,53,0,5,0,0,1,7,2093556184081371,EdMarkeyforMA,/story.php?story_fbid=2093556184081371&id=303167829786891
Ed Markey,,2020-01-12 08:34:20,"Today marks the ten year anniversary of the 7.0 magnitude earthquake that devastated Haiti and claimed more than 200,000 lives. Haiti, we mourn with you, we pray for you, and we stand in solidarity with you always as the healing and rebuilding continues.",34,16,0,2,1,15,0,4,2093166957453627,EdMarkeyforMA,/EdMarkeyforMA/photos/a.303486423088365/2093166957453627
Ed Markey,,2020-01-12 08:26:00,"Today marks the ten year anniversary of the 7.0 magnitude earthquake that devastated Haiti and claimed more than 200,000 lives. Haiti, we mourn with you, we pray for you, and we stand in solidarity with you always as the healing and rebuilding continues.",35,12,0,1,1,20,1,6,2093153314121658,EdMarkeyforMA,/EdMarkeyforMA/photos/a.303486423088365/2093153314121658
Ed Markey,,2020-01-11 21:23:49,Right now we are facing the greatest test of our democracy in decades. It will take every one of us to push back against the dangerous and hateful politics that fuel the Trump administration. I have faith that our movement will succeed and we will build a just and sustainable future for all.,49,42,2,5,0,0,0,10,2092298117540511,EdMarkeyforMA,/story.php?story_fbid=2092298117540511&id=303167829786891
Ed Markey,,2020-01-11 17:38:49,"‪We are at a critical moment in American history. Every morning we make a choice: do we give up and agonize, or do we get up and organize? It was an honor to be surrounded by so many inspiring organizers in Douglas today.‬",51,45,0,3,0,0,3,3,2092015614235428,EdMarkeyforMA,/story.php?story_fbid=2092015614235428&id=303167829786891
