source,shared_from,date,text,reactions,likes,ahah,love,wow,sigh,grrr,comments,post_id,page_id,url
Elect Sharon Hudson,,2020-03-03 23:27:12,"I am so humbled by all of the wonderful people who voted for me. Thank you. Congratulations to the candidates who won, I'm sorry for the many fantastic candidates who worked so hard and didn't make it. Now let's all work together to Keep America Great!",8,7,0,1,0,0,0,2,2609015992529639,electsharonhudson,/story.php?story_fbid=2609015992529639&id=558545447576714
Elect Sharon Hudson,,2020-03-02 13:10:42,Send a Steel Magnolia to Washington to Drain the Swamp.,129,110,5,10,0,0,4,16,2606322192799019,electsharonhudson,/story.php?story_fbid=2606322192799019&id=558545447576714
Elect Sharon Hudson,,2020-03-01 20:10:55,I wrote this for a citizen in Pender County who is working to pass a 2A resolution there.,6,6,0,0,0,0,0,0,2604938149604090,electsharonhudson,/story.php?story_fbid=2604938149604090&id=558545447576714
Elect Sharon Hudson,,2020-02-29 15:44:23,Send a Steel Magnolia to Washington to Drain the Swamp.,4,3,0,1,0,0,0,1,2602605409837364,electsharonhudson,/story.php?story_fbid=2602605409837364&id=558545447576714
Elect Sharon Hudson,,2020-02-28 21:01:17,"I'm organizing my desk and thinking about all of the wonderful adventures I've had and the special people I have met since I filed to run on December 20th. I still have many things to do before Super Tuesday, but I want to thank all of you for coming along for the ride. The only sure thing about politics is that it is always interesting!! Good luck to all of the candidates. And if this lasts longer than next Tuesday for me, I will need all of your help. I hope to see many of you at the Trump rally on Monday. No matter what, let's help our President keep America great!!",6,4,0,2,0,0,0,2,2601019479995957,electsharonhudson,/story.php?story_fbid=2601019479995957&id=558545447576714
Elect Sharon Hudson,,2020-02-28 19:23:28,It was great seeing Mecklenburg County Commissioner Pat Cotham at the Newsmaker Breakfast this morning. She is an expert on affordable housing.,3,3,0,0,0,0,0,0,2600893300008575,electsharonhudson,/story.php?story_fbid=2600893300008575&id=558545447576714
Elect Sharon Hudson,,2020-02-27 14:12:04,"If you are in Winston-Salem tonight stop by! Forsyth County Republican Women,    6:30 p.m.   Bib's Downtown, Hickory Room Winston-Salem, NC",2,2,0,0,0,0,0,0,2598421943589044,electsharonhudson,/story.php?story_fbid=2598421943589044&id=558545447576714
Elect Sharon Hudson,,2020-02-26 03:49:29,"I look forward to meeting the Hendersonville Republican Men's Club Breakfast this morning, 7:30-9 a.m.  Dixie Diner, 1724 Brevard Road Laurel Park, N.C.  If you are in the area please join us!",6,5,0,1,0,0,0,0,2595628870535018,electsharonhudson,/story.php?story_fbid=2595628870535018&id=558545447576714
Elect Sharon Hudson,,2020-02-26 00:31:44,Thank you Republican Women of Cary for allowing me to speak this afternoon at your wonderful event. Trump 2020!!,12,9,0,3,0,0,0,1,2595417183889520,electsharonhudson,/story.php?story_fbid=2595417183889520&id=558545447576714
Elect Sharon Hudson,,2020-02-24 23:54:15,I met some very nice people at the Onslow County Lincoln-Reagan Dinner.,5,5,0,0,0,0,0,0,2593440490753856,electsharonhudson,/story.php?story_fbid=2593440490753856&id=558545447576714
Elect Sharon Hudson,,2020-02-24 23:35:03,"I am looking forward to spending time tomorrow with the Republican Women of Cary and Southwestern Wake at the Lara Trump Luncheon. I hope to see you there! Prestonwood Country Club, Cary, NC.",5,5,0,0,0,0,0,0,2593418200756085,electsharonhudson,/story.php?story_fbid=2593418200756085&id=558545447576714
Elect Sharon Hudson,,2020-02-21 23:51:33,Listening to C.L. Bryant speak at the Crystal Coast Republican Women’s Lincoln-Reagan Rally. It was a wonderfully event. Thank you for having me.,4,3,0,1,0,0,0,0,2587599478004624,electsharonhudson,/story.php?story_fbid=2587599478004624&id=558545447576714
Elect Sharon Hudson,,2020-02-21 00:39:48,"""Senator Thom Tillis is hell-bent on turning our rural communities into pipelines for cartel drug trafficking and criminal aliens."" Vote him out!!  https://www.conservativereview.com/news/horowitz-senate-republicans-looking-repeat-1986-amnesty-seeking-president-trumps-support/",6,3,0,0,0,0,3,3,2585671574864081,electsharonhudson,/story.php?story_fbid=2585671574864081&id=558545447576714
Elect Sharon Hudson,,2020-02-21 00:00:21,I look forward to meeting everyone Saturday in Jacksonville!,1,1,0,0,0,0,0,0,2585628594868379,electsharonhudson,/story.php?story_fbid=2585628594868379&id=558545447576714
Elect Sharon Hudson,,2020-02-20 22:11:36,"I am looking forward to meeting everyone Friday evening. Country Club of the Crystal Coast, Pine Knoll Shores, NC",1,1,0,0,0,0,0,0,2585493421548563,electsharonhudson,/story.php?story_fbid=2585493421548563&id=558545447576714
Elect Sharon Hudson,,2020-02-16 22:12:17,"February 17 Cumberland County GOP Convention     6:00 p.m Headquarters Library 300 Maiden Lane Fayetteville, NC  Come if you are in the area!",0,0,0,0,0,0,0,0,2577774075653831,electsharonhudson,/story.php?story_fbid=2577774075653831&id=558545447576714
Elect Sharon Hudson,,2020-02-20 21:49:04,I am proud to have received a four star candidate rating by Grass Roots North Carolina. Which is two more than Sen. Tillis.,8,6,0,2,0,0,0,0,2585466041551301,electsharonhudson,/story.php?story_fbid=2585466041551301&id=558545447576714
Elect Sharon Hudson,,2020-02-19 02:10:45,It was great being with Burke County citizens tonight as they passed their Second Amendment Protection Resolution.,2,1,0,1,0,0,0,1,2581871418577430,electsharonhudson,/story.php?story_fbid=2581871418577430&id=558545447576714
Elect Sharon Hudson,,2020-02-12 16:21:36,"If you are in the Charlotte area this evening drop in to Noble Smoke, 2216 Freedom Drive, from 6-8. I will be visiting our newest Republican Women's Club. https://uptowncharlotterepublicanwomen.nationbuilder.com/events",0,0,0,0,0,0,0,0,2569279723169933,electsharonhudson,/story.php?story_fbid=2569279723169933&id=558545447576714
Elect Sharon Hudson,,2020-02-18 13:55:08,"If you live near Morganton, please stop by. There may be a 2A Sanctuary Resolution tonight.",4,3,0,1,0,0,0,4,2580964048668167,electsharonhudson,/story.php?story_fbid=2580964048668167&id=558545447576714
Elect Sharon Hudson,,2020-02-17 00:05:10,Committee to Elect Sharon Hudson.  Please share if you are in the area.,2,2,0,0,0,0,0,0,2577911402306765,electsharonhudson,/story.php?story_fbid=2577911402306765&id=558545447576714
Elect Sharon Hudson,,2020-02-16 21:11:17,It was fun running to Lee Haywood this afternoon at the Delta Sigma Theta Sorority candidate forum. Thanks for representing the conservative viewpoint!!,5,5,0,0,0,0,0,1,2577699545661284,electsharonhudson,/story.php?story_fbid=2577699545661284&id=558545447576714
Elect Sharon Hudson,,2020-02-14 18:10:41,"I will be heading to Hendersonville tomorrow to attend the Republican Breakfast. If you live in the area please drop by. I would love to meet you. 7:30 - 9 a.m. Dixie Diner, Laurel Park.",1,1,0,0,0,0,0,0,2573457212752184,electsharonhudson,/story.php?story_fbid=2573457212752184&id=558545447576714
Elect Sharon Hudson,,2020-02-06 01:42:54,,7,6,0,1,0,0,0,0,2556359654461940,electsharonhudson,/story.php?story_fbid=2556359654461940&id=558545447576714
Elect Sharon Hudson,,2020-02-05 13:03:44,,5,4,0,1,0,0,0,2,2555423904555515,electsharonhudson,/electsharonhudson/photos/a.558552874242638/2555423904555515
Elect Sharon Hudson,,2020-02-04 23:09:11,Conservatism works! Congratulations President Trump on an outstanding State of the Union address. Visit www.ElectSharonHudson.com to learn more about U.S. Senate candidate Sharon Y. Hudson.,14,12,0,2,0,0,0,0,2554262108005028,electsharonhudson,/story.php?story_fbid=2554262108005028&id=558545447576714
Elect Sharon Hudson,,2020-02-02 23:41:18,A hero’s return home.,3,2,0,1,0,0,0,0,2550646615033244,electsharonhudson,/story.php?story_fbid=2550646615033244&id=558545447576714
Elect Sharon Hudson,,2020-01-31 01:50:41,I will be speaking at the Winter meeting of the North Carolina Federation of Republican Women tonight (Friday) in Winston-Salem. I hope to see you there! https://www.facebook.com/NCFRW/,1,1,0,0,0,0,0,0,2545146848916554,electsharonhudson,/story.php?story_fbid=2545146848916554&id=558545447576714
Elect Sharon Hudson,,2020-01-31 00:46:00,"Please use this cover to help advertise my campaign. Or just share the photo. Thank you! Sharon Y. Hudson, U.S. Senate Candidate.",5,4,0,1,0,0,0,0,2545070088924230,electsharonhudson,/electsharonhudson/photos/a.558552874242638/2545070088924230
Elect Sharon Hudson,,2020-01-29 20:52:22,A friend said it was time for an update. Great job Deborah Young Studio in Cornelius.,21,18,0,3,0,0,0,4,2542897109141528,electsharonhudson,/electsharonhudson/photos/a.558550344242891/2542897109141528
Elect Sharon Hudson,,2020-01-23 00:04:09,We welcome our African American friends to join the Trump Train! https://www.newsobserver.com/news/politics-government/election/article239465798.html?,3,3,0,0,0,0,0,1,2529983723766200,electsharonhudson,/story.php?story_fbid=2529983723766200&id=558545447576714
Elect Sharon Hudson,,2020-01-19 21:39:30,There is evil in the world. This is why we need the Second Amendment. https://twitter.com/bennyjohnson/status/1219051740512866306?s=21,4,4,0,0,0,0,0,0,2524228137675092,electsharonhudson,/story.php?story_fbid=2524228137675092&id=558545447576714
Elect Sharon Hudson,,2020-01-08 15:02:20,"The web site is up! Much more to complete, but it is a start. www.ElectSharonHudson.com",3,3,0,0,0,0,0,0,2501599129937993,electsharonhudson,/story.php?story_fbid=2501599129937993&id=558545447576714
Elect Sharon Hudson,,2020-01-08 14:53:26,,2,2,0,0,0,0,0,0,2501587159939190,electsharonhudson,/story.php?story_fbid=2501587159939190&id=558545447576714
Elect Sharon Hudson,,2020-01-05 22:43:39,"“Once again, President Trump has taken a stand for the safety and security of Americans, our interests, and our allies,” Hudson said in a statement emailed to TCB. “We are grateful for his continued vigilance in identifying threats and his willingness to take action to make our world a safer place. I sincerely hope Iran does not retaliate. It would be unwise.” https://triad-city-beat.com/tillis-criticism-trumps-strike-soleimani-reckless/",6,6,0,0,0,0,0,2,2496047500493156,electsharonhudson,/story.php?story_fbid=2496047500493156&id=558545447576714
Elect Sharon Hudson,,2019-12-22 23:46:16,Merry Christmas everyone. Stay safe out there!,4,3,0,1,0,0,0,0,2467236430040930,electsharonhudson,/story.php?story_fbid=2467236430040930&id=558545447576714
