source,shared_from,date,text,reactions,likes,ahah,love,wow,sigh,grrr,comments,post_id,page_id,url
"Johnny ""JJ"" Presley for U.S. Senate,Johnny ""JJ"" Presley for U.S. Senate",,2020-03-04 22:37:22,"UPDATE!🚨UPDATE : PER PUTNAM COUNTY EMA MISSING PERSONS UPDATE:  Our missing persons list is down to one person. Leah Suzanne Weeks remains missing, as verified by the TBI. If you have information to locate Ms. Weeks, please call the Emergency Operations Center at (931) 646-INFO. ••••••••••••••••••••••••••••••••••••• PLEASE PLEASE PLEASE stop what you are doing and share these names, lets FLOOD social media until every single person is accounted for! Names of those still missing in Putnam County.. 77 names. A friend. A father or mother. A grandmother or grandpa. Someone’s neighbor. A sister or brother.  A PRECIOUS child.  Lord have your hand on each and every single life. Amen.  Please share, folks.",0,0,0,0,0,0,0,0,140710060758085,JohnnyJJPresley,/story.php?story_fbid=140710060758085&id=100351601460598
"Johnny ""JJ"" Presley for U.S. Senate",,2020-04-13 22:21:46,"The Tennessee Republican Party is not allowing me on the ballot for The US Senate Primary Election in August. With your help, my voice and my message was heard. I will continue to fight and be a voice for rural Tennesseans and bring attention to our Healthcare crisis! Thank you to everyone who supported me in this endeavor!",113,66,0,2,13,31,1,0,152490452913379,JohnnyJJPresley,/story.php?story_fbid=152490452913379&id=100351601460598
"Johnny ""JJ"" Presley for U.S. Senate",,2020-03-19 11:34:38,"Now is the time to adhere to the the guidelines as recommended-avoid the public. Folks, if you don’t think this illness has reached your community yet, it is rampantly coming if not already there, and quick! Due to the downfall of rural hospitals (especially in TN, 14 closed as of now), the COVID-19 will put a hardship on our medical communities. No medical supplies or protective equipment for our providers on the front lines in the clinics, emergency care facilities, nor hospitals. Most of our rural hospitals and clinics are already in an uphill battle, we cannot stand the hit of having less and less hospital beds. You must adhere to the warnings and distance yourself—now.  This is the most contagious disease we have ever seen. There is no treatment, other than supplemental oxygen and mechanical ventilation for the severely ill, and even for those we lack in equipment. Just remember—4 out of 5 people are contagious and do not even realize it. Strict isolation is imperative in order to contain the spread. Do your part and stay away from others!  https://fox17.com/news/local/state-unsure-if-it-will-have-enough-hospital-beds-during-height-of-pandemic?jwsource=cl",34,22,0,2,1,8,1,0,144806847015073,JohnnyJJPresley,/story.php?story_fbid=144806847015073&id=100351601460598
"Johnny ""JJ"" Presley for U.S. Senate",,2020-03-03 21:31:26,"🚨UPDATE : PER PUTNAM COUNTY EMA MISSING PERSONS UPDATE:  Our missing persons list is down to one person. Leah Suzanne Weeks remains missing, as verified by the TBI. If you have information to locate Ms. Weeks, please call the Emergency Operations Center at (931) 646-INFO. ••••••••••••••••••••••••••••••••••••• PLEASE PLEASE PLEASE stop what you are doing and share these names, lets FLOOD social media until every single person is accounted for! Names of those still missing in Putnam County.. 77 names. A friend. A father or mother. A grandmother or grandpa. Someone’s neighbor. A sister or brother.  A PRECIOUS child.  Lord have your hand on each and every single life. Amen.  Please share, folks.",68,28,0,5,1,34,0,0,140394454122979,JohnnyJJPresley,/story.php?story_fbid=140394454122979&id=100351601460598
"Johnny ""JJ"" Presley for U.S. Senate",,2020-03-03 20:19:40,"🚨🚨IMPORTANT INFO🚨🚨 In the comment section below, emergency info has been shared for those in need or those who wish to lend a hand. Feel free to share or add to the list.  Praying continuously for our brothers and sisters across Tennessee.",11,9,0,2,0,0,0,0,140380987457659,JohnnyJJPresley,/story.php?story_fbid=140380987457659&id=100351601460598
"Johnny ""JJ"" Presley for U.S. Senate,Randall Dye,Johnny ""JJ"" Presley for U.S. Senate",,2020-03-03 17:44:02,Johnny on the scene in Cookeville trying to help his neighbors. Thank You Johnny.,118,101,0,17,0,0,0,0,140354080793683,JohnnyJJPresley,/story.php?story_fbid=140354080793683&id=100351601460598
"Johnny ""JJ"" Presley for U.S. Senate,WBIR Channel 10",,2020-03-03 14:17:10,"If you are trying to find information about a loved one, you can call 931-646-INFO.  https://www.facebook.com/80100579774/posts/10157437487099775/?d=nOfficials said the tornado hit around 2 a.m. while most people were sleeping and they had no time to take cover. If you are trying to get information about a loved one, you can call 931-646-INFO.",30,14,0,0,0,16,0,0,140315054130919,JohnnyJJPresley,/story.php?story_fbid=140315054130919&id=100351601460598
"Johnny ""JJ"" Presley for U.S. Senate",,2020-03-03 11:53:18,"Sending love and prayers to our fellow Tennesseans as we process the damage and lives lost this morning. Prayers to all the lineman, first responders, medical staff and all the good samaritans in this time of need. May God bless each and every one in this time of need who have lost homes, loved ones and those who are still out searching.  https://www.nashvillescene.com/news/pith-in-the-wind/blog/21119626/nashville-tornado-how-to-help-where-to-get-help",62,44,0,3,0,15,0,0,140284940800597,JohnnyJJPresley,/story.php?story_fbid=140284940800597&id=100351601460598
"Johnny ""JJ"" Presley for U.S. Senate",,2020-03-01 19:00:56,"Farming teaches us the very basics of accountability, discipline and responsibility. I'm a common man, ready to get to work for you!",113,109,0,4,0,0,0,0,139706534191771,JohnnyJJPresley,/story.php?story_fbid=139706534191771&id=100351601460598
"Johnny ""JJ"" Presley for U.S. Senate",,2020-03-01 10:41:07,Proud of my family and those families across the great state of Tennessee. Together we can represent Tennessee proud!,111,100,0,11,0,0,0,0,139705867525171,JohnnyJJPresley,/story.php?story_fbid=139705867525171&id=100351601460598
"Johnny ""JJ"" Presley for U.S. Senate",,2020-03-01 10:35:01,,68,66,0,2,0,0,0,0,139704910858600,JohnnyJJPresley,/JohnnyJJPresley/photos/a.100351638127261/139704910858600
"Johnny ""JJ"" Presley for U.S. Senate",,2020-02-29 13:03:09,,126,120,0,6,0,0,0,0,139425950886496,JohnnyJJPresley,/story.php?story_fbid=139425950886496&id=100351601460598
,,2020-02-28 23:33:23,"The continued demise of rural healthcare is all around us. The fine folks in Parsons, TN, invited me down to discuss the future of their rural hospital-Decatur County General Hospital. If this hospital closes, the lifeline of this county dies with it. I appreciate getting the chance to speak with the hospital administrator as well as several county commissioners. God Bless this small town, their hospital, as well as their fine people.",58,51,0,7,0,0,0,0,139269907568767,JohnnyJJPresley,/story.php?story_fbid=139269907568767&id=100351601460598
"Johnny ""JJ"" Presley for U.S. Senate",,2020-02-25 21:14:12,"“Free healthcare, free education, free college, free gun pickup..” Hey, let’s hand out free unicorns and rainbows and hugs, too! 🙄 #DemDebate #trump2020",112,76,33,3,0,0,0,0,138377930991298,JohnnyJJPresley,/story.php?story_fbid=138377930991298&id=100351601460598
"Johnny ""JJ"" Presley for U.S. Senate",,2020-02-24 21:45:01,"Oh, Bernie. What a joke. You too, Warren.  PERSONAL RESPONSIBILITY, folks.  Good tactic for a lousy bait and switch targeting the young folks in this election..let’s get real.  #trump2020  https://www.google.com/amp/s/www.forbes.com/sites/zackfriedman/2020/02/22/bernie-sanders-student-loans-forgiveness/amp/",59,38,5,0,0,0,16,0,138084621020629,JohnnyJJPresley,/story.php?story_fbid=138084621020629&id=100351601460598
"Johnny ""JJ"" Presley for U.S. Senate",,2020-02-23 19:50:11,"Got a second? Go to Chattanoogan.com and show your support for Johnny Presley by voting! Scroll the bottom, look on the right.  Thank you for your support!",33,33,0,0,0,0,0,0,137786947717063,JohnnyJJPresley,/story.php?story_fbid=137786947717063&id=100351601460598
"Johnny ""JJ"" Presley for U.S. Senate",,2020-02-17 21:47:18,"Don’t forget! Tomorrow night, 6:00PM Central at the Cumberland County Community Complex.",53,50,0,3,0,0,0,0,135999544562470,JohnnyJJPresley,/story.php?story_fbid=135999544562470&id=100351601460598
"Johnny ""JJ"" Presley for U.S. Senate",,2020-02-17 16:18:16,"Today, we celebrate Presidents’ Day! We salute the great leaders of our nation for their courage and sacrifice.  Who’s your favorite president?",45,40,0,5,0,0,0,0,135939647901793,JohnnyJJPresley,/story.php?story_fbid=135939647901793&id=100351601460598
"Johnny ""JJ"" Presley for U.S. Senate",,2020-02-24 20:10:03,"Congratulations to our neighbors in the Kentucky House for pushing this issue. Step up, Tennessee!   https://www.usnews.com/news/best-states/kentucky/articles/2020-02-20/kentucky-house-votes-to-legalize-medical-marijuana",66,61,0,4,1,0,0,0,138078341021257,JohnnyJJPresley,/story.php?story_fbid=138078341021257&id=100351601460598
"Johnny ""JJ"" Presley for U.S. Senate",,2020-02-16 10:49:37,"Happy Sunday, folks.",50,47,0,3,0,0,0,0,135569187938839,JohnnyJJPresley,/story.php?story_fbid=135569187938839&id=100351601460598
,,2020-02-15 19:23:17,If I had even half the energy as my grandson Ryder I’d be doing well. My best days are spent with my boy!,182,171,0,11,0,0,0,0,135346007961157,JohnnyJJPresley,/story.php?story_fbid=135346007961157&id=100351601460598
"Johnny ""JJ"" Presley for U.S. Senate",,2020-02-15 11:54:11,"I can’t understand why Tennessee is still dwindling in the middle on this issue. With over 30+ years of experience as a TN medical provider, I FULLY support medical marijuana and any bill pushing forward to make it happen. WAY OVERDUE, TENNESSEE!  We’ve got to get a handle on the opioid crisis in Tennessee as well as across the nation. A safer alternative to dangerous and addicting painkillers? Absolutely!  Why the lack of support from our law enforcement officials? This is a win-win for all.",100,80,0,20,0,0,0,0,135251527970605,JohnnyJJPresley,/story.php?story_fbid=135251527970605&id=100351601460598
"Johnny ""JJ"" Presley for U.S. Senate",,2020-02-15 11:38:24,"Good news! Come on folks, let’s use a bit of common sense. 🙄 We have to have standards and stipulations in place..That’s a no-brainer.",17,17,0,0,0,0,0,0,135247304637694,JohnnyJJPresley,/story.php?story_fbid=135247304637694&id=100351601460598
"Johnny ""JJ"" Presley for U.S. Senate",,2020-02-15 13:58:12,"Not just no, but H❌❌❌ NO!",64,27,25,0,6,2,4,0,135283221300769,JohnnyJJPresley,/story.php?story_fbid=135283221300769&id=100351601460598
"Johnny ""JJ"" Presley for U.S. Senate",,2020-02-11 10:43:45,"Inviting all to the Cumberland County GOP monthly meeting a week from today, Tuesday, February 18th. See you at the Community Complex at 6:00PM Central. Spread the word!",98,96,0,2,0,0,0,0,134058254756599,JohnnyJJPresley,/story.php?story_fbid=134058254756599&id=100351601460598
"Johnny ""JJ"" Presley for U.S. Senate",,2020-02-05 22:08:45,"After watching the State of The Union last night, I wanted to take a few minutes to share some thoughts. This will be a long but important one, folks. Hold tight with me.   As a medical provider in Tennessee, I was thrilled to hear our President support keeping the ban on denying medical coverage on pre-existing conditions as part of the healthcare reform he envisions.  I support this policy 100%.   I support our President's call for a renewed focus on vocational education as an additional pathway to the American dream.  Not everybody is meant to go to a four year college and we have to recognize that is okay. America needs to make sure we are promoting multiple pathways to success including the trades. Throughout our history, it has been the Tradesmen that have built this country and made it great. Sadly, here in Tennessee, it seems these workers are the ones being left behind. That's not okay. I will go to Washington as a voice for all Tenesseans including those who feel they have been left behind.  We need all of the hardworking folks of Tennessee and America to KAG - Keep America Great!  I support The President's America First Agenda.  America is a great country but we need to solve our problems here - Healthcare, Veterans Issues, Education, Poverty and Infrastructure before we solve the world's problems.  We need to make sure citizens in Tennessee are treated at least as well as those refugees Tennessee is welcoming inside its borders.  America should never turn a blind eye to humanitarian atrocities anywhere in the world. Just like here in Tennessee, we have an obligation to protect those that cannot protect themselves.  At the same time, America cannot be responsible for changing or fixing every worldwide problem we see.  We must respect the sovereignty of other countries while using diplomatic pressure to work towards making changes that are practical and achievable.  Lastly, I want to state that I was disappointed at the rudeness exhibited by all parties at the SOTU.  That is not a behavior we accept here in Tennessee.  Regardless of Party label, and I am a Republican, I believe we need to get back to solving America's problems.  I don't care what somebody's label is, everybody should be using common sense and exhibiting professionalism when working, just like we do here in Tennessee. Thank you folks for listening.",144,121,0,23,0,0,0,0,132333098262448,JohnnyJJPresley,/story.php?story_fbid=132333098262448&id=100351601460598
"Johnny ""JJ"" Presley for U.S. Senate",,2020-02-04 16:51:40,"Hey, Tennessee.  Your rural people are dying in closed hospital parking lots. No affordable healthcare. Your teachers are working just for mediocre benefits. If your farmers HAVE survived suicide, they are now filing for bankruptcy.. Our jobs are being outsourced. Refugees>Veterans.  The list goes on... I am Johnny Presley and I will spend every second I have been blessed with to fight for YOUR prosperity. I'm not a career politician. Don't put your vote in the pocket of an already bought-off elitist.",1200,1100,4,86,7,5,1,0,131961068299651,JohnnyJJPresley,/story.php?story_fbid=131961068299651&id=100351601460598
"Johnny ""JJ"" Presley for U.S. Senate",,2020-02-02 17:12:17,"Big congratulations to Katie, one of our own campaign volunteers, on her swearing in for the U.S. Army on Friday. Your courage, integrity and selflessness speaks volumes.  Ms. Katie leaves in March and we couldn’t be more proud. God bless you and your family!",99,83,0,15,1,0,0,0,131360945026330,JohnnyJJPresley,/story.php?story_fbid=131360945026330&id=100351601460598
"Johnny ""JJ"" Presley for U.S. Senate,WATE 6 On Your Side",,2020-02-03 21:30:02,"Rep. Tim Burchett is a stand up guy, one that I’m proud to call a friend. Good news!Rep. Tim Burchett stopped by Mayor Jacobs' office on Monday to drop off books for the drive benefiting Read City USA. You can also contribute to the ""Reading Gives You Wings"" drive through Thursday. Details in the story:",20,20,0,0,0,0,0,0,131707668324991,JohnnyJJPresley,/story.php?story_fbid=131707668324991&id=100351601460598
"Johnny ""JJ"" Presley for U.S. Senate",,2020-02-02 00:04:01,Don’t forget! Tune in to WATE 6 On Your Side tomorrow at 12:30EST/11:30CST to catch my interview with Blake Stevens on the healthcare epidemic and why it sparked my decision to run for U.S. Senate.  Please share if you have a minute. I appreciate you and your support!,17,17,0,0,0,0,0,0,131115888384169,JohnnyJJPresley,/story.php?story_fbid=131115888384169&id=100351601460598
"Johnny ""JJ"" Presley for U.S. Senate",,2020-02-01 19:32:06,"We held a small family and friends meet and greet to kick off our campaign, and I truly appreciate Mr. Tom Pelfrey for letting us setup at Buck Creek Ranch.  Excited to spread more gatherings in Cumberland County, East Tennessee and across our great state in the very near future to get the word out that change is coming. As always, thank you for your support.",156,152,0,3,1,0,0,0,131064935055931,JohnnyJJPresley,/story.php?story_fbid=131064935055931&id=100351601460598
"Johnny ""JJ"" Presley for U.S. Senate",,2020-01-30 17:43:12,"Sometimes you’ve gotta call up Ol’ Dad and put him to work to keep him out of trouble, ha!",206,185,5,15,1,0,0,0,130418758453882,JohnnyJJPresley,/story.php?story_fbid=130418758453882&id=100351601460598
"Johnny ""JJ"" Presley for U.S. Senate",,2020-01-28 14:18:47,"Sat down with WATE Blake Stevens early this morning to discuss the Tennessee hospital closure epidemic and how I can bring the necessary changes to our government in the U.S. Senate. Story airs on Sunday on Wate TV Channel 6 at 12:30EST. Tune in, and share with your friends. This is big for our rural communities!",81,77,0,3,1,0,0,0,129745205187904,JohnnyJJPresley,/story.php?story_fbid=129745205187904&id=100351601460598
"Johnny ""JJ"" Presley for U.S. Senate",,2020-01-28 12:57:05,"Great lunch meeting with Cole Sullivan for WBIR Channel 10 at the world family famous Litton's Market and Restaurant in Fountain City, Knoxville. I am so happy to have his support in bringing awareness to the rural healthcare crisis in Tennessee.",101,97,0,3,1,0,0,0,129719471857144,JohnnyJJPresley,/story.php?story_fbid=129719471857144&id=100351601460598
"Johnny ""JJ"" Presley for U.S. Senate",,2020-01-26 23:00:09,,16,15,0,1,0,0,0,0,129168368578921,JohnnyJJPresley,/story.php?story_fbid=129168368578921&id=100351601460598
"Johnny ""JJ"" Presley for U.S. Senate",,2020-01-26 15:29:18,"Persistence, persistence, persistence. Never give up, NEVER lose hope! It may be a slow and steady race, but I’m here for it. I’m here for each and every one of my people. Let’s continue to push forward!",68,66,0,1,0,1,0,0,129075611921530,JohnnyJJPresley,/story.php?story_fbid=129075611921530&id=100351601460598
"Johnny ""JJ"" Presley for U.S. Senate",,2020-01-26 14:30:39,"What a man. What a direction! If he doesn’t make you want to get up and make change, not much will. Hats off to you Inky Johnson. Incredible! Thank you, Linary Church of Christ for hosting.",54,47,0,6,1,0,0,0,129055568590201,JohnnyJJPresley,/story.php?story_fbid=129055568590201&id=100351601460598
"Johnny ""JJ"" Presley for U.S. Senate",,2020-01-26 11:18:25,"Inspiring, yet a bone-chilling realization that our society today is failing to go into a prosperous direction and coming up short, especially in our government. The system is broken. Your vote is powerful, don’t fall silent.  Happy Sunday, friends.",46,40,0,5,1,0,0,0,129013108594447,JohnnyJJPresley,/story.php?story_fbid=129013108594447&id=100351601460598
"Johnny ""JJ"" Presley for U.S. Senate",,2020-01-24 21:00:53,"Hey, friends! Tomorrow evening at 5:00PM, tune into Fox 17 Nashville News and catch my interview with Alex Apple.  If you don’t live in the broadcasted area, catch it live online! ⬇️ Go to Fox17 .com.....look for the ‘watch’ button in the top, right-hand corner.",76,74,0,1,1,0,0,0,128417351987356,JohnnyJJPresley,/story.php?story_fbid=128417351987356&id=100351601460598
,,2020-01-23 17:56:45,"Johnny Presley speaking at Dr. Ming Wang’s Chinese New Year event at Steinway Recital Hall in Nashville, TN.  Thank you to Dr. Ming Wang for the kind hospitality and support.",27,25,0,2,0,0,0,0,1012837712424010,JohnnyJJPresley,/story.php?story_fbid=1012837712424010&id=100351601460598
"Johnny ""JJ"" Presley for U.S. Senate",,2020-01-23 16:49:07,"LET’S TALK REAL FACTS.  •I grew up in a rural area. Small town. I’ve been here.. I’ve never left.  •I’ve worked in the rural hospitals, the rural clinics, with the rescue squads, the volunteer fire departments..I’ve been HERE. I’ve worked with YOU. Your family. I’ve worked alongside the rural people. REAL people.  •I know what real work on a farm is because I live on a REAL farm. Not a ‘farm’. I have real boots and you can find them covered in dirt.  •I don’t have the elitist of the elite speaking on my behalf; I do support President Trump but I’m not riding on his coat tail to get anywhere.  It doesn’t take millions of dollars to share my message if people will just listen. Who do you want representing YOU?  Someone who has stood where you’ve stood?  Or another... politician.  Choose wisely. Your life and the lives of those you love and their future depend on it. 🇺🇸",231,192,0,38,0,1,0,0,128032855359139,JohnnyJJPresley,/story.php?story_fbid=128032855359139&id=100351601460598
"Johnny ""JJ"" Presley for U.S. Senate",,2020-01-23 12:41:20,"Wake up, folks. Where’s the representation?  https://www.wate.com/news/top-stories/rennova-employee-says-financial-struggle-is-impacting-east-tn-workers-and-patients/",36,35,0,0,1,0,0,0,127982388697519,JohnnyJJPresley,/story.php?story_fbid=127982388697519&id=100351601460598
"Johnny ""JJ"" Presley for U.S. Senate,WBIR Channel 10",,2020-01-22 17:38:06,"Welcome home, troops! Thankful for these people and their families. May God bless you all and your sacrifices.. 🇺🇸 https://www.facebook.com/80100579774/posts/10157311048039775/?d=nMore than a hundred soldiers based in Knoxville will be returning home tomorrow after being deployed for nine months.",61,47,0,14,0,0,0,0,127743595388065,JohnnyJJPresley,/story.php?story_fbid=127743595388065&id=100351601460598
"Johnny ""JJ"" Presley for U.S. Senate",,2020-01-20 09:20:45,"Life’s most persistent and urgent question is: “What are you doing for others?” -Martin Luther King, Jr.  By sharing his dream, he awoke a nation and created a better tomorrow for countless Americans. Hats off to you, sir!",20,19,0,1,0,0,0,0,126954388800319,JohnnyJJPresley,/story.php?story_fbid=126954388800319&id=100351601460598
"Johnny ""JJ"" Presley for U.S. Senate,Sparta Rescue Squad",,2020-01-18 09:28:17,"Hats off to the White County Rescue Squad and anyone that had a hand in saving this life.  In the four or five years I was a part of the Cumberland County Rescue squad, I can say it’s not for the faint of heart. God bless you folks!  https://www.facebook.com/1458819704427224/posts/2200130240296163/?d=nThe Patient We cavers get pretty emotional about rescues. The kind of emotional that finds a group of 40 people from at least three different states happily atop a windy and frigid mountain in White County at night in the dead of winter. We are busy with tasks. Rope must be rigged. Paths must be cleared. We must be trained on how to use a haul system. Inside the cave people are shaving rocks to widen the passage. Cavers are placing bolts to assist with moving the patient. A medic has rappelled and climbed to him and administers medication to ease the pain. Hand warmers are placed on him. He is cold from having been underground, and unable to move for so long. He hurts and is weary, but he holds a deep strength that all here know and admire.  Here is a place where normal people become heroes. Normal people learn the complex art of cave and cliff rescue and apply that to help their fellow humans. Normal people volunteer their time to their local rescue group. We wait for the order “Slow haul!” and hand over hand two teams pull the lines a man’s life hangs by. It is a process, with many steps to bring an injured person to the surface. We work and we wait. People within the cave are communicating messages to us about what we need to do.  Sometime around 3:30am the patient emerges from the cave. He is pale, but doing well despite the ordeal he has endured. I shout ""We love you!"" from above and see him crack a smile. Soon he is on the back of a side-by-side and on his way down the mountain. Cold and tired we pack up and find our way down to our cars. There must be a hundred people here.  Humans are capable of such beauty and wonder. If you ever doubt your fellow man, come to a cave rescue. Tonight a team of humans saved a life. I can’t think of anything more amazing than that. For licensing of photos, please make a donation to any or better, all of the following (and message me the receipt): Sparta-White County Rescue Squad Chattanooga Hamilton County Rescue Service Huntsville Cave Rescue Unit, Inc. WSMV News 4, Nashville WZTV Fox 17",24,22,0,2,0,0,0,0,126809258814832,JohnnyJJPresley,/story.php?story_fbid=126809258814832&id=100351601460598
"Johnny ""JJ"" Presley for U.S. Senate",,2020-01-19 20:59:07,Heads up Titan fans.. you have so much to be proud of! That playoff route was a tough one. Couldn’t be more proud of this team. #titanup,34,34,0,0,0,0,0,0,126797568816001,JohnnyJJPresley,/story.php?story_fbid=126797568816001&id=100351601460598
"Johnny ""JJ"" Presley for U.S. Senate",,2020-01-19 15:45:39,Good Ole Sam. Sunday naps are better on cool days like today!,42,41,0,1,0,0,0,0,126742775488147,JohnnyJJPresley,/story.php?story_fbid=126742775488147&id=100351601460598
"Johnny ""JJ"" Presley for U.S. Senate",,2020-01-18 14:48:38,"How does it feel to not be represented in your own country? I’m sick of the garbage, I’m sick of the same old political crap. Let’s call it what it is, people! I will NEVER ‘go along, just to get along’, that’s not in my blood. With your support and prayers, we have a chance at having a rural voice being heard.  Will you help me?  https://secure.winred.com/johnny-presley-for-us-senate/donate",61,56,0,4,1,0,0,0,126390212190070,JohnnyJJPresley,/story.php?story_fbid=126390212190070&id=100351601460598
