source,shared_from,date,text,reactions,likes,ahah,love,wow,sigh,grrr,comments,post_id,page_id,url
Lummis for Wyoming,,2020-05-03 00:19:32,Ready for those OPEN signs. With good practices we can combat COVID-19 while we work.,23,23,0,0,0,0,0,0,3240436149300887,LummisforWyoming,/story.php?story_fbid=3240436149300887&id=369214063089791
Lummis for Wyoming,,2020-05-01 12:30:11,"“I’m in a unique position. It’s important for me to reflect the public health needs of our state, but I also intimately understand the toll this is taking on small businesses and the economy.” Dr. David Wheeler, President, Wyoming Medical Society For today's installment of WyoLight, I had the opportunity to speak with Dr. David Wheeler, President of the Wyoming Medical Society.  Healthcare Providers have the deepest understanding of the crisis we face, and also understand firsthand the impact it has had on small businesses across Wyoming.  While much of our discussion centered around the harsh reality of this virus, we got to reflect on how well our doctors and health care providers work together across the state to provide the highest quality service to the people of Wyoming. We have unique challenges here in Wyoming, but we work together and come up with solutions that are best for Wyoming and its people.",11,11,0,0,0,0,0,0,3234848123193023,LummisforWyoming,/story.php?story_fbid=3234848123193023&id=369214063089791
Lummis for Wyoming,,2020-04-30 14:10:57,"“To work in the hospitality industry, you’ve got to be a warrior.” – Chris Brown, Executive Director of the Wyoming Lodging & Restaurant Association This week we are launching a new series called ‘WyoLight’ to highlight Wyoming industries and hear how they are being impacted by COVID-19. As Wyoming Lodging and Restaurant Association's Chris Brown said during our inaugural WyoLight conversation, folks who work in hotels, restaurants, recreation, travel and tourism and other hospitality industries are true warriors who have gone through tough times before.  That being said, Chris had an important point that hospitality “can weather a terrible season, but we can’t weather a season that doesn’t happen at all.” There are many ways we can support restaurants and small businesses while they are still shut down including ordering food to-go, purchasing gift certificates and writing positive reviews online.  For a full list of ideas, check out the guide on our website: https://lummisforwyoming.com/covid/",17,16,0,1,0,0,0,0,3231378710206631,LummisforWyoming,/story.php?story_fbid=3231378710206631&id=369214063089791
Lummis for Wyoming,,2020-04-29 17:24:07,"I wanted to say thanks to all the Wyoming Young Professionals who hopped on Zoom with me last night. It was a great conversation! Special thanks to State Rep. Tyler Lindholm for moderating and to our co-hosts State Rep. Cyrus Western, Ryan McConnaughey, Shannon Wilson, and Dallas Tyrrell.  Great discussion and questions. Next time let’s do it in person 🤞.",39,38,0,1,0,0,0,0,3228243100520192,LummisforWyoming,/story.php?story_fbid=3228243100520192&id=369214063089791
Lummis for Wyoming,,2020-04-28 16:54:14,"""From farm to fork, or ranch to ribeye, now is the time to cut the bureaucratic fat out of our food system and allow American producers and consumers to come to the dining room table together again."" In case you missed it, I had a column in the Wyoming Livestock Roundup recently on a subject near and dear to my heart -- reconnecting American families with the nation's family farmers and ranchers.",110,105,0,5,0,0,0,0,3224719180872584,LummisforWyoming,/story.php?story_fbid=3224719180872584&id=369214063089791
Lummis for Wyoming,,2020-04-27 18:36:23,"I recently had the opportunity to visit with Dr. Paul Beaupré, CEO of St. John's Health in Jackson. Teton County has been a hot spot for the coronavirus in Wyoming with 64 laboratory confirmed cases. Find some of the highlights from my conversation with Dr. Beaupré including his insights on telehealth, testing, and manufacturing PPE in Wyoming at the link: https://lummisforwyoming.com/checking-in-with-st-johns-hospital-in-teton-county/ Team Lummis was proud to work with The Wort Hotel to deliver dinner to hospital staff last week.  A special thanks to The Wort Hotel General Manager Jim Waldrop and Food and Beverage Director Jordan Holcomb for making it happen!",51,47,0,4,0,0,0,0,3221695387841630,LummisforWyoming,/story.php?story_fbid=3221695387841630&id=369214063089791
Lummis for Wyoming,,2020-04-26 11:54:54,"“Our current crisis reveals our friends and our foes. Clearly, President Trump’s tough talk on trade and placement of some sideboards on globalism is needed now more than ever. These tactics of hitting the U.S. while it’s down must not go unnoticed and unaddressed.  “As we rebuild our energy sector, let’s look to local production first. The industry has proven that they can do it cleaner, more environmentally responsibly and with an eye towards job creation right here in Wyoming.”",126,117,0,9,0,0,0,0,3217231601621342,LummisforWyoming,/story.php?story_fbid=3217231601621342&id=369214063089791
Lummis for Wyoming,,2020-04-25 17:07:18,"Anybody else missing sports? 🙋🏼‍♀️ I was pleased to see Wyoming’s own Logan Wilson go in the NFL draft. So cool to see a Natrona County standout and UW Poke head to the pros 🤎💛! I watched Jumpshot, which was SO AWESOME, last weekend and am now totally taken with the Last Dance documentary on the MJ-era Bulls.  Just coincidentally, came across this picture of my dad on the 1948 Cowboys Basketball team. The back of the photo reads “Puncher Guard”. All I can figure is that he was a cowpuncher and a guard... Anyway, it’s always a great day to be a University of Wyoming Cowboy (and thank goodness I’m not a CSU Ram).",98,92,0,5,1,0,0,0,3214138641930638,LummisforWyoming,/story.php?story_fbid=3214138641930638&id=369214063089791
Lummis for Wyoming,,2020-04-23 16:11:17,"Deeply, deeply grateful for all the help and support. We have started to have weekly county chairs calls and I am just floored by the outpouring of help and eagerness to get going.  President Trump is right, we can Make America Great Again x 2. And with the energy from our campaign, you can bet Wyoming will be leading the charge.  Let’s get to work! (Can’t wait to get out on the road.)",67,63,0,4,0,0,0,0,3206505829360586,LummisforWyoming,/story.php?story_fbid=3206505829360586&id=369214063089791
Lummis for Wyoming,,2020-04-22 23:59:21,Today’s example of why socialism is antithetical to the American Dream.,184,41,30,0,19,7,87,0,3203876142956888,LummisforWyoming,/story.php?story_fbid=3203876142956888&id=369214063089791
Lummis for Wyoming,,2020-04-21 15:34:51,"Shout out to our Natrona County Campaign Chairs, JoAnn True, Shane True, and Ryan McConnaughey, who coordinated a Team Lummis donation of meals to hospital staff from The Grab and Go Gourmet last week. Thanks also to owner Maggie King and her team for making this happen! Yesterday, I had the opportunity to connect with Michele Chulick, President and CEO of the Wyoming Medical Center in Casper. As of April 20, there have been 38 laboratory confirmed cases of COVID-19 in Natrona County, 22 of which have recovered. I checked in with WMC for an update on how the hospital and community are coping with the pandemic as well as the status of diagnosed patients.  A snapshot of our conversation follows at the link: https://lummisforwyoming.com/an-update-from-the-wyoming-medical-center/",83,77,0,5,1,0,0,0,3199593916718444,LummisforWyoming,/story.php?story_fbid=3199593916718444&id=369214063089791
Lummis for Wyoming,,2020-04-20 12:27:51,"Love this video, particularly, the reference to President Teddy Roosevelt's 'speak softly but carry a big stick' quote: ""Sticks don't get any bigger than this."" Amen. To all those working at FE Warren Air Force Base in Cheyenne, thank you 🙏 for all you do to keep our nation safe.",13,13,0,0,0,0,0,0,3195902527087583,LummisforWyoming,/story.php?story_fbid=3195902527087583&id=369214063089791
Lummis for Wyoming,,2020-04-19 22:33:49,"The Chinese Communist Party (CCP) must be held responsible for their gross mismanagement of this disease, their lies, and their coverup of its origins and spread.",206,187,1,16,0,0,2,0,3193554657322370,LummisforWyoming,/story.php?story_fbid=3193554657322370&id=369214063089791
Lummis for Wyoming,,2020-04-18 22:19:44,"Encouraging news, to be sure. Eager to see more data on antibody tests, both nationally and in Wyoming.",95,91,0,4,0,0,0,0,3189011871109982,LummisforWyoming,/story.php?story_fbid=3189011871109982&id=369214063089791
Lummis for Wyoming,,2020-04-17 14:01:21,"This is absolutely spot on. 🎯 ‘Talk about moving goal posts. A month ago, the administration announced its 15-day plan to “flatten the curve” and “slow the spread” of the virus. Examine those phrases. The goal of the shutdown was never to eradicate the disease—an impossibility absent a vaccine. The lockdown was designed to buy the health sector time... In that regard, the Trump administration has become a victim of its own success. The guidelines did flatten the curve. As ugly as the outbreak has been, even New York City and other hot spots have had enough ventilators. Numerous emergency field hospitals ended up sitting empty. The lockdown has been so effective that it has allowed Mr. Trump’s political opponents to lay out a false narrative of what counts as “victory.”’",72,41,1,0,2,2,26,0,3182889541722215,LummisforWyoming,/story.php?story_fbid=3182889541722215&id=369214063089791
Lummis for Wyoming,,2020-04-15 18:13:28,"President Trump made the right decision to halt funding of the World Health Organization (WHO) pending review of their coronavirus response, and cozy relationship with the Chinese Communist Party (CCP).  American taxpayers deserve transparency. Paying billions to be misled for China’s benefit is a shocking fraud.",230,173,0,2,0,6,49,0,3175770862434083,LummisforWyoming,/story.php?story_fbid=3175770862434083&id=369214063089791
Lummis for Wyoming,,2020-04-14 14:11:20,"Last Friday, I had the opportunity to visit with leadership from SageWest Health Care in Lander. I am actively working to understand the situation on the ground in Wyoming as I know that the actions of smart, diligent, and caring Wyoming people will see us through this.  Understanding the situation now is key as we will soon be pulling our economy out of this as One Wyoming family. Knowing what's working will empower us to move quickly and nimbly as soon as possible. Follow the link for my report on our conversation: https://lummisforwyoming.com/a-conversation-with-sagewest-health-care-leadership/ I spoke with Chief Executive Officer John Ferrelli, Chief of Staff Mel Meyer, MD, Chief Nursing Officer Kathie Hirsch-Lanute and Director of Quality Management Leah Holman. Josh Hopson with LifePoint Health and the President of the Wyoming Hospital Association Eric Boley also joined us. Thanks to all for taking the time to explain the current status in Lander and around Wyoming. To the healthcare heroes on the front lines in Lander and across the Cowboy State, I say thank you 🙏 and God Bless.  Team Lummis was happy to be able to provide a meal for staff at SageWest Health Care in Lander this weekend. A special thanks to owners and staff at The Oxbow Restaurant for making it happen and for continuing to serve the public!",64,60,0,4,0,0,0,0,3172389449438891,LummisforWyoming,/story.php?story_fbid=3172389449438891&id=369214063089791
Lummis for Wyoming,,2020-04-13 17:09:42,"I am glad to read that my friend, and former House colleague, Governor Kristi Noem is making this happen in South Dakota.  States are the incubators of national solutions, now and always. I pray that this and other trials yield viable treatments as Wyoming -- and America -- cannot afford to remain shuttered much longer.",198,181,1,16,0,0,0,0,3170025833008586,LummisforWyoming,/story.php?story_fbid=3170025833008586&id=369214063089791
Lummis for Wyoming,,2020-04-11 19:41:09,"On this Holy Saturday, and tomorrow on Easter Sunday, May the Lord bless you and keep you, May He make His face shine upon you and be gracious unto you, May the Lord lift His countenance upon you  And give you peace. 🙏",131,109,0,22,0,0,0,0,3165078373503332,LummisforWyoming,/story.php?story_fbid=3165078373503332&id=369214063089791
Lummis for Wyoming,,2020-04-10 16:51:08,"Somebody said it's National Sibling Day. I love my family and am very blessed to work with them on our family ranch. As this photo (recently found by my nephew) makes clear, I was always livin' at the height of fashion. 🤦‍♀️",117,104,2,11,0,0,0,0,3162474310430405,LummisforWyoming,/story.php?story_fbid=3162474310430405&id=369214063089791
Lummis for Wyoming,,2020-04-10 11:28:14,"This week, I had the opportunity to visit on the phone with Tim Thornell, the President and CEO of Cheyenne Regional Medical Center (CRMC). Their hospital is on the front lines of diagnosing and treating residents of Laramie County with COVID-19.  Team Lummis was pleased to provide sandwiches, chips and cookies to CRMC staff this week. We are so grateful for all that you do! I hope you’ll join me in continuing to support hospitals and healthcare workers across the state who are keeping Wyoming citizens healthy and protected during this difficult time.  Follow the link below for some of the key questions I posed and summaries of answers from Tim. Please note these answers are only summaries, edited for length and clarity: https://www.dropbox.com/s/ooqmn7691elmjx2/CL%20visits%20with%20local%20hospital%20CEO%20about%20coronavirus.pdf?dl=0",59,52,1,6,0,0,0,0,3161873703823799,LummisforWyoming,/story.php?story_fbid=3161873703823799&id=369214063089791
Lummis for Wyoming,,2020-04-08 17:56:32,"I am grateful 🙏 to everyone who has generously agreed to help out with our campaign. I have had the chance to visit one-on-one with my county chairs (70 so far) in all 23 counties and with my statewide campaign committee while we all try to find our way through this difficult time for our communities, our state and our nation. Our shared values and our deep commitment to the future of this special place are at the root of every conversation.  God bless Wyoming and its people. It is like no place on earth. And no place I'd rather be.",110,101,0,9,0,0,0,0,3157873400890496,LummisforWyoming,/story.php?story_fbid=3157873400890496&id=369214063089791
Lummis for Wyoming,,2020-04-07 10:38:46,"Today's question comes from Jessica who asks how we can help businesses and restaurants impacted by the coronavirus. It's hard to be stuck at home. We all want to get out there and do something to help. But, while staying home, there are still lots of little ways to help small businesses in Wyoming. We have come up with a list of ideas to help Wyoming businesses and posted them to our website: https://lummisforwyoming.com/covid-19/ Reminder: I asked if you would send me any questions that you have while hunkered down close to home. I've had a chance to record a couple answers and will continue to answer more questions I receive from you in the days ahead. Be well, Wyoming.",28,24,0,4,0,0,0,0,3154721861205650,LummisforWyoming,/story.php?story_fbid=3154721861205650&id=369214063089791
Lummis for Wyoming,,2020-04-06 17:09:14,I love Paul Harvey. This Easter story is a little gift 🎁. God is good!,58,48,0,10,0,0,0,0,3153122464698923,LummisforWyoming,/story.php?story_fbid=3153122464698923&id=369214063089791
Lummis for Wyoming,,2020-04-06 11:39:46,"I asked if you would send me any questions that you have while hunkered down close to home. I've had a chance to record a couple answers and will continue to answer more questions I receive from you in the days ahead. This question comes from Ron who asked if the coronavirus will impact the payout of social security. The short answer is no. It should not impact social security payments at all. If you are having issues with your social security payments, the staffs of Wyoming's congressional delegation are there to help. Message me if you need some assistance getting in contact with someone.",33,32,0,1,0,0,0,0,3152468191431017,LummisforWyoming,/story.php?story_fbid=3152468191431017&id=369214063089791
Lummis for Wyoming,,2020-04-06 00:17:23,"“A leader listens, assesses. and then decides; this is what President Trump does every day as challenges unfold. When it comes to lifting the quarantine and restarting the economy,  Trump is more than capable of making the decisions necessary to make America great again.”",98,87,1,10,0,0,0,0,3151427604868409,LummisforWyoming,/story.php?story_fbid=3151427604868409&id=369214063089791
Lummis for Wyoming,,2020-04-04 22:49:20,Important perspective from our neighbor to the south.,62,58,0,0,0,2,2,0,3148881375123032,LummisforWyoming,/story.php?story_fbid=3148881375123032&id=369214063089791
Lummis for Wyoming,,2020-04-03 18:20:03,"About a week ago, I asked if you would send me any questions that you have while hunkered down close to home.  I've had a chance to record a couple answers and will continue to answer more questions I receive from you in the days ahead.  This first question comes from Jeremy who asked if I support federal funding for abortion through Planned Parenthood.  I am pro-life and I oppose the use of taxpayer funds for abortion. Watch my reply for more detail and stay tuned as I answer more of your questions over the weekend.",79,69,0,10,0,0,0,0,3146121275399042,LummisforWyoming,/story.php?story_fbid=3146121275399042&id=369214063089791
Lummis for Wyoming,,2020-04-02 18:11:08,"💯💯💯. Please read and share: ""...COVID-19 should make the paramount importance of affordable, reliable electricity clearer than ever. Without it, none of us could do our jobs, and this new disease would have killed far more of our parents, children, brothers, friends.""",23,20,0,2,1,0,0,0,3143878975623272,LummisforWyoming,/story.php?story_fbid=3143878975623272&id=369214063089791
Lummis for Wyoming,,2020-04-02 00:06:53,"China has lied and silenced those within their own nation in a desperate attempt to save face, no matter the human cost.",100,45,0,0,8,5,42,0,3142145299129973,LummisforWyoming,/story.php?story_fbid=3142145299129973&id=369214063089791
Lummis for Wyoming,,2020-03-30 15:17:25,"It is National Doctors Day.  We are grateful to you (and the families of health care providers unable to be with their loved ones right now). We are thankful for your heroic call to serve our communities, particularly in this time of need. With prayers for your health and deepest thanks.",52,45,0,7,0,0,0,0,3136593526351817,LummisforWyoming,/story.php?story_fbid=3136593526351817&id=369214063089791
Lummis for Wyoming,,2020-03-30 13:04:09,"“I’m proud to endorse principled constitutional conservative Cynthia Lummis for U.S. Senate from Wyoming. Cynthia will prioritize American security, workers & the rights of the unborn. I look forward to working alongside Cynthia to Keep America Great with President Donald J. Trump.” – David Bossie, President and Chairman of the Board, Citizens United Citizens United is an organization dedicated to restoring our government to citizens' control. Through a combination of education, advocacy, and grassroots organization, Citizens United seeks to reassert the traditional American values of limited government, freedom of enterprise, strong families, and national sovereignty and security. Citizens United's goal is to restore the founding fathers' vision of a free nation, guided by the honesty, common sense, and good will of its citizens.",60,60,0,0,0,0,0,0,3136347889709714,LummisforWyoming,/story.php?story_fbid=3136347889709714&id=369214063089791
Lummis for Wyoming,,2020-03-29 18:46:21,"""If you have to go through hell, go through it as fast as possible.  “The president is a wartime president. He's made some tough calls already. He's shut down all the traffic coming in from China. And he quarantined everybody that came back. And he was criticized by Morning Joe and [2020 rival Joe] Biden and those guys as being racist, nativist, and xenophobic."" - Steve Bannon",42,37,0,4,1,0,0,0,3134591426552027,LummisforWyoming,/story.php?story_fbid=3134591426552027&id=369214063089791
Lummis for Wyoming,,2020-03-28 21:04:21,When I was in the House I used to make regular appointments to visit with the gentleman from Oklahoma. Senator Coburn was a class act. His understanding of the federal budget process and the solutions he brought to address our debt were beyond compare.  His commitment to fiscal discipline and guardianship of the taxpayer is a legacy to which everyone in the Congress should aspire.,47,22,0,1,0,24,0,0,3132308520113651,LummisforWyoming,/story.php?story_fbid=3132308520113651&id=369214063089791
Lummis for Wyoming,,2020-03-27 09:31:29,"“If by September Mr. Trump and his team are bringing the U.S. through the threat from this pandemic, he will be re-elected. Without a single rally. Rallying a nation is what gets presidents remembered.”",129,112,1,15,0,1,0,0,3128733100471193,LummisforWyoming,/story.php?story_fbid=3128733100471193&id=369214063089791
Lummis for Wyoming,,2020-03-25 18:04:06,"The conversations I’ve had with so many awesome Wyoming folks on the phone, at food pickup and online strengthen my resolve and reaffirm my love for the people of Wyoming.  We are small but mighty, and geography is no barrier to community for us. Be well, Wyoming. And give someone a ring today, you never know who needs to hear a friendly voice.",26,21,0,5,0,0,0,0,3124810870863416,LummisforWyoming,/story.php?story_fbid=3124810870863416&id=369214063089791
"Lummis for Wyoming,Micro Pop-Up Concepts",,2020-03-23 19:44:31,"My friend Juan Coronado lets no grass grow under his feet.  Wyoming is amazing because of people like him doing things like this for the community and for restaurant workers in our area.  If you are in Cheyenne, mark your calendars for THIS FRIDAY and support Wyoming workers while practicing responsible social distancing.Chef Driven Community Funded Pop-Up   Now offering Curb-Side Pick up Meals Pick up Date: March 27th 2020 4pm-7pm  Drive- Thru Pop Up Location: West Edge Collective, 707 W. Lincolnway, Cheyenne, WY 82001 Orders: Facebook@micropopupconcepts  OR Email:micropopupconcepts@gmail.com With your support and that of our community we can contribute to Cheyenne’s future by providing essential chef driven services.  Micro Pop- Up Concepts is dedicated to the safety of our community, by adhering to the guidelines set by the FDA, WHO, and the CDC. We are committed to; practicing social distancing, above standard sanitation, a no-cash policy, as well as utilizing food safe medical grade disinfectant and sanitizer. Pre- order one entree size meal with a minimum donation of $12 Donations exceeding the minimum will support out of work restaurant industry folks in our local community Micro Pop-up Concepts will give back 2 meals per every 10 orders. Huge thanks to this week's partners, WYFresh Farms, and West Edge Collective.   Payment options: Apple Pay, Facebook Pay, Venmo.",9,9,0,0,0,0,0,0,3121553624522474,LummisforWyoming,/story.php?story_fbid=3121553624522474&id=369214063089791
Lummis for Wyoming,,2020-03-23 17:08:28,The Gray Lady. A story in four headlines. 🙄,48,13,1,0,1,4,29,0,3119848044693032,LummisforWyoming,/story.php?story_fbid=3119848044693032&id=369214063089791
"Lummis for Wyoming,Ivinson Memorial Hospital & Foundation",,2020-03-18 16:53:46,"Ivinson Memorial Hospital & Foundation in Laramie FOR THE WIN. 💛 Cowboys! Cowboys! Cowboys!Getting tired of singing, ""happy birthday,"" while washing your hands? We got you covered! Adapted from the World Health Organization Guidelines on Hand Hygiene in Health Care, we present to you, ""How Wyomingites Wash Their Hands.""  Download the poster from our website: http://bit.ly/imhcovid19",24,22,0,2,0,0,0,0,3117302948280875,LummisforWyoming,/story.php?story_fbid=3117302948280875&id=369214063089791
Lummis for Wyoming,,2020-03-21 15:59:21,"You can support local business while practicing social distancing. I’m heading back to Cheyenne today and stopped for a drive through coffee + sweet treat at Delish Donuts 🍩 in Alpine (their mini cereal donuts are 2x delish).  As we all know, Wyoming runs on local business so we have put together some ways you can support Wyoming restaurants and small businesses during this difficult spell: https://lummisforwyoming.com/covid-19/",24,21,0,3,0,0,0,0,3114894481855055,LummisforWyoming,/story.php?story_fbid=3114894481855055&id=369214063089791
,,2020-03-20 16:04:00,,39,36,0,3,0,0,0,0,531304654238600,LummisforWyoming,/story.php?story_fbid=531304654238600&id=369214063089791
Lummis for Wyoming,,2020-03-20 14:34:07,"Hey everybody. Was having a little bit of cabin fever and thought maybe some Wyoming families might be feeling similarly and looking for school resources.  I am going to do a short Facebook Live at 2 PM for any Wyoming K-12 students who want to participate in a short Civics class. This is a first for me so check out this page at 2 PM if you're interested. Be well, Wyoming.",24,21,0,3,0,0,0,0,3112257875452049,LummisforWyoming,/story.php?story_fbid=3112257875452049&id=369214063089791
Lummis for Wyoming,,2020-03-20 12:08:28,"Who: President Donald J. Trump is hosting a call with small business owners on COVID-19. All Wyoming small business owners are invited to call-in. When: TODAY, March 20, 2020 at 1:45 PM MST Where: Use this link to RSVP https://ems9.intellor.com?do=register&t=1&p=901338",23,23,0,0,0,0,0,0,3111973962147107,LummisforWyoming,/story.php?story_fbid=3111973962147107&id=369214063089791
