source,shared_from,date,text,reactions,likes,ahah,love,wow,sigh,grrr,comments,post_id,page_id,url
Lummis for Wyoming,,2020-01-18 16:42:36,"After a great morning at March for Life in Casper I am headed for Cheyenne to catch the screening of ‘Cowboys’ at the Cheyenne Civic Center. The tag line for the movie says it all: ‘It’s not what we do, it’s who we are’.  So pleased to see real ranchers get a star turn and thrilled to be able to celebrate our western heritage! This documentary is presented by Welding and Machine of Cheyenne, honoring the American western heritage, in support Cheyenne Frontier Days™ Old West Museum’s Capital Campaign, Become a Legend.",82,79,0,3,0,0,0,0,2974651795879325,LummisforWyoming,/story.php?story_fbid=2974651795879325&id=369214063089791
Lummis for Wyoming,,2020-01-18 12:07:04,"Thank you March for Life Natrona County for organizing such a great event this morning.  Grateful to be with you all supporting the Right to Life.  My favorite verse in defense of life: “The word of the Lord came to me saying, ‘Before I formed you in the womb I knew you, before you were born I set you apart; I appointed you as a prophet to the nations.’” (Jeremiah 1:4-5)",139,114,0,25,0,0,0,0,2974233445921160,LummisforWyoming,/story.php?story_fbid=2974233445921160&id=369214063089791
Lummis for Wyoming,,2020-01-17 22:05:41,"Look, the most important endorsements I receive are from you, Wyoming's voters.  That said, I want to fill you in on a recent endorsement that I am grateful to have earned from the Senate Conservatives.  I am a dyed-in-the-wool Wyoming conservative and I share the policy goals and unapologetic, liberty-minded orientation of many Senate Conservative Fund candidates like Ted Cruz, Mike Lee, Marsha Blackburn and Tom Cotton.  Wyoming is a conservative place. As Wyoming's Senator I will vote to uphold our unwavering, patriotic, freedom-focused principles. Can't wait to get started.",62,56,0,6,0,0,0,0,2972978822713289,LummisforWyoming,/story.php?story_fbid=2972978822713289&id=369214063089791
Lummis for Wyoming,,2020-01-16 19:52:19,Our Founding Fathers were acutely aware of the importance and uniqueness of a nation with religious freedom at its cornerstone.  America remains a 'shining city on a hill' because of our embrace of freedom. Please consider including a prayer🙏 for the freedom to bow our heads in prayer and practice our our faith out loud tonight.  It is #ReligiousFreedomDay.,52,51,0,1,0,0,0,0,2970596896284815,LummisforWyoming,/story.php?story_fbid=2970596896284815&id=369214063089791
Lummis for Wyoming,,2020-01-16 16:24:46,"Congressman Liz Cheney has been a great spokeswoman and leader for the Republican Party in DC. Her role as House Republican Conference Chair is one she truly excels in and I think her future knows no bounds. It’s a tremendous benefit to the people of Wyoming to have Senator John Barrasso in leadership in the Senate and Liz Cheney in leadership in the House. From day one, my campaign has been focused on the people of Wyoming. Over the last four months, Democrats in Washington have shown they are dead set on stopping President Trump’s America First agenda – which is creating record job growth, increasing wages for the middle class and helping small businesses flourish. He’s taken critical steps to secure our borders and keep all Americans safe. And his historic deregulation and unleashing of our vast natural resources is poised to usher in a new era of American energy dominance. Wyoming’s future is dependent upon President Trump getting re-elected and the success of his administration for another four years.  I’m running for the U.S. Senate to advance President Trump’s pro-America, pro-energy, pro-agriculture, pro-Wyoming agenda.",231,213,0,18,0,0,0,0,2970287896315715,LummisforWyoming,/story.php?story_fbid=2970287896315715&id=369214063089791
Lummis for Wyoming,,2020-01-14 15:33:22,Protecting the Second Amendment is EXTREMELY IMPORTANT.  We must never let the left dilute or diminish our Constitutional freedoms. That requires constant vigilance and unwavering commitment to protecting our founding principles.  #2A,97,89,0,7,1,0,0,0,2965390056805499,LummisforWyoming,/story.php?story_fbid=2965390056805499&id=369214063089791
Lummis for Wyoming,,2020-01-13 21:49:56,"I’ve been accused of being All-Wyoming, All the Time, and it’s true. I just love this state. Talk about a place worth fighting for. Still, for all its stunning vistas, it’s the people who make it extraordinary.",372,316,0,55,1,0,0,0,2963671656977339,LummisforWyoming,/story.php?story_fbid=2963671656977339&id=369214063089791
Lummis for Wyoming,,2020-01-12 23:50:58,"Critical win for Wyoming. President Donald J. Trump’s National Environmental Policy Act (NEPA) reform is already having positive impacts in Wyoming.  By requiring that environmental reviews be handled within two years, Wyoming can reduce permitting time — while maintaining robust environmental protections — and produce more AMERICAN energy!  #MAGA",184,165,1,16,0,0,2,0,2961490403862131,LummisforWyoming,/story.php?story_fbid=2961490403862131&id=369214063089791
Lummis for Wyoming,,2020-01-11 22:57:34,"All across the American West federal wildfire management fails because of kowtowing to radical environmental lawsuits. To protect our forests and grasslands, we need responsible management that includes grazing and conservation tree thinning.",161,149,0,11,0,0,1,0,2958982237446281,LummisforWyoming,/story.php?story_fbid=2958982237446281&id=369214063089791
Lummis for Wyoming,,2020-01-10 13:55:39,So fun to join Erick Erickson on his radio show / podcast.  Give it a listen. My interview with Erick starts at about 1:03:17 and we talk Wyoming's significant contribution to American energy independence and the need to return to fiscal sanity in the federal budget process.,42,39,0,3,0,0,0,0,2955633467781158,LummisforWyoming,/story.php?story_fbid=2955633467781158&id=369214063089791
Lummis for Wyoming,,2020-01-09 22:45:26,Thank you to Wyoming's local law enforcement for all you do each and every day. #NationalLawEnforcementAppreciationDay,106,97,0,7,2,0,0,0,2954159834595188,LummisforWyoming,/story.php?story_fbid=2954159834595188&id=369214063089791
"Lummis for Wyoming,Ranch & Rodeo Roundup",,2020-01-06 17:58:21,"Talk about a #ThrowbackThursday: My first job out of college was working for Cotton Rosser and the Flying U Rodeo Company.  A modern day Buffalo Bill Cody. A true showman of the spirit of the American West.Just got off the phone with my friend Cotton Rosser, Cotton has  inspired so many people including myself, and continues to do so at the young age of 91.   Here is a story that was done on Cotton last year in part by PRSN But what most spectators won’t know is that one man has produced nearly every other rodeo in the Golden State at one time or another. Since Cotton Rosser bought the Flying U Rodeo Company 60 years ago, he has become a legend in the rodeo world. Everyone knows his name. ""The loveliest people are in rodeos,"" says Rosser. ""They do it because they love it, and it’s a Western way of life. They love the animals and the horses and the outdoors, and the atmosphere of rodeo is just barbecues and fun."" At 91 years old, Rosser has been honored by nearly every cowboy, rodeo or rancher hall of fame there is. He has a place in the Hall of Great Westerners, alongside John Wayne, Ronald Reagan and Dwight D. Eisenhower. But he was actually born a city kid in Long Beach in 1928. He grew up reading books about cowboys and watching Gene Autry, Will Rogers and Hopalong Cassidy. “I wanted to be a cowboy my whole life,” says Rosser. He was barely a teenager when he got a job on Santa Catalina Island, on a ranch owned by William Wrigley of chewing gum fame. At the time there were no cowboys for hire -- they were off fighting in World War II. So they gave young Cotton Rosser a chance, since he only had school half-days. “I used to clean stalls, clean the manure, and they let me ride a donkey named Jack,” says Rosser. And the donkey was just the beginning. Soon, he graduated to riding bulls and saddle broncs, and by the time he was a student at Cal Poly San Luis Obispo, he turned pro. Rosser competed in rodeos all over the country. “[The] Cow Palace, Las Vegas, Reno, Calgary Stampede,” he says. “All the rodeos -- Cheyenne, [and] Pendleton.” In 1951, he even won the Grand National Rodeo’s all-around cowboy title. Then, in 1955, he broke both his legs in an accident while digging post holes on his Marysville ranch north of Sacramento. That ended his rodeo career. “[It was the] best thing that ever happened to me,” Rosser says. He bought the Flying U Rodeo Company and started his career putting on shows and raising rodeo animals. Today, the Flying U is the oldest continually operating stock contracting company in the United States. Since he joined the rodeo world in the 1940s, Rosser has seen the sport change, and at times it seemed like fans were slipping away. To bring more people to the arena, the Flying U Rodeo Company got creative. It added high production value, loud rock 'n' roll, audience engagement and freestyle motocross -- dirt bike riders performing flips off tall ramps. And in recent years, Cotton says these new attractions have boosted attendance. That includes the Grand National Rodeo at the Cow Palace.  “It’s very action-packed,” he says. “It’s always something new ! ProRodeo Hall of Fame stock contractor Cotton Rosser has been named the 2019 Legend of ProRodeo. Rosser was honored at the 12th annual Wrangler Gold Buckle Gala on Dec. 2 at the South Point Grand Ballroom in Las Vegas. “This is a wonderful, great honor to receive,” said Rosser, 91. Rosser was inducted into the ProRodeo Hall of Fame in 1995. Rosser and his son, Reno, operate the Flying U Rodeo and Rosser Rodeo stock contracting companies based in Marysville, Calif. They produce about 50 rodeos a year. “I’m just the PR man now,” Cotton said with a chuckle. “I never imagined my rodeo career would be like this. I’m the richest guy in the world with memories and friends. I’ve loved every minute of the rodeo business and I would do it all over again. It has been a great experience.” Rosser is the 14th man to be honored with the ProRodeo Legend award, following Jake Barnes, Jim Shoulders, Clem McSpadden, Harry Vold, Larry Mahan, Shawn Davis, Dean Oliver, Donnie Gay, Benny Binion, Mel Potter, Neal Gay, Michael Gaughan, and Keith Martin. Rosser is a pioneer in the rodeo industry who was ahead of his time in developing the entertainment side of rodeo. Rosser received the PRCA Donita Barnes Contract Personnel Lifetime Achievement award in 2015. “A lot of rodeos we have, we have had for 60 years, like the Cow Palace, Red Bluff (in California) and Reno (Nev.),” said Rosser, who served on the PRCA Board of Directors for many years. “They even put a statue up in Reno of me (in 2014). It just doesn’t get much better. I have raised a good family and I really tried to help rodeo. Some people say if you’ve seen one rodeo, you have seen them all, and I have always said I don’t think that’s quite true. Rodeo is the greatest sport in the world, and I’m glad to have been a part of it for the last 70 years.” Rosser still rides a horse into the arena, and he wouldn’t have it any other way. “Rodeo is the only thing I know,” Rosser said. “It doesn’t get better than that when you ride into the arena and they play the national anthem and there is a full house,” he said. For more than 60 years, Rosser has been known for his spectacular, flamboyant opening ceremonies at rodeos on the West Coast and for many years at the National Finals Rodeo. Rosser is considered the “P.T. Barnum” of professional rodeo. He has searched out ideas from sources as remote from the sport as ice shows and circuses, looking for that special something he can add to his productions. The other side of Rosser is his history as a top cowboy, who started competing in all of rodeo’s standard events as a teenager and later as a member of his college rodeo team at Cal Poly University-San Luis Obispo. As a professional, he won buckles, saddles and trophies. Among his many titles, one of Rosser’s highlights was winning the all-around title at the 1951 Grand National Rodeo in San Francisco. Rosser purchased the Flying U Rodeo Ranch in 1956, which is now the oldest continuing rodeo livestock company in the United States. In 1985, Rosser was named PRCA Stock Contractor of the Year.",71,67,0,4,0,0,0,0,2953285161349322,LummisforWyoming,/story.php?story_fbid=2953285161349322&id=369214063089791
Lummis for Wyoming,,2020-01-08 13:24:54,"“Your campaign of terror, murder, mayhem will not be tolerated any longer. It will not be allowed to go forward.” Our President, Donald J. Trump, to Iran this morning. God bless this man. Once again, President Trump kept his promise to put Americans FIRST -- our troops, diplomats, and civilians -- while eliminating terrorists from the battlefield. Thanks to our brave troops and the bold, decisive, defensive action of the President, American deterrence is restored and Obama's policy of appeasement is rightly relegated to the dust pan of history.",169,147,0,22,0,0,0,0,2950990568245448,LummisforWyoming,/story.php?story_fbid=2950990568245448&id=369214063089791
Lummis for Wyoming,,2020-01-07 00:50:26,"Wyoming has more guns per capita than any state in the nation. As upholders of the Second Amendment, I am asking you to call, email, text, tweet (heck, carrier pigeon) folks you know in Kentucky and Virginia to get them involved in this fight to protect our Constitutional rights.  Today from the NRA - National Rifle Association of America in VA: https://www.nraila.org/articles/20200106/virginia-gov-northam-wants-millions-in-tax-money-to-ban-guns-and-jail-gun-owners Map below (via Congressman Thomas Massie) of upcoming votes to establish 2nd Amendment sanctuary counties in Kentucky.  #2AShallNotBeInfringed",140,127,0,13,0,0,0,0,2947579538586551,LummisforWyoming,/story.php?story_fbid=2947579538586551&id=369214063089791
Lummis for Wyoming,,2020-01-06 01:12:37,"This is simply untenable. Our Border Patrol agents are overextended and, even so, have apprehended 4.3 million migrants on our nation’s southern border in the last ten years. More than 800,000 in FY 2019 alone.  We must secure our borders. #BuildTheWall",75,48,0,2,4,6,15,0,2945370535474118,LummisforWyoming,/story.php?story_fbid=2945370535474118&id=369214063089791
Lummis for Wyoming,,2020-01-04 00:17:32,"Articles or it didn't happen... The last twenty-four hours bring into stark contrast what a bunch of irresponsible, petulant children the Democrats are. Americans face real issues. The political games and impeachment nonsense must stop.",209,162,3,5,13,4,22,0,2940744232603415,LummisforWyoming,/story.php?story_fbid=2940744232603415&id=369214063089791
Lummis for Wyoming,,2020-01-02 23:08:21,"Tonight an evil terrorist, murderer, and Tehran tyrant is dead because of DECISIVE DEFENSIVE ACTION to protect AMERICAN LIVES. God bless our troops and God bless our nation's commander-in-chief Donald J. Trump. We can all sleep more soundly tonight.",515,427,2,84,1,0,1,0,2938316109512894,LummisforWyoming,/story.php?story_fbid=2938316109512894&id=369214063089791
Lummis for Wyoming,,2020-01-02 01:02:09,Living within a budget means separating wants from needs... And while Wyoming families do it every day Congress has decided not to live within its means and instead treat taxpayers' money as monopoly dough.  That failure of responsibility leaves our country open to jumping from crisis to crisis on a series of continuing resolutions. The federal budget process is broken and needs an overhaul.,92,83,0,5,2,2,0,0,2936271426384029,LummisforWyoming,/story.php?story_fbid=2936271426384029&id=369214063089791
Lummis for Wyoming,,2020-01-01 01:25:07,Great night ringing in the New Year (and new decade) with good friends at the Cheyenne Frontier Days Old West Museum.   I am proud to be a part of this organization and support the preservation and promotion of Wyoming’s rich western culture.  May God bless Wyoming in 2020 and always. Happy New Year! #LummisforWyoming,150,140,0,9,1,0,0,0,2934052326605939,LummisforWyoming,/story.php?story_fbid=2934052326605939&id=369214063089791
Lummis for Wyoming,,2019-12-30 22:47:25,I wish this was a joke. A whopping $1.2 billion in the public’s money down the drain. We need to cut this waste.,93,35,0,1,4,14,39,0,2931130733564765,LummisforWyoming,/story.php?story_fbid=2931130733564765&id=369214063089791
Lummis for Wyoming,,2019-12-29 22:30:11,I am deeply sorry to learn of the attacks on Americans freely practicing their religion in New York and Texas.  Our rights often intermingle to support and reinforce our freedom.  Today the right to peaceful assembly and to practice our faith were protected by fellow parishioners on a tragic day that could have been much worse without a good guy legally carrying a gun.,296,260,0,23,1,12,0,0,2928923157118856,LummisforWyoming,/story.php?story_fbid=2928923157118856&id=369214063089791
Lummis for Wyoming,,2019-12-27 18:10:07,"Here's a feel good story for your weekend. Every life is sacred. Proud of my 100% pro-life voting record and ready to stand up and defend the right to life. Also, check out Mayor Charlie's 'Make America Kind Again agenda' including patriotism, adoption and life ❤️❤️❤️. #MAGA #prolife",88,75,1,12,0,0,0,0,2924132217597950,LummisforWyoming,/story.php?story_fbid=2924132217597950&id=369214063089791
Lummis for Wyoming,,2019-12-26 16:56:12,"The great news just keeps a comin' under this administration's leadership... Keep America Great, indeed.",104,82,0,22,0,0,0,0,2921740594503779,LummisforWyoming,/story.php?story_fbid=2921740594503779&id=369214063089791
Lummis for Wyoming,,2019-12-24 21:12:23,Merry Christmas to all and to all a good night. My favorite Christmas Eve read aloud...,120,102,1,17,0,0,0,0,2917415434936295,LummisforWyoming,/story.php?story_fbid=2917415434936295&id=369214063089791
Lummis for Wyoming,,2019-12-23 18:31:39,"Wyoming is unique. We have unique traditions, unique natural resources, and unique challenges. As a life-long Wyoming girl fortunate to travel this state from corner to corner, I understand what sets Wyoming apart.  I am running for the United States Senate to fight for Wyoming's very way of life. For the freedom to live our lives without fear of government intrusion and overreach. Enjoying the All American Cutter and Chariot Races in Afton with my family is a great reminder of why Wyoming needs to be ever vigilant and take the fight to the Swamp. Our way of life is worth fighting for and I will fight on the frontlines of that battle every day. #ThatsWY #CutterRacing #ChariotRacing #AftonWyoming",124,107,0,16,1,0,0,0,2914973151847190,LummisforWyoming,/story.php?story_fbid=2914973151847190&id=369214063089791
Lummis for Wyoming,,2019-12-22 19:30:12,"Busy, busy getting ready for Christmas while keeping the true reason for season close in my head and my heart.  Merry Christmas from my family to yours!",156,141,1,14,0,0,0,0,2912899688721203,LummisforWyoming,/story.php?story_fbid=2912899688721203&id=369214063089791
Lummis for Wyoming,,2019-12-21 23:20:21,"Today was a totally wonderful day in Wyoming. I got to spend a bit of my morning talking with Bank of Star Valley President Rod Jensen about the inspiring Angel Tree program.  Community members fill the wishlists of area children whose folks are struggling to make ends meet this Christmas. The Bank organizes the wishlists and donations. I got to be there as volunteers from the bank handed out gifts to the families! Wyoming people helping Wyoming people. Such an awesome thing to see.  If you can, pay it forward this Christmas. Nothing will do more to get you in the holiday spirit.",67,57,0,10,0,0,0,0,2910947858916386,LummisforWyoming,/story.php?story_fbid=2910947858916386&id=369214063089791
Lummis for Wyoming,,2019-12-20 20:21:40,Great news in the fight for life.  Taxpayers should NEVER fund abortions. #prolife #KAG,209,186,0,22,0,0,1,0,2908312135846625,LummisforWyoming,/story.php?story_fbid=2908312135846625&id=369214063089791
Lummis for Wyoming,,2019-12-19 19:29:10,"Gotta say, the news stings that one of the smartest, savviest, most liberty-minded gentlemen in Congress is leaving. Former House Freedom Caucus Chair Mark Meadows is an unrivaled advocate for the issues that matter to Americans working hard in the real world.  Mark is a top of the heap guy and a great friend. Nothing but class. I hope he steps into even greater roles in his extraordinary work on behalf of the nation and the cause of liberty.",151,141,1,9,0,0,0,0,2905740566103782,LummisforWyoming,/story.php?story_fbid=2905740566103782&id=369214063089791
Lummis for Wyoming,,2019-12-18 18:25:13,"It's a dark day in DC as Democrats place impeachment ahead of helping Americans. I am disgusted with my former Dem House colleagues. The unrepentant egotism of the Ds to lie, politicize & overturn the will of 63 MILLION Americans is a disgrace. If I were a member of the Senate, I would vote ‘HELL NO’ to convict Donald J. Trump on articles of impeachment.",218,192,2,8,3,3,10,0,2903457702998735,LummisforWyoming,/story.php?story_fbid=2903457702998735&id=369214063089791
Lummis for Wyoming,,2019-12-17 23:59:25,Thanks to the Lincoln County GOP for letting me join in for the Christmas party at Wyoming GOP National Committeewoman Marti Halverson’s stunning home.  Fun to see people across Wyoming wishing each other a Merry Christmas and enjoying time together. Our tight knit communities bind us together and offer a perfect opportunity to celebrate one Nation under God.,161,148,0,11,2,0,0,0,2901742393170266,LummisforWyoming,/story.php?story_fbid=2901742393170266&id=369214063089791
Lummis for Wyoming,,2019-12-16 19:40:54,All-time high! Love livin’ in this Trump economy.   #KAG,280,254,0,22,4,0,0,0,2899188090092363,LummisforWyoming,/story.php?story_fbid=2899188090092363&id=369214063089791
Lummis for Wyoming,,2019-12-15 19:24:32,Comey is busted by Inspector General. Now he admits “sloppiness”?  My friend Trey Gowdy’s right on (as usual). It’s more than too little too late. It’s a personnel issue that can only be solved by DRAINING THE SWAMP.,167,152,6,2,6,1,0,0,2896866720324500,LummisforWyoming,/story.php?story_fbid=2896866720324500&id=369214063089791
Lummis for Wyoming,,2019-12-13 14:27:10,"Big time thank you to the Washakie County Wyoming Republican Party for letting me join in at last night's Christmas party. The badging of all the precinct committeemen and women was so awesome to be a part of. A great turnout and good conversation with more than 40 fellow Republicans. Couldn't help but stop in for a visit and a little Christmas shopping with my friends, the Tauberts, at Lou Taubert Ranch Outfitters in Casper on the drive back.  Snowy roads or no, Wyoming is the best.",96,94,0,2,0,0,0,0,2891517260859446,LummisforWyoming,/story.php?story_fbid=2891517260859446&id=369214063089791
Lummis for Wyoming,,2019-12-12 15:50:57,"Thrilled to have earned the endorsement of the grassroots focused, liberty-minded folks at FreedomWorks. Conservative values are Wyoming values and I look forward to fighting each and every day to uphold these in the United States Senate! You can find the FreedomWorks for America release here: https://freedomworksforamerica.org/press-releases/freedomworks-for-america-endorses-cynthia-lummis-in-wyoming-senate-race/ #LummisforWyoming",50,48,0,2,0,0,0,0,2889358311075341,LummisforWyoming,/story.php?story_fbid=2889358311075341&id=369214063089791
Lummis for Wyoming,,2019-12-11 15:05:24,"""I’m going to talk about what’s on the minds of Wyoming people. That’s the job of their representative. And that’s the job I’m applying for...” Proud to stand with and for Wyoming, always.",179,159,0,19,0,1,0,0,2887003084644197,LummisforWyoming,/story.php?story_fbid=2887003084644197&id=369214063089791
Lummis for Wyoming,,2019-12-10 21:36:18,"Incredible night to be in Cheyenne celebrating the 150th anniversary of women’s suffrage in Wyoming. I am so proud to be a daughter of the state that was the first in the nation to grant women the right to vote.  Diana Enzi is such a force and I can’t say enough about the Herculean effort she put forth to highlight this momentous occasion in Wyoming and across the country.  It was such a treat to see Bill Dubois, Cheyenne historian and great great grandson of Esther Hobart Morris, too.  Congratulations Geoff O’Gara on ‘State of Equality’ an achievement worthy of the occasion.  Feeling blessed to be a citizen of the Equality State. A place worth fighting for.",171,162,0,9,0,0,0,0,2885377241473448,LummisforWyoming,/story.php?story_fbid=2885377241473448&id=369214063089791
Lummis for Wyoming,,2019-12-09 15:29:15,Extremely troubling FISA report out today on FBI's Crossfire Hurricane investigation.  Don't buy the liberal spin. Read it for yourself here: https://www.justice.gov/storage/120919-examination.pdf,113,103,0,2,0,0,8,0,2882545065089999,LummisforWyoming,/story.php?story_fbid=2882545065089999&id=369214063089791
Lummis for Wyoming,,2019-12-08 20:07:48,"Did you see the incredible jobs report released Friday? The lowest unemployment rate in America in 50 years.  In Wyoming, the unemployment rate sits at 3.8 percent (through October). “People don't want to say good things... You can't contradict that these are the best numbers of our lives.""  - Mad Money’s Jim Cramer",221,198,0,19,4,0,0,0,2880675421943630,LummisforWyoming,/story.php?story_fbid=2880675421943630&id=369214063089791
Lummis for Wyoming,,2019-12-07 18:42:25,"“A date which will live in infamy."" #PearlHarbor78",87,78,0,2,0,7,0,0,2878220878855751,LummisforWyoming,/story.php?story_fbid=2878220878855751&id=369214063089791
