source,shared_from,date,text,reactions,likes,ahah,love,wow,sigh,grrr,comments,post_id,page_id,url
Lummis for Wyoming,,2020-03-19 18:17:01,"As we practice social distancing to help ""flatten the curve,"" I still want to connect with you! If you have a question, please ask it at the link below, and I'll answer them in a video on this page.",414,383,0,31,0,0,0,0,3110256538985516,LummisforWyoming,/story.php?story_fbid=3110256538985516&id=369214063089791
Lummis for Wyoming,,2020-03-19 10:57:35,"""This epidemic will subside. But we will not forget Beijing’s irresponsibility, nor its cowardice and dishonesty in the early days of the outbreak...  ...The Beijing regime has long been a boot on the neck of the Chinese people, but it is now a menace to the world at large. There are many things that we hope will change in the wake of this crisis. The character of the government in Beijing should be one of them.""",84,72,0,3,0,1,8,0,3109449512399552,LummisforWyoming,/story.php?story_fbid=3109449512399552&id=369214063089791
Lummis for Wyoming,,2020-03-18 16:29:09,"""... there is no substitute for the action of the American people. If all of us can take these important steps requested by the president over the next two weeks, then we can be confident that we will get through this, and we will see a better, healthier future for America."" - Vice President Mike Pence",28,26,0,2,0,0,0,0,3107773635900473,LummisforWyoming,/story.php?story_fbid=3107773635900473&id=369214063089791
Lummis for Wyoming,,2020-03-17 21:11:04,"Don’t let quarantine/social distancing get you down.  Thanks be 🙏 for these wide open Wyoming skies and the ability to get outside while being responsible to the health of our friends and neighbors.  Be well, Wyoming.",47,40,0,7,0,0,0,0,3105802282764275,LummisforWyoming,/story.php?story_fbid=3105802282764275&id=369214063089791
Lummis for Wyoming,,2020-03-16 21:19:23,"I’m attending the precinct caucuses tonight in lower Star Valley (Etna) tonight.  As you can see, attendees are honoring ‘social distancing’.  Some precinct people are participating by computer and have on-line access to caucus materials.  Lincoln County is also considering having its first virtual county convention on March 28.  Right now it’s scheduled for the Afton Community Center. On-line participation tonight is working really well. Marti Halverson, Wyoming’s Republican National Committewoman, is running the Caucus in the absence of the County Chairman.",40,35,0,1,4,0,0,0,3103337303010773,LummisforWyoming,/story.php?story_fbid=3103337303010773&id=369214063089791
Lummis for Wyoming,,2020-03-14 21:58:16,"Our man in Rome... A worthwhile read from Newt Gingrich on the coronavirus and his view on the proper next steps to combat the virus. Hint: More aggressive and decisive preparations.  “We should be planning for a worst-case pandemic and using the kind of intensity of implementation which served us so well in World War II. Getting enough ventilators, masks, intensive care units, treatment medications and aggressive community-wide testing are the minimum steps to saving lives and stopping the pandemic.”",36,35,0,0,1,0,0,0,3098073456870491,LummisforWyoming,/story.php?story_fbid=3098073456870491&id=369214063089791
Lummis for Wyoming,,2020-03-13 21:48:05,"It’s in uncertain times like these that we see the very best in Wyoming people - thanks for being such great neighbors.  Here are three Ps to keep in mind as we all come together: ✔️ Prepare to work from, and stay close to, home 🏠. (And please stay home if you feel under the weather, call a doctor if your symptoms are consistent with the coronavirus.) ✔️ Practice good hygiene 🧼 (Pro-tip: Bag balm at the feed store is great for hands cracked from frequent and extended washing.) ✔️ Protect the most vulnerable members of Wyoming communities from the virus by keeping a distance of 6 feet 📏, when possible. (Maintaining a bigger than normal personal bubble is just fine.)",56,51,0,5,0,0,0,0,3095454120465758,LummisforWyoming,/story.php?story_fbid=3095454120465758&id=369214063089791
"Lummis for Wyoming,Wyoming 4-H",,2020-03-13 13:20:31,"Classy statement by Wyoming 4-H. Proud to have been a 4-Her and a 4-H mom (and very much looking forward to being a 4-H grandma).  Remember, fellow former 4-Hers:  I pledge my head to clearer thinking, My heart to greater loyalty, My hands to larger service, and my health to better living, for my club, my community, my country, and my world.Dear 4-H Family, From now through the end of month (March 31st), all face-to-face 4-H activities are postponed or must use technology methods (Zoom, Google Hangouts, etc.).  This includes all project, club, committee, council, foundation meetings, etc. This short hiatus will allow our local medical professionals to better manage and address the effects of this particular virus.  Our decisions are not motivated by politics, money, the media, fear, or anything else other than being a good citizen and contributing to the greater effort of the health and well-being of our family, friends, loved-ones, neighbors, and communities. Truly we get to apply the 4-H pledge in our daily lives.",37,37,0,0,0,0,0,0,3095048613839642,LummisforWyoming,/story.php?story_fbid=3095048613839642&id=369214063089791
Lummis for Wyoming,,2020-03-12 22:23:45,"This is an important story for several refineries operating in Wyoming. If it stands, the Tenth Circuit's ruling would hit five small Wyoming refineries hard.  And (shocker) the issue has received very little coverage. I stand with Senator John Barrasso, Senator Mike Enzi and the many men and women whose careers hang in the balance of the appeal to the Tenth Circuit’s decision.",54,40,0,0,2,12,0,0,3093206154023888,LummisforWyoming,/story.php?story_fbid=3093206154023888&id=369214063089791
Lummis for Wyoming,,2020-03-11 17:28:49,Highly recommend this piece.  The President has been consistent on this point and the spread of the coronavirus (unnerving and unpredictable as it is) shows that President Donald J. Trump is right on target in his approach to China and other authoritarian regimes.,135,121,0,13,0,1,0,0,3090493170961853,LummisforWyoming,/story.php?story_fbid=3090493170961853&id=369214063089791
Lummis for Wyoming,,2020-03-10 14:10:30,"The mainstream media has unfairly maligned my friend, Vice President Mike Pence. He is absolutely the right person to manage the response to this virus. As a Congressman, Governor, and VPOTUS he has always made clear that he walks in faith. Praying for guidance, wisdom and the wellbeing of our nation should be respected, not repudiated. With his humility, a head for policy and a steady hand, I am greatly comforted to know that President Donald J. Trump has placed Mike at the helm of the coronavirus taskforce.",171,155,2,14,0,0,0,0,3087812554563248,LummisforWyoming,/story.php?story_fbid=3087812554563248&id=369214063089791
Lummis for Wyoming,,2020-03-09 16:21:33,"The Democrats modus operandi, ""It applies to thee but not to me."" It is so sad to see children stuck in bad learning environments and missing out on opportunities for the best access to an education suited to the student and the family because of politics. Put families first, support school choice.",40,39,0,1,0,0,0,0,3085679114776592,LummisforWyoming,/story.php?story_fbid=3085679114776592&id=369214063089791
Lummis for Wyoming,,2020-03-08 16:06:00,"Wyoming has lots to brag about on International Women’s Day. We are the first state to grant women the right to vote, a full 50 years before the 19th Amendment.  And Wyoming women were pioneers in law, business and politics (including): ✔️First woman Governor ✔️First woman Justice of the Peace ✔️First woman Bailiff  I am thinking of one of my mentors today, Ellen Crowley, an undersung hero of the Equality State. Ellen was State Librarian from 1949-1951 and an Assistant Wyoming Attorney General from 1955-1959. She was small in stature but made her presence known with super high heels and an unmistakable wit.  Ellen was the first woman lawyer in the Wyoming AG’s office and the first female law clerk in the U.S. District Courts in Wyoming. She served in the Wyoming House of Representatives from 1973-1987 and as President of the Laramie County Bar Association from 1974-1975.  Would love to hear about your female Wyoming heroes if you’d like to share in the comments.",61,55,0,6,0,0,0,0,3083455108332326,LummisforWyoming,/story.php?story_fbid=3083455108332326&id=369214063089791
Lummis for Wyoming,,2020-03-07 22:23:19,Great turnout tonight at the Cheyenne Frontier Days™ Old West Museum Art Show. Always look forward to these chances to celebrate our rich western heritage. Proud to be associated with The Daddy of ‘Em All since I was Miss Frontier in 1976!,70,69,0,1,0,0,0,0,3081872105157293,LummisforWyoming,/story.php?story_fbid=3081872105157293&id=369214063089791
Lummis for Wyoming,,2020-03-07 00:17:11,Special thanks to the University of Wyoming College Republicans for coming over the hill to join us at the Laramie County Republican Party Lincoln Day dinner.  The future of Wyoming is in great hands.,95,87,0,7,1,0,0,0,3079853712025799,LummisforWyoming,/story.php?story_fbid=3079853712025799&id=369214063089791
Lummis for Wyoming,,2020-03-05 19:43:14,"“Campuses in Wyoming are really the first bastion to fighting socialism. “To protect First Amendment rights, Second Amendment rights — in fact all of our rights under the Constitution — the students who are constitutional adherents are really the frontline in preserving constitutional government. Since that is a really big focus of our campaign, we really want to have frequent and active involvement of students at UW and other community colleges around the state.”",83,77,0,4,0,0,2,0,3077155638962273,LummisforWyoming,/story.php?story_fbid=3077155638962273&id=369214063089791
Lummis for Wyoming,,2020-03-04 17:57:01,"Thank you for a great day, Wheatland (and special thanks to the Brown's for a fabulous lunch). So many old friends, and new ones too.  Platte County is full of little gems, great businesses, and hardworking people. A treat to be with you. PS - Shout out to the Wheatland City crew who were trying to get the ghosties out of the trees on the windiest day of the year.",126,120,0,6,0,0,0,0,3074838539193983,LummisforWyoming,/story.php?story_fbid=3074838539193983&id=369214063089791
Lummis for Wyoming,,2020-03-03 14:08:12,"It's Super Tuesday and it seems that many young people -- even in Wyoming -- are ""feeling the Bern"". It's incumbent on us to take the rise of socialism seriously and communicate its horrible history to the young people in our lives. ""...over two centuries, socialism has been tried in every corner of the earth and in every variety that people could dream up, and it has never worked. Young people can argue that they weren’t taught this history, but what is Bernie’s excuse? Blinded by ideology, he finds things to laud in the most vicious socialist dictatorships – whether it is Fidel Castro’s literacy programs or the Soviet Union’s subway system. """,234,135,14,1,4,25,55,0,3072350229442814,LummisforWyoming,/story.php?story_fbid=3072350229442814&id=369214063089791
Lummis for Wyoming,,2020-03-01 16:10:08,"Happy Birthday to the world’s first national park, Yellowstone National Park, founded on March 1, 1872.   “When President Ulysses S. Grant signed the Yellowstone National Park Protection Act into law, it protected more than 2 million acres of mountain wilderness, amazing geysers and vibrant landscapes for future generations to enjoy.”",118,94,0,24,0,0,0,0,3068185213192649,LummisforWyoming,/story.php?story_fbid=3068185213192649&id=369214063089791
Lummis for Wyoming,,2020-02-29 22:59:29,“Democratic socialism” is a fraud. A convenient phrase used by radical liberals to dupe people into foregoing freedom for the promise of government benevolence.,203,180,2,15,2,2,2,0,3066476436696860,LummisforWyoming,/story.php?story_fbid=3066476436696860&id=369214063089791
"Lummis for Wyoming,Cheyenne Historic Preservation",,2020-02-26 21:31:57,"So fun to see this image pop up. This was my great grandfather's business in Cheyenne.  To this day, I love to peruse local hardware stores seeking little treasurers and smelling the faint aroma of sawdust. On the campaign trail, coffee shops and hardware stores are likely places to find me when I need to recharge. 🔋   #shoplocal #ThrowbackThursdayMemories?",127,114,0,13,0,0,0,0,3061180030559834,LummisforWyoming,/story.php?story_fbid=3061180030559834&id=369214063089791
Lummis for Wyoming,,2020-02-27 09:59:22,"Grateful President Donald J. Trump is using the force of the Oval Office to stand for public safety and take dollars away from sanctuary cities, whose policies create havens for criminals, gangs, and drug cartels.  The law should be on the side of the American people.",347,302,0,44,1,0,0,0,3060674090610428,LummisforWyoming,/story.php?story_fbid=3060674090610428&id=369214063089791
Lummis for Wyoming,,2020-02-26 16:20:08,"If you are old enough to put your life on the line in defense of our country, you are old enough to buy a handgun. #2A",466,411,0,54,1,0,0,0,3059125937431910,LummisforWyoming,/story.php?story_fbid=3059125937431910&id=369214063089791
Lummis for Wyoming,,2020-02-25 17:36:23,"PSA: World War II Marine Cpl. Remigio “Ray” Barela, who died at 101, will be buried at the Oregon Trail Veterans Cemetery in Casper at 10 a.m. THIS Friday.  Cpl. Barela has no known living relatives. If you are available, please consider attending the burial to honor this brave Marine which, thanks to the Wyoming Patriot Guard, will likely include full military honors. 🇺🇸",181,126,0,6,0,49,0,0,3057136267630877,LummisforWyoming,/story.php?story_fbid=3057136267630877&id=369214063089791
Lummis for Wyoming,,2020-02-24 16:33:17,I was asked last week in Casper what Day 1 priorities would look like for me if elected to serve Wyoming in the US Senate. For me it's All Wyoming. All the Time: ✔️ Set up offices geared to support Wyoming people ✔️ Get on committees with the greatest policy impact for Wyoming ✔️ Support President Donald J. Trump in his second term because his agenda supports hard working Wyoming people,171,164,0,7,0,0,0,0,3054928091185028,LummisforWyoming,/story.php?story_fbid=3054928091185028&id=369214063089791
Lummis for Wyoming,,2020-02-22 22:01:42,"Started the day with fascinating meetings and valuable conversations in Douglas.  Capped the night at the Natrona County Republican Party’s Lincoln Day dinner.  As a socialist wins the Democratic nomination for President in Nevada 🤦🏼‍♀️ I’m grateful to be with pro-Trump, freedom-loving, Constitution-minded Republicans in Wyoming. 🇺🇸",142,128,1,13,0,0,0,0,3051035211574316,LummisforWyoming,/story.php?story_fbid=3051035211574316&id=369214063089791
Lummis for Wyoming,,2020-02-22 02:31:32,Great night at the Wyoming Republican Party’s Salute to Women’s Suffrage. Karen Budd-Falen delivered a fantastic keynote. Grateful to be with fellow Republicans.,163,154,0,9,0,0,0,0,3049191388425365,LummisforWyoming,/story.php?story_fbid=3049191388425365&id=369214063089791
Lummis for Wyoming,,2020-02-20 01:32:43,"All the Dems on the debate stage tonight should take a beat and listen to Baxter Black.  They might regain some patriotism, a sense of humor, and much needed thankfulness for our great country 🇺🇸.  Thank goodness President Trump understands and is putting #AmericaFirst.",240,193,0,47,0,0,0,0,3044718765539294,LummisforWyoming,/story.php?story_fbid=3044718765539294&id=369214063089791
Lummis for Wyoming,,2020-02-18 11:04:22,Grateful. 🙏  Honored. 🇺🇸 Ready to get to work. 💪,434,393,0,38,3,0,0,0,3041194712558366,LummisforWyoming,/story.php?story_fbid=3041194712558366&id=369214063089791
Lummis for Wyoming,,2020-02-16 14:11:11,Great time celebrating the Laramie County Community College rodeo team last night.  Multitalented student athletes. Beautiful event. Wyoming’s collegiate rodeo teams are great ambassadors for our way of life.,119,114,0,5,0,0,0,0,3037152519629252,LummisforWyoming,/story.php?story_fbid=3037152519629252&id=369214063089791
Lummis for Wyoming,,2020-02-15 15:49:40,Sanctuary cities become sanctuary states when illegal immigrants are granted drivers' licenses.  It's absurd that someone who came to this country illegally would be granted the most commonly accepted form of identification for myriad benefits as well as the privilege to travel without raising any red flags. This bill - sponsored by my friend Marsha Blackburn - would end funding to states that grant drivers licenses to illegal immigrants from a program that issues federal criminal justice funding from the Department of Justice.,304,262,0,39,0,0,3,0,3035090133168824,LummisforWyoming,/story.php?story_fbid=3035090133168824&id=369214063089791
Lummis for Wyoming,,2020-02-14 20:07:32,"Happy Valentines Day! Wyoming, I love ya.  The freedoms, friends, family and fabulous landscapes that we enjoy make this unique and spectacular place home.",123,111,0,11,0,1,0,0,3033285363349301,LummisforWyoming,/story.php?story_fbid=3033285363349301&id=369214063089791
Lummis for Wyoming,,2020-02-13 16:55:48,"Thanks Alex Salvi and One America News Network for the great visit about our need to address federal spending run amuck, the restoration of the 10th Amendment and the work of Donald J. Trump’s administration to combat dangerous sanctuary city policies.",76,70,0,6,0,0,0,0,3030685723609265,LummisforWyoming,/story.php?story_fbid=3030685723609265&id=369214063089791
Lummis for Wyoming,,2020-02-12 10:43:34,"Life in America is getting better and better. The majority of Americans say they are better off under President Donald J. Trump.   52% of U.S. adults say it is easier for them to ""go and buy things in the stores"" than it was three years ago.",156,136,1,18,0,0,1,0,3027812337229937,LummisforWyoming,/story.php?story_fbid=3027812337229937&id=369214063089791
Lummis for Wyoming,,2020-02-11 17:39:09,"It is crazy that Democrats are considering bringing back earmarks... But they are. Banning earmarks was a victory for good government, a victory that we must fight to keep in place.",80,64,1,2,1,3,9,0,3026271014050736,LummisforWyoming,/story.php?story_fbid=3026271014050736&id=369214063089791
Lummis for Wyoming,,2020-02-10 15:19:23,"Typical winter in Wyoming. Got the truck stuck in a drift 🤦🏼‍♀️ 20 miles down a dirt road.  God bless Wyoming, a place where you can still count on the goodness of neighbors...  With great big tractors.",212,187,1,21,3,0,0,0,3023904240954080,LummisforWyoming,/story.php?story_fbid=3023904240954080&id=369214063089791
Lummis for Wyoming,,2020-02-09 20:21:00,Sending prayers to the families of these two brave American soldiers.  All give some and some give all. Our nation is in their debt. 🇺🇸,375,125,2,16,0,231,1,0,3022158817795289,LummisforWyoming,/story.php?story_fbid=3022158817795289&id=369214063089791
Lummis for Wyoming,,2020-02-07 12:19:55,"Republican leadership in the Senate and the presidency of Donald J. Trump are like PB&J. A winning combo for the American economy.  Good news, all part of a great American comeback.",124,113,0,10,0,0,1,0,3016992798311891,LummisforWyoming,/story.php?story_fbid=3016992798311891&id=369214063089791
Lummis for Wyoming,,2020-02-06 00:16:55,Acquitted FOREVER! The Dems need to give it up...,190,160,1,29,0,0,0,0,3013728215305016,LummisforWyoming,/story.php?story_fbid=3013728215305016&id=369214063089791
Lummis for Wyoming,,2020-02-05 00:04:24,"I’m wowed. Truly a historic SOTU address 🇺🇸: “We are Americans. We are the pioneers. We are the pathfinders. We settled the new world, we built the modern world, and we changed history forever by embracing the eternal truth that everyone is made equal by the hand of Almighty God.”",527,331,5,81,11,8,91,0,3011582475519590,LummisforWyoming,/story.php?story_fbid=3011582475519590&id=369214063089791
Lummis for Wyoming,,2020-02-03 22:40:21,Sending extra prayers to Rush Limbaugh tonight.  I have the fondest memories of walking into my dad’s house and listening to Rush together. Wishing a speedy recovery to a happy conservative warrior who fights the fight for hard working Americans.,202,153,0,15,1,33,0,0,3009328555744982,LummisforWyoming,/story.php?story_fbid=3009328555744982&id=369214063089791
Lummis for Wyoming,,2020-02-01 18:20:04,Pleased to read this.  A devastating issue for Wyoming and the country as a whole. The past few weeks have brought tragic news about the fate of Wyoming and Montana girls.  This Task Force’s work is of critical importance.,217,181,0,32,2,2,0,0,3004755319535639,LummisforWyoming,/story.php?story_fbid=3004755319535639&id=369214063089791
Lummis for Wyoming,,2020-01-30 23:17:14,Great discussion on Medicaid Expansion today in Cheyenne with Wyoming Liberty Group.  Obamacare has failed Wyoming people and it is long past time to go back to the drawing board with solutions to address access and affordability.,64,61,1,2,0,0,0,0,3000787189932452,LummisforWyoming,/story.php?story_fbid=3000787189932452&id=369214063089791
Lummis for Wyoming,,2020-01-29 22:40:50,"Today, on Data Privacy Day, I'm reading up on an important bill from my friend, Bill Cassidy.  Americans' health info is deeply personal. Nowadays one-in-six Americans wears a smart watch of some kind 🙋🏼‍♀️. Companies shouldn't be selling private health data stored on personal wearable devices.",38,38,0,0,0,0,0,0,2998619870149184,LummisforWyoming,/story.php?story_fbid=2998619870149184&id=369214063089791
Lummis for Wyoming,,2020-01-28 16:01:38,"Grateful for the kind words of support from my good friend, the former chair of the House Freedom Caucus, fierce defender of our President and tireless advocate of liberty for all, the gentleman from North Carolina, Mark Meadows.",79,71,0,8,0,0,0,0,2995647633779741,LummisforWyoming,/story.php?story_fbid=2995647633779741&id=369214063089791
Lummis for Wyoming,,2020-01-27 16:45:30,"Today, on the 75th anniversary of the liberation of Auschwitz, our hearts break as #WeRemember the atrocities of the Holocaust. ""To forget the victims means to kill them a second time. So I couldn't prevent the first death. I surely must be capable of saving them from a second death."" - Elie Wiesel #HolocaustMemorialDay",123,78,0,3,1,41,0,0,2993646500646521,LummisforWyoming,/story.php?story_fbid=2993646500646521&id=369214063089791
Lummis for Wyoming,,2020-01-26 21:21:29,"If you want to understand the Dem’s impeachment chicanery and the trial in the Senate, Senator Ted Cruz’s podcast ‘Verdict’ is the best, most honest resource available to the public.  Highly recommend.",36,33,1,1,0,0,1,0,2991976960813475,LummisforWyoming,/story.php?story_fbid=2991976960813475&id=369214063089791
Lummis for Wyoming,,2020-01-25 20:04:02,"Great day at the National Western Stock Show      Thanks to Nate and Sunshine Schultz of Prairie Wind Yaks in Casper for the awesome convo. And thanks to the Messengers and Rocky, the 8 year old Percheron, from Laramie County for taking a photo today ahead of competition in the  ‘Ladies Cart Class’.",121,114,0,6,0,1,0,0,2989618757715962,LummisforWyoming,/story.php?story_fbid=2989618757715962&id=369214063089791
Lummis for Wyoming,,2020-01-23 22:04:56,,264,247,1,15,0,1,0,0,2985603341450837,LummisforWyoming,/story.php?story_fbid=2985603341450837&id=369214063089791
Lummis for Wyoming,,2020-01-22 23:36:46,"Radical Democrats in the Senate seem intent on embarrassing themselves and making a mockery of the Senate trial. (I feel like we’ve seen this before...) These offensive and illegitimate political theatrics are being put to a stop by a sober and rational, Republican Senate. It’s about time.",185,161,4,6,1,5,8,0,2983669761644195,LummisforWyoming,/story.php?story_fbid=2983669761644195&id=369214063089791
Lummis for Wyoming,,2020-01-20 21:58:39,"“Cynthia Lummis is a principled, pro-growth conservative who is a staunch advocate for limited government, liberty, and economic freedom. She is a proven fighter against the Washington Establishment, and Club for Growth Action will spend millions to support her candidacy to become the next Senator from Wyoming.”  - David McIntosh, President of the Club for Growth Find the full endorsement from the fiscal conservative policy leaders at Club for Growth here: https://www.clubforgrowth.org/club-for-growth-pac-endorses-cynthia-lummis-for-wyoming-senate/",54,50,0,4,0,0,0,0,2979203342090837,LummisforWyoming,/story.php?story_fbid=2979203342090837&id=369214063089791
Lummis for Wyoming,,2020-01-19 21:25:47,"I grew up on a ranch in Laramie County and seeing so many of the hard-working, tough, honest ag folks in our area come into town for the showing of the ‘Cowboys’ documentary was something special.  Wyoming is wonderfully unique because of our western heritage, tight-knit communities and deep connection to the land we steward.  Staying rooted close to the land and to those who provide the food and fiber we need to raise healthy kids, and grandkids, is a priority. God bless Wyoming’s cowboys and cowgirls.",298,275,0,23,0,0,0,0,2977155668962271,LummisforWyoming,/story.php?story_fbid=2977155668962271&id=369214063089791
