source,shared_from,date,text,reactions,likes,ahah,love,wow,sigh,grrr,comments,post_id,page_id,url
Paula Jean Swearengin,,2020-03-02 20:37:53,A dose of cuteness & why I fight! Benji says... #SwearInGrandmaSwearengin,83,51,0,32,0,0,0,4,1494361117408553,PaulaJean2020,/story.php?story_fbid=1494361117408553&id=785936231584382
Paula Jean Swearengin,,2020-03-02 15:27:22,"I am sick of the typical playbook argument from the establishment, ""He/she can't win."" The candidates that we get behind win!",142,126,0,16,0,0,0,7,1494197577424907,PaulaJean2020,/story.php?story_fbid=1494197577424907&id=785936231584382
Paula Jean Swearengin,,2020-02-29 20:50:13,"We started this day in a real fundraising jam, and I am just amazed at how many of you have stepped up to help us get to our goal. Hitting these numbers gives us the resources to reach the people of West Virginia, and now we are only around $3,600 from our goal! We can do this if we all pull together! I don't have the words to express how thankful I am for you all! It's truly a team! http://bit.ly/PJS_FB #UniteOurFight #NotMeUs #TeamPaulaJean",92,75,0,17,0,0,0,3,1492776247567040,PaulaJean2020,/story.php?story_fbid=1492776247567040&id=785936231584382
Paula Jean Swearengin,,2020-02-29 13:35:23,Join our 100% people-funded movement to flip this seat and give power back to the people of West Virginia and the entire country. To learn more about Paula Jean visit: https://paulajean.com,157,119,0,38,0,0,0,8,1492533530924645,PaulaJean2020,/story.php?story_fbid=1492533530924645&id=785936231584382
Paula Jean Swearengin,,2020-02-28 13:47:20,"We need all hands on deck if we're going to flip this Senate seat in November! #TeamPaulaJean is fighting for everyday people and right now we're short this month. Can you help us catch up with $1, $3 or even $5 before midnight Saturday? Thank you! http://bit.ly/PJS_Feb #UniteOurFight #WestVirgina",102,86,0,16,0,0,0,3,1491710081006990,PaulaJean2020,/story.php?story_fbid=1491710081006990&id=785936231584382
Paula Jean Swearengin,,2020-02-28 10:02:46,"Hello, Kentucky friends! This candidate is the real deal! Please spread the word! #DitchMitch2020 #PeopleFunded",19,14,0,5,0,0,0,0,1491562607688404,PaulaJean2020,/story.php?story_fbid=1491562607688404&id=785936231584382
"Paula Jean Swearengin,90 for 90",90 for 90,2020-02-27 18:39:06,"Thank you 90 for 90 for your support!!Welcome Paula Jean Swearengin, Candidate U.S. Senate West Virginia, to 90 for 90. https://www.90for90.org/2020-candidates-west-virginia",168,128,0,40,0,0,0,6,1491090457735619,PaulaJean2020,/story.php?story_fbid=1491090457735619&id=785936231584382
Paula Jean Swearengin,,2020-02-26 21:49:06,"As a woman, I know what it’s like to be paid less to do the same work as a man. Sen. Capito claims to be a champion of women but has a LONG history of voting against #EqualPayForEqualWork.  She was the first woman elected to the U.S. Senate for West Virginia but she’ll be the LAST woman elected who ignores our needs!!! #PaulaJean2020",91,73,0,17,1,0,0,7,1490298067814858,PaulaJean2020,/story.php?story_fbid=1490298067814858&id=785936231584382
Paula Jean Swearengin,,2020-02-26 18:29:55,The hardest thing for me as a candidate is having to be away from my family so much! I was so happy to see this precious baby today!  #ProudGrandma,88,65,0,23,0,0,0,1,1490190397825625,PaulaJean2020,/story.php?story_fbid=1490190397825625&id=785936231584382
Paula Jean Swearengin,,2020-02-25 22:55:37,"Maybe Pete Buttigieg doesn’t get it. There is a clear difference between having healthcare and having health insurance. When people who are insured still can’t afford to seek medical attention, we have a national healthcare crisis! #TeamPaulaJean will fight for Medicare for All!  http://bit.ly/PJS2020_MFA #PaulaJean2020 #HealthcareIsAHumanRight #DemDebate #MedicareforAll #UniteOurFight",172,123,0,49,0,0,0,8,1489529384558393,PaulaJean2020,/story.php?story_fbid=1489529384558393&id=785936231584382
Paula Jean Swearengin,,2020-02-25 19:59:34,"Beckley, WV area folks....#TeamPaulaJean is needing a reasonable rate for lodging for 5 people for dates, March 7 -March 9. Any suggestions?",5,4,0,1,0,0,0,3,1489438654567466,PaulaJean2020,/story.php?story_fbid=1489438654567466&id=785936231584382
Paula Jean Swearengin,,2020-02-23 23:12:01,Shout out to my family & the closest people around me that make sure that I at least take breaks to eat. It really takes more than a village! Much love! 💜💜🔥✊ #TeamPaulaJean #PaulaJean2020,55,46,0,9,0,0,0,2,1487885464722785,PaulaJean2020,/story.php?story_fbid=1487885464722785&id=785936231584382
Paula Jean Swearengin,,2020-02-23 22:46:58,We can do this #WestVirgina!,108,96,0,12,0,0,0,3,1487872914724040,PaulaJean2020,/story.php?story_fbid=1487872914724040&id=785936231584382
Paula Jean Swearengin,,2020-02-23 21:02:57,Real change doesn't happen through self promotion! In order to survive we have to elect real people servants from a local level to a federal level. Legislation is not passed with one single person!  #Government101 #WVCantWait #BrandNewCongress #NotMeUs,42,39,0,3,0,0,0,0,1487819754729356,PaulaJean2020,/story.php?story_fbid=1487819754729356&id=785936231584382
"Paula Jean Swearengin,Zoa Postlethwait",Zoa Postlethwait,2020-02-23 14:36:20,"Paden City, WV update.",10,10,0,0,0,0,0,0,1487626348082030,PaulaJean2020,/story.php?story_fbid=1487626348082030&id=785936231584382
Paula Jean Swearengin,,2020-02-22 12:34:27,Team Paula Jean is honored to have received the endorsement of Blue America!,134,111,0,23,0,0,0,5,1486739924837339,PaulaJean2020,/story.php?story_fbid=1486739924837339&id=785936231584382
Paula Jean Swearengin,,2020-02-21 21:45:12,"Paden City, WV needs safe, clean drinking water now!",36,24,0,0,3,7,2,0,1486227728221892,PaulaJean2020,/story.php?story_fbid=1486227728221892&id=785936231584382
Paula Jean Swearengin,,2020-02-21 18:45:37,"Padan City, WV update.",61,49,0,12,0,0,0,4,2589623271363055,PaulaJean2020,/story.php?story_fbid=2589623271363055&id=785936231584382
Paula Jean Swearengin,,2020-02-21 11:15:10,,60,44,0,16,0,0,0,8,1375133182681648,PaulaJean2020,/story.php?story_fbid=1375133182681648&id=785936231584382
Paula Jean Swearengin,,2020-02-21 09:55:26,"Help us put pressure on West Virginia Governor Jim Justice to declare a state of emergency in Paden City! Here’s the Story: Town officials received a letter from authorities in March of 2019 informing them that PCE levels had reached 5.5. That level is just above what the EPA states as dangerous for humans. And, PCE levels have spiked much higher through the years, recorded as high as 49.6 in 2013! Paden City officials have known about elevated PCE levels since at least 1999, possibly longer. Why the secrecy? Why aren’t they doing weekly tests? We need EVERYONE who cares about access to clean water to step up and act — will you send a message now? http://bit.ly/PJS2020PadenCityPetition #WestVirginia #UniteOurFight #HumanRights",87,56,0,2,3,10,16,6,1485782564933075,PaulaJean2020,/story.php?story_fbid=1485782564933075&id=785936231584382
Paula Jean Swearengin,,2020-02-20 16:20:11,#TeamPaulaJean  is back on the road.,118,92,0,26,0,0,0,8,2698498630197602,PaulaJean2020,/story.php?story_fbid=2698498630197602&id=785936231584382
Paula Jean Swearengin,,2020-02-20 13:45:47,"#TeamPaulaJean is down in Paden City, WV talking to folks about what is going on in their town & the need for clean water. Please sign this petition & let Governor Jim Justice know that clean water is a human right!   https://bit.ly/2SIYGUF",119,98,0,16,0,4,1,8,1485016565009675,PaulaJean2020,/story.php?story_fbid=1485016565009675&id=785936231584382
Paula Jean Swearengin,,2020-02-19 21:18:50,"Help us put pressure on West Virginia Governor Jim Justice to declare a state of emergency in Paden City! Here’s the Story: Town officials received a letter from authorities in March of 2019 informing them that PCE levels had reached 5.5. That level is just above what the EPA states as dangerous for humans. And, PCE levels have spiked much higher through the years, recorded as high as 49.6 in 2013! Paden City officials have known about elevated PCE levels since at least 1999, possibly longer. Why the secrecy? Why aren’t they doing weekly tests? We need EVERYONE who cares about access to clean water to step up and act — will you send a message now? http://bit.ly/PJS2020PadenCityPetition #WestVirginia #UniteOurFight #HumanRights",76,55,0,0,3,16,2,6,1484419041736094,PaulaJean2020,/story.php?story_fbid=1484419041736094&id=785936231584382
Paula Jean Swearengin,,2020-02-18 14:23:16,,41,32,0,9,0,0,0,1,1483353225176009,PaulaJean2020,/story.php?story_fbid=1483353225176009&id=785936231584382
Paula Jean Swearengin,,2020-02-18 11:58:40,Thank you Inside the News Room for a great interview!  https://insidethenewsroom.substack.com/p/64-paula-jean-swearengin-us-senate,121,94,0,27,0,0,0,3,1483269388517726,PaulaJean2020,/story.php?story_fbid=1483269388517726&id=785936231584382
"Paula Jean Swearengin,Appalachians Rising",Appalachians Rising,2020-02-17 17:11:13,"Thank you so much! I am humbled!We are excited to endorse Paula J Swearengin for the West Virginia U.S. Senate! 🌹Single mom, grandma, and coal miner's daughter 💦Protects mountains and water  🌍Supports Bernie, Medicare for All & the New Green Deal  💰Won't take corporate donations",214,174,0,40,0,0,0,3,1482718801906118,PaulaJean2020,/story.php?story_fbid=1482718801906118&id=785936231584382
Paula Jean Swearengin,,2020-02-17 12:22:40,,451,358,0,93,0,0,0,14,1482475611930437,PaulaJean2020,/PaulaJean2020/photos/a.785936268251045/1482475611930437
Paula Jean Swearengin,,2020-02-16 13:25:25,"#TeamPaulaJean has been organizing in Logan, WV the past few days with some amazing people. We're so excited about the next few months. With your support we'll take this people-powered movement all the way to the Senate floor! Can you chip in $5 and help us stay on track this month? http://bit.ly/PJS_mm #UniteOurFight #NotMeUs #PaulaJean2020",136,102,0,34,0,0,0,5,1481737588670906,PaulaJean2020,/story.php?story_fbid=1481737588670906&id=785936231584382
Paula Jean Swearengin,,2020-02-15 19:11:04,"#TeamPaulaJean has been in Logan, WV organizing the past few days with some amazing people. We're really excited about how things are progressing & the people that have joined our team! We really appreciate the warm welcome!  #UniteOurFight #PaulaJean2020 #NotMeUs",52,45,0,7,0,0,0,1,1481108538733811,PaulaJean2020,/story.php?story_fbid=1481108538733811&id=785936231584382
Paula Jean Swearengin,,2020-02-14 20:04:18,We all are tired of flip-flopping politicans that are not concerned about anything but self promotion & enhancing their careers. It's not about one single person being angry. We all are angry & upset. We need a coalition of people working TOGETHER for our future.  #NotMeUs #UniteOurFight,63,54,0,9,0,0,0,1,1480310655480266,PaulaJean2020,/story.php?story_fbid=1480310655480266&id=785936231584382
Paula Jean Swearengin,,2020-02-14 18:43:14,"Imagine having ordinary people serving us instead of career politicians? Who better to serve us than us? Many have signed up, from a local level to the federal level! Vet and vote wisely. We are in a fight for our lives!  #UniteOurFight #NotMeUs",60,50,0,10,0,0,0,0,1480265425484789,PaulaJean2020,/story.php?story_fbid=1480265425484789&id=785936231584382
Paula Jean Swearengin,,2020-02-13 22:05:13,"Our campaign for the U.S. Senate is a grassroots army of dedicated activists and ordinary people, and we’re all fighting for every West Virginian. We have the momentum from the 2018 race behind us, and we’re building on it every day. But we absolutely can’t do this without you so I hope we can count on you to pitch in tonight and keep this movement fueled for the fight ahead. Thank you all so much!  http://bit.ly/PJS_FB #UniteOurFight #NotMeUs #PeopleFunded",30,24,0,6,0,0,0,3,1479489542229044,PaulaJean2020,/story.php?story_fbid=1479489542229044&id=785936231584382
"Paula Jean Swearengin,Silvers for Sanders",Silvers for Sanders,2020-02-12 02:14:01,Thank you Silvers for Sanders!!!Silvers for Sanders is excited to announce our endorsement for Paula Jean Swearengin! She's an amazing Progressive from West Virginia who is also a dedicated environmental and social activist.  Learn more about Paula: https://paulajean.com/,211,159,1,51,0,0,0,3,1478541235657208,PaulaJean2020,/story.php?story_fbid=1478541235657208&id=785936231584382
"Paula Jean Swearengin,Blue America",Blue America,2020-02-12 10:07:59,"Thanks again Blue America!Yesterday we endorsed Paula Jean Swearengin for Senate in West Virginia. She's running to unseat a very corrupt GOP daughter of a very corrupt ex-WV Governor.   Howie Klein says, ""More than almost any other candidate I've spoken to, she really and truly is... one of us.""  the GOP-held Senate is destroying our Constitution before our eyes -- FIGHT BACK, Help us FLIP this Seat!  WATCH her fantastic video: https://tinyurl.com/v37ojn3",130,110,0,20,0,0,0,6,1478359762342022,PaulaJean2020,/story.php?story_fbid=1478359762342022&id=785936231584382
Paula Jean Swearengin,,2020-02-11 19:39:58,Help get Danielle Walker for House in West Virginia get re-elected! She is a true people servant! #Mountaineers are BLESSED to have her! #UniteOurFight #WVCantWait #NotMeUs  https://secure.actblue.com/donate/daniforwv,55,44,0,11,0,0,0,3,1477775529067112,PaulaJean2020,/story.php?story_fbid=1477775529067112&id=785936231584382
Paula Jean Swearengin,,2020-02-11 13:44:45,Thank you Blue America for the endorsement!  #flipthesenate  https://downwithtyranny.blogspot.com/2020/02/paula-jean-swearengin-coal-miners.html,220,167,0,53,0,0,0,6,1477586025752729,PaulaJean2020,/story.php?story_fbid=1477586025752729&id=785936231584382
Paula Jean Swearengin,,2020-02-10 23:02:27,"Our campaign is the ONLY campaign for the U.S. Senate for the state of West Virginia that hasn't taken corporate and corporate PAC dollars. We are 100% #PeopleFunded! We challenge every candidate in this race to do the same!  Campaign financing doesn't lie! #ShowTheReciepts  *cough* *cough;...Senator Shelley Moore Capito, Richard Ojeda",123,108,0,15,0,0,0,2,1477104619134203,PaulaJean2020,/story.php?story_fbid=1477104619134203&id=785936231584382
Paula Jean Swearengin,,2020-02-08 20:52:25,Benji Swearengin is wondering why you haven't signed up to volunteer for his grandma's campaign yet!  #UniteOurFight  #OurChildrenTheirFuture  PaulaJean.com volunteer@paulajean.com,119,74,1,44,0,0,0,8,1475454342632564,PaulaJean2020,/story.php?story_fbid=1475454342632564&id=785936231584382
Paula Jean Swearengin,,2020-02-08 17:02:01,"When I see politicians, like my opponent, talking about the futures of their family, I am happy that their families are secure. But, I also think about the future of my family and I am reminded of the policies that so many of these corrupt and privileged politicians pass.  Where was your outrage Shelley Moore Capito when Trump was locking children in cages?  Where was your concern for families when you voted for spending bills that cut food stamps, child care programs, Medicare and Social Security?  We need representatives that will stand tall for all of our families’ futures. Who will put all of us first? Not empty promises and photo-ops. #UniteOurFight #EndCorruption  #PaulaJean2020",180,160,0,20,0,0,0,6,1475343399310325,PaulaJean2020,/story.php?story_fbid=1475343399310325&id=785936231584382
Paula Jean Swearengin,,2020-02-07 22:33:26,Boots were never designed to trample on people that have no shoes!,37,33,0,3,0,1,0,0,1474699992707999,PaulaJean2020,/story.php?story_fbid=1474699992707999&id=785936231584382
Paula Jean Swearengin,,2020-02-07 16:55:45,We have to stop with divisive partisan politics and put our government into the hands of the PEOPLE!  #PaulaJean2020 #UniteOurFight #InvestingInOurselves #NotMeUs,31,27,0,4,0,0,0,1,1474522529392412,PaulaJean2020,/story.php?story_fbid=1474522529392412&id=785936231584382
Paula Jean Swearengin,,2020-02-05 16:24:26,"Senator Joe Manchin III and Senator Mitt Romney showed they were impartial jurors, upheld their oaths and the Constitution. THANK you both! The spotlight is on Shelley Moore Capito now! It’s time to stand for country over party! #impeachmentday #impeachment",205,181,0,23,1,0,0,21,1472881246223207,PaulaJean2020,/story.php?story_fbid=1472881246223207&id=785936231584382
Paula Jean Swearengin,,2020-02-04 12:35:03,re governor's daughter. I'm a . Isn't it time we have real West Virginians representing real WVians in Washington? Join our campaign today & together we can take back our government.  ,183,159,0,24,0,0,0,3,1471963049648360,PaulaJean2020,/PaulaJean2020/photos/a.790639461114059/1471963049648360
Paula Jean Swearengin,,2020-02-04 07:45:11,"#TeamPaulaJean is proud to be a part of a movement of candidates, organizers, & volunteers that are working together to unseat corrupt politicans like Shelly Moore-Capito. It's not about who has the loudest voice. We need to raise the voices of the voiceless & put our government into the hands of the people. #UniteOurFight #NotMeUs  #PaulaJean2020  PaulaJean.com",61,56,0,5,0,0,0,0,1471775869667078,PaulaJean2020,/story.php?story_fbid=1471775869667078&id=785936231584382
Paula Jean Swearengin,,2020-02-03 20:30:09,"I'm a PROUD  National Surrogate! For those who say, you and Bernie can't do this!? WE can! I'm a US Senate candidate part of  slate to back up  when he's President! Join me & take our government back!     ",152,101,1,50,0,0,0,5,1471457069698958,PaulaJean2020,/PaulaJean2020/photos/a.790639461114059/1471457069698958
Paula Jean Swearengin,,2020-02-03 20:00:08,I'm a PROUD @BernieSanders National Surrogate! For those who say “You and Bernie can't do this!?” WE can! I'm a US Senate candidate part of  slate that will back up  when he's President! Join me & take our government back!  ,412,281,1,130,0,0,0,12,1471442329700432,PaulaJean2020,/PaulaJean2020/photos/a.790639461114059/1471442329700432
"Paula Jean Swearengin,Brand New Congress",Brand New Congress,2020-01-31 17:53:17,#UniteOurFightSick of the #GOPCowards who let Trump off the hook to commit more crimes? Help us replace 3 of them in 2020. Chip in below to support #BrandNewCongress and: Kimberly Graham for US Senate - Iowa: http://bit.ly/ReplaceErnst Betsy Sweet: http://bit.ly/ReplaceCollins Paula Jean Swearengin: http://bit.ly/ReplaceCapito,184,146,1,37,0,0,0,5,1469923663185632,PaulaJean2020,/story.php?story_fbid=1469923663185632&id=785936231584382
Paula Jean Swearengin,,2020-01-31 21:16:23,Y'all probably need to forgive this proud grandma. Most posts will be about politics but I can't resist posting about my grandchild. Benji met all of his uncles and my heart is full!,110,69,0,41,0,0,0,5,1469110586600273,PaulaJean2020,/story.php?story_fbid=1469110586600273&id=785936231584382
Paula Jean Swearengin,,2020-01-31 20:31:02,"Sometimes it’s hard to keep faith in our government, but I refuse to give up. It’s clear that everyday, working class people MUST step up and serve, which is exactly what this campaign is about.  Just like last cycle, we are running on pure people-power: a coalition of progressive fighters for justice and equality. Here in West Virginia, I’m fighting particularly hard for economic diversity so that everyday people have a shot at happy and healthy lives.     That’s why your support is so important! With only hours left in January, we’re still a bit short, so every dollar matters right now!  If you’re able, please pitch in $1, $5 or $10 to help us close this gap before the clock strikes midnight. Thank you!  https://secure.actblue.com/donate/paula-jean-swearengin-2020_c2g_sm #PaulaJean2020 #Elections2020 #UniteOurFight #EndCorruption #PeopleFunded #NotMeUs",16,13,0,3,0,0,0,0,586678952177060,PaulaJean2020,/story.php?story_fbid=586678952177060&id=785936231584382
Paula Jean Swearengin,,2020-01-31 13:42:48,thoughts for today:  Call @SenCapito today 202-224-6472 and tell her to vote for witnesses and give the American people a fair & transparent trial. It's time to send someone to the US Senate who will vote to uphold the rule of law & restore the checks and balances of government.,67,65,1,0,0,1,0,22,1468882199956445,PaulaJean2020,/story.php?story_fbid=1468882199956445&id=785936231584382
Paula Jean Swearengin,,2020-01-30 23:42:07,These people don't deserve this! If you are trying to exploit them you are wrong!!,129,44,0,0,0,59,26,5,1468396673338331,PaulaJean2020,/story.php?story_fbid=1468396673338331&id=785936231584382
Paula Jean Swearengin,,2020-01-30 16:35:31,Thank you Flip The Senate!,255,188,0,66,1,0,0,6,1468179196693412,PaulaJean2020,/story.php?story_fbid=1468179196693412&id=785936231584382
Paula Jean Swearengin,,2020-01-28 15:54:11,#TeamPaulaJean does not support subsidising greyhound dog track racing in West Virginia. I have worked with pet rescue organizations over the years & we will continue to work together to strengthen humane laws for our four legged friends on a state and federal level in addition to working on sustainable job creation for hard working West Virginians.,109,92,0,17,0,0,0,7,1466591013518897,PaulaJean2020,/story.php?story_fbid=1466591013518897&id=785936231584382
Paula Jean Swearengin,,2020-01-27 21:11:33,All the children of West Virginia are a big dill and this state is in a pickle! Help Grandma Paula Jean get to the U.S. Senate to bring real change to this state.   Benji weighs a little over 8 pounds! Can you give $8 tonight?      ,156,98,1,57,0,0,0,5,1465966956914636,PaulaJean2020,/PaulaJean2020/photos/a.790639461114059/1465966956914636
Paula Jean Swearengin,,2020-01-26 19:01:34,My life changed today & the fuel to my fight just got a lot bigger! There are no words to describe holding your baby's baby!,362,204,0,157,1,0,0,24,1465130660331599,PaulaJean2020,/story.php?story_fbid=1465130660331599&id=785936231584382
Paula Jean Swearengin,,2020-01-26 12:10:01,Be still my heart! My grandson was born at 10:02 am! Mom and baby are doing fine!  #ProudGrandma,443,273,1,169,0,0,0,48,1464840300360635,PaulaJean2020,/story.php?story_fbid=1464840300360635&id=785936231584382
Paula Jean Swearengin,,2020-01-24 21:34:51,Running for office is not about self promotion. I am running for U.S. Senate to build a movement of ordinary people who can do extraordinary things. Let's put ego aside to bring better paying jobs & healthcare to the millions of Americans who desperately need it. #UniteOurFight,135,106,0,29,0,0,0,5,1463537843824214,PaulaJean2020,/story.php?story_fbid=1463537843824214&id=785936231584382
Paula Jean Swearengin,,2020-01-24 16:41:29,#WestVirginia should immediately legalize #cannabis & #hemp to kick start our economy. Doing so will provide jobs & economic development within months. We must diversify our economy & in the Senate help break the log jam to get it done.,174,146,0,28,0,0,0,10,1463373993840599,PaulaJean2020,/story.php?story_fbid=1463373993840599&id=785936231584382
Paula Jean Swearengin,,2020-01-22 20:22:08,"I have been on calls with women in West Virginia, Tennessee and Kentucky this evening. Something that nobody should underestimate is the power of Appalachian women uniting for our children!  #UniteOurFight #AppalachianPride #WomenUnite",95,76,0,19,0,0,0,2,1461822613995737,PaulaJean2020,/story.php?story_fbid=1461822613995737&id=785936231584382
Paula Jean Swearengin,,2020-01-22 10:41:24,#ILikeBernie #WomenForBernie #Bernie2020,179,113,0,66,0,0,0,4,1461487820695883,PaulaJean2020,/story.php?story_fbid=1461487820695883&id=785936231584382
Paula Jean Swearengin,,2020-01-21 15:30:20,"In front of the World Economic Forum and Greta Thunberg Trump once again rejected the reality of dangerous climate change and called environmental activists “prophets of doom.”  I wish I could say this was unbelievable, but we’re beyond that. Trump and his lackey, Shelley Moore Capito, not only deny climate change, but actively pursue regressive and harmful anti-environmental policies. It’s time to elect someone who’s been fighting for environmental justice for years. Our planet’s running out of time. Will you help us elect an environmental ally to the Senate?",100,78,2,18,0,1,1,3,1460869014091097,PaulaJean2020,/story.php?story_fbid=1460869014091097&id=785936231584382
Paula Jean Swearengin,,2020-01-20 21:31:18,"Thank you Dr. King for your bravery, dedication, leadership, and inspiration.  #MLKDay  #UnitedWeStand  #UniteOurFight",27,25,0,2,0,0,0,0,1460267437484588,PaulaJean2020,/story.php?story_fbid=1460267437484588&id=785936231584382
Paula Jean Swearengin,,2020-01-20 19:00:10,We’re the only campaign in this race that prioritizes social justice and equality. We’ll never back down from fighting for your rights. Step up with us and say PEOPLE MATTER.,27,21,1,4,1,0,0,0,1460195477491784,PaulaJean2020,/story.php?story_fbid=1460195477491784&id=785936231584382
Paula Jean Swearengin,,2020-01-18 20:41:01,This was #WVCantWait candidates waiting to get into the West Virginia Secretary of State office to file their candidacy papers to be on the ballot for 2020! Every SINGLE one of them have pledged not to take corporate PAC dollars. I am proud to say that #TeamPaulaJean is on that list! We are GROWING! Together!  #UniteOurFight  #EndCorruption  #WVProud,108,73,0,32,3,0,0,1,1458643417646990,PaulaJean2020,/story.php?story_fbid=1458643417646990&id=785936231584382
