source,shared_from,date,text,reactions,likes,ahah,love,wow,sigh,grrr,comments,post_id,url
Trevor Fuller,,2019-03-14 16:30:00,"Under pressure from Donald Trump and the far right-wing of his party, Thom Tillis has failed the people of North Carolina.  Two weeks ago, he pretended to be an independent voice that we need in the US Senate but today he showed his true colors.  He must be defeated in 2020 and that is what I am running to do.",36,26,,6,,,4,4,578706462619084,/story.php?story_fbid=578706462619084&id=548982772258120
Trevor Fuller,,2019-03-08 14:01:19,"I’m proud of and inspired by all the women who have felt strong enough and empowered enough to tell their truth in these trying times. Women who have felt strong enough to tell their stories to the world about unspeakable abuse and repression, but who have persisted nevertheless, knowing that they will be disbelieved and discounted yet again. I am here today because of such women.  #InternationalWomensDay",9,9,,,,,,,575997519556645,/story.php?story_fbid=575997519556645&id=548982772258120
Trevor Fuller,,2019-02-24 20:48:50,"I'm saddened to learn of the passing of former Congressman Frank Ballance, Jr.  My heart goes out to his family and his many friends throughout North Carolina.",3,3,,,,,,1,570218136801250,/story.php?story_fbid=570218136801250&id=548982772258120
Trevor Fuller,,2019-02-22 19:59:34,Congratulations to Antoine Marshall for being honored as a Rising Star by the Wake County Democratic Party.,11,11,,,,,,1,569205220235875,/story.php?story_fbid=569205220235875&id=548982772258120
Trevor Fuller,,2019-02-22 19:19:36,Great to see NC Supreme Court Chief Justice Cheri Beasley at the Wake Dems Valentine’s reception,26,26,,,,,,,569193580237039,/story.php?story_fbid=569193580237039&id=548982772258120
Trevor Fuller,,2019-02-14 16:31:58,"My wife, Camille Davidson, gives me the love and strength I need everyday to serve you in elected office. May you enjoy love today and everyday. #HappyValentinesDay.",30,20,,10,,,,4,565059173983813,/story.php?story_fbid=565059173983813&id=548982772258120
Trevor Fuller,,2019-02-12 14:38:48,Congratulations to Justice Cheri Beasley who was named as Chief Justice of the NC Supreme Court today.  She will be the first African-American woman to hold that post.  What a great choice!,25,20,,5,,,,3,563930130763384,/story.php?story_fbid=563930130763384&id=548982772258120
Trevor Fuller,,2019-02-10 19:30:56,It's a sad day for North Carolina.  Thank you Congressman Walter Jones for your years of service.,4,3,,,,1,,,563000034189727,/story.php?story_fbid=563000034189727&id=548982772258120
Trevor Fuller,,2019-02-06 11:08:21,"""But we must all embrace that from agriculture to health care to entrepreneurship, America is made stronger by the presence of immigrants - not walls."" Stacey Abrams",3,3,,,,,,,560652207757843,/story.php?story_fbid=560652207757843&id=548982772258120
Trevor Fuller,,2019-02-05 13:31:51,"After tonight's SOTU, make sure to stay tuned and watch Stacey Abrams rebuttal message.",2,2,,,,,,,560179194471811,/story.php?story_fbid=560179194471811&id=548982772258120
Trevor Fuller,,2019-02-02 20:35:11,Great so see my friend Vancine Sturdivant at the #FairElectionsNC09 rally today. I had a wonderful time and the crowd was electrifying,8,7,,1,,,,,558724821283915,/story.php?story_fbid=558724821283915&id=548982772258120
Trevor Fuller,,2019-01-31 13:04:19,I invite Mr. Colbert to join me at any number of NC BBQ establishments where I will offer ample evidence to the contrary.,6,5,,1,,,,2,557535314736199,/story.php?story_fbid=557535314736199&id=548982772258120
Trevor Fuller,,2019-01-29 12:37:42,Health care should be a right for all Americans. Come join our campaign at http://www.FullerForNorthCarolina.com  and let's make it happen. #ReclaimAmerica,5,4,,1,,,,,556486174841113,/story.php?story_fbid=556486174841113&id=548982772258120
Trevor Fuller,,2019-01-26 13:52:58,Taking a moment to catch up with NC Senator Don Davis at the NC Democratic Party State Executive Committee meeting today.,5,5,,,,,,,555038248319239,/story.php?story_fbid=555038248319239&id=548982772258120
Trevor Fuller,,2019-01-26 13:46:47,Proud to be with so many good Democrats at the #NCDP   State Executive Committee meeting in Charlotte today. These ladies make up the Delta Sigma Theta Caucus.,9,8,,1,,,,1,555036178319446,/story.php?story_fbid=555036178319446&id=548982772258120
Trevor Fuller,,2019-01-25 17:00:06,I laud congressional Democrats for standing up to Donald Trump and his pipe dream of a border wall. A wall is a medieval approach to a modern concern. The government must remain open beyond Feb. 15 in accordance with the wishes of the American people. Let's move on.,6,6,,,,,,,554563848366679,/story.php?story_fbid=554563848366679&id=548982772258120
Trevor Fuller,,2019-01-25 08:58:13,,5,3,,2,,,,1,554375795052151,/FullerforNC/photos/a.548982808924783/554375795052151
Trevor Fuller,,2019-01-25 08:56:00,I’m truly humbled. I want to thank everyone who joined us this Tuesday as we launched our campaign for U.S. Senate and everyone who has reached out offering their support.  I’m so thankful to have you on my side. -Trevor,10,10,,,,,,,554374625052268,/story.php?story_fbid=554374625052268&id=548982772258120
Trevor Fuller,,2019-01-22 11:11:18,"""We shall reach higher together. With people this journey is impossible but with God all things are possible."" -TF",6,5,,1,,,,,552960555193675,/story.php?story_fbid=552960555193675&id=548982772258120
Trevor Fuller,,2019-01-22 11:07:36,It's official!  I'm running for U.S. Senate.  Read more at >>,17,16,,1,,,,2,552959301860467,/story.php?story_fbid=552959301860467&id=548982772258120
Trevor Fuller,,2019-01-22 10:50:14,"Vilma Leake channeled her inner civil rights leader Fannie Lou Hamer ""I’m sick and tired of being sick and tired.""",9,9,,,,,,1,552952951861102,/story.php?story_fbid=552952951861102&id=548982772258120
Trevor Fuller,,2019-01-22 10:38:48,"""Trevor has a story and a vision that transcends geography...Now is the time to chose inclusion over exclusion."" -- Commissioner Mark Jerrell",2,2,,,,,,,552948568528207,/story.php?story_fbid=552948568528207&id=548982772258120
Trevor Fuller,,2019-01-22 10:18:52,Just a few more minutes remain until my special announcement.....,4,4,,,,,,1,552939885195742,/story.php?story_fbid=552939885195742&id=548982772258120
Trevor Fuller,,2019-01-21 10:42:04,"Today we remember and honor a great man who broke down social barriers and taught us the need for justice and equality.   The quest for racial harmony persists, and we must work together to build a culture of love and respect.",7,5,,2,,,,,552435395246191,/story.php?story_fbid=552435395246191&id=548982772258120
Trevor Fuller,,2019-01-14 22:42:53,,9,7,,2,,,,1,549146588908405,/FullerforNC/photos/a.548982808924783/549146588908405
