source,shared_from,date,text,reactions,likes,ahah,love,wow,sigh,grrr,comments,post_id,url
Jason Lewis,,2019-10-11 00:20:24,"Just when Minneapolis Mayor Jacob Frey told you it was safe to go downtown...his base of anarchists and Communists showed up to commit violence against Trump supporters, light fires in the streets, and assault police officers. This is what we’re up against folks! I never thought I’d see police in riot gear, Communist flags, and Marxist sympathizers in our streets. Shame on you Mayor for inciting this with your incendiary rhetoric and anti-law enforcement stances.",1.2K,665,19,3,106,89,394,,10156903189008472,/story.php?story_fbid=10156903189008472&id=130467958471
Jason Lewis,,2019-09-12 16:31:17,"The land of 10,000 lakes is front and center in this TIME article highlighting states that are going to put President Trump over the top next year. 2020 is Minnesota's time to make history. The President knows it, I know it, and you know it. I'm running to be your Senator because our values are under attack from a party of radicals who want to fundamentally transform this country into something unrecognizable. I won't let it happen, I'm fighting back. Are you with us? Click our sign up link in the comments below and join the team!",298,255,8,34,,,1,,10156832855228472,/story.php?story_fbid=10156832855228472&id=130467958471
Jason Lewis,,2019-10-03 12:08:31,"Kudos to Minneapolis & MN law enforcement for thoroughly preparing for next week's rally and re-assuring the public in the face of threats of protest from the ""resistance,"" and after the Minneapolis mayor undermined Minneapolis police by telling them they were forbidden from appearing with or even near the President while in uniform. I admire and respect them for doing their jobs and their ""duty first"" mentality.",469,413,7,47,2,,,,10156883606803472,/story.php?story_fbid=10156883606803472&id=130467958471
Jason Lewis,,2019-09-04 16:15:00,"In 2016 we almost turned Minnesota “red”... and in  2020 we can finish the job! I’m running for U.S. Senate to fight for your values, but I need every supporter on board to win. Join my campaign today! https://action.lewisformn.com/turn-mn-red/",412,364,12,32,,1,3,,10156814178403472,/story.php?story_fbid=10156814178403472&id=130467958471
Jason Lewis,,2019-09-02 09:26:57,Happy Labor Day to all my fellow Minnesotans. I hope everyone is enjoying a healthy and happy holiday weekend. Beautiful day to be outside on the lake!,322,306,,16,,,,,10156808907553472,/story.php?story_fbid=10156808907553472&id=130467958471
Jason Lewis,,2019-08-28 12:53:40,"TUNE IN ALERT- I will be on the Rush Limbaugh show at 12:30 to discuss my campaign. Minnesota needs someone who will fight for lower taxes and good paying jobs in the U.S. Senate, not someone like Tina Smith who embraces radical job killing policies like the “Green New Deal.”",244,220,7,17,,,,,10156797778398472,/story.php?story_fbid=10156797778398472&id=130467958471
Jason Lewis,,2019-09-29 08:00:01,I look forward to standing with the President on October 10th and in victory next November. President Trump's 4th visit to Minnesota in 16 months shows just how serious he is about winning Minnesota and sending a Republican to the U.S. Senate!,446,365,7,69,2,,3,,10156870998013472,/story.php?story_fbid=10156870998013472&id=130467958471
Jason Lewis,,2019-06-27 13:17:12,"Until 2019 health insurance premiums under Obamacare had risen six straight years resulting in a doubling of insurance costs. Along with that, coverage, as everyone knows, has gotten worse. Thankfully, the previous Congress along with the Trump administration took substantive steps to hold prices down for families by repealing the individual mandate, allowing small businesses to pool costs and now a new HHS rule granting employees covered by HRAs the same tax advantages enjoyed by large corporations (i.e., they can go out and buy insurance with pre-tax dollars). Much more needs to be done along these lines, but it’s safe to say more ‘reinsurance’ bailouts offered by big spending Democrats won’t save Obamacare from itself. We need continue with real health care reform that “guarantees lower premiums, catastrophic coverage and a private, portable plan for everyone—including those with preexisting conditions.” Here’s how.",68,66,2,,,,,,10156655376838472,/story.php?story_fbid=10156655376838472&id=130467958471
Jason Lewis,,2019-09-22 12:00:15,"The author here is right, Iranian sanctions are working (their oil exports have plunged 90%) and thanks to President Trump’s leadership—especially on American energy production—we are indeed winning. The U.S. is a net exporter of energy for the first time in 45 years on the President’s watch and another reason we need @minnesotans4L3. Which of course is good news for places like Minnesota. When I’m in the U.S. Senate I will work with the President to continue these policies and keep Minnesota working!",118,106,7,5,,,,,10156855744833472,/story.php?story_fbid=10156855744833472&id=130467958471
Jason Lewis,,2019-04-14 11:57:31,"""Now with the wisdom of years, I try to reason things out And the only people I fear are those who never have doubts Save us all from arrogant men, and all the causes they're for I won't be righteous again, I'm not that sure anymore""                                                        --Billy Joel, Shades of Grey If there ever were a tune for the climate alarmists, this would be it. Pick any media story, and the 100% absolute ontological certainty of impending doom is everywhere.  National Geographic's unmistakeable headline, without hesitation, ""Scientific consensus is overwhelming: The planet is getting warmer, and humans are behind it"" is a good example. There not only is no debate--but we won't allow one.  In fact, calling skeptics 'climate deniers' is exactly how the left's (dangerous) preoccupation with political censorship got its start.  But, as most people used to realize, science is often wrong. Contrary to the media hype, recent 'data' are in and the last decade and a half show a notable pause in warming with the last few years showing demonstrable cooling and droughts evaporating. We know there were times when CO2 levels were far higher than today and without computer model adjustments, raw temperature readings from satellite as well as ground base sensors show no catastrophic change one way or another.  According to a recent peer reviewed study, the three main surface temp datasets managed by NASA, NOAA and the UK's Met Office have used adjustments actually larger than recent trends in global warming. A ocean warming study had to be 'walked-back' after flaws were quickly found in its methodology used in part to conclude the 'ocean is warming...independent of direct ocean temperature measurements.'  So depending on which you adjust... Even if the US went carbonless (which seems to be #MN02  @AngieCraigMN wish as she is co-sponsoring a massive energy tax on electricity, gasoline, diesel fuel, home heating oil in a district home to a major refinery), IPCC figures show it would make no major difference on global temps. There is simply much we don't know--and that's the point. But if the world according to AOC is going to end in 12 years without drastic action, why no crash course in carbon-free nuclear power? Or is all the fantastic climate conformity just the most convenient answer in search of a why we need a $93 trillion dollar Green New Deal question?  Ponder that while you shovel the April snow.",151,130,3,10,8,,,,10156488997388472,/story.php?story_fbid=10156488997388472&id=130467958471
