source,shared_from,date,text,reactions,likes,ahah,love,wow,sigh,grrr,comments,post_id,url
Jason Lewis,,2020-05-01 14:26:13,"Mom-and-pop businesses, like those on Broadway in Albert Lea, are the backbone of our communities. But they may never reopen thanks to CRUSHING government mandates. Small businesses owners are on the brink of losing everything. We need to re-open Minnesota FAST.",54,53,,,,,1,,10157509207388472,/story.php?story_fbid=10157509207388472&id=130467958471
Jason Lewis,,2020-05-01 13:08:35,"‪From cancer surgeries to orthopedic procedures, this medical care is far from “nonessential.”‬ And yet Governor Walz continues to delay lifting the ban on “elective” surgeries. Enough! ‪Senator Tina Smith needs to show some leadership and tell Walz to stop standing between doctors and their patients. ‬ ‪People are in dire pain and suffering!",62,33,,,1,14,14,,10157508994603472,/story.php?story_fbid=10157508994603472&id=130467958471
Jason Lewis,,2020-05-01 10:43:34,“Pence’s Wife?” Disrespectful.  You’re referencing the Second Lady of the United States Karen Pence. Minnesota media is top notch.,70,35,4,1,12,1,17,,10157508494268472,/story.php?story_fbid=10157508494268472&id=130467958471
Jason Lewis,,2020-04-30 23:57:46,"As businesses fail and futures ruined, we have reached the point where these draconian intrusions on our way of life transcend politics and lifestyle. Yes, Elon Musk, we want our freedom back. Before it’s too late.",376,340,1,34,,,,,10157507215003472,/story.php?story_fbid=10157507215003472&id=130467958471
Jason Lewis,,2020-04-30 21:15:05,"It must be asked, do we really want to live with leaders who: ✅ Seek to spy on, set up and imprison their adversaries ✅ Censor, blackmail and smear their political opponents ✅ Rescind the Bill of Rights in the name of public health I have rarely, if ever, witnessed a more grave threat to liberty.",148,80,2,2,9,7,48,,10157506781888472,/story.php?story_fbid=10157506781888472&id=130467958471
Jason Lewis,,2020-04-30 20:10:40,Farmers need our help NOW. We need to...  - re-open processing plants immediately - invoke the agricultural provisions in the CARES Act so the USDA can expand their assistance to a wider range of agricultural producers - consider extending crop insurance to livestock farmers Tina Smith has failed Minnesota farmers. This can't wait!,39,35,,4,,,,,10157506568558472,/story.php?story_fbid=10157506568558472&id=130467958471
Jason Lewis,,2020-04-30 17:37:09,Our critical end-of-month fundraising deadline is just a few hours away! Chip in whatever you can before 11:59PM TONIGHT to help us FLIP Minnesota RED and keep the momentum going >>>,7,7,,,,,,,10157502020488472,/story.php?story_fbid=10157502020488472&id=130467958471
Jason Lewis,,2020-04-30 16:31:54,99.24% of coronavirus deaths in Minnesota have been people with significant underlying conditions. 78% have been those in long-term care facilities. The data is clear: it’s time to #ReopenMN while protecting the most vulnerable.,326,265,,5,22,10,24,,10157505954113472,/story.php?story_fbid=10157505954113472&id=130467958471
Jason Lewis,,2020-04-30 15:32:56,"Per the Governor, MN is NOT lifting the ban on elective surgeries, but claims to be working with hospitals to ""modify"" it. Enough is enough! People are in pain and suffering with broken bones and torn ligaments! I know, having met with 2 orthopedic surgeons last week. Why is Senator Tina Smith MIA here?",267,186,,5,3,4,69,,10157505798913472,/story.php?story_fbid=10157505798913472&id=130467958471
Jason Lewis,,2020-04-30 17:30:22,"‪Farmers are having to euthanize their hogs because processing plants are closed. ‬ ‪Small businesses are struggling to survive this shutdown. ‬ ‪Today our #ReopenMN tour was in Albert Lea, giving these people a voice. ‬ ‪Tune in to KIMT News 3 tonight at 4:30 and 6pm for the full story.‬",60,41,,2,2,8,7,,10157506114738472,/story.php?story_fbid=10157506114738472&id=130467958471
Jason Lewis,,2020-04-29 15:25:57,"Every passing day we permanently lose more of Minnesota’s incredible small businesses, costing lives and livelihoods. It’s time to reopen Minnesota.",289,271,1,15,,1,1,,10157502586698472,/story.php?story_fbid=10157502586698472&id=130467958471
Jason Lewis,,2020-04-29 11:49:01,"I've met with 2 orthopedic surgeons recently, one of whom said business is down 85%. The State of MN in their infinite wisdom deemed orthopedic surgeries ""elective"" & ""non-essential."" “I appreciate him doing the tour with businesses in the area to find out how this COVID-19 outbreak has affected us,” Orthopedic surgeon Dr. Patrick Hall said, “We’d like to start getting patients the care they need in a safe, effective way, so hopefully we can come up with a plan that allows us to do that.” Lewis said, ""I think it's especially acute with these medical clinics. Here you have people waiting to get a biopsy in dire pain and suffering, and we're just telling them, 'just wait, just wait,' and that is not good medicine. And it's not being done by professionals like Dr. Hall, it's being done by politicians."" This madness must end! #ReopenMN",94,82,,9,,,3,,10157502077403472,/story.php?story_fbid=10157502077403472&id=130467958471
Jason Lewis,,2020-04-29 11:22:31,"🚨DEADLINE LOOMING → Tomorrow is our April fundraising deadline and we’re going to need all the help we can get to reach our goal. Protecting the Senate Majority is dependent on us flipping Minnesota RED. Help keep us in the fight with a contribution of $10, $5, or even just $3 today:",20,15,2,3,,,,,10157502010128472,/story.php?story_fbid=10157502010128472&id=130467958471
Jason Lewis,,2020-04-28 17:57:36,"Minnesota is once again on the forefront as we battle this pandemic. I want to thank VP Mike Pence for setting time aside to meet with me, allowing me to share Minnesotans’ concerns. We know testing is key, and Mayo Clinic has given us all a reason for optimism.",246,221,,24,,,1,,10157499422678472,/story.php?story_fbid=10157499422678472&id=130467958471
Jason Lewis,,2020-04-28 14:41:53,‪On Vice President Mike Pence’s detail today in Rochester as he visits the Mayo Clinic to learn about their new coronavirus testing plan.‬ ‪Minnesotans are proud of the leadership of Mike Pence and Donald J. Trump as we fight this virus! ‬,361,308,3,46,,,4,,10157498846958472,/story.php?story_fbid=10157498846958472&id=130467958471
Jason Lewis,,2020-04-28 13:06:11,‪Dental clinics are reporting a 95% drop in revenue due to government mandates my opponent Tina Smith supports.‬ ‪Some even fear permanent closure due to financial strain.‬ ‪We need to reopen Minnesota to avoid long-term consequences to our healthcare system.‬,98,59,,3,4,22,10,,10157498532078472,/story.php?story_fbid=10157498532078472&id=130467958471
Jason Lewis,,2020-04-27 20:38:11,"Every passing day more and more Minnesotans permanently lose businesses and livelihoods. We must defeat this virus, but we can’t cause a second Great Depression in the process. Too bad Democrats like Tim Walz and Tina Smith represent their party and not the people of Minnesota! #ReopenMN",232,169,1,4,,21,37,,10157496363008472,/story.php?story_fbid=10157496363008472&id=130467958471
Jason Lewis,,2020-04-27 16:40:42,Thousands of healthcare workers across Minnesota are laid-off and furloughed. Meanwhile Governor Tim Walz signed an executive order allowing out of state workers to work here? We need to put the livelihoods of Minnesota’s healthcare workers first!,114,59,,1,12,5,37,,10157495756623472,/story.php?story_fbid=10157495756623472&id=130467958471
Jason Lewis,,2020-04-28 15:08:36,‪At Air Force 2 in Rochester waiting for Vice President Mike Pence to take off. ‬ ‪Mike Pence and Donald J. Trump have been instrumental in helping Minnesota fight the coronavirus. ‬ ‪But we can’t finish the fight with a shuttered economy. We must do whatever it takes to reopen Minnesota and America sooner than later.‬,167,146,7,13,,,1,,10157498926913472,/story.php?story_fbid=10157498926913472&id=130467958471
Jason Lewis,,2020-04-27 13:24:10,"Quarantine is when you limit the movement of the sick and vulnerable. Tyranny is when you restrict the movement of everyone. We need to double down on protecting the vulnerable like those in long-term care facilities, while letting the rest of Minnesota get back to work.",198,169,1,8,2,17,1,,10157495209748472,/story.php?story_fbid=10157495209748472&id=130467958471
Jason Lewis,,2020-04-26 13:37:29,"First sign of a collapsing market is a supply glut.‬ ‪We now have massive gluts in hogs, oil and even beer...‬ ‪We are flirting with a Great Depression by continuing to quarantine healthy customers. #ReopenMN‬ ‪‬",278,96,,1,13,116,52,,10157491740493472,/story.php?story_fbid=10157491740493472&id=130467958471
Jason Lewis,,2020-04-28 11:38:55,We're in uncharted territory.  We've deliberately shut down the economy with public policy that is hurting families and destroying businesses.  Let's use common sense and quarantine the sick and the vulnerable while letting healthy people return to work. #ReopenMN,240,219,,18,,1,2,,10157498326603472,/story.php?story_fbid=10157498326603472&id=130467958471
Jason Lewis,,2020-04-26 11:41:08,"Happy Birthday Melania! You and your family have greatly sacrificed for the sake of America and we couldn’t be more thankful! Join me, and sign a birthday card for our incredible First Lady Melania Trump!",46,35,5,5,,,1,,10157491300598472,/story.php?story_fbid=10157491300598472&id=130467958471
Jason Lewis,,2020-04-24 22:26:45,"There are costs associated with this lockdown many aren’t considering. “The health risk of isolation is equal to smoking 15 cigarettes a day,” said BYU professor Julianne Holt-Lunstad. The cure can not be worse than the disease.",72,53,2,,7,9,1,,10157485190488472,/story.php?story_fbid=10157485190488472&id=130467958471
Jason Lewis,,2020-04-24 20:23:54,‪We have to start to reopen America and Minnesota to fight this virus. ‬ ‪We should be putting America back to work with an infrastructure package that beefs up the nation’s vital assets while at the same time eliminating its idle ones.‬ ‪How? ‬ ‪Read my plan in the Duluth News Tribune‬.,30,29,1,,,,,,10157484780028472,/story.php?story_fbid=10157484780028472&id=130467958471
Jason Lewis,,2020-04-24 19:00:25,"As our #ReopenMN RV tour continues I’m seeing heartbreaking personal suffering caused by this shutdown. Minnesotans are hurting and in significant pain because of the restriction on ‘elective’ surgery. I don’t know about you, but I don’t consider torn ligaments ‘elective.’",208,185,,8,1,14,,,10157484489058472,/story.php?story_fbid=10157484489058472&id=130467958471
Jason Lewis,,2020-04-25 13:49:40,‪Another example of how the liberals’ one-size-fits-all approach to the coronavirus is unnecessarily burdening small businesses.‬ ‪Dead On Inc can’t have their indoor shooting range open despite ventilation that makes the range safer than their store.‬ ‪Let’s use some common sense and start to reopen Minnesota. ‬,52,45,1,6,,,,,10157487959783472,/story.php?story_fbid=10157487959783472&id=130467958471
Jason Lewis,,2020-04-25 12:35:06,‪People are in dire pain and suffering.‬ ‪Thousands of healthcare workers are losing their jobs. ‬ ‪Hospitals could close down for good. ‬ ‪This ban on elective surgeries has backfired. Get government out of the way and let doctors do their job!,255,142,,4,8,41,60,,10157487607738472,/story.php?story_fbid=10157487607738472&id=130467958471
Jason Lewis,,2020-04-27 15:52:13,"When you hear the term ‘elective’ surgeries, most people tend to think they’re optional. But that’s not the case.  Healthcare workers are being laid off and surgery centers closed, all while patients are waiting on live-saving treatments.",278,167,,5,14,62,30,,10157495651503472,/story.php?story_fbid=10157495651503472&id=130467958471
Jason Lewis,,2020-04-24 12:27:43,"Country Goods in Owatonna was forced to shutdown by Governor Tim Walz. With no revenue coming in, Todd and Grace had to use their retirement to pay bills.  Meanwhile big box stores can stay open?  This shutdown is CRUSHING small businesses. #ReopenMN",132,108,1,6,2,11,4,,10157483196658472,/story.php?story_fbid=10157483196658472&id=130467958471
Jason Lewis,,2020-04-23 19:02:24,"‪Never thought I’d say this: just hosted a fundraiser from the  RV! ‬  ‪Made a pit stop in Waterville on our  tour, remember to .‬  ‪Thanks to everyone who dialed in, & thx to Congressman @petestaubermn  and Rep. Heintzeman for speaking as well‬.",53,52,,1,,,,,10157480383843472,/LewisForMN/photos/a.252013348471/10157480383843472
Jason Lewis,,2020-04-23 13:52:57,"Visiting with Todd and Grace, owners of Country Goods in Owatonna, on our #ReopenMN RV tour. The prolonged shutdown is taking its toll on this wonderful store.  We don't want to lose great businesses like this by making the cure worse than the disease! Video to come--stay tuned!",89,83,1,5,,,,,10157479353903472,/story.php?story_fbid=10157479353903472&id=130467958471
,,2020-04-23 10:05:24,,21,21,,,,,,,2483616228616373,/events/2483616228616373?view=permalink&id=2485039215140741
Jason Lewis,,2020-04-23 15:45:32,"‪Thanks to liberal politicians’ one-size-fits-all approach, people in dire pain can’t get the medical care they need. ‬ ‪The disease they’re treating is coronavirus. But their cure has no regard for the damage it’s causing.‬ ‪People need treatment they’re unable to get. We need to #ReopenMN.",139,126,,4,,8,1,,10157479733938472,/story.php?story_fbid=10157479733938472&id=130467958471
Jason Lewis,,2020-04-22 15:12:51,"BACK ON THE ROAD TOMORROW!  Look for us as we continue our  RV Tour, in which we meet 1 on 1 w/ small biz. owners so they can tell their stories & have their voices heard.  Businesses are dying-this 1 size fits all lockdown isn't working. Time to gradually open things up",132,116,1,14,,,1,,10157475497983472,/LewisForMN/photos/a.252013348471/10157475497983472
Jason Lewis,,2020-04-22 09:06:48,With 22 million Americans unemployed- we must limit competition in the job market. Americans come first! I say close the borders & #ReOpenMN. DFL & Senator Tina Smith want MN closed & OPEN borders. Has Tina said where she stands on this move to protect our workers?? Or has she refused to weigh in and take a position (again)? Will the media do their jobs and hold her accountable?,59,53,,6,,,,,10157474351263472,/story.php?story_fbid=10157474351263472&id=130467958471
Jason Lewis,,2020-04-21 19:09:56,"‪Workers throughout Minnesota are being crushed by the economic impacts of coronavirus.‬ ‪Families across Minnesota, know this: your lives, jobs, and communities will have a voice.‬ ‪I will not stop fighting for Minnesota workers now, or when I’m in DC! #ReopenMN ‬",84,52,,1,1,24,6,,10157472434998472,/story.php?story_fbid=10157472434998472&id=130467958471
,,2020-04-21 17:04:58,,5,5,,,,,,,629038257952602,/events/629038257952602?view=permalink&id=629460607910367
Jason Lewis,,2020-04-21 15:52:45,"On this solemn day, Yom HaShoah, we remember the 6 million Jews who were systematically murdered by the Nazi regime.  Let us never forget the lives that were taken and promise to never allow another Holocaust to happen again. #NeverMeansNever #HolocaustRemembranceDay",55,38,,1,,16,,,10157471832118472,/story.php?story_fbid=10157471832118472&id=130467958471
Jason Lewis,,2020-04-21 14:52:58,"“‘This is about making certain that we keep our liberties, including putting food on the table. Time to reopen Minnesota,’ U.S. Senate candidate Jason Lewis said as he drove through the rally in his RV.” The cure can’t be worse than the disease!",138,127,1,8,2,,,,10157471614613472,/story.php?story_fbid=10157471614613472&id=130467958471
Jason Lewis,,2020-04-20 13:17:19,"Our Constitutional Rights aren’t subject to a pandemic exception. AG Barr is right when he says “Indeed, ‘individual rights secured by the Constitution do not disappear during a public health crisis.’” We can not allow Liberty to be trampled!",44,40,,4,,,,,10157467676458472,/story.php?story_fbid=10157467676458472&id=130467958471
Jason Lewis,,2020-04-20 14:02:11,#COVID19 will prove to be a turning point for China's standing as a manufacturing superpower if I have anything to say about it.  2 weeks ago I went up with a commercial talking about how we're going to bring manufacturing home and start putting #AmericaFirst.,350,295,2,48,2,2,1,,10157467787013472,/story.php?story_fbid=10157467787013472&id=130467958471
Jason Lewis,,2020-04-17 09:32:05,"I call on Senator Smith to do her job and provide a much-needed lifeline to ailing businesses by funding the Small Business Administration (which ran out of money yesterday). Then I call on her to stand with me in demanding Minnesota re-open for business when the stay at home order ends on May 4th. If she is not willing to do so today, perhaps she will be willing to do so after hearing from the many struggling families and small business owners I will be meeting with in the coming weeks. Right now there are 22 million Americans out of work, and just today Minnesota-based Best Buy announced they are furloughing 50,000 employees. Enough is enough. We can't afford to have Tina play politics any more - like she did when she twice voted to delay economic relief  to work in funding for her liberal pet projects like funding the Kennedy Center and the Green New Deal.",166,149,,12,1,,4,,10157454508793472,/story.php?story_fbid=10157454508793472&id=130467958471
"Jason Lewis,Rob Barrett, Jr. for US Senate",,2020-04-14 11:36:41,"No one is downplaying the tragic loss of life caused by coronavirus. But we can't continue to ignore the devastating impact a crashing economy will have on Americans' health. Suicide and drug-related deaths could surpass coronavirus if we don’t quickly start to re-open our economy and get Americans back to work.3 Reasons Why Jason Lewis Can't Win in 2020 (and 3 reasons why Rob Barrett, Jr. can)",244,209,1,3,3,26,2,,10157443363603472,/story.php?story_fbid=10157443363603472&id=130467958471
Jason Lewis,,2020-04-13 18:52:35,The United States is dealing with a global pandemic that has shut down the entire economy. Yet every press briefing turns into nonstop ‘gotcha’ questions from a press desperate to damage Donald J. Trump.  The media needs to put politics aside and focus on informing America.,206,195,1,6,,1,3,,10157441154553472,/story.php?story_fbid=10157441154553472&id=130467958471
Jason Lewis,,2020-04-14 15:14:00,More Americans are afraid of what coronavirus will do to our economy than they are of the virus itself. To avoid a deadly economic collapse we need to reopen for business. We can protect the most vulnerable and the economy at the same time!,178,163,1,14,,,,,10157444133198472,/story.php?story_fbid=10157444133198472&id=130467958471
Jason Lewis,,2020-04-09 18:38:50,"#ThrowbackThursday — Circa ’63. Here I am with my brothers, sisters, Beau (our dog), and mom (Mom was a Twin Cities native) on our way to celebrate Easter in the Amana Colonies, Iowa! #TBT",79,68,1,10,,,,,10157426602733472,/story.php?story_fbid=10157426602733472&id=130467958471
Jason Lewis,,2020-04-08 18:41:57,There are many lessons to be learned from the coronavirus pandemic.‬ ‪One lesson must be eliminating our dependence on foreign manufacturing for life saving supplies and medicine.‬ ‪Especially a foreign power like communist China who caused this crisis! ‬,213,209,1,3,,,,,10157423375833472,/story.php?story_fbid=10157423375833472&id=130467958471
Jason Lewis,,2020-04-06 15:01:06,Globalism is what got us into this mess... Now Hollywood along with the WHO are putting on “One World.” We’re in the middle of a global pandemic and the World Health Organization is planning concerts?  Stop the madness!,124,70,9,1,4,3,37,,10157416742108472,/story.php?story_fbid=10157416742108472&id=130467958471
Jason Lewis,,2020-04-03 21:22:17,I’m old enough to remember the time Governor Walz assured us it wasn’t a lockdown and they wouldn’t actually be charging folks.‬ ‪Turns out that was a lie. I support social distancing and protecting the vulnerable.‬ ‪But not indefinite government mandated house arrest!‬,218,82,,2,18,2,114,,10157407819073472,/story.php?story_fbid=10157407819073472&id=130467958471
Jason Lewis,,2020-04-06 12:01:48,"This should send a chill down every American’s spine.  We can’t let Communist China use this crisis to reinvent the global order.  Don’t be fooled: this virus started in China, they lied about it since day one, and now they must be held accountable.",193,122,2,2,4,2,61,,10157416294558472,/story.php?story_fbid=10157416294558472&id=130467958471
Jason Lewis,,2020-04-05 21:38:03,‪The media’s rabid insistence on snuffing out hope and optimism in the midst of this #Covid_19 pandemic has been nothing short of nauseating. ‬ ‪#TrumpDerangementSyndrome is very real.‬,173,157,5,6,,3,2,,10157414729733472,/story.php?story_fbid=10157414729733472&id=130467958471
Jason Lewis,,2020-04-03 15:48:27,"Another great story of a Minnesota small business stepping up to battle coronavirus. Small businesses are being hit hard by Governor Tim Walz’s lockdown, yet even through the struggle we see signs of hope. Thank you Gemini Athletic Wear for doing this!",155,149,,6,,,,,10157406817278472,/story.php?story_fbid=10157406817278472&id=130467958471
Jason Lewis,,2020-04-04 15:14:01,Inspector General Horowitz reviewed 29 FISA cases and found each one riddled with errors.  Add that to long list of errors found in the Carter Page case in December. It’s too late for reform. We must protect civil liberties and do away with the secret court.  Read more at Alpha News.,143,132,,10,1,,,,10157410120443472,/story.php?story_fbid=10157410120443472&id=130467958471
Jason Lewis,,2020-04-02 15:52:07,"‪We can’t continue to flirt with the point of no return for Main Street in Minnesota and across the US. ‬ ‪In just 2 weeks, 10 million people are now jobless, and still rising.‬ ‪It’s unsustainable. We must untie the hands of small business owners, before it’s too late!",102,90,1,4,1,6,,,10157403374083472,/story.php?story_fbid=10157403374083472&id=130467958471
Jason Lewis,,2020-04-01 10:59:17,"‪The University of Minnesota is shortchanging students by only refunding a small percentage of room and board. ‬ ‪While we’re all tightening our belts, they’re trying to pocket some extra cash on the backs of indebted students. ‬ ‪Unacceptable! Appropriate refunds should be given NOW!‬",83,37,,1,6,3,36,,10157399075998472,/story.php?story_fbid=10157399075998472&id=130467958471
Jason Lewis,,2020-03-27 17:22:01,Governor Tim Walz doesn’t want it called a “lockdown” or a “shelter-in-place”—he prefers softer terminology. He’s asking people to “voluntarily stay at home.” And if you don’t you’ll be arrested and fined—nothing about this is voluntary or constitutional.,138,72,6,1,15,3,41,,10157382494488472,/story.php?story_fbid=10157382494488472&id=130467958471
,,2020-03-25 19:30:39,,127,114,1,10,,,2,,519337932351453,/story.php?story_fbid=519337932351453&id=130467958471
Jason Lewis,,2020-03-25 18:29:15,"Some medical experts are suggesting a shelter in place order may be counterproductive. Even worse, this extreme social distancing has very real social and economic consequences. You can't halt the nation’s workforce and not expect inevitable ramifications.",89,80,1,5,,2,1,,10157375570578472,/story.php?story_fbid=10157375570578472&id=130467958471
Jason Lewis,,2020-03-24 12:12:15,"‪Protecting vulnerable citizens & keeping our economy going are NOT mutually exclusive.‬ ‪While we must continue best practices, social distancing & continue battling COVID19, we must ask ourselves if we’re implementing a cure worse than the disease itself.‬",67,63,1,2,,1,,,10157371051848472,/story.php?story_fbid=10157371051848472&id=130467958471
Jason Lewis,,2020-03-23 12:59:50,"From medicine to vital minerals, the United States is FAR too reliant on China. ”America First” starts with getting Minnesota's Iron Range going.  We are too dependent on foreign countries, and we don't have to be! The Iron Range has some of the largest mineral deposits in the world. We need to use safe and responsible mining to tap into our vast natural resources and put ""America First."" Having visited many towns in the Iron Range -- including Ely, Hibbing, and Virginia (the towns mentioned in the story) -- my takeaway is folks are ready to walk away from the Democratic Party.",88,84,2,2,,,,,10157367632158472,/story.php?story_fbid=10157367632158472&id=130467958471
Jason Lewis,,2020-03-22 11:55:47,"‪Is globalism so grand that we expose ourselves to the very serious health and financial risks of DENV, MERS, SARS, Ebola, COVID-19, or any other infectious disease with uncontrolled cross-border migration? ‪We did it for terrorism...‬ ‪It’s now time to do it for the third leading cause of death in the United States, infectious disease. ‪Read my latest Alpha News:",61,56,3,2,,,,,10157363654873472,/story.php?story_fbid=10157363654873472&id=130467958471
Jason Lewis,,2020-03-21 13:18:38,Thanks to all the Trump for President and Lewis for Senate volunteers who are hard at work today for our National Day of Action. What better way to spend your Saturday quarantine than making some calls from home to help the cause? Visit  to join the team and lend a hand! ,52,44,2,6,,,,,10157359888253472,/LewisForMN/photos/a.252013348471/10157359888253472
