source,shared_from,date,text,reactions,likes,ahah,love,wow,sigh,grrr,comments,post_id,url
David Perdue,,2020-01-08 16:00:36,President Trump has been clear: Iran’s destabilizing behavior will not be tolerated.  My hope is that Iran and its proxy forces will heed the President’s warnings and embrace a peaceful way forward with the United States and our allies.,281,249,12,17,1,,2,44,1436815886485871,/story.php?story_fbid=1436815886485871&id=159597424207730
David Perdue,,2020-01-07 09:35:43,"I’m joining Senator Josh Hawley and nine of our colleagues in introducing a resolution that would allow dismissal of articles of impeachment for lack of prosecution within 25 days. The impeachment process Democrats carried out in the U.S. House was nothing more than a partisan show trial. Now, both Speaker Pelosi & Leader Schumer are trying to bring these political games to the Senate. President Trump deserves his day in court and, as I’ve said, the Senate is prepared to conduct a fair trial. However, if the House simply refuses to send over the articles, the Senate should have the ability to dismiss, move on, and focus on delivering real results for the American people.",1.3K,1.1K,27,137,3,1,15,151,1435489509951842,/story.php?story_fbid=1435489509951842&id=159597424207730
"David Perdue,David Perdue",David Perdue,2020-01-07 08:20:34,"2020 is here. The future of our Republic is at stake.  📺 Watch this video to see why it's so critical that we win in Georgia in 2020! 📺The stakes couldn't be higher in 2020. The choice in this election is about the future of our Republic, and we MUST send a message that the road to socialism will NEVER run through Georgia!",113,95,7,6,1,1,3,31,1435421559958637,/story.php?story_fbid=1435421559958637&id=159597424207730
David Perdue,,2020-01-06 15:25:38,"President Donald J. Trump deserves his day in court and the United States Senate is prepared to conduct a fair trial.  With that said, if the House refuses to send over the articles of impeachment, the Senate should have the ability to dismiss and move on.",509,452,21,32,,,4,95,1434756593358467,/story.php?story_fbid=1434756593358467&id=159597424207730
David Perdue,,2020-01-06 14:24:10,"Heading into 2020, my number one priority is what it's always been: Getting RESULTS for all of Georgia and all of America.  This year, we have a moment of opportunity to keep up the momentum for our WINNING agenda, which has created one of the greatest economic turnarounds in U.S. history. We must seize this moment of opportunity and continue delivering results.",144,119,10,8,,,7,21,1434710086696451,/story.php?story_fbid=1434710086696451&id=159597424207730
David Perdue,,2020-01-06 09:14:39,"We ended 2019 with momentum, but now that 2020 is here, I’m counting on our top supporters more than ever before.  Will you chip in $20.20 for 2020 today and become one of our first OFFICIAL 2020 donors?",51,37,9,3,1,,1,21,1434457860055007,/story.php?story_fbid=1434457860055007&id=159597424207730
David Perdue,,2020-01-03 07:53:39,"Since day one, President Donald J. Trump has been clear: When American lives are threatened, he will not hesitate to act with strength.  Iranian General Soleimani and his terrorist Quds Force ruthlessly orchestrated the deaths of countless Americans. Justice has been served.",724,633,4,78,1,1,7,88,1431369993697127,/story.php?story_fbid=1431369993697127&id=159597424207730
David Perdue,,2020-01-02 20:00:04,"2020 is here. The future of our Republic is at stake. The choice is simple: Will we keep up the momentum for President Trump’s winning agenda, or will we go the way of countries that have failed because of socialism? If we get this right, we can continue unleashing our economic potential. We can continue rebuilding our military. We can continue confirming judges who defend the Constitution. If we fail, radical Democrats will bring their socialist agenda to the U.S. Senate. They will push for higher taxes, government-run health care, the “Green New Deal,” and open borders. And they will transform America by abolishing the Electoral College and packing the Supreme Court with liberal justices. Victory – and stopping the radical Left – starts with YOU. Join Team Perdue today:",177,144,16,13,,,4,50,1430572573776869,/story.php?story_fbid=1430572573776869&id=159597424207730
David Perdue,,2020-01-02 13:13:16,"Total state control leads to less freedom. It leads to a bigger, more powerful government that controls entire aspects of your life. This ideology has failed the people it claims to champion everywhere it’s been tried. Having lived and worked around the world, I have seen this total failure firsthand. Alarming trends, like this, are why we must continue to call out politicians embracing a radical agenda that would take us down this dangerous road.",979,304,18,5,39,209,404,374,1430620157105444,/story.php?story_fbid=1430620157105444&id=159597424207730
David Perdue,,2020-01-02 08:41:17,"Unemployment = falling.  Wages = rising.  As we start a new year, it's clear that despite distractions, gridlock, and historic obstructionism from Democrats, President Donald J. Trump's economic agenda is working!  It's critical that we keep up the momentum for our winning agenda in 2020.",803,672,21,106,1,,3,70,1430361720464621,/story.php?story_fbid=1430361720464621&id=159597424207730
David Perdue,,2020-01-01 12:00:00,Bonnie and I wish each of a happy and prosperous New Year!,135,128,,5,,,2,22,1430354400465353,/story.php?story_fbid=1430354400465353&id=159597424207730
David Perdue,,2019-12-31 11:24:35,This is your last chance in 2019 to send a message that the road to socialism will NEVER run through Georgia. Will you chip in $10 or more BEFORE 11:59 PM to help us start 2020 with momentum?  https://secure.winred.com/david-perdue/2019-december-deadline,75,56,13,4,1,,1,40,1428233277344132,/story.php?story_fbid=1428233277344132&id=159597424207730
David Perdue,,2019-12-30 09:55:11,"Since President Donald J. Trump took office, the U.S. Senate has confirmed 187 federal judges, including two Supreme Court justices. This is HUGE for our country's future. These judges are protecting liberty and upholding the Constitution.",395,326,3,54,,1,11,59,1426922697475190,/story.php?story_fbid=1426922697475190&id=159597424207730
David Perdue,,2019-12-27 08:00:19,"Georgia will decide who controls the White House and U.S. Senate in 2020. In order to win, we must build the strongest grassroots team in our state's history. Sign up to join Team Perdue and get updates here.",224,198,12,14,,,,40,1423212154512911,/story.php?story_fbid=1423212154512911&id=159597424207730
David Perdue,,2019-12-26 17:25:46,"Last week, President Donald J. Trump signed permanent funding for Historically Black Colleges & Universities into law. The FUTURE Act permanently funds HBCUs and minority-serving institutions. It also simplifies the FAFSA form that over 20 million American families fill out each year to qualify for federal student aid. Put simply, America succeeds when our HBCUs succeed. They have played a key role in educating minority students for over 180 years. This bill will ensure that important work continues. We’ve also made it easier to apply for federal financial aid, so that all students can gain the skills they need to pursue their career of choice.  As a member of the HBCU Caucus, I couldn’t be more encouraged about the future of minority-serving institutions and their contributions to both Georgia and the entire country.",197,179,5,13,,,,22,1423211024513024,/story.php?story_fbid=1423211024513024&id=159597424207730
David Perdue,,2019-12-25 08:44:12,"From our family to yours, Merry Christmas!",658,610,2,44,,,2,99,1421807677986692,/story.php?story_fbid=1421807677986692&id=159597424207730
David Perdue,,2019-12-22 16:27:56,Happy Hanukkah and Chag Sameach to all celebrating the Festival of Lights!,94,88,,6,,,,10,1419113278256132,/story.php?story_fbid=1419113278256132&id=159597424207730
David Perdue,,2019-12-19 13:29:39,"🚨 BIG NEWS 🚨 Georgia's unemployment rate is 3.3%. That's the lowest rate ever recorded in our state's history!  This is the direct result of 17 years of responsible Republican leadership in Georgia, combined with President Trump's WINNING economic agenda.",513,438,17,52,5,,1,49,1415912478576212,/story.php?story_fbid=1415912478576212&id=159597424207730
David Perdue,,2019-12-19 10:18:28,The American people already see House Democrats' show trial for what it was: One political party attempting to remove President Donald J. Trump from office rather than face him again in 2020.,444,363,24,12,2,14,29,97,1415765741924219,/story.php?story_fbid=1415765741924219&id=159597424207730
David Perdue,,2019-12-19 09:30:22,Johnny Isakson's legacy in the United States Senate goes beyond any piece of legislation. He has taught all of us what it means to be a true statesman. He has brought dignity and respect to the Senate. He has made Georgia proud.,197,166,10,10,,1,10,51,1415725751928218,/story.php?story_fbid=1415725751928218&id=159597424207730
David Perdue,,2019-12-17 16:38:33,"Without question, this year’s defense authorization bill delivers results for our military. It provides the resources necessary to continue carrying out President Trump’s National Defense Strategy.  Most importantly, completing the defense bill means Congress can finally move on to passing defense appropriations this week, which will allow our military to stop operating under an insidious “continuing resolution.”  The world is more dangerous today than any time in my lifetime, and yet Congress has been locked in a cycle of “CRs” that cost our military billions and prevent the Pentagon from improving readiness, modernizing hardware, and taking care of those in uniform. Getting this defense bill across the finish line is a major win for Georgia’s military. However, we must not forget that it was held up for months over partisan political issues that have nothing to do with protecting the United States.",101,88,5,5,1,1,1,27,1414073995426727,/story.php?story_fbid=1414073995426727&id=159597424207730
David Perdue,,2019-12-17 12:01:57,"Cartels are the worst of humanity. They terrorize innocent families and exploit children in order to fuel the drug trade and other illicit activity. They must face severe consequences for the terror they inflict, and this plan is an important first step to putting them out of business once and for all.",69,58,4,6,,1,,26,1413882988779161,/story.php?story_fbid=1413882988779161&id=159597424207730
David Perdue,,2019-12-17 09:55:11,"Despite all the noise coming from Washington, and despite the Democrats' impeachment sham, the last week has delivered major results for Georgia and our entire country:  ✅ House Democrats FINALLY agreed to put #USMCA to a vote after over a year of delays.  ✅ A Phase One agreement was reached with China on trade.  ✅ The U.S. Senate confirmed its 50th Circuit Court judge since President Donald J. Trump took office.",211,190,6,14,,,1,46,1413780418789418,/story.php?story_fbid=1413780418789418&id=159597424207730
David Perdue,,2019-12-16 16:04:52,"Flags have been lowered to half-staff in Georgia Airman Apprentice Cameron Scott Walters is laid to rest today. Our thoughts continue to be with his family, friends, and loved ones.",950,467,,42,,436,5,80,1413092545524872,/story.php?story_fbid=1413092545524872&id=159597424207730
David Perdue,,2019-12-15 13:53:34,"Georgians are fed up with the Democrats’ obstruction & impeachment sham. They want results: Growing the economy, rebuilding our military, and leveling the trade playing field.",1.3K,1.1K,34,157,1,1,4,138,1411968632303930,/story.php?story_fbid=1411968632303930&id=159597424207730
David Perdue,,2019-12-14 12:00:00,"President Donald J. Trump is the first president to actually fight for a level playing field with the rest of the world. The breakthrough in negotiations with China shows that the President’s trade strategy, led by Ambassador Lighthizer and Secretary Mnuchin, is clearly delivering positive results. A Phase One agreement is a critical first step that will help American workers, farmers, and businesses gain equal access to China’s markets and keep up momentum for further negotiations.  While Senator Steve Daines and I are not involved in the process, on a recent trip to Beijing, we made it clear that President Trump has strong support from Congress for his administration’s trade positions. We emphasized that we support the incremental approach that ultimately led to this Phase One agreement.  I congratulate negotiators and leadership on this breakthrough. While there is a lot left to do, this is a very encouraging first step in rebalancing our trade relationship with China.",321,288,18,15,,,,17,1411966978970762,/story.php?story_fbid=1411966978970762&id=159597424207730
David Perdue,,2019-12-12 12:21:06,The U.S. Senate has now confirmed 50 Circuit Court judges nominated by President Donald J. Trump! One in four Circuit Court judges on the bench have been nominated by this President. That is huge for our country's future.,493,422,2,52,,2,15,59,1408801882620605,/story.php?story_fbid=1408801882620605&id=159597424207730
David Perdue,,2019-12-12 09:47:19,Drug cartels inflict terror in the United States and around the world. They must face severe consequences. That's why I'm joining Senator Tom Cotton in cosponsoring a plan to subject these drug cartels to the same level of sanctions as terrorist groups.,71,64,3,2,,1,1,20,1408681122632681,/story.php?story_fbid=1408681122632681&id=159597424207730
David Perdue,,2019-12-11 11:58:42,2020 is almost here. Control of the White House and U.S. Senate will be decided in Georgia. Victory starts with YOU. Take our OFFICIAL 2020 Victory Survey now!,91,80,8,1,,,2,31,1407792049388255,/story.php?story_fbid=1407792049388255&id=159597424207730
David Perdue,,2019-12-10 14:20:48,"President Donald J. Trump is fighting for our workers, farmers, and manufacturers. There is no better evidence of this than his commitment to getting better trade deals with countries around the world. USMCA is a groundbreaking deal. It will dramatically improve the way we do business with close trading partners.  USMCA will create nearly 180,000 new jobs. It will increase our GDP by $68 billion. Not only will it continue America’s historic economic turnaround, it will give the President negotiating power in trade talks with China and other countries.  Frankly, the American people should be outraged that Democrats in the House have held this deal hostage while aimlessly pursuing an illegitimate impeachment trial. It shouldn’t have taken over a year to get here, but finally, we will have the opportunity to deliver this huge win for the entire country.",434,370,27,29,1,3,4,75,1406911516142975,/story.php?story_fbid=1406911516142975&id=159597424207730
David Perdue,,2019-12-09 11:55:19,"Bonnie and I are sending our prayers to the families of the Naval Air Station Pensacola shooting victims, including Airman Apprentice Walters of Richmond Hill, Georgia, who had just graduated from boot camp.  These sailors showed tremendous courage. They will be remembered as heroes.",457,136,,14,1,303,3,43,1405783749589085,/story.php?story_fbid=1405783749589085&id=159597424207730
David Perdue,,2019-12-06 10:45:52,"The November jobs report is more proof that our agenda is working!  -266,000 jobs created.  -Wages have risen 3.1% in the last year.  -Overall unemployment is at 3.5%, a 50 YEAR LOW.",242,201,9,30,,,2,34,1402701366563990,/story.php?story_fbid=1402701366563990&id=159597424207730
David Perdue,,2019-12-05 13:48:22,The U.S. Senate has now confirmed 170 judges since President Trump took office. This is huge for our country. These judges are defending and upholding the Constitution!,517,439,5,63,1,5,4,54,1401825686651558,/story.php?story_fbid=1401825686651558&id=159597424207730
David Perdue,,2019-12-05 10:51:48,REMINDER: Democrats have been trying to impeach President Donald J. Trump since the day he took office. Literally.,606,204,11,3,14,60,314,142,1401640450003415,/story.php?story_fbid=1401640450003415&id=159597424207730
David Perdue,,2019-12-03 16:45:57,"Today, I was honored to pay tribute to my friend and colleague, Johnny Isakson, who is retiring at the end of the month. Johnny helped me transition into the U.S. Senate. He befriended me, advised me, and introduced me to new colleagues. He's been the best partner anyone could ask for.  A lot of people in Washington know how to talk. Johnny has shown how important it is to listen to one another and learn.  It's been a blessing to serve with him.",403,362,3,37,,,1,39,1399642920203168,/story.php?story_fbid=1399642920203168&id=159597424207730
David Perdue,,2019-12-03 08:51:33,"It has now been OVER A YEAR since President Donald J. Trump signed the USMCA. Yet Speaker Pelosi STILL hasn't brought it up for a vote in the House.  USMCA would mean 176,000 jobs. It would boost our economy by $68 billion. This is a good deal. The American people want this deal.  It's past time for Congress to start LEGISLATING and stop investigating!",701,567,6,19,5,14,90,115,1399171963583597,/story.php?story_fbid=1399171963583597&id=159597424207730
David Perdue,,2019-12-02 08:52:21,"Unleashing America's energy potential has been part of the overall strategy to get our economy going again. Just as we're seeing results in other areas, we're seeing results here too. This is huge for our economy.",161,129,4,22,4,,2,23,1398123903688403,/story.php?story_fbid=1398123903688403&id=159597424207730
David Perdue,,2019-11-28 17:12:17,"Bonnie and I hope you’re enjoying Thanksgiving Day with family, friends, and loved ones.  I also hope you’ll join us in sending our best wishes to those who are spending today away from their loved ones because they are protecting us. Our service members, law enforcement officers, and first responders represent the best, and I mean the very best, our country has to offer.  Bonnie and I are thankful for the opportunity to serve the people of Georgia in the United States Senate. We’re also truly grateful for your prayers and support on this journey.  Thank you again for everything. Happy Thanksgiving!",246,224,4,18,,,,21,1394416557392471,/story.php?story_fbid=1394416557392471&id=159597424207730
David Perdue,,2019-11-26 12:03:20,"Bonnie and I send our deepest sympathies to Jay’s wife, Deidra, and the entire Powell family. Jay served the people of Camilla and our entire state with the highest level of integrity.",105,30,,1,4,70,,5,1392190067615120,/story.php?story_fbid=1392190067615120&id=159597424207730
David Perdue,,2019-11-25 10:28:32,I need supporters like you to step up so we can keep Georgia red. Will you pitch in $10 or whatever you can afford right now to help us hit our goal for this month?,54,35,13,5,,,1,34,1391094981057962,/story.php?story_fbid=1391094981057962&id=159597424207730
David Perdue,,2019-11-22 10:54:53,"Violence of any kind, especially against women, is reprehensible. I’m proud to support Senator Joni Ernst's effort to combat domestic violence and better support survivors with the Violence Against Women Reauthorization Act of 2019.  For over two decades, this initiative has made a difference in the lives of women who have gone through extreme trauma. Partisan politics should never stand in the way of this initiative. Senator Ernst has been a warrior in leading this effort, and I’m grateful for her leadership.",142,128,4,10,,,,32,1387948844705909,/story.php?story_fbid=1387948844705909&id=159597424207730
David Perdue,,2019-11-21 15:35:03,"Earlier today, I voted against the so-called “continuing resolution” to keep the federal government’s lights on until December.  Let’s be clear: The only reason the Senate did not work through the August recess this year was because a bipartisan deal was reached in July to fund the government on time, and without partisan “poison pill” amendments. But Senate Democrats turned their back on that agreement. They should be ashamed of themselves.  Furthermore, since September, Democrats have blocked funding for our military at every turn. They have forced our women and men in uniform to operate from one “CR” to the next. Democrats know that these “CRs” cost the military billions every year, yet they continually refuse to negotiate in good faith.  Kicking the can down the road to December does nothing to solve the real issues here. Congress should work every single day and night to solve this funding crisis. Nothing about this will really change until we fix the way Congress funds the federal government and start holding politicians responsible for failure.",594,448,11,7,8,32,88,106,1387123384788455,/story.php?story_fbid=1387123384788455&id=159597424207730
David Perdue,,2019-11-21 09:51:33,This week's hearings have been a sham and nothing more than a continuation of the historic obstruction we've seen since President Donald J. Trump took office.,370,258,27,6,3,10,66,97,1386865834814210,/story.php?story_fbid=1386865834814210&id=159597424207730
David Perdue,,2019-11-20 23:29:03,"In tonight's debate in Atlanta, we again saw a Democrat Party that is totally out of touch and is only drifting further and further to the Left.  These Democrats debated in Georgia because they believe they can win in Georgia. We must not let that happen! Join our team today, and let's send a message that the road to socialism will NEVER run through Georgia!",442,373,32,27,4,4,2,55,1386448434855950,/story.php?story_fbid=1386448434855950&id=159597424207730
David Perdue,,2019-11-20 20:14:54,"In less than an hour, the country's most liberal Democrat politicians are flooding the airwaves with their radical, socialist ideas.  They will attempt to paint a rosy picture of policies that have failed everywhere they've been tried.",245,152,30,3,4,9,47,72,1386315451535915,/story.php?story_fbid=1386315451535915&id=159597424207730
David Perdue,,2019-11-20 16:03:21,"Here's what USMCA would mean for American workers and businesses. It should be a bipartisan win for the American people.  Instead, it's still being delayed by House Democrats who are fixated on impeaching President Trump.",63,44,6,1,1,3,8,18,1386153004885493,/story.php?story_fbid=1386153004885493&id=159597424207730
David Perdue,,2019-11-20 13:03:22,"The free-market system creates opportunity in America. Take a man named JL Turner. His father died when he was 11 years old, and he had to feed his family. JL was functionally illiterate but started a general store in Scottsville, Kentucky, in 1939. The business grew, and his stores eventually became known as Dollar General. Years later, I was humbled to serve as the company’s first non-family CEO. Today, Dollar General is a Fortune 500 company with more than 135,000 employees and $25 billion in revenues, and it underwrites one of the country’s largest literacy foundations. Dollar General’s success story COULD NOT exist in a socialist society where the state controls the economy and makes decisions for individuals.",312,262,18,22,7,2,1,41,1386031134897680,/story.php?story_fbid=1386031134897680&id=159597424207730
David Perdue,,2019-11-20 11:00:01,Always remember this: The price of socialism is FREEDOM!,136,110,15,4,1,3,3,35,1385915841575876,/story.php?story_fbid=1385915841575876&id=159597424207730
David Perdue,,2019-11-20 08:30:16,"If Democrats win the White House, take the Senate majority, and keep the House, they will create a socialist regime to change the very fabric of America. The choice in 2020 is not about personality. It is about what kind of nation we will leave for our children and our children’s children. It is about America’s national interest versus political self-interest. It is about self-determination versus total state control. It is about preserving America’s founding principles. Always remember: The price of socialism is freedom.",369,237,18,7,1,61,45,95,1385773488256778,/story.php?story_fbid=1385773488256778&id=159597424207730
David Perdue,,2019-11-20 07:45:38,I'm joining Fox Business at 8:00 AM to discuss tonight's Democrat debate in Atlanta. Tune in if you can!,77,59,11,5,,,2,25,1385772631590197,/story.php?story_fbid=1385772631590197&id=159597424207730
David Perdue,,2019-11-19 14:16:25,"When President Donald J. Trump took office, he said that job one was to get the economy going again. We took action to do the following:  -Roll back ridiculous, overreaching federal regulations.  -Unleash America’s energy potential.  -Cut taxes and change the tax code to make us more competitive globally.  -Undo the most onerous parts of Dodd-Frank.  As a result of these actions, we are seeing the greatest economic turnaround in U.S. history:  -Over 6 million new jobs have been created.  -African-American and Hispanic unemployment is the lowest ever measured.  -Median household income is the highest it’s been in U.S. history.  -Overall unemployment is at a 50-year low.  We can’t turn back now. We must keep up the momentum for our agenda, because it’s working. However, all 10 of the Democrats debating in Atlanta tomorrow night would undo these results. They would take us down a path of more government and less freedom.  The choice in 2020 is real simple. Will we continue unleashing a new era of economic prosperity and opportunity, or will we go down the road to socialism, which has failed everywhere it has been tried?",349,297,20,29,1,1,1,46,1385085064992287,/story.php?story_fbid=1385085064992287&id=159597424207730
David Perdue,,2019-11-19 11:04:21,The radical agenda supported by the Democrats coming to Georgia for tomorrow's debate would wipe out hundreds of thousands of American jobs. It would totally erase the positive results we've delivered over the last two years.,647,172,21,,25,53,376,175,1384943881673072,/story.php?story_fbid=1384943881673072&id=159597424207730
