source,shared_from,date,text,reactions,likes,ahah,love,wow,sigh,grrr,comments,post_id,url
David Perdue,,2019-09-09 13:00:02,The coming weeks are the most critical yet. Georgia is receiving even more attention from the national liberal media. Big donors who already planned to spend millions are doubling down on their investment.  We’re up against a massive effort. It’s unlike anything we have ever seen before. We simply won’t win without you. Your support is absolutely critical to victory in 2020.  Join Team Perdue today:,115,85,16,13,,,1,50,1319285884905539,/story.php?story_fbid=1319285884905539&id=159597424207730
David Perdue,,2019-09-09 09:38:20,"Over the last month, I have traveled around Georgia meeting with Georgians from all walks of life.  We met with local business leaders in Johns Creek for the Greater North Fulton Chamber of Commerce Chairman’s Circle. We toured Mashburn Elementary School in Forsyth County and participated in a roundtable discussion on school safety.  We traveled to Ocilla for a meeting with South Central Primary Care Center, health care professionals, and local officials as part of National Health Center Week. We toured Coley Cotton Farm in Vienna and had a discussion about agriculture, which is Georgia’s number one industry.  We visited employees at the JTEKT-Koyo Bearings manufacturing facility in Dahlonega and KIA Motors Manufacturing Georgia in West Point. I was also honored to speak at the Georgia Chamber’s Annual Congressional Luncheon in Macon.  At these stops and others, we saw time and time again why Georgia is the best state in the country in which to live, and the best state in the country in which to do business.",111,102,6,3,,,,28,1319258358241625,/story.php?story_fbid=1319258358241625&id=159597424207730
David Perdue,,2019-09-04 17:22:47,"Senator Steve Daines and I recently traveled to China with one goal: to reinforce President Trump’s efforts to secure a level playing field with our trading partners. We were there to emphasize that the President and his team have strong support from Congress.  President Trump and President Xi have developed a special relationship. We are hopeful their renewed negotiations lead to a productive conclusion. The President deserves praise for standing up for American workers, farmers, and manufacturers. Clearly, China sees that America is serious about achieving equal access.",235,210,14,10,,,1,28,1315489871951807,/story.php?story_fbid=1315489871951807&id=159597424207730
David Perdue,,2019-09-04 12:41:18,"Governor Kemp has expanded his initial emergency declaration to 21 Georgia counties. Hurricane Dorian has the potential to have a devastating impact on Coastal Georgia. Both Governor Kemp and local officials are preparing for the hurricane and will continue to update Georgians as the situation develops.  I urge Georgians to take precautions and follow advice from local, state, and federal officials. The most important thing right now is to heed warnings and prepare accordingly.",52,50,,1,,1,,5,1315336665300461,/story.php?story_fbid=1315336665300461&id=159597424207730
"David Perdue,Atlanta Braves",Atlanta Braves,2019-09-02 14:16:47,"Very proud of the Atlanta Braves for their generosity in extending this invitation.The Atlanta Braves are extending an invitation to anyone who has evacuated to Atlanta due to mandatory evacuations in anticipation of Hurricane Dorian to be our guests for their games vs. the Toronto Blue Jays on Tuesday, September 3 and the Washington Nationals on Thursday, September 5. In addition, all the proceeds from the 50/50 raffle on those dates will benefit relief efforts for the hurricane.  DETAILS: https://atmlb.com/2UqnRdT",35,34,,1,,,,4,1314526065381521,/story.php?story_fbid=1314526065381521&id=159597424207730
"David Perdue,Governor Brian Kemp",Governor Brian Kemp,2019-08-31 09:36:54,"Both Governor Kemp and local authorities are preparing for this storm. Please take this storm seriously and heed all advice from local, state, and federal officials.Hurricane Dorian projections have now shifted more toward Coastal Georgia. I urge Georgians in these areas to stay vigilant, keep an eye on storm developments, and take all necessary precautions.",54,47,,2,4,1,,4,1312371485596979,/story.php?story_fbid=1312371485596979&id=159597424207730
David Perdue,,2019-08-29 18:30:18,"Governor Kemp has declared a state of emergency in several Georgia counties. When preparing for Dorian, please heed warnings from local & state officials. Read more here:",15,15,,,,,,2,1311022299065231,/story.php?story_fbid=1311022299065231&id=159597424207730
David Perdue,,2019-08-28 14:10:38,"When Johnny Isakson speaks, people listen. Johnny is a true statesman, and it shows every single day. It’s an honor to serve as his partner in the U.S. Senate. Like so many Georgians, I was both surprised and saddened to hear that he will not finish the rest of his term.  Together, we have been able to get real results for Georgia. Throughout Johnny’s four decades of service, he has always been a champion for all of Georgia, and especially for our veterans. Bonnie and I are grateful for Johnny and Dianne’s leadership and proud to call them our friends.",228,208,6,5,,9,,26,1310165525817575,/story.php?story_fbid=1310165525817575&id=159597424207730
David Perdue,,2019-08-27 15:28:53,"LET’S SET A RECORD: If everyone who sees this message chips in – even just $1 – we will set a record for individual donors to our Outsider movement in a single month.  I can’t think of a better way to send radical Democrats a message, TOGETHER, that the road to socialism will NEVER run through Georgia!  Will you rush a donation of whatever you can afford right now to help us set a record?",35,25,7,2,,,1,23,1309449312555863,/story.php?story_fbid=1309449312555863&id=159597424207730
David Perdue,,2019-08-26 20:25:02,"The new trade deal with Japan is a major win for farmers, ranchers, and manufacturers in Georgia and around the country. President Donald J. Trump deserves credit for reengaging with our allies and working towards a level playing field on trade around the world.",307,287,10,10,,,,21,1308855795948548,/story.php?story_fbid=1308855795948548&id=159597424207730
David Perdue,,2019-08-26 19:00:01,"I joined First Lady Marty Kemp, and State Schools Superintendent Richard Woods for a tour of Mashburn Elementary School in Forsyth County and conversation about security upgrades made for this school year.",82,77,2,2,,,1,12,1308767272624067,/story.php?story_fbid=1308767272624067&id=159597424207730
David Perdue,,2019-08-26 10:04:12,"Bonnie is an amazing wife, mother, and grandmother. Blessed to have another year with her. Happy Anniversary; I love you!",547,489,1,57,,,,118,1308545679312893,/story.php?story_fbid=1308545679312893&id=159597424207730
David Perdue,,2019-08-25 21:00:00,"We're building the largest and strongest grassroots team in Georgia's history, and I want you to be part of the effort.  Join #TeamPerdue today:",104,82,12,9,,,1,16,1308523452648449,/story.php?story_fbid=1308523452648449&id=159597424207730
David Perdue,,2019-08-24 15:47:49,Back home in Houston County for the 8th District GOP's annual Fish Fry. Strong crowd that's fired up and ready to WIN in 2020!,298,278,6,14,,,,27,1307301216104006,/story.php?story_fbid=1307301216104006&id=159597424207730
David Perdue,,2019-08-23 14:00:01,"Signing up for mobile alerts will guarantee you're updated on campaign strategy, upcoming events in your area, and ways you can help the campaign. They're the fastest way to get the latest breaking news.  Sign up here:",15,13,2,,,,,11,1306407709526690,/story.php?story_fbid=1306407709526690&id=159597424207730
David Perdue,,2019-08-23 10:45:01,"Enjoyed spending some time with Mr. Richard Little, who served in the 101st Airborne and parachuted into Normandy. They began their training in Toccoa, Georgia. The Greatest Generation’s service and sacrifice in defense of freedom around the world will never be forgotten.",274,261,,12,,,1,22,1306414559526005,/story.php?story_fbid=1306414559526005&id=159597424207730
David Perdue,,2019-08-21 08:17:01,"Yesterday, I had a great evening of candid conversation in Atlanta with my friend Cory Ruth and Political Cocktails. Grateful for the opportunity.",119,105,5,8,,,1,22,1304767129690748,/story.php?story_fbid=1304767129690748&id=159597424207730
David Perdue,,2019-12-27 08:00:19,"Georgia will decide who controls the White House and U.S. Senate in 2020. In order to win, we must build the strongest grassroots team in our state's history. Sign up to join Team Perdue and get updates here.",224,198,12,14,,,,40,1423212154512911,/story.php?story_fbid=1423212154512911&id=159597424207730
David Perdue,,2019-12-26 17:25:46,"Last week, President Donald J. Trump signed permanent funding for Historically Black Colleges & Universities into law. The FUTURE Act permanently funds HBCUs and minority-serving institutions. It also simplifies the FAFSA form that over 20 million American families fill out each year to qualify for federal student aid. Put simply, America succeeds when our HBCUs succeed. They have played a key role in educating minority students for over 180 years. This bill will ensure that important work continues. We’ve also made it easier to apply for federal financial aid, so that all students can gain the skills they need to pursue their career of choice.  As a member of the HBCU Caucus, I couldn’t be more encouraged about the future of minority-serving institutions and their contributions to both Georgia and the entire country.",197,179,5,13,,,,22,1423211024513024,/story.php?story_fbid=1423211024513024&id=159597424207730
David Perdue,,2019-12-22 16:27:56,Happy Hanukkah and Chag Sameach to all celebrating the Festival of Lights!,94,88,,6,,,,10,1419113278256132,/story.php?story_fbid=1419113278256132&id=159597424207730
David Perdue,,2019-12-19 10:18:28,The American people already see House Democrats' show trial for what it was: One political party attempting to remove President Donald J. Trump from office rather than face him again in 2020.,444,363,24,12,2,14,29,97,1415765741924219,/story.php?story_fbid=1415765741924219&id=159597424207730
David Perdue,,2019-12-19 09:30:22,Johnny Isakson's legacy in the United States Senate goes beyond any piece of legislation. He has taught all of us what it means to be a true statesman. He has brought dignity and respect to the Senate. He has made Georgia proud.,197,166,10,10,,1,10,51,1415725751928218,/story.php?story_fbid=1415725751928218&id=159597424207730
David Perdue,,2019-12-17 12:01:57,"Cartels are the worst of humanity. They terrorize innocent families and exploit children in order to fuel the drug trade and other illicit activity. They must face severe consequences for the terror they inflict, and this plan is an important first step to putting them out of business once and for all.",69,58,4,6,,1,,26,1413882988779161,/story.php?story_fbid=1413882988779161&id=159597424207730
David Perdue,,2019-12-12 09:47:19,Drug cartels inflict terror in the United States and around the world. They must face severe consequences. That's why I'm joining Senator Tom Cotton in cosponsoring a plan to subject these drug cartels to the same level of sanctions as terrorist groups.,71,64,3,2,,1,1,20,1408681122632681,/story.php?story_fbid=1408681122632681&id=159597424207730
David Perdue,,2019-12-10 14:20:48,"President Donald J. Trump is fighting for our workers, farmers, and manufacturers. There is no better evidence of this than his commitment to getting better trade deals with countries around the world. USMCA is a groundbreaking deal. It will dramatically improve the way we do business with close trading partners.  USMCA will create nearly 180,000 new jobs. It will increase our GDP by $68 billion. Not only will it continue America’s historic economic turnaround, it will give the President negotiating power in trade talks with China and other countries.  Frankly, the American people should be outraged that Democrats in the House have held this deal hostage while aimlessly pursuing an illegitimate impeachment trial. It shouldn’t have taken over a year to get here, but finally, we will have the opportunity to deliver this huge win for the entire country.",434,370,27,29,1,3,4,75,1406911516142975,/story.php?story_fbid=1406911516142975&id=159597424207730
David Perdue,,2019-12-03 08:51:33,"It has now been OVER A YEAR since President Donald J. Trump signed the USMCA. Yet Speaker Pelosi STILL hasn't brought it up for a vote in the House.  USMCA would mean 176,000 jobs. It would boost our economy by $68 billion. This is a good deal. The American people want this deal.  It's past time for Congress to start LEGISLATING and stop investigating!",701,567,6,19,5,14,90,115,1399171963583597,/story.php?story_fbid=1399171963583597&id=159597424207730
David Perdue,,2019-12-02 08:52:21,"Unleashing America's energy potential has been part of the overall strategy to get our economy going again. Just as we're seeing results in other areas, we're seeing results here too. This is huge for our economy.",161,129,4,22,4,,2,23,1398123903688403,/story.php?story_fbid=1398123903688403&id=159597424207730
David Perdue,,2019-11-20 13:03:22,"The free-market system creates opportunity in America. Take a man named JL Turner. His father died when he was 11 years old, and he had to feed his family. JL was functionally illiterate but started a general store in Scottsville, Kentucky, in 1939. The business grew, and his stores eventually became known as Dollar General. Years later, I was humbled to serve as the company’s first non-family CEO. Today, Dollar General is a Fortune 500 company with more than 135,000 employees and $25 billion in revenues, and it underwrites one of the country’s largest literacy foundations. Dollar General’s success story COULD NOT exist in a socialist society where the state controls the economy and makes decisions for individuals.",312,262,18,22,7,2,1,41,1386031134897680,/story.php?story_fbid=1386031134897680&id=159597424207730
David Perdue,,2019-11-19 11:04:21,The radical agenda supported by the Democrats coming to Georgia for tomorrow's debate would wipe out hundreds of thousands of American jobs. It would totally erase the positive results we've delivered over the last two years.,647,172,21,,25,53,376,175,1384943881673072,/story.php?story_fbid=1384943881673072&id=159597424207730
David Perdue,,2019-11-14 10:56:24,"HUGE news: China has lifted its ban on poultry imports from the United States.  Georgia is the #1 poultry producing state in the country, so this expanded access will have a major positive impact on producers in our state.",473,430,5,34,3,,1,26,1379727725528021,/story.php?story_fbid=1379727725528021&id=159597424207730
David Perdue,,2019-11-12 09:28:09,"Yesterday, I was honored to participate in the Veterans Day program at Walk of Heroes Veterans War Memorial in Rockdale County. Thank you to all veterans for your service and sacrifice!",166,149,2,15,,,,11,1377522289081898,/story.php?story_fbid=1377522289081898&id=159597424207730
David Perdue,,2019-11-05 14:57:23,Democrats are once again trying not to fund the military. They are putting politics over our women and men in uniform. They would rather obsess over the sham impeachment proceedings and the border wall than negotiate in good faith to pass the NDAA and fund the military. This is both reckless and ridiculous.,837,429,15,2,10,56,325,121,1370387659795361,/story.php?story_fbid=1370387659795361&id=159597424207730
David Perdue,,2019-10-31 14:03:36,"Today, the U.S. Senate passed a funding package that only deals with about 15% of the federal government’s discretionary budget. That may be a step in the right direction, but there is still no clear path forward for funding our country’s defense priorities.  Washington is heading towards yet another colossal failure when the current short-term “continuing resolution” runs out on November 21. We wouldn’t even be in this position if Democrats had not broken a bipartisan agreement to fund the government on time without “poison pill” amendments. Their unending refusal to negotiate in good faith is leading Congress towards a 188th “continuing resolution,” which would be totally draconian for our military.”  Career politicians are going to pat themselves on the pack for getting a small part of the job done. But until we finally fix the broken funding process used by Congress, and impose harsh consequences for failure, there is no room for celebration.",286,168,4,2,4,35,73,58,1365493160284811,/story.php?story_fbid=1365493160284811&id=159597424207730
David Perdue,,2019-10-29 15:56:38,#USMCA would mean new jobs and $68 billion for our economy.  And House Democrats are holding it up purely because of politics.,147,101,6,1,5,3,31,46,1363616983805762,/story.php?story_fbid=1363616983805762&id=159597424207730
David Perdue,,2019-10-28 16:40:45,"Today, the world is a safer place because of this dog and his human counterparts. An extra treat is well-deserved.",963,768,5,187,3,,,75,1362669093900551,/story.php?story_fbid=1362669093900551&id=159597424207730
David Perdue,,2019-10-24 19:00:19,"Every day, I'm fighting to cut through the gridlock and noise in Washington, but I can't do this without YOU.  Join our team and sign up for campaign updates here.",131,111,12,6,1,,1,30,1358427077658086,/story.php?story_fbid=1358427077658086&id=159597424207730
David Perdue,,2019-10-20 14:25:01,Terrible news from Fort Stewart this morning. Bonnie and I are sending our deepest condolences and prayers to the Fort Stewart-Hunter Army Airfield family and all impacted by this heartbreaking accident.,432,70,2,1,,355,4,52,1354819581352169,/story.php?story_fbid=1354819581352169&id=159597424207730
David Perdue,,2019-10-11 11:23:11,Great news for Tifton and for the entire state of Georgia! Our state is the best state in the country in which to do business.,393,353,5,31,4,,,35,1345976905569770,/story.php?story_fbid=1345976905569770&id=159597424207730
David Perdue,,2019-10-10 19:00:00,"My message last night to the UGA College Republicans in two points.  -Our Founders never envisioned the rise of career politicians. We need term limits for Congress more than ever before.  -Since I came to the U.S. Senate, I've focused on one thing: RESULTS. And whether it's reversing regulations, taking steps to unleash our energy potential, changing the tax code, calling out Washington's broken funding process, or a bipartisan rollback of Dodd-Frank, I've worked with both sides of the aisle to deliver them.",91,76,8,5,,,2,20,1345324708968323,/story.php?story_fbid=1345324708968323&id=159597424207730
David Perdue,,2019-10-10 08:14:14,I had a great time yesterday meeting with the UGA College Republicans. We're ready to WIN in 2020!,319,292,5,21,,,1,35,1344963635671097,/story.php?story_fbid=1344963635671097&id=159597424207730
David Perdue,,2019-10-08 19:00:00,Throwback to great times in Perdue Country five years ago this week!,168,151,5,11,,,1,25,1343575682476559,/story.php?story_fbid=1343575682476559&id=159597424207730
David Perdue,,2019-10-04 10:31:51,The economic turnaround continues:  ✅Lowest overall unemployment in 50 years.  ✅Lowest African-American and Hispanic unemployment ever measured.  ✅Highest middle-class income ever measured.  Promises made. Promises kept.,258,219,12,25,,,2,54,1339841436183317,/story.php?story_fbid=1339841436183317&id=159597424207730
David Perdue,,2019-10-02 09:49:16,"It's been a full year since the USMCA was announced. Mexico has ratified this deal. Canada is in the process of ratifying this deal. It's past time for the U.S. to do the same.  Here's what USMCA would mean for our economy:  -176,000 new jobs.  -$68 billion economic boost. It's time to end the delays and get this deal done for the American people.",202,141,10,6,8,6,31,36,1338137203020407,/story.php?story_fbid=1338137203020407&id=159597424207730
David Perdue,,2019-10-01 08:05:09,"Thanks to supporters like you, not only did we hit our online fundraising goal for this quarter, we EXCEEDED it.  Thanks to supporters like you, we’re keeping up the momentum for our winning agenda.  Thanks to supporters like you, we’re on track to WIN in 2020!",187,174,2,10,,,1,30,1337186116448849,/story.php?story_fbid=1337186116448849&id=159597424207730
David Perdue,,2019-09-30 10:29:01,"WE'RE ALMOST OUT OF TIME: Our most important fundraising deadline yet is at 11:59 PM TONIGHT!  It's critical that we hit our goal for this fundraising quarter. It's critical that we have the resources it takes to respond to false attacks and build the strongest grassroots team in Georgia history.  I'm counting on each of our supporters to step up between now and 11:59 PM TONIGHT. Together, we can crush our goal for this fundraising quarter and keep up the momentum for our winning agenda. Together, we can win in 2020 and continue delivering results for ALL of Georgia.",31,21,9,,1,,,21,1336462886521172,/story.php?story_fbid=1336462886521172&id=159597424207730
David Perdue,,2019-09-28 14:52:20,"THE CLOCK IS TICKING: We've got TWO DAYS left to hit our goal for this quarterly fundraising deadline. I'm asking each of our grassroots supporters and chip in now before it's too late.  The coming days and weeks are critical. It's vital that we have the resources it takes to WIN in 2020. Together, we can send a message that the road to socialism will NEVER run through Georgia!",31,23,6,,,,2,14,1335002470000547,/story.php?story_fbid=1335002470000547&id=159597424207730
David Perdue,,2019-09-24 19:00:00,"After the Oklahoma City Bombing in 1994, designs and security at federal buildings were modernized. Following the terrorist attacks on Sept. 11th, 2001, everything from our airports to sporting venues were rethought to prevent lapses in safety. Yet after years of tragic incidents, little has been done to make school design safer. The private sector is working hard to change that. State and local officials are working hard to change that. The bipartisan School Safety Clearinghouse Act will help them make that change possible so that we can better protect all of our children. Read more:",37,36,,,,1,,14,1331415600359234,/story.php?story_fbid=1331415600359234&id=159597424207730
David Perdue,,2019-09-12 15:29:14,"With China, we've had difficulties when it comes to equal access, intellectual property rights, forced technology transfers, cyber war, and compliance with the WTO.  President Trump has made reasonable requests: Equal access and a level playing field. It's about time we had a President who stood up to China on these issues.",46,42,4,,,,,15,1321886824645445,/story.php?story_fbid=1321886824645445&id=159597424207730
David Perdue,,2019-09-12 11:12:53,"Mexico has already ratified the USMCA. Canada is in the process of doing so. It's past time for Congress to do the same.  The American people want this deal. It would increase our GDP by $68 billion and could potentially create 176,000 new jobs. This is a good deal, and it's time for Congress to put aside political self-interest and get this done.",96,86,4,5,,,1,17,1321733154660812,/story.php?story_fbid=1321733154660812&id=159597424207730
David Perdue,,2019-09-11 15:18:53,"President Trump’s nominee for Secretary of the Air Force, Ambassador Barbara Barrett, is the leader we need to propel the Air Force into the 21st Century. She has years of international business experience and is a respected aeronautics expert.  In my meeting with Ambassador Barrett, we discussed our shared priorities, including the Advanced Battle Management System and the U.S. Space Force. Without a doubt, Ambassador Barrett’s experience as a pilot and astronaut will be a tremendous asset to the Department of Defense as we continue developing our capabilities and countering global threats. Ambassador Barrett has my full support, and I’m confident she will do an excellent job leading the Air Force.",91,86,,4,,1,,11,1321054251395369,/story.php?story_fbid=1321054251395369&id=159597424207730
David Perdue,,2019-09-10 06:39:54,I'll be on Fox Business around 7:00 am this morning. Tune in!,64,56,6,1,,,1,21,1319936781507116,/story.php?story_fbid=1319936781507116&id=159597424207730
David Perdue,,2019-09-09 13:00:02,The coming weeks are the most critical yet. Georgia is receiving even more attention from the national liberal media. Big donors who already planned to spend millions are doubling down on their investment.  We’re up against a massive effort. It’s unlike anything we have ever seen before. We simply won’t win without you. Your support is absolutely critical to victory in 2020.  Join Team Perdue today:,115,85,16,13,,,1,50,1319285884905539,/story.php?story_fbid=1319285884905539&id=159597424207730
