source,shared_from,date,text,reactions,likes,ahah,love,wow,sigh,grrr,comments,post_id,url
David Perdue,,2020-03-05 14:54:19,"Chuck Schumer attacked the country’s highest judicial body yesterday. Threatening two sitting Supreme Court justices is not only disgraceful, it is dangerous. This shows how far the radical left is willing to go to realize their socialist agenda. Schumer’s actions threaten the very balance of our three-branch government. It was irresponsible, inappropriate, and unacceptable. I hope the Senate will stand together and condemn this unacceptable behavior. Of course, Schumer should apologize, but I’m afraid his comments have already caused irreparable damage.",350,295,11,4,4,8,28,93,1486212534879539,/story.php?story_fbid=1486212534879539&id=159597424207730
David Perdue,,2020-03-05 08:00:37,"I never thought in my lifetime we would be having a debate between socialism and free enterprise. But if you’re paying attention to what the Democrats running for President and my opponents in this race are saying, that’s exactly where we are. I welcome that debate and look forward to our opportunity to defend America’s Founding Principles.",192,172,8,4,,1,7,41,1485911061576353,/story.php?story_fbid=1485911061576353&id=159597424207730
David Perdue,,2020-03-04 20:00:00,"It’s been a big week for our campaign! We’ve officially qualified to run for reelection. With a contrast this stark – between our proven record of results for all of Georgia and the Democrats’ radical socialist agenda – we have a message that resonates with all Georgians. We have a statewide grassroots team- organized in all 159 counties, that will be taking that fight and message to every corner of our state, but we need your help to ensure our team has the resources it takes to win. Chip in now to help us hit the ground running.",51,35,10,4,,,2,15,1485157234985069,/story.php?story_fbid=1485157234985069&id=159597424207730
David Perdue,,2020-03-04 11:30:15,"In case you missed it, I officially qualified for U.S. Senate on Monday. We're building the largest & strongest grassroots team in Georgia's history to WIN in November!  Read more here.",235,205,15,11,,2,2,42,1485144101653049,/story.php?story_fbid=1485144101653049&id=159597424207730
David Perdue,,2020-03-04 08:43:22,"In 2014, I asked you to stand with me to change the direction of our country. In 2020, I’m asking you to stand with me to keep up the momentum for our winning agenda and to send a message that America will NEVER be a socialist country!",276,241,9,15,1,,10,46,1485137661653693,/story.php?story_fbid=1485137661653693&id=159597424207730
David Perdue,,2020-03-03 21:00:45,"""While political insiders have been commonplace for decades in Congress, outsiders capable of changing the status quo are a rare thing. Senator David Perdue is that kind of outsider, and we must re-elect him this November.""",20,9,7,1,,,3,10,1484493645051428,/story.php?story_fbid=1484493645051428&id=159597424207730
David Perdue,,2020-03-03 13:47:51,Humbled to have so many supporters join us yesterday as I qualified to run for reelection! We built an outsider movement in 2014 together. Now it's time to finish the job.,65,50,8,6,,,1,10,1484496825051110,/story.php?story_fbid=1484496825051110&id=159597424207730
David Perdue,,2020-03-03 11:45:09,"I came to Washington as an outsider. I'm doing this job as an outsider. By definition, I will always be an outsider because unlike career politicians, I'm focused on RESULTS.",68,47,17,2,,,2,24,1484410321726427,/story.php?story_fbid=1484410321726427&id=159597424207730
David Perdue,,2020-03-02 19:51:13,"I officially qualified to run for re-election to the U.S. Senate! Serving you has been the honor of my life, and I'm ready to finish the job.",564,499,13,44,1,3,4,70,1483841735116619,/story.php?story_fbid=1483841735116619&id=159597424207730
David Perdue,,2020-03-02 14:31:58,"You know, it seems like every election we hear pundits on TV talk about how it is the most important election of our lifetime. Well friends, this time they are actually right. This is the moment when we as a country have to decide whether we go down the failed road of socialism or stay on the path of freedom and opportunity that has made this the greatest country in the world. And I know that Georgia will make the right choice.",182,152,14,15,,,1,34,1483678218466304,/story.php?story_fbid=1483678218466304&id=159597424207730
David Perdue,,2020-03-02 10:11:34,"In 2014, I asked you to stand with me to change the direction of our country. In 2020, Democrats believe the path to the White House and U.S. Senate runs through Georgia. They have embraced a socialist agenda of higher taxes, government-run health care, and the Green New Deal. The only thing standing in the way of their socialist agenda is us. This morning, I OFFICIALLY qualified to run for reelection in 2020 and I’m asking you to stand with me.   I’m asking you to stand with me to reelect President Trump and defend the Republican Senate majority. I’m asking you to stand with me to ensure that the road to socialism will never run through Georgia!",141,111,9,18,,,3,42,1483508328483293,/story.php?story_fbid=1483508328483293&id=159597424207730
David Perdue,,2020-03-02 09:00:01,"We know the importance of freedom. We know that God is the source of our freedom. We know that self-determination has ALWAYS trumped total state control. But for self-determination to win around the world, it has to win here at home.",114,89,14,9,,,2,24,1483411881826271,/story.php?story_fbid=1483411881826271&id=159597424207730
David Perdue,,2020-02-27 20:10:27,"Just as we stopped Democrats in Georgia in 2014, 2016, and 2018, we’re going to stop them in 2020.",554,425,49,16,4,,60,108,1480115345489258,/story.php?story_fbid=1480115345489258&id=159597424207730
David Perdue,,2020-02-27 10:49:22,"After eight years of retreat under Barack Obama, President Donald J. Trump has restored American leadership around the world. He’s reaffirmed our commitments to our allies, brought China to the table on trade, and dealt with those who've threatened American lives. As a result, satisfaction with America’s position in the world is at a 17-year high.",982,779,33,168,1,,1,95,1480114488822677,/story.php?story_fbid=1480114488822677&id=159597424207730
David Perdue,,2020-02-27 08:00:01,"Since day one, we’ve said that Georgia will decide who controls the White House and U.S. Senate majority. Now, the Democratic National Committee has officially listed Georgia as one of its top 2020 targets! This news means more Democrat field offices in Georgia. It means more false attack ads. It means MILLIONS more in donations from radical liberal donors who are determined to stop President Trump, defeat me, and end our Senate majority. Our end of month fundraising deadline on Saturday just got even more important, so I’ve authorized an Emergency DOUBLE MATCH on all donations until 11:59 PM Saturday. Will you rush a donation of whatever you can afford right now?",96,72,17,2,1,1,3,42,1479500025550790,/story.php?story_fbid=1479500025550790&id=159597424207730
David Perdue,,2020-02-26 20:00:17,"I couldn’t be prouder of my cousin Sonny. As Governor, he changed the direction of Georgia, helped us weather the Great Recession, and made our state the best place in the country to do business.",96,90,3,3,,,,9,1479499452217514,/story.php?story_fbid=1479499452217514&id=159597424207730
David Perdue,,2020-02-26 16:38:21,"Socialist presidential candidate Bernie Sanders supports the so-called ""Green New Deal."" Don't be fooled. The Green New Deal is nothing more than a socialist wish list that would crush our economy and cost the American people trillions, including right here in Georgia.",195,71,24,,4,4,92,57,1479473818886744,/story.php?story_fbid=1479473818886744&id=159597424207730
David Perdue,,2020-02-25 18:56:41,"We've been saying all along that Georgia will decide who controls the White House and U.S. Senate in 2020. Now, the Democratic National Committee has added Georgia to its list of TOP 2020 targets.  Radical Democrats may think the road to socialism and the U.S. Senate majority runs through Georgia, but we're going to prove them wrong in November!",285,173,37,4,16,5,50,98,1478704625630330,/story.php?story_fbid=1478704625630330&id=159597424207730
David Perdue,,2020-02-24 19:00:00,"Under President Donald J. Trump, our winning agenda has produced the greatest economic turnaround in U.S. history!  We're proving that what we believe in works: -Over 7 million new jobs created.  -Highest median household income ever.  -Lowest unemployment in 50 years.  -Lowest African American, Hispanic, and Asian unemployment EVER measured.",223,174,20,25,,,4,38,1477793062388153,/story.php?story_fbid=1477793062388153&id=159597424207730
David Perdue,,2020-02-24 13:30:12,"In today’s economy, broadband access is not a luxury; it’s a necessity. The Broadband ReConnect program will have a huge impact on education, business, and health care in Southwest Georgia, and it will help ensure no Georgian is left behind.",87,75,6,2,1,,3,37,1477488482418611,/story.php?story_fbid=1477488482418611&id=159597424207730
David Perdue,,2020-02-24 08:04:48,"The socialist agenda embraced by today’s Democrat Party would kill the American Dream. It has failed everywhere it’s been tried, especially in Cuba.",609,317,42,1,17,29,203,152,1477488049085321,/story.php?story_fbid=1477488049085321&id=159597424207730
David Perdue,,2020-02-23 20:00:00,Growing up in a farming family taught me that agriculture is not just a business - it's a way of life. I'm proud of this UGA student for calling out Mike Bloomberg's insulting & out-of-touch comments about our state's #1 industry.,238,221,7,8,1,,1,23,1477089499125176,/story.php?story_fbid=1477089499125176&id=159597424207730
David Perdue,,2020-02-23 15:00:00,The 4C Academy in Albany is doing great work to expand opportunity and prepare Georgia's workforce for the future. It was great to spend time with the students and faculty there earlier this week.,26,25,,1,,,,,1476640812503378,/story.php?story_fbid=1476640812503378&id=159597424207730
David Perdue,,2020-02-23 09:00:56,Couldn't be prouder of Lt. Thessa Washington for being named the first African American pilot of Savannah's 165th Airlift Wing!,844,727,2,112,3,,,57,1476639545836838,/story.php?story_fbid=1476639545836838&id=159597424207730
David Perdue,,2020-02-22 16:08:13,Great to be home in Middle Georgia for Houston & Bibb County Georgia Republican Party precinct caucus meetings! Team Perdue is ready to WIN in 2020!,187,166,9,9,1,,2,26,1476167712550688,/story.php?story_fbid=1476167712550688&id=159597424207730
David Perdue,,2020-02-21 15:00:00,Great to say hello to the Dublin Rotary Club today! They are doing great work in Laurens County.,39,35,3,,,,1,6,1475453419288784,/story.php?story_fbid=1475453419288784&id=159597424207730
David Perdue,,2020-02-21 09:22:47,The students at 4C Academy are on the cutting edge. This academy is doing great work as it trains them for the future. I enjoyed spending time with these incredible students yesterday.,40,35,5,,,,,7,1475021505998642,/story.php?story_fbid=1475021505998642&id=159597424207730
David Perdue,,2020-02-20 09:43:24,"Small business owners are the backbone of Georgia's economy. They see that in spite of all the gridlock and obstruction from Democrats in Washington, our agenda is working!",384,317,12,47,5,,3,28,1474185136082279,/story.php?story_fbid=1474185136082279&id=159597424207730
David Perdue,,2020-02-19 09:11:22,"To reelect President Trump and defend the Senate majority, every Republican in Georgia has to show up and vote!  Are you voting in November? Take our ONE-QUESTION Survey now!",692,613,11,66,,,2,163,1473302666170526,/story.php?story_fbid=1473302666170526&id=159597424207730
David Perdue,,2020-02-18 20:00:35,"Since last October alone, we’ve: ✅ Signed a Phase One deal with China. ✅ Gotten USMCA across the finish line. ✅ Taken out the leader of ISIS and General Soleimani, who was responsible for hundreds of American deaths. ✅ Seen continued economic momentum. These are great results & we must keep up the momentum!",120,105,10,4,,,1,23,1472306859603440,/story.php?story_fbid=1472306859603440&id=159597424207730
David Perdue,,2020-02-18 11:00:00,"2020 is here. The future of our Republic is at stake.  Starting now, we have to build the strongest grassroots team in Georgia’s history. I’m counting on YOU to help us from now until Election Day. This is no time for complacency.  Chip in $25 or more now to become one of our first OFFICIAL 2020 Donors.",73,58,11,1,,,3,17,1472282596272533,/story.php?story_fbid=1472282596272533&id=159597424207730
David Perdue,,2020-02-18 08:39:45,"Socialist policies have destroyed other countries. The Soviet Union crumbled. Greece’s economy collapsed. Cuba and Venezuela today are failed states, and people are suffering. Why would America want to emulate any of these failed socialist regimes? America was built on simple principles: economic opportunity for everyone, fiscal responsibility, limited government, and individual liberty. In the post-World War II era, our free-market, free-enterprise system has generated the greatest period of economic growth in human history. The American dream exists because of the free-market system. The socialist agenda would kill the American dream. We must stop it by exposing its total failure between now and Election Day.",570,354,21,11,9,84,91,135,1472306056270187,/story.php?story_fbid=1472306056270187&id=159597424207730
David Perdue,,2020-02-17 09:07:45,"In 2014, Georgia sent an outsider to the U.S. Senate. Now radical Democrats are planning to spend MILLIONS in our state because we’re making a difference.  I need YOU to help us fight back. I’m counting on YOU, from now until Election Day. I’m counting on YOU to send a message that the road to socialism will NEVER run through Georgia!  Join Team Perdue today >>>",234,195,17,21,,,1,57,1471537223013737,/story.php?story_fbid=1471537223013737&id=159597424207730
David Perdue,,2020-02-14 15:00:11,"Best thing that ever happened to me is when I met Bonnie in the first grade. She's an amazing wife, mother, and grandmother. I'm so thankful she's on this journey with me. Happy Valentine's Day!",230,201,1,26,1,,1,20,1469210966579696,/story.php?story_fbid=1469210966579696&id=159597424207730
David Perdue,,2020-02-14 11:30:22,Our women and men in uniform - past and present - are the best this country has to offer. We have a responsibility to care for these heroes. I'm glad Governor Kemp has joined this initiative to reduce suicides among veterans.,153,135,1,15,1,,1,30,1468880346612758,/story.php?story_fbid=1468880346612758&id=159597424207730
David Perdue,,2020-02-14 08:30:45,"Let’s be clear: Weakening President Trump's ability to defend our country from attack is not just reckless, it’s downright dangerous.",781,289,17,4,10,22,439,292,1468879859946140,/story.php?story_fbid=1468879859946140&id=159597424207730
David Perdue,,2020-02-13 20:00:56,Yesterday: 61% say they’re better off now than they were before President Trump took office. Today: A new report shows 401(k)s hit a record last year. Our agenda has created the greatest economic turnaround in U.S. history!,294,256,16,19,1,,2,44,1468287193338740,/story.php?story_fbid=1468287193338740&id=159597424207730
David Perdue,,2020-02-13 14:01:27,"This has been an historic week for the Savannah Harbor Expansion Project. This critical infrastructure project is on track to be completed within the next two years, and this is the fourth straight year SHEP will receive full funding.",51,46,3,1,,,1,13,1468286050005521,/story.php?story_fbid=1468286050005521&id=159597424207730
David Perdue,,2020-02-12 16:18:58,"HUGE: 61% of Americans say they’re better off now than they were three years ago. ✅ Over 7 million new jobs created. ✅ Highest middle-class income in U.S. history. ✅ Lowest overall unemployment in 50 years. ✅ Lowest African-American, Hispanic, and Asian unemployment ever measured. Our agenda is working! To keep up the momentum, we have to WIN in November!",321,294,12,11,,,4,66,1467548180079308,/story.php?story_fbid=1467548180079308&id=159597424207730
David Perdue,,2020-02-11 18:38:03,"This has been an historic week for the Savannah Port and all of Georgia! Not only does President Trump’s budget request full funding for the Savannah Harbor Expansion Project, but today the Department of Transportation announced a $34.6 million grant for infrastructure improvements at the Port of Savannah. The Savannah Port is the third largest and fastest growing port in the entire country and the most efficient container port in North America. President Trump has broken through years of gridlock to secure approvals and the necessary funding to complete SHEP over the next two years. Infrastructure improvements like these will be critical to increasing exports and continuing to grow the economy. This is another major win for Georgia, and I thank the Trump administration for their sustained efforts to support Georgia workers and businesses.",173,157,5,9,,,2,27,1466809423486517,/story.php?story_fbid=1466809423486517&id=159597424207730
David Perdue,,2020-02-11 10:02:51,"For the fourth straight year, President Trump has requested full funding for the Savannah Harbor Expansion Project. This is huge for Georgia and for our entire country. After 20 years of career politicians trying to deepen the Port just five feet, it's on track to be completed within the next two years!",117,110,2,3,1,,1,10,1466515703515889,/story.php?story_fbid=1466515703515889&id=159597424207730
David Perdue,,2020-02-10 16:54:42,"President Trump has requested full funding for the Savannah Harbor Expansion Project for the fourth straight year. This President continues to make Georgia infrastructure projects a top priority! After 20 years of attempts to deepen the port just five feet to accommodate larger Post Panamax ships, President Trump’s administration has SHEP on track for completion. The Port of Savannah is the third largest – and fastest growing – port in America. It consistently shatters records for container cargo moved. Once it’s completed, SHEP will contribute $282 million to the economy every year. This is huge for Georgia and will give America a competitive advantage around the world.",716,638,1,70,4,,3,54,1465982970235829,/story.php?story_fbid=1465982970235829&id=159597424207730
David Perdue,,2020-02-10 09:56:20,Democrats used impeachment as a political weapon because they were determined to overturn 2016 and impact 2020. We stopped them in the Senate. Now we have to stop them in November.  Chip in now to stand with President Trump & the Senate majority >>>,167,147,14,2,,,4,47,1465736136927179,/story.php?story_fbid=1465736136927179&id=159597424207730
David Perdue,,2020-02-09 13:41:13,Democrats used impeachment as a political weapon because they were determined to overturn 2016 and impact 2020. We stopped them in the Senate. Now we have to stop them in November.  Join our team today >>>,406,362,15,25,,,4,77,1465058203661639,/story.php?story_fbid=1465058203661639&id=159597424207730
David Perdue,,2020-02-08 11:16:43,"After 17 House witnesses, over 28,000 pages of documents, and 193 videos of witness testimony, we had heard enough. Now we get back to work for the American people.",393,312,20,54,,,7,65,1464119477088845,/story.php?story_fbid=1464119477088845&id=159597424207730
David Perdue,,2020-02-07 14:00:26,"In his State of the Union on Tuesday, President Trump described the economic turnaround we're seeing as the Great American Comeback. He's exactly right. We're seeing the greatest economic turnaround in U.S. history and the momentum isn't slowing down.  What we believe in works!",196,167,11,16,1,,1,37,1463199530514173,/story.php?story_fbid=1463199530514173&id=159597424207730
David Perdue,,2020-02-07 10:39:54,"Fort Benning is one of three finalists to host the U.S. Army's fourth corps headquarters. Fort Benning has 26 million square feet of facilities and 102,000 acres of maneuver training areas. It’s the home of the Army’s Maneuver Center of Excellence. Its training, support, and command facilities are unmatched. It’s ready to meet every requirement needed. This would be a huge win for Georgia and for our national security.",61,55,2,4,,,,16,1463196397181153,/story.php?story_fbid=1463196397181153&id=159597424207730
David Perdue,,2020-02-07 09:00:17,"After 17 House witnesses, over 28,000 pages of documents, and 193 videos of witness testimony, we had heard enough. Now we get back to work for the American people.",729,582,18,118,1,1,9,92,1463042733863186,/story.php?story_fbid=1463042733863186&id=159597424207730
David Perdue,,2020-02-06 21:30:08,"Around Georgia & the entire country, the American people woke up to headlines like this today.  Now, we have to win in November. Chip in here to join the fight: https://www.perduesenate.com/donate",307,260,13,30,,2,2,44,1462659687234824,/story.php?story_fbid=1462659687234824&id=159597424207730
David Perdue,,2020-02-06 19:23:44,"This week, the U.S. Senate turned the page on one of the most troubling chapters in our country’s history. Democrats in the U.S. House of Representatives attempted to use impeachment as a partisan political weapon. The Senate prevented this from happening. From day one, House Democrats were only concerned with overturning the 2016 election and influencing the 2020 election. The Senate acquitted President Trump not only because the two articles presented were illegitimate and did not qualify for impeachment, but also because there was zero evidence of wrongdoing. You can’t just say someone is guilty. You must prove it. The House did not do that. Read more in my new op-ed:",639,523,26,81,,,9,70,1462657430568383,/story.php?story_fbid=1462657430568383&id=159597424207730
David Perdue,,2020-02-06 15:00:00,"Ronald Reagan would've been 109 years old today. His legacy and commitment to our Founding Principles - economic opportunity, fiscal responsibility, limited government, and individual liberty - live on.",181,157,3,21,,,,37,1462629537237839,/story.php?story_fbid=1462629537237839&id=159597424207730
David Perdue,,2020-02-06 13:00:36,"More huge news from the Port of Savannah. The Port is the third largest – and fastest growing – port in the entire country. It consistently breaks records for container cargo moved. For 20 years, career politicians have tried to deepen this Port five feet. Now, since President Trump took office, we’ve broken through the gridlock and fully funded the Savannah Harbor Expansion Project for three straight years. We are now on track to complete the expansion by 2022. The Port is vital to both Georgia and our country’s ability to compete globally. Georgia is the best state in the country in which to do business, and the Port will continue to play a major role in our state’s economic success.",374,335,2,32,3,1,1,31,1462335657267227,/story.php?story_fbid=1462335657267227&id=159597424207730
David Perdue,,2020-02-06 09:04:47,"Two priorities: First, get President Donald J. Trump reelected. Second, keep the Republican majority in the U.S. Senate.",973,835,21,99,,4,14,188,1462280477272745,/story.php?story_fbid=1462280477272745&id=159597424207730
David Perdue,,2020-02-05 21:00:00,The way to fix the childish behavior we saw from Democrats in the State of the Union… the way to end the historic obstructionism of the last three years… and the way to keep up momentum for our winning agenda… is to WIN in November!,373,319,10,30,1,2,11,72,1461861587314634,/story.php?story_fbid=1461861587314634&id=159597424207730
David Perdue,,2020-02-05 18:15:11,"Here in America, we believe in the rule of law, due process, and that you are innocent until proven guilty. House Democrats violated each of those precepts by using impeachment as a partisan political weapon, which is exactly what Alexander Hamilton warned against. For Democrats, this was never about finding the truth or protecting the Republic. For Democrats, this was only about overturning the 2016 election and impacting 2020. The U.S. Senate acquitted President Trump because the two articles were illegitimate, inappropriate, and didn’t rise to the level of impeachment. There was zero evidence of wrongdoing. Even with 17 witnesses, 193 testimony videos, and 28,000 pages of documents, House Managers failed to make a compelling case. It’s time to put this dark chapter behind us. It’s time to get back to work to deliver more results for the American people.   Join us today:",341,277,25,27,,1,11,67,1461819010652225,/story.php?story_fbid=1461819010652225&id=159597424207730
"David Perdue,Heather Cox Richardson",,2020-02-05 12:00:00,"President Donald J. Trump is the first president to be impeached without being accused of a crime. Enough. It’s time to move on.February 5, 2020 (Wednesday) As expected, today the Senate voted to acquit President Trump of the charges of which he was accused in the articles of impeachment...",137,120,12,2,,,3,33,1461208084046651,/story.php?story_fbid=1461208084046651&id=159597424207730
David Perdue,,2020-02-05 09:07:00,"The House had 17 witnesses, 193 videos of testimony, 28,000 pages of evidence, and then they told the Senate to do their job for them. We shut that down last week & today we’re going to acquit President Trump.",241,196,4,24,1,1,15,54,1461484507352342,/story.php?story_fbid=1461484507352342&id=159597424207730
David Perdue,,2020-02-05 07:45:00,"Our agenda is working! ✅ 7.5 million new jobs. ✅ Highest middle-class income in U.S. history. ✅ Lowest unemployment in 50 years. ✅ Lowest African-American, Asian, and Hispanic unemployment ever measured.",88,71,11,5,,,1,27,1461206124046847,/story.php?story_fbid=1461206124046847&id=159597424207730
