source,shared_from,date,text,reactions,likes,ahah,love,wow,sigh,grrr,comments,post_id,url
David Perdue,,2019-10-09 09:24:24,"Did you see the news? GEORGIA is hosting the November Democrat debate.  This means EVERY radical Democrat running for President is coming here. The national liberal media will be giving Georgia more attention than ever before. Each of these Democrats will be raising money from liberal donors before, during, and after the debate. We’re counting on YOU to help us fight back and hold these Democrats accountable for embracing SOCIALISM. It’s critical we raise as much as we can for our Rapid Response Fund NOW, before November. Can you rush a donation to help us get ready for the onslaught right now?",679,223,112,3,37,33,271,322,1344128662421261,/story.php?story_fbid=1344128662421261&id=159597424207730
David Perdue,,2019-10-08 19:00:00,Throwback to great times in Perdue Country five years ago this week!,168,151,5,11,,,1,25,1343575682476559,/story.php?story_fbid=1343575682476559&id=159597424207730
David Perdue,,2019-10-08 10:02:34,The USMCA is a win for American workers and businesses. It will create jobs and pump money into our economy. It's past time for Congress to take action on this deal.,240,220,7,11,,,2,34,1343302722503855,/story.php?story_fbid=1343302722503855&id=159597424207730
David Perdue,,2019-10-07 09:23:02,"Median household income is at an all-time high.  We've taken action to roll back overreaching regulations, unleash our energy potential, simplify the tax code, and undo the most onerous parts of Dodd-Frank.  We're proving that what we believe in WORKS!",197,167,11,19,,,,30,1342429239257870,/story.php?story_fbid=1342429239257870&id=159597424207730
David Perdue,,2019-10-04 14:36:40,"Overall unemployment is the lowest it's been since The Beatles released Abbey Road.  What's one way to keep up the momentum?  Passing the #USMCA NOW. It would mean 176,000 American jobs and $68 billion for our economy!",152,141,2,7,,,2,35,1340011306166330,/story.php?story_fbid=1340011306166330&id=159597424207730
David Perdue,,2019-10-04 10:31:51,The economic turnaround continues:  ✅Lowest overall unemployment in 50 years.  ✅Lowest African-American and Hispanic unemployment ever measured.  ✅Highest middle-class income ever measured.  Promises made. Promises kept.,258,219,12,25,,,2,54,1339841436183317,/story.php?story_fbid=1339841436183317&id=159597424207730
"David Perdue,Atlanta Braves",Atlanta Braves,2019-10-03 13:59:06,Best of luck to the Braves as they begin their postseason journey today!Today’s threads! 😤 #RELENTLESS,27,23,3,1,,,,4,1339157146251746,/story.php?story_fbid=1339157146251746&id=159597424207730
David Perdue,,2019-10-03 13:00:03,I campaigned for John James in Michigan last year & was glad to welcome him to Atlanta earlier this week. It's critical that we win Michigan next year and grow our Republican Senate majority!,443,399,8,35,,,1,36,1339059872928140,/story.php?story_fbid=1339059872928140&id=159597424207730
David Perdue,,2019-10-03 11:47:47,Sheriff Cullen Talton has been a friend of mine for years and this honor is very well-deserved. Cullen became Houston County sheriff in 1973 and is Georgia's longest-serving sheriff.,89,76,,11,1,1,,8,1339042066263254,/story.php?story_fbid=1339042066263254&id=159597424207730
David Perdue,,2019-10-03 10:12:22,Here's why it's critical that we expose socialism for what it is: A failed worldview that hurts the very people it claims to champion.,324,151,14,2,20,41,96,89,1338974676269993,/story.php?story_fbid=1338974676269993&id=159597424207730
David Perdue,,2019-10-02 19:00:02,"To win in 2020, we must build the strongest grassroots team in Georgia's history. That means we can't do this without YOU.  Get updates from the trail and join the team here.",113,92,11,10,,,,31,1338354372998690,/story.php?story_fbid=1338354372998690&id=159597424207730
David Perdue,,2019-10-02 13:49:23,"The choice in 2020 is about the future of this Republic. If we get this right, we can keep up the momentum for our winning agenda. We can continue returning to our Founding Principles: Economic opportunity for everyone, fiscal responsibility, limited government, and individual liberty.",326,277,17,28,2,,2,70,1338297646337696,/story.php?story_fbid=1338297646337696&id=159597424207730
David Perdue,,2019-10-02 09:49:16,"It's been a full year since the USMCA was announced. Mexico has ratified this deal. Canada is in the process of ratifying this deal. It's past time for the U.S. to do the same.  Here's what USMCA would mean for our economy:  -176,000 new jobs.  -$68 billion economic boost. It's time to end the delays and get this deal done for the American people.",202,141,10,6,8,6,31,36,1338137203020407,/story.php?story_fbid=1338137203020407&id=159597424207730
David Perdue,,2019-10-01 14:12:56,"As we again saw last week, Washington's funding process is completely broken. We need a clean-page, politically neutral platform that fully funds the government on time. I firmly believe that Congress should face tough consequences for failing to get the job done.",174,160,3,6,,2,3,41,1337427783091349,/story.php?story_fbid=1337427783091349&id=159597424207730
David Perdue,,2019-10-01 11:00:02,"No matter where it has been tried, socialism's price has always been freedom.",464,364,11,13,,43,33,90,1337195193114608,/story.php?story_fbid=1337195193114608&id=159597424207730
David Perdue,,2019-10-01 08:05:09,"Thanks to supporters like you, not only did we hit our online fundraising goal for this quarter, we EXCEEDED it.  Thanks to supporters like you, we’re keeping up the momentum for our winning agenda.  Thanks to supporters like you, we’re on track to WIN in 2020!",187,174,2,10,,,1,30,1337186116448849,/story.php?story_fbid=1337186116448849&id=159597424207730
David Perdue,,2019-09-30 13:30:54,"Term limits for Congress are overdue & continue to be one of my top priorities in the U.S. Senate. We need more citizen legislators, not career politicians.",427,388,10,29,,,,56,1336584519842342,/story.php?story_fbid=1336584519842342&id=159597424207730
David Perdue,,2019-09-30 13:00:04,Too many communities don't have access to the knowledge or tools needed to build safer schools.  My bipartisan plan - The School Safety Clearinghouse Act - would work to change that.,81,70,8,3,,,,16,1336465896520871,/story.php?story_fbid=1336465896520871&id=159597424207730
David Perdue,,2019-09-30 10:29:01,"WE'RE ALMOST OUT OF TIME: Our most important fundraising deadline yet is at 11:59 PM TONIGHT!  It's critical that we hit our goal for this fundraising quarter. It's critical that we have the resources it takes to respond to false attacks and build the strongest grassroots team in Georgia history.  I'm counting on each of our supporters to step up between now and 11:59 PM TONIGHT. Together, we can crush our goal for this fundraising quarter and keep up the momentum for our winning agenda. Together, we can win in 2020 and continue delivering results for ALL of Georgia.",31,21,9,,1,,,21,1336462886521172,/story.php?story_fbid=1336462886521172&id=159597424207730
David Perdue,,2019-09-29 19:36:15,Wishing a blessed & healthy new year to all celebrating Rosh Hashanah in Georgia and around the world.,64,62,,2,,,,6,1335978219902972,/story.php?story_fbid=1335978219902972&id=159597424207730
David Perdue,,2019-09-28 14:52:20,"THE CLOCK IS TICKING: We've got TWO DAYS left to hit our goal for this quarterly fundraising deadline. I'm asking each of our grassroots supporters and chip in now before it's too late.  The coming days and weeks are critical. It's vital that we have the resources it takes to WIN in 2020. Together, we can send a message that the road to socialism will NEVER run through Georgia!",31,23,6,,,,2,14,1335002470000547,/story.php?story_fbid=1335002470000547&id=159597424207730
David Perdue,,2019-09-28 11:03:57,"This week, the funding process used by Congress failed the American people yet again. Instead of funding the government on time, Congress threw up its hands and resorted to a “continuing resolution.” It’s the 187th time a so-called “CR” has been used in the last 45 years.  The reality is that Congress will continue to face this dilemma EVERY single year until the funding process is completely changed. I’ve put forward a plan to do so. The Fix Funding First Act would do several things.  First, it would change the fiscal year to match the calendar year and end the ridiculous “Vote-a-rama” process in the Senate.  Second, it would only require topline spending levels every two years.  Third, it would make the budget agreement a law. The current budget resolution is not a law.  Fourth, and most importantly, it would impose tough consequences on Members of Congress for failing to get the job done. These consequences would include things like “No Funding, No Recess,” and “No Funding, No Pay.”  Fifth, it would require the Senate Budget Committee to report a five-year bipartisan plan every two years.  We need a politically neutral platform to fund the government every year without delays or drama. We need structural changes to the process. We need tough consequences for failure. The American people deserve better than this totally broken funding process. Period.",180,149,6,3,1,6,15,41,1334850283349099,/story.php?story_fbid=1334850283349099&id=159597424207730
David Perdue,,2019-09-27 15:39:31,"The stakes couldn't be higher in 2020. The choice in this election is about the future of our Republic, and we MUST send a message that the road to socialism will NEVER run through Georgia!",219,184,10,21,2,,2,39,1334139486753512,/story.php?story_fbid=1334139486753512&id=159597424207730
David Perdue,,2019-09-27 08:06:37,Always remember: The price of socialism is FREEDOM!,568,496,33,24,,12,3,110,1333790720121722,/story.php?story_fbid=1333790720121722&id=159597424207730
David Perdue,,2019-09-26 15:24:05,"Today – having AGAIN failed to fully fund the government on time – Congress threw up its hands, kicked the can down the road, and resorted to a “continuing resolution” for the 187th time in 45 years.  This is completely ridiculous. Senate Democrats helped cause this when they reneged on a bipartisan plan to fund the government on time without poison pill amendments. Instead of negotiating in good faith, they have chosen to force our military to operate under a “CR,” which is reckless given the evolving threats we face around the world.  It’s time to quit the nonsensical partisan games and put America’s national interest before political self-interests. Unfortunately, however, the Senate will continue to face this dilemma every single year until it FINALLY fixes the totally broken funding process.",443,279,7,,3,38,116,78,1333219866845474,/story.php?story_fbid=1333219866845474&id=159597424207730
David Perdue,,2019-09-25 15:03:51,"We've only got FIVE DAYS to hit our fundraising goal for this quarter, and I'm counting on each of our supporters to step up.  It's critical that we have the resources it takes to respond to false attacks AND to build the strongest grassroots team in Georgia's history. We can't do this if we don't hit our fundraising goals.  Please consider chipping in $50, $25, or $10 right now.",24,15,6,3,,,,20,1332336993600428,/story.php?story_fbid=1332336993600428&id=159597424207730
David Perdue,,2019-09-25 09:50:08,"Last month, the Port of Savannah handled over 437,000 twenty-foot equivalent container units, making August its busiest month for containerized trade.  This is huge! The Port of Savannah is the third largest – and fastest growing – port in the entire country. It consistently breaks records for container cargo moved.  Furthermore, after two decades of failed attempts to deepen the Port five feet to accommodate larger Post Panamax ships, we’ve now fully funded the Savannah Harbor Expansion Project for three consecutive years. This critical infrastructure project is now on track for completion by 2022. This is an economic win for Georgia, and indeed the entire country. It will continue to make us more competitive with the rest of the world.",153,145,,7,1,,,16,1332115623622565,/story.php?story_fbid=1332115623622565&id=159597424207730
David Perdue,,2019-09-24 19:00:00,"After the Oklahoma City Bombing in 1994, designs and security at federal buildings were modernized. Following the terrorist attacks on Sept. 11th, 2001, everything from our airports to sporting venues were rethought to prevent lapses in safety. Yet after years of tragic incidents, little has been done to make school design safer. The private sector is working hard to change that. State and local officials are working hard to change that. The bipartisan School Safety Clearinghouse Act will help them make that change possible so that we can better protect all of our children. Read more:",37,36,,,,1,,14,1331415600359234,/story.php?story_fbid=1331415600359234&id=159597424207730
David Perdue,,2019-09-24 14:39:18,"Our quarterly fundraising deadline is just SIX DAYS away. It's absolutely critical that we hit our goal.  Will you pitch in $5, $10, or whatever you can afford to help us continue delivering results for all of Georgia?",26,17,6,3,,,,15,1331409873693140,/story.php?story_fbid=1331409873693140&id=159597424207730
David Perdue,,2019-09-24 11:22:58,Today is #NationalVoterRegistrationDay!  Check your voter registration status or register to vote here.,99,88,3,8,,,,22,1331385710362223,/story.php?story_fbid=1331385710362223&id=159597424207730
David Perdue,,2019-09-24 09:38:45,"What can we do to keep our kids safe? We can start by building schools that are designed to protect our children. As an engineer by trade, I have learned that building design is more than brick, metal, and wood – it is the first line of defense. School design is not the only solution to making schools safer; we still have to find better ways to enforce existing law and keep guns out of the wrong hands. However, redesigning schools is an essential first step to keeping our kids safe. I'm proud to join a bipartisan group in sponsoring the School Safety Clearinghouse Act in the U.S. Senate. This bill will direct the Department of Homeland Security to build and maintain a national clearinghouse containing all the best practices and developments in school design. The School Safety Clearinghouse Act will close the gaps preventing schools from finding the school design advancements they need to protect their students and faculty.It does so while also upholding a key doctrine of our Founding Mothers and Fathers: that decisions are best made by families, communities, and states – not the Federal Government. Read more in my op-ed for the AJC:",70,62,6,2,,,,29,1331313463702781,/story.php?story_fbid=1331313463702781&id=159597424207730
David Perdue,,2019-09-23 16:06:05,"I joined 11 other senators in sending a letter encouraging U.S. Trade Representative Robert Lighthizer to prioritize pecan tariff reductions in trade negotiations with India.  The current tariff disparity has created an unlevel playing field for American producers. The tariff on U.S. pecans entering India is around 36%, while the tariff on similar products entering America is only around 10%.",45,40,4,1,,,,16,1330756020425192,/story.php?story_fbid=1330756020425192&id=159597424207730
David Perdue,,2019-09-23 10:52:25,"We have SEVEN DAYS to show we're ready for the fight in 2020. At the end of the month, our fundraising number goes public. I'm personally asking each of our supporters to help us hit our goal for this crucial deadline.  Will you chip in whatever you can afford right now?",46,29,12,4,,,1,25,1330572057110255,/story.php?story_fbid=1330572057110255&id=159597424207730
David Perdue,,2019-09-18 17:26:44,"Here we go again: The fiscal year ends on September 30th and Senate Democrats are playing partisan politics by blocking critical funding for our military. The ONLY reason the Senate recessed during August was because BOTH SIDES agreed to a bipartisan budget deal that would have no poison pill amendments. Senate Democrats should be ashamed of themselves for turning their back on this good-faith agreement. They only have one mission – obstructing President Trump – but the reality is that they are forcing another continuing resolution, or government shutdown, on the American people. Either outcome would be draconian for our military. Furthermore, we shouldn’t be in this position in the first place. It’s past time for Congress to fix the broken funding process that has only funded the government on time four times since 1974. Congress has shut down the government 21 times and used 186 continuing resolutions since then.  Until politicians are held accountable for completing the funding process on time, the Senate will continue to face the exact same dilemma EVERY YEAR. If this newest display of partisan politics doesn’t convince Washington that it’s time to change the broken funding process, I don’t know what will.",236,149,15,2,9,8,53,79,1326801130820681,/story.php?story_fbid=1326801130820681&id=159597424207730
David Perdue,,2019-09-18 13:54:10,"Yesterday on the floor of the U.S. Senate, I was honored to pay tribute to my friend and colleague, Senator Johnny Isakson.  I’ve come to revere Johnny since I got to the U.S. Senate. He’s been a mentor. He’s been a great leader for Georgia for many years. He’s been both an effective and reliable colleague. Most of all, he’s been a friend whom I cherish. Johnny epitomizes the best of the Senate. His legacy can be summed up in one word: Service. No matter what he does, Johnny always puts other people before himself, and this has been the case since the first day I met him when he was running a real estate company in Atlanta. Johnny’s dedication to service is even more impressive because it has produced incredible results for Georgia, and our country. There’s a lot of activity in Washington, but it’s short on results. Johnny knows the difference. As Johnny and Dianne head into the next chapter of their life, I have no doubt Johnny will continue to serve others. That’s exactly who he is. Matthew 23 tells us that “the greatest among you will be a servant.” When you consider all Johnny has done, it’s clear to me that Johnny Isakson is truly the greatest among us.",138,121,3,14,,,,16,1326695187497942,/story.php?story_fbid=1326695187497942&id=159597424207730
David Perdue,,2019-09-18 09:17:19,I'm calling in to catch up with Erick Erickson live on air around 9:40 am. Full interview will be posted later today!,32,25,5,1,,,1,17,1326515720849222,/story.php?story_fbid=1326515720849222&id=159597424207730
David Perdue,,2019-09-17 16:23:33,"""Optimism in the U.S. construction industry has reached a record high.""",42,37,3,2,,,,10,1326006684233459,/story.php?story_fbid=1326006684233459&id=159597424207730
David Perdue,,2019-09-17 10:56:31,"Today is Constitution Day. This document gave birth to a new nation and reshaped the global stage.  America’s Founders carefully crafted a more perfect union and a government for the people by the people. They charged the government with maintaining domestic peace, providing for the common defense, and promoting the general welfare of others, all while protecting liberty for future generations.  Four years after the Constitution’s creation, the states approved the Bill of Rights: 10 amendments that place specific limits on government power.  Today, over 230 years later, our Constitution is – and must always be – the guiding hand for our great nation.",155,127,5,21,,1,1,36,1325815084252619,/story.php?story_fbid=1325815084252619&id=159597424207730
David Perdue,,2019-09-17 09:09:00,"The rollback of the Obama EPA's overreaching Waters of the U.S. rule has been finalized and made official! This is a resounding victory for Georgia’s farmers and agriculture industry, and indeed the entire country.  It shouldn’t be easier to create bureaucracy than it is to eliminate it, but now we have a President working to get Washington out of the way.",185,148,1,14,,1,21,37,1325745847592876,/story.php?story_fbid=1325745847592876&id=159597424207730
David Perdue,,2019-09-16 14:25:26,"Keeping up the momentum for our winning agenda starts by keeping the Republican U.S. Senate majority. That majority hangs in the balance right here in Georgia.  Join our team today, and together we can finish the job.",88,72,10,4,,,2,20,1325185290982265,/story.php?story_fbid=1325185290982265&id=159597424207730
David Perdue,,2019-09-16 09:57:49,-Over 5 million new jobs created. -The highest middle class income in U.S. history.  -Lowest unemployment in 50 years.  We're proving that what we believe in WORKS!  Join our team today: https://perduesenate.com/get-involved/email-updates/,82,68,10,2,,,2,27,1325026317664829,/story.php?story_fbid=1325026317664829&id=159597424207730
David Perdue,,2019-09-13 10:01:22,"Last night's debate was another reminder that today's Democrat Party has embraced SOCIALISM. Each of the 10 Democrat candidates on the debate stage would totally undo our winning agenda.  It's absolutely critical that we keep the White House and U.S. Senate majority in 2020. With BOTH Senate seats on the ballot, Georgia is crucial to the effort.  We're ready to WIN, but we can't do this without you. Join Team Perdue today.",149,124,16,8,,,1,47,1322458681254926,/story.php?story_fbid=1322458681254926&id=159597424207730
David Perdue,,2019-09-12 19:30:00,"Since the day I got to the U.S. Senate, I've focused on one thing: RESULTS.  Over the last two years, we've:  -Rolled back thousands of overreaching regulations.  -Unleashed America's energy potential.  -Made historic changes to the tax code.  -Reversed the most onerous parts of Dodd-Frank.  OUR AGENDA IS WORKING! The economy has turned a corner:  -Over 5 million jobs have been created.  -Median household income is the highest it's ever been.  -Small business and consumer confidence have hit record highs.  -African-American, Hispanic, and Asian-American unemployment rates are the lowest ever recorded.  All turnarounds take time, but we've begun to successfully change the direction of our country. Now, it's time to finish the job.",196,171,10,12,,,3,21,1321976517969809,/story.php?story_fbid=1321976517969809&id=159597424207730
David Perdue,,2019-09-12 15:29:14,"With China, we've had difficulties when it comes to equal access, intellectual property rights, forced technology transfers, cyber war, and compliance with the WTO.  President Trump has made reasonable requests: Equal access and a level playing field. It's about time we had a President who stood up to China on these issues.",46,42,4,,,,,15,1321886824645445,/story.php?story_fbid=1321886824645445&id=159597424207730
David Perdue,,2019-09-12 11:12:53,"Mexico has already ratified the USMCA. Canada is in the process of doing so. It's past time for Congress to do the same.  The American people want this deal. It would increase our GDP by $68 billion and could potentially create 176,000 new jobs. This is a good deal, and it's time for Congress to put aside political self-interest and get this done.",96,86,4,5,,,1,17,1321733154660812,/story.php?story_fbid=1321733154660812&id=159597424207730
David Perdue,,2019-09-11 15:18:53,"President Trump’s nominee for Secretary of the Air Force, Ambassador Barbara Barrett, is the leader we need to propel the Air Force into the 21st Century. She has years of international business experience and is a respected aeronautics expert.  In my meeting with Ambassador Barrett, we discussed our shared priorities, including the Advanced Battle Management System and the U.S. Space Force. Without a doubt, Ambassador Barrett’s experience as a pilot and astronaut will be a tremendous asset to the Department of Defense as we continue developing our capabilities and countering global threats. Ambassador Barrett has my full support, and I’m confident she will do an excellent job leading the Air Force.",91,86,,4,,1,,11,1321054251395369,/story.php?story_fbid=1321054251395369&id=159597424207730
David Perdue,,2019-09-11 08:08:59,"9/11 was one of the darkest days in America’s history. The women and men who rushed into danger as the Twin Towers crumbled are true heroes. As we continue to face evolving threats around the world, the terrorist attacks on September 11th are a reminder that we must remain vigilant in defending our homeland. We will never forget the lives lost, nor the bravery of the first responders. Thank you to all of those in uniform who fight to protect our nation. We are forever grateful to you for your service and sacrifice.",147,117,,4,,26,,8,1320777284756399,/story.php?story_fbid=1320777284756399&id=159597424207730
David Perdue,,2019-09-10 17:07:22,"Today, Georgia was again named the best state in the country in which to do business!  This is a testament to 16 years of Republican leadership at the state level. It's also another sign that our economic agenda is working!",383,332,5,43,2,1,,37,1320303831470411,/story.php?story_fbid=1320303831470411&id=159597424207730
David Perdue,,2019-09-10 13:49:13,The battle for the White House and U.S. Senate majority in 2020 will be decided in Georgia.  It's about keeping up the momentum for our winning agenda. It's about the future of this Republic.  Chip in today to help us share our message of results far & wide: https://secure.winred.com/david-perdue/2020-georgia,88,72,7,7,1,,1,35,1320199941480800,/story.php?story_fbid=1320199941480800&id=159597424207730
David Perdue,,2019-09-10 06:39:54,I'll be on Fox Business around 7:00 am this morning. Tune in!,64,56,6,1,,,1,21,1319936781507116,/story.php?story_fbid=1319936781507116&id=159597424207730
