source,shared_from,date,text,reactions,likes,ahah,love,wow,sigh,grrr,comments,post_id,url
Richard Dien Winfield,,2020-02-11 15:48:51,"On the picket line at the AIG factory Conley, Ed Caines, organizer for the International Union of Operating Engineers Local 926, discussed how employers use misclassification of employees as “independent contractors” to commit massive wage-theft and benefit-theft.  My Employee Bill of Rights combats such theft by requiring employers to extend the same pay and benefits to full timers, part timers, “contract” workers, and “zero” hour gig hires.  Let’s make this national law!",7,5,,2,,,,,784002195440102,/story.php?story_fbid=784002195440102&id=311710576002602
Richard Dien Winfield,,2020-02-11 15:37:15,What US #Senate candidates in #Georgia really stand up for employee rights? This morning in Conley we joined picketers from the International Union of Painters and Allied Trades DISTRICT 77 and the Levantemonos Junto Coalition in support of an American Insulated Glass worker fired for supporting unionization.  Such firings happen too often and employers    have too little incentive to obey the law.  Reinstatement and fines are not enough.  These are criminal violations that deserve serious punishment.,13,11,,2,,,,,783994958774159,/story.php?story_fbid=783994958774159&id=311710576002602
Richard Dien Winfield,,2020-02-10 23:33:23,"The PhilosopherForSenate, AKA CWA Union member for Senate, opens in Manuel’s Tavern for the Young Dems of Atlanta’s comedy show.  “Senator Weed” = Senator Green New Deal?",7,7,,,,,,,783426302164358,/story.php?story_fbid=783426302164358&id=311710576002602
"Richard Dien Winfield,Robert Reich",Robert Reich,2020-02-07 19:04:02,"The Great American Comeback?  Or rather continued erosion of the American Dream due to failure to fulfill our social rights?  Make America righteous!Record unemployment numbers and historic economic expansion aren’t telling the whole story of the state of our economy today. Consider this: — Home prices are rising faster than wages in about 80 percent of American metro regions — From 2010 to 2016, healthcare premiums jumped by 28 percent while median household incomes rose less than 20 percent — Childcare costs have increased by 2,000 percent in the past 40 years This is the real state of our economy today: exorbitant housing, healthcare, education, and childcare costs coupled with stagnant wages in which millions of families are barely scraping by. The next time Trump tries to tell you that this is the best economy ever, don’t believe him.",9,9,,,,,,,782901565550165,/story.php?story_fbid=782901565550165&id=311710576002602
Richard Dien Winfield,,2020-02-09 22:54:44,"Before the Oscars, return to Calvary Baptist Church in Madison, with Pastor Hoke Smith, and then more political discussion in Oglethorpe County.",9,9,,,,,,,782651555575166,/story.php?story_fbid=782651555575166&id=311710576002602
Richard Dien Winfield,,2020-02-06 18:49:02,"‪A reminder: Tonight at 9 PM, I will be live on Joe Firestone’s In Depth online show giving my response to both Trump’s StateOfTheUnion address and the Democratic Party official reply.  To view go here: facebook.com/letsgetitdonej…‬",,,,,,,,,780186075821714,/story.php?story_fbid=780186075821714&id=311710576002602
Richard Dien Winfield,,2020-02-08 20:24:55,"Speaking at the Beulah Baptist Church Voter Information Forum, led by Jo Handy-Sewell, with hope that voter suppression will not prevail come November.",11,11,,,,,,,781784272328561,/story.php?story_fbid=781784272328561&id=311710576002602
Richard Dien Winfield,,2020-02-08 20:23:40,"At the Douglas County Democrats monthly meeting, spreading the word about the social rights agenda.  The county was originally called “Douglass”, in honor of Frederick Douglass, but it was renamed “Douglas” in Jim Crow times after Lincoln’s debate and presidential opponent.",17,15,,2,,,,,781783145662007,/story.php?story_fbid=781783145662007&id=311710576002602
Richard Dien Winfield,,2020-02-07 15:38:50,"‪My local Earthfare announced its closing this week, as the whole chain shuts down.  The employees heard about it Monday and only five will receive any severance, according to the cashier.  Another example of why we need an Employee Bill of Rights with mandatory collective bargaining and employee seats on corporate boards.‬  See the WinfieldForSenate.com website for details of the Employee Bill of Rights.",18,16,,1,1,,,,780828835757438,/story.php?story_fbid=780828835757438&id=311710576002602
"Richard Dien Winfield,Robert Reich",Robert Reich,2020-02-05 12:15:34,"The Great American Comeback?  The truth will set us free.Friends, I wasn't going to comment on Trump's lie-filled State of the Union message but the whoppers were so big —  especially on the economy — that I feel compelled. Here, for the record, is the real state of the union:  1. JOBS: Average monthly job creation dropped from 223,000 in 2018 to 176,000 in 2019. The employment rate for working-age adults has increased less than during the Obama recovery, and is still significantly below that of other developed countries. The pace of job creation is also markedly slower than it was under Obama. 2. WAGES: Wage growth has slowed, except in states with minimum-wage increases. The typical American household remains poorer today than it was before the financial crisis began in 2007. The median wage of a full-time male worker (and those with full-time jobs are the lucky ones) is still more than 3% below what it was 40 years ago.  3. TAXES: The Trump-Republican tax cut has been a huge failure. We were promised an increase in business investment, but business investment has contracted for the third straight quarter—the first time this has happened since the Great Recession in 2009. Instead, the tax cut triggered an all-time record binge of share buybacks – some $800 billion in 2018.  If fully implemented, the 2017 tax cut will result in tax increases for most households in the bottom 80 percent.  And it has resulted in record peacetime deficits (almost $1 trillion in fiscal 2019) in a country supposedly near full employment. Even with weak investment, the US had to borrow massively abroad: the most recent data show foreign borrowing at nearly $500 billion a year, with an increase of more than 10% in America’s net indebtedness position in one year alone. Nothing has trickled down to average workers. To the contrary, If fully implemented the 2017 tax cut will result in tax increases for most households in the bottom 80 percent.  4. TRADE: The 2018 goods deficit was the largest on record. Even the deficit in trade with China was up almost a quarter from 2016.  5 GROWTH: Last quarter’s growth was just 2.1%, far less than the 4%, 5%, or even 6% Trump promised to deliver, and even less than the 2.4% average of Obama’s second term. That is a remarkably poor performance considering the stimulus provided by the $1 trillion deficit and ultra-low interest rates.  6. WORKERS' RIGHTS: Trump administration has systematically weakened workers’ rights. More than eight million workers will be left behind by the Trump overtime rule. Workers would receive $1.4 billion less than under the 2016 rule. New Trump administration joint-employer rule has $1 billion price tag for workers. 7. HEALTH: Millions of Americans have lost their health  coverage, and the uninsured rate has risen, in just two years, from 10.9% to 13.7%. US life expectancy, already relatively low, fell in each of the first two years of Trump’s presidency, and in 2017, midlife mortality reached its highest rate since World War II.  8. CLIMATE: losses related to climate change have already reached new highs in the US, which has suffered more property damage than any other country – reaching some 1.5% of GDP in 2017.",1,1,,,,,,,780240639149591,/story.php?story_fbid=780240639149591&id=311710576002602
Richard Dien Winfield,,2020-02-06 20:22:54,"‪Due to technical difficulties, my appearance on Joe Firestone’s In Depth online show has been postponed till next Wednesday, 2/12, at 9 pm.  To view go here: facebook.com/letsgetitdonej…‬",1,1,,,,,,,780228145817507,/story.php?story_fbid=780228145817507&id=311710576002602
Richard Dien Winfield,,2020-02-05 16:17:01,"The Great American Comeback? “More than 1.5 million students in U.S. are homeless, report says The number of students experiencing homelessness spiked by 15% over the three years the report covered.” Read in CBS News: https://apple.news/AfURR3TxpQTSs117iC45A0g",5,2,,,,3,,,779373879236267,/story.php?story_fbid=779373879236267&id=311710576002602
Richard Dien Winfield,,2020-02-05 16:11:55,"‪In Avondale, discussing the Georgia Senate campaigns with Clarkston Mayor Ted Terry, who led the charge for a GreenNewDeal in the race against Perdue.‬  Some good advice on the road ahead.",10,10,,,,,,,779370775903244,/story.php?story_fbid=779370775903244&id=311710576002602
Richard Dien Winfield,,2020-02-05 08:26:16,"‪The #GreatAmericanComeback?  The long recovery from the #GreatRecession has still left nearly 5 million Americans officially unemployed, another 4.5 million stuck with part time jobs instead of the full time jobs they want, and many millions more giving up searching for jobs.‬ Despite slight increases in median income, the share of wages in national income continues to fall, as income and wealth inequality intensifies.  Wages, as well as disability and retirement benefits, continue to lag behind housing costs, child and elder care costs, health care costs, education costs, and costs of legal representation. Employee disempowerment continues to accelerate.  Union representation has fallen to the lowest level in our lifetimes.  Corporate boards remain fortresses of privilege, from which the voice of employees is excluded.  We are free ... to be fired.",9,9,,,,,,,779092085931113,/story.php?story_fbid=779092085931113&id=311710576002602
Richard Dien Winfield,,2020-02-04 11:34:41,"‪This Thursday, 2/6 at 9 PM, I will be live on Joe Firestone’s In Depth online show giving my response to both Trump’s State of the Union address and the Democratic Party official reply.  To view go here: https://www.facebook.com/letsgetitdonejoe?fref=ufi&redirect=false ‬",2,2,,,,,,,778443645995957,/story.php?story_fbid=778443645995957&id=311710576002602
Richard Dien Winfield,,2020-02-04 07:37:36,"‪The Iowa Caucuses procedure reproduces on a small scale the inequities of the Electoral College. To fairly represent each voter, the first round totals of each caucus should be aggregated into a statewide total & the delegates should be distributed in proportion to that overall result.‬ Then no vote will be wasted.",5,5,,,,,,,778300406010281,/story.php?story_fbid=778300406010281&id=311710576002602
"Richard Dien Winfield,Richard Dien Winfield",Richard Dien Winfield,2020-02-02 17:45:31,"On this #SuperBowlSunday don’t forget to contribute to the contest that really counts!  Before it’s too late...It's now official: the campaign has begun for Winfield for US Senate.  Join the fight to fulfill our social rights and unchain our democracy.  This ""jungle election"" to fill out the term of ailing Republican Senator Isakson goes all the way to November 3rd with no primary.  Help support the long campaign ahead by contributing to Winfield For Senate through Act Blue at https://secure.actblue.com/donate/winfield-for-senate-1.   And check out the new campaign website: winfieldforsenate.com. Spread the word by sharing far and wide.",8,8,,,,,,,777222556118066,/story.php?story_fbid=777222556118066&id=311710576002602
Richard Dien Winfield,,2020-02-02 13:04:49,"‪On this Super Bowl Sunday Rev. Samuel Thompkins let me address his Athens Greater Bethel AME Church about this year’s fateful contest to make America a righteous nation, which upholds all our social, as well as civil and political rights.  We can’t afford to just be spectators. ‬",4,4,,,,,,,777063669467288,/story.php?story_fbid=777063669467288&id=311710576002602
Richard Dien Winfield,,2020-02-01 18:57:52,"At todays RESULTS United 2020 Georgia meeting in Decatur for Child Survival and Housing, we discussed how to make rental housing affordable and how to deal with the health consequences of Global Warming. The time for solutions is now.",6,6,,,,,,,776490279524627,/story.php?story_fbid=776490279524627&id=311710576002602
Richard Dien Winfield,,2020-02-01 18:56:26,"In Newnan, at today’s Coweta County Democrats meeting, the topic was what turning Georgia blue should mean.",10,8,,2,,,,,776489586191363,/story.php?story_fbid=776489586191363&id=311710576002602
Richard Dien Winfield,,2020-01-31 10:19:44,The Democratic Party needs a bold new direction.  More on what we should advocate in the second part of my appearance on Tim Bryant’s WGAU Classic City Today show.,15,13,,2,,,,1,775486152958373,/story.php?story_fbid=775486152958373&id=311710576002602
Richard Dien Winfield,,2020-01-31 10:03:44,There is an alternative to the old wine of establishment Democrats.   Delivering the goods on the Tim Bryant WGAU Classic City Morning show.,5,5,,,,,,,775477036292618,/story.php?story_fbid=775477036292618&id=311710576002602
Richard Dien Winfield,,2020-01-30 23:59:32,"‪At tonight’s Aroma Atlanta’s Meet and Greet, “changing the world, one activist at a time”.",15,13,,2,,,,,775167789656876,/story.php?story_fbid=775167789656876&id=311710576002602
Richard Dien Winfield,,2020-01-30 23:38:16,"‪Don’t forget to set your alarms to get up in time to listen to tomorrow’s 9 AM Classic City Today radio show on WGAU, 98.7 FM & AM 1340.  I’ll be discussing my US Senate campaign with host Tim Bryant.  No preaching to the choir.‬",15,13,,2,,,,,775156319658023,/story.php?story_fbid=775156319658023&id=311710576002602
Richard Dien Winfield,,2020-01-30 12:34:34,"What have our legislators, Republican or Democratic, done since passage of the Wagner Act to remedy the decline in unionization and the falling share of wages in our national income?  Nothing sufficient to balance the playing field between employees and employers.  It’s time for an Employee Bill of Rights.  The details are on my campaign website: winfieldforsenate.com",15,14,,1,,,,,774838806356441,/story.php?story_fbid=774838806356441&id=311710576002602
Richard Dien Winfield,,2020-01-29 17:50:05,"‪At today’s Athens Area Sunrise Launch Party, the Green New Deal takes root in North Georgia, with Georgia’s Green New Deal Senate candidate. ‬",18,18,,,,,,1,774290906411231,/story.php?story_fbid=774290906411231&id=311710576002602
Richard Dien Winfield,,2020-01-29 13:47:18,"‪Millions of Americans are putting off building families and buying homes because they are buried under student debt.  Let’s emancipate them and future generations by providing stipends and free tuition at all public post-secondary education and by canceling student debt.‬  Student debt cancellation will lift the US GDP between $86-108 billion annually, reduce unemployment from 0.2-0.3%, and add 1.2-1.5 million jobs (according to the 3/18 Levy Economics Institute Report).",26,24,,2,,,,2,774152716425050,/story.php?story_fbid=774152716425050&id=311710576002602
Richard Dien Winfield,,2020-01-28 16:35:05,"Today I ran into Tim Bryant in the produce section in Kroger’s and he invited me to come talk about my US Senate candidacy this Friday at 9 AM on his Classic City Today radio show on WGAU, 98.7 FM & AM 1340.  Come listen in ... it could get hot.",21,21,,,,,,1,773538596486462,/story.php?story_fbid=773538596486462&id=311710576002602
Richard Dien Winfield,,2020-01-26 22:04:34,,,,,,,,,,772202996620022,/richarddienwinfieldofficial/photos/a.311710622669264/772202996620022
Richard Dien Winfield,,2020-01-26 22:39:05,,12,11,,1,,,,,772217293285259,/richarddienwinfieldofficial/photos/a.311710622669264/772217293285259
Richard Dien Winfield,,2020-01-26 22:16:03,Meme me.  And share.,15,14,,1,,,,,772207989952856,/story.php?story_fbid=772207989952856&id=311710576002602
Richard Dien Winfield,,2020-01-26 19:19:08,"At the Atlanta Metro Malayalee Association Indian Republic Day Celebration, time to reflect on two great experiments in democracy.",4,4,,,,,,,772127016627620,/story.php?story_fbid=772127016627620&id=311710576002602
Richard Dien Winfield,,2020-01-24 16:50:05,Here’s how the discussion continued at  Thursday’s Oglethorpe County Democrats meeting...,3,3,,,,,,,770474920126163,/story.php?story_fbid=770474920126163&id=311710576002602
Richard Dien Winfield,,2020-01-24 16:25:06,"At this Thursday’s meeting of the Oglethorpe County Democrats, chaired by employee rights lawyer Janet Hill, we addressed how a Federal Job Guarantee makes possible implementation of a Green New Deal, just immigration reform, and full reproductive freedom.",3,3,,,,,,,770458943461094,/story.php?story_fbid=770458943461094&id=311710576002602
Richard Dien Winfield,,2020-01-24 11:19:34,"Introduced by Lady B at the Athens MLK Day African-American Elders Storyfest, where tales of courageous resistance to ugly Jim Crow oppression are not to be forgotten.",8,8,,,,,,,770259490147706,/story.php?story_fbid=770259490147706&id=311710576002602
Richard Dien Winfield,,2020-01-24 11:15:13,"At last night’s monthly meeting of the Oglethorpe County Democrats, chaired by employee rights lawyer Janet Hill, we discussed how a new social bill of rights, anchored in a Federal Job Guarantee and capped by Legal Care for All, can make America righteous.",19,14,,5,,,,,770256490148006,/story.php?story_fbid=770256490148006&id=311710576002602
Richard Dien Winfield,,2020-01-23 17:04:58,The word is out - there is a philosopher running for Senate.,58,48,,10,,,,1,769676970205958,/story.php?story_fbid=769676970205958&id=311710576002602
Richard Dien Winfield,,2020-01-21 20:12:34,"Enrique Reyna, Director of Organizing, showed us around the very impressive apprenticeship training center in Decatur of the International Union of Painters and Allied Trades, District Council 77.  We discussed my Employee Bill of Rights and the union organizing challenges facing the building trades.#IUPATDC77  #employeebillofrights",20,20,,,,,,,768267287013593,/story.php?story_fbid=768267287013593&id=311710576002602
Richard Dien Winfield,,2020-01-20 22:19:37,"Scenes from the Athens #MLK Day Parade, where our Senate campaign gathers steam.",35,28,,7,,,,1,767626943744294,/story.php?story_fbid=767626943744294&id=311710576002602
Richard Dien Winfield,,2020-01-20 21:37:02,"At the Athens, Georgia, #MLK Day Parade, the Winfield For Senate campaign renews King’s last agenda: to fulfill the social rights that remain ignored. #winfieldforsenate #socialrights",15,15,,,,,,,767605413746447,/story.php?story_fbid=767605413746447&id=311710576002602
Richard Dien Winfield,,2020-01-20 20:37:19,"‪At today’s Linnentown protest rally in front of Athens’ City Hall, Joey Carter invited me to address the crowd.  I spoke about the fundamental social right to decent housing and how its fulfillment depends upon three factors: guaranteeing jobs & fair income, implementing the right to mental & physical health care, and ensuring an adequate supply of good affordable housing, which a Federal Job Guarantee can help construct. #federaljobguarantee #fjg #socialrights",11,11,,,,,,,767581133748875,/story.php?story_fbid=767581133748875&id=311710576002602
Richard Dien Winfield,,2020-01-20 13:36:02,"‪The Winfield For Senate contingent will be the second group from the front in the Athens, GA #MLK parade - join us!  We start assembling at 2:15; the parade begins at 3 in front of the historic Morton Theater.   ‬",3,3,,,,,,,767383850435270,/story.php?story_fbid=767383850435270&id=311710576002602
"Richard Dien Winfield,Richard Dien Winfield",Richard Dien Winfield,2020-01-19 19:50:18,Tomorrow the Winfield For Senate contingent will March in the Athens MLK Day Parade.In honor of Martin Luther King we inaugurate a Senate campaign to bring to Washington the fight to fulfill our social rights and complete the unfinished business of the civil rights movement.,,,,,,,,,766863513820637,/story.php?story_fbid=766863513820637&id=311710576002602
Richard Dien Winfield,,2020-01-19 21:04:15,In honor of Martin Luther King we inaugurate a #Senate campaign to bring to Washington the fight to fulfill our social rights and complete the unfinished business of the civil rights movement. #MLKDay2020 #socialrights,47,36,2,4,2,2,1,3,766893890484266,/story.php?story_fbid=766893890484266&id=311710576002602
Richard Dien Winfield,,2020-01-19 19:46:56,Today we launch our campaign to renew MLK’s final struggle for a social bill of rights to complete the unfinished business of the civil rights movement. https://drive.google.com/file/d/1SIIbQChZONo2Z5vF6pt6UMTdsUJLhkrV/view?usp=drivesdk,15,14,,1,,,,,766862027154119,/story.php?story_fbid=766862027154119&id=311710576002602
Richard Dien Winfield,,2020-01-19 13:24:19,"At today’s Sunday service at St.Luke AME Church, Athens oldest, I fulfilled Bishop Jackson’s commission and the congregation pledged to be counted and make their voices count.  Listen ...",14,11,,3,,,,1,766673463839642,/story.php?story_fbid=766673463839642&id=311710576002602
Richard Dien Winfield,,2020-01-18 15:56:23,"Here’s some of the discussion about my Employee Bill of Rights at today’s meeting of SteelWorkers District 9 Local 254, hosted by President Darryl Ford. #employeebillofrights",3,3,,,,,,,766015503905438,/story.php?story_fbid=766015503905438&id=311710576002602
Richard Dien Winfield,,2020-01-18 15:43:44,"Today at the SteelWorkers District 9 Local 254 meeting, led by Local President Darryl Ford, I spoke about the Employee Bill of Rights that I will bring to Washington for Congress to enact. #employeebillofrights",8,8,,,,,,,766009183906070,/story.php?story_fbid=766009183906070&id=311710576002602
Richard Dien Winfield,,2020-01-15 23:55:41,At last Fall’s Athens Democrats Breakfast - Looking ahead to the 2020 Georgia Senate elections and what now lies at stake.,4,2,,2,,,,,763857384121250,/story.php?story_fbid=763857384121250&id=311710576002602
Richard Dien Winfield,,2020-01-14 14:27:09,"This is how the discussion raged at the Rockdale County Dems Politics After Dark - laying out the 4 advantages of a single payer health care system, exposing the fraudulent worry about retaining private health insurance plans, and showing how the social rights agenda is not a matter of handouts and welfare dependency.",1,1,,,,,,,762602847580037,/story.php?story_fbid=762602847580037&id=311710576002602
Richard Dien Winfield,,2020-01-13 23:25:54,"At tonight’s Rockdale County Democrats Politics After Dark, we debate the social rights agenda from guaranteed jobs at fair wages to legal care for all - here’s how it all began:",5,5,,,,,,,762028797637442,/story.php?story_fbid=762028797637442&id=311710576002602
Richard Dien Winfield,,2020-01-10 22:59:40,"At a Keralan holiday music fest, addressing the three great challenges facing US and Indian democracy.",8,7,,1,,,,,759111787929143,/story.php?story_fbid=759111787929143&id=311710576002602
Richard Dien Winfield,,2020-01-10 00:50:59,Tonight Dekalb County Democrats got introduced to the candidate for US Senate who will bring to Washington the fight to fulfill our social rights and unchain our democracy.,14,10,,4,,,,,758222518018070,/story.php?story_fbid=758222518018070&id=311710576002602
Richard Dien Winfield,,2020-01-04 22:26:17,"At today’s Athens demonstration, addressing how Trump’s actions towards Iran are weakening our democracy, undermining nuclear non-proliferation, and hindering the greening of petro-states.",12,11,,1,,,,,753724745134514,/story.php?story_fbid=753724745134514&id=311710576002602
