source,shared_from,date,text,reactions,likes,ahah,love,wow,sigh,grrr,comments,post_id,url
Theresa Greenfield,,2019-10-31 14:13:54,"""The trade war and two straight years of adverse weather rattled farmers already facing commodity price slumps."" Senator Ernst is not standing up for our farmers in Washington, and our ag communities are paying the price.",138,49,1,,3,41,44,13,1209352969275892,/story.php?story_fbid=1209352969275892&id=683872625157265
Theresa Greenfield,,2019-10-30 18:09:57,"Nearly 500,000 Iowans have a pre-existing condition. Senator Ernst voted yet again to uphold junk insurance plans – plans that can refuse to cover people with pre-existing conditions.  She's on the side of Mitch McConnell & the big insurance companies funding her campaign – not Iowans.",5K,612,17,9,59,344,3.9K,810,1208565946021261,/story.php?story_fbid=1208565946021261&id=683872625157265
Theresa Greenfield,,2019-10-29 17:53:10,Fact check: true.,225,200,11,14,,,,2,1207543666123489,/story.php?story_fbid=1207543666123489&id=683872625157265
Theresa Greenfield,,2019-10-29 14:45:05,"🗳 We're one week out from Election Day, and there are local elections happening all across Iowa. Make sure you have everything you need to cast your vote next week!",175,163,,12,,,,12,1207491239462065,/story.php?story_fbid=1207491239462065&id=683872625157265
Theresa Greenfield,,2019-10-28 15:22:09,"Social Security helped save my family when my first husband died in a workplace accident. Joni Ernst & Washington Republicans want to gut it ""behind closed doors.""   We have to flip the Senate, and that means we have to win in Iowa. Join us 👇",1K,929,18,85,11,5,14,51,1206624076215448,/story.php?story_fbid=1206624076215448&id=683872625157265
Theresa Greenfield,,2019-10-27 14:53:52,"The tax scam that Joni Ernst voted for “is projected to increase the annual deficit by about $200 billion, or close to $2 trillion over 10 years when factoring in interest payments, according to the nonpartisan Congressional Budget Office.” Instead of making Washington squeal, Ernst votes for corporate special interests. We can vote her out.",133,59,,,9,6,59,10,1205736416304214,/story.php?story_fbid=1205736416304214&id=683872625157265
Theresa Greenfield,,2019-10-25 17:18:25,We had a great conversation with labor leaders and  Dave Loebsack in Davenport today. Thank you for discussing the issues that are on the minds of the labor movement with me.,322,295,9,15,2,,1,15,1203991759812013,/story.php?story_fbid=1203991759812013&id=683872625157265
Theresa Greenfield,,2019-10-24 17:31:19,"Senator Ernst, this isn't a laughing matter for Iowa farmers.",137,41,2,,12,8,74,33,1203143523230170,/story.php?story_fbid=1203143523230170&id=683872625157265
Theresa Greenfield,,2019-10-24 12:19:53,"With her fundraising lagging, Senator Ernst is now turning to Mitch McConnell's dark money group again to prop her up with a new six-figure ad buy in Iowa. Ready to fight back? Chip in: secure.actblue.com/donate/tg-october-eom?refcode=fb1024&amount=10 https://apnews.com/57cba17b02314ffe879a74ccbbfa3de6",1.9K,596,293,19,78,54,861,271,1202949433249579,/story.php?story_fbid=1202949433249579&id=683872625157265
Theresa Greenfield,,2019-10-23 13:58:53,"Yesterday, Justin & Kody at Turtle Creek Wind Farm in Stacyville welcomed me for a tour of their facilities and took me to see their turbines. Their turbines can generate enough clean energy to power 61,000 average homes in Iowa each year with wind power, which helps us cut our greenhouse gas emissions.    Thank you for the great tour and for letting me see wind turbines up close!",84,73,,10,1,,,3,1202067153337807,/story.php?story_fbid=1202067153337807&id=683872625157265
Theresa Greenfield,,2019-10-22 21:44:06,"Thank you to State Rep. Mark Smith and his wife Karen for inviting me into your home in Marshalltown. I had such a great time meeting everyone, and thank you for taking the time to let me know what's on your mind.",43,40,,3,,,,,1201402203404302,/story.php?story_fbid=1201402203404302&id=683872625157265
Theresa Greenfield,,2019-10-22 19:16:32,"""As her fundraising has slowed, Ernst’s support back home has also declined...Iowa farmers have taken a serious hit from the president’s trade war."" Meanwhile, we're building a grassroots team that will put Iowans first. Join us → greenfieldforiowa.com",3.7K,2.8K,276,448,65,16,47,223,1201307126747143,/story.php?story_fbid=1201307126747143&id=683872625157265
Theresa Greenfield,,2019-10-22 11:39:11,"I'm honored to have the endorsement of LiUNA Midwest Region! Iowa’s dedicated and highly skilled laborers have helped build our state, and I’ll be working tirelessly in the Senate to ensure our state’s hardworking women and men can earn a living with dignity.",69,61,,8,,,,2,1200943973450125,/story.php?story_fbid=1200943973450125&id=683872625157265
Theresa Greenfield,,2019-10-21 22:49:40,Great meeting new friends in Jefferson County tonight! Loved discussing health care and climate change with each and every one of you.,70,67,,3,,,,4,1200398623504660,/story.php?story_fbid=1200398623504660&id=683872625157265
Theresa Greenfield,,2019-10-20 23:26:27,We also got a chance to head to the Linn County Hall of Fame tonight where hundreds of our friends surprised me and Kamala Harris  by singing to us.,42,33,1,8,,,,,1199433453601177,/story.php?story_fbid=1199433453601177&id=683872625157265
Theresa Greenfield,,2019-10-20 23:24:52,"What a birthday! We started the day meeting with Iowans in Elkader and Manchester, where we discussed what’s on their mind from Social Security to our climate.  This birthday was one of the best I’ve had, and it’s all thanks to Iowans for taking the time out of their Sundays to meet with me and hear from folks up and down the ballot on how we’re going to flip Iowa blue. Thank you again!",94,89,,5,,,,2,1199432290267960,/story.php?story_fbid=1199432290267960&id=683872625157265
Theresa Greenfield,,2019-10-20 16:26:13,"It's my birthday today! The best gift you can get me is getting involved, especially with local elections coming up soon. Head to iwillvote.com to get all the information you need, and thank you for the birthday wishes.",236,204,,32,,,,45,1199161523628370,/story.php?story_fbid=1199161523628370&id=683872625157265
Theresa Greenfield,,2019-10-20 11:48:40,"What a treat to be at the Guthrie County Fall Dinner last night! Great meeting Iowans of all ages and hearing what’s on their mind. Thanks for having me, Guthrie County Democrats!",81,76,,5,,,,4,1198955716982284,/story.php?story_fbid=1198955716982284&id=683872625157265
Theresa Greenfield,,2019-10-17 15:24:14,"State of our race for Senate here in Iowa: ✅Outraised Senator Ernst in Q3 ✅Ratings change in our direction ✅Ernst's approval is now underwater ✅And a brand new poll has this race in the single digits If you're ready to flip this seat, and the Senate, chip in:",476,423,15,34,2,,2,16,1196097707268085,/story.php?story_fbid=1196097707268085&id=683872625157265
Theresa Greenfield,,2019-10-17 09:39:46,"""Iowa voters soured on Sen. Joni Ernst by 9 points, the biggest slide in net approval for any senator between the second and third quarters of 2019."" Join us in the race for Senate to get Iowans representation they can be proud of. GreenfieldforIowa.com",6.4K,4.9K,562,769,81,22,34,717,1195868167291039,/story.php?story_fbid=1195868167291039&id=683872625157265
Theresa Greenfield,,2019-10-15 18:15:48,"With an average online contribution of just $16, we outraised Joni Ernst and the corporate special interests funding her campaign.",75,60,2,13,,,,,1194378567439999,/story.php?story_fbid=1194378567439999&id=683872625157265
Theresa Greenfield,,2019-10-15 14:39:31,"At a closed-door fundraiser with Mike Pence, Joni Ernst said *herself* that she’s one of the most vulnerable Senators up for re-election. Folks, we can win here in Iowa, but I’m going to need you with me to make that a reality. Join us →",1K,874,30,86,5,1,5,68,1194258470785342,/story.php?story_fbid=1194258470785342&id=683872625157265
Theresa Greenfield,,2019-10-13 16:05:04,"Joni Ernst, earlier this year: “We hear a lot of those talking points about the wealthy getting wealthier. That's not true.” In reality: The GOP tax law “was a windfall for the wealthy”",139,52,1,,1,7,78,7,1192498720961317,/story.php?story_fbid=1192498720961317&id=683872625157265
Theresa Greenfield,,2019-10-11 19:35:16,"RATINGS CHANGE: Inside Elections moved this Senate race in our direction just after the news that we outraised Senator Ernst last quarter! Folks, we have momentum, and we can flip this seat, but we need you with us. Chip in right now:  https://secure.actblue.com/donate/tg-ratingschange?refcode=tw1011&amount=10.00",5.5K,4.6K,101,722,37,14,23,407,1190903914454131,/story.php?story_fbid=1190903914454131&id=683872625157265
Theresa Greenfield,,2019-10-11 12:51:14,"🚨🚨Big news in the race for the Senate in Iowa: we outraised Joni Ernst last quarter! It's clear we have the grassroots momentum to flip this seat, and that Iowans are ready for new leadership.",403,309,,86,7,1,,19,1190686201142569,/story.php?story_fbid=1190686201142569&id=683872625157265
Theresa Greenfield,,2019-10-09 09:35:43,Folks like you helped us close the books on Q3 strong! I'm so thankful for everyone on Team Greenfield -- this is what a grassroots campaign looks like.,39,34,,3,1,,1,2,1188906987987157,/story.php?story_fbid=1188906987987157&id=683872625157265
Theresa Greenfield,,2019-10-08 21:06:14,"Loved meeting Iowans in Kossuth County tonight on this beautiful fall day! Thanks for having me, and for telling me why you’re in this fight",67,63,,3,,,1,3,1188487451362444,/story.php?story_fbid=1188487451362444&id=683872625157265
Theresa Greenfield,,2019-10-08 16:18:10,Iowans across the state are ready to elect someone who will put Iowa first. Great talking with so many folks in Jasper County!,61,55,,6,,,,2,1188352268042629,/story.php?story_fbid=1188352268042629&id=683872625157265
Theresa Greenfield,,2019-10-07 17:38:50,"I grew up on a family farm where I learned the value of hard work. We suffered through the farm crisis of the 1980s, where we saw neighbors lose their farms, their livelihoods. It was tough times all over the Midwest. We cannot let history repeat itself, and Iowans need leadership that will actually stand up for our agricultural community.",145,78,,6,,49,12,16,1187549604789562,/story.php?story_fbid=1187549604789562&id=683872625157265
Theresa Greenfield,,2019-10-06 16:21:17,A great Sunday afternoon with the Jasper County Democrats! Thank you for the warm welcome and the tasty soup. Looking forward to working together to flip this Senate seat blue.,79,73,,6,,,,,1186693571541832,/story.php?story_fbid=1186693571541832&id=683872625157265
Theresa Greenfield,,2019-10-06 11:41:09,"Northwest Iowa Democrats are energized, and they’re ready to win this race. Something *is* going on in Iowa, and I intend to get up early and stay up late to make sure we flip this Senate seat.",144,124,,20,,,,5,1186522941558895,/story.php?story_fbid=1186522941558895&id=683872625157265
Theresa Greenfield,,2019-10-05 13:04:58,Had a great time celebrating the work being done across Iowa to support and empower our LGBTQ+ youth at the Iowa Safe Schools Spirit Awards last night!,107,89,,16,1,1,,3,1185705454973977,/story.php?story_fbid=1185705454973977&id=683872625157265
Theresa Greenfield,,2019-10-04 17:08:26,"I would not be here without the help I got from Social Security and union benefits after my first husband died in a workplace accident. So when I hear people like Joni Ernst talk about how we should gut Social Security “behind closed doors,” it gets me hot under the collar. Those programs helped save my family, and that’s why I’m running to flip this Senate seat. To help families like mine.",145,120,,25,,,,8,1184978131713376,/story.php?story_fbid=1184978131713376&id=683872625157265
Theresa Greenfield,,2019-10-04 11:11:07,"Joni Ernst voted to repeal the Affordable Care Act, all while knowing there’s no plan in place to replace it if it’s struck down.",208,41,,3,2,9,153,37,1184717248406131,/story.php?story_fbid=1184717248406131&id=683872625157265
Theresa Greenfield,,2019-10-03 21:34:50,"Had a perfect fall day in southeastern Iowa out talking to folks in Fort Madison and Sperry! It’s an honor to talk with you to hear what’s keeping you up at night, and why you’re in this fight.",73,70,,3,,,,2,1184164025128120,/story.php?story_fbid=1184164025128120&id=683872625157265
Theresa Greenfield,,2019-10-02 17:27:25,"Senator Ernst promised she’d be different. But as this trade war has dragged on and Iowa’s renewable energy industry continues to suffer, she’s refused to break with Mitch McConnell and Washington Republicans to protect Iowa’s agricultural communities, who now more than ever need a champion in Washington.  In the Senate, I won’t be afraid to stand up to do what’s right for our working families and agricultural economy. I can’t get there alone -- join us today: greenfieldforiowa.com",175,57,3,3,7,7,98,29,1183151891896000,/story.php?story_fbid=1183151891896000&id=683872625157265
Theresa Greenfield,,2019-10-02 10:42:26,"In Iowa, we’ve seen record flooding and severe weather harm our families across the state — we can’t afford leaders who reject the science on climate change. I’m so grateful to have the support of the League of Conservation Voters Action Fund in our campaign for Senate here in Iowa.",57,54,,2,,,1,5,1182906991920490,/story.php?story_fbid=1182906991920490&id=683872625157265
Theresa Greenfield,,2019-10-01 23:15:09,Loved spending my day out with friends in southwestern Iowa. Thanks for braving the rain to tell me what’s on your mind!,48,48,,,,,,,1182509428626913,/story.php?story_fbid=1182509428626913&id=683872625157265
Theresa Greenfield,,2019-09-30 17:46:41,"🚨Alright folks, our FEC deadline is TONIGHT. And we’re not taking any money from corporate PACs, so we’re relying on people like you to step up and chip in to help us make sure we hit this goal. Pitch in right now:",21,17,,4,,,,,1181534245391098,/story.php?story_fbid=1181534245391098&id=683872625157265
Theresa Greenfield,,2019-09-28 21:24:35,Thank you Woodbury County Democratic Party for having me tonight at the Harry Hopkins dinner! Great meeting Siouxlanders who are ready to flip seats up and down the ballot.,71,70,,1,,,,2,1180072635537259,/story.php?story_fbid=1180072635537259&id=683872625157265
Theresa Greenfield,,2019-09-27 16:46:02,"Joni Ernst has voted over and over to repeal the Affordable Care Act and undermine protections for Iowans with pre-existing conditions. If she cares about protecting Iowans' health care, she should put partisan politics aside & actually defend pre-existing conditions protections.",119,77,,6,,2,34,19,1179132342297955,/story.php?story_fbid=1179132342297955&id=683872625157265
Theresa Greenfield,,2019-09-24 15:19:41,"Today is National Voter Registration Day! Time to: ✅register to vote ✅confirm your registration is up to date ✅make sure your friends are registered, too!",123,109,,14,,,,2,1176575979220258,/story.php?story_fbid=1176575979220258&id=683872625157265
Theresa Greenfield,,2019-09-24 10:03:51,"BIG NEWS: Congresswoman Abby Finkenauer is on Team Greenfield! She knows what hardworking Iowans are up against in their lives each and every day, and I've been inspired by her leadership. I'm proud to have her in my corner in our race for the U.S. Senate.",475,395,26,50,2,1,1,26,1176388815905641,/story.php?story_fbid=1176388815905641&id=683872625157265
Theresa Greenfield,,2019-09-23 20:56:28,"Our critical FEC fundraising deadline is coming up in one week, and we have a lot of money we need to raise before then. This campaign is built by everyday folks like you pitching in what you can, when you can. If you’re ready to flip Iowa, and the Senate, blue, use this link to give right away:",14,11,,3,,,,1,1175970665947456,/story.php?story_fbid=1175970665947456&id=683872625157265
Theresa Greenfield,,2019-09-23 14:21:23,Joni Ernst wants to gut Social Security -- both “behind closed doors” and in a twisted way to pay for family leave after having kids. We have to vote her out.,3.5K,939,33,16,79,183,2.2K,674,1175781585966364,/story.php?story_fbid=1175781585966364&id=683872625157265
Theresa Greenfield,,2019-09-21 17:39:46,Scenes from the Polk County Democrats #SteakFry! Another great weekend out talking with everyone. Only in Iowa.￼￼,198,178,,20,,,,7,1174384039439452,/story.php?story_fbid=1174384039439452&id=683872625157265
Theresa Greenfield,,2019-09-19 15:42:52,"Because of climate change, the days above 90 degrees in Iowa are expected to nearly triple. Meanwhile, Joni Ernst repeatedly rejects climate science and refuses to take much-needed action. I'm running for Senate because we need to act. We deserve a Senator who will stand up for our communities thrust into peril because of climate change.",138,78,,4,10,18,28,14,1172748799602976,/story.php?story_fbid=1172748799602976&id=683872625157265
Theresa Greenfield,,2019-09-17 18:34:05,“Senator Ernst needs to be held accountable for her actions as she is willing to end a critical program for Iowans in need of adequate and affordable health care.”  Read more on what these votes mean to Iowans👇,77,63,1,,,1,12,3,1171252806419242,/story.php?story_fbid=1171252806419242&id=683872625157265
Theresa Greenfield,,2019-09-17 11:54:33,"Thank you to Boilermakers Local 83 for supporting our campaign for Senate. Unions are essential to the fabric of our economy and lift up hardworking families across our state, and I’m honored to have their support. I’ll continue to be a vocal ally for union members as Iowa’s next Senator.",60,60,,,,,,1,1171062729771583,/story.php?story_fbid=1171062729771583&id=683872625157265
Theresa Greenfield,,2019-09-13 14:05:50,"""It's no surprise that Ernst would want to discuss solutions 'behind closed doors' away from the scrutiny of her constituents."" Joni Ernst wants to gut Social Security.  I want to protect it. If you do too, join us: greenfieldforiowa.com",1.8K,1.2K,3,80,30,22,471,122,1168134493397740,/story.php?story_fbid=1168134493397740&id=683872625157265
Theresa Greenfield,,2019-09-12 13:28:59,It was great to talk to the Johnston Area Democrats about what’s on everyone’s mind last night. Meeting new friends and seeing familiar faces – and learning which issues matter most to you – is the best part of running for Senate in Iowa.,50,46,1,3,,,,2,1167363760141480,/story.php?story_fbid=1167363760141480&id=683872625157265
Theresa Greenfield,,2019-09-12 10:33:04,"I’m honored to have the support of the Omaha and Southwest Iowa Building and Construction Trades Council in our campaign for Senate. Organized construction workers have helped build our communities and build our middle class, and I’ll never stop working to be an ally for union members and working families all across Iowa.",50,47,,2,,1,,,1167239160153940,/story.php?story_fbid=1167239160153940&id=683872625157265
Theresa Greenfield,,2019-09-11 11:05:09,"Today, on the anniversary of September 11th, we remember the lives we lost and honor our first responders who put themselves in harms’ way to keep our country safe.",59,51,,2,,6,,,1166462120231644,/story.php?story_fbid=1166462120231644&id=683872625157265
Theresa Greenfield,,2019-09-10 23:32:51,"‪What an evening in Grinnell. I got to meet so many Iowans — friends, neighbors, and farmers — and hear firsthand what’s on their minds as we head into fall. ‬",126,119,1,6,,,,1,1166094456935077,/story.php?story_fbid=1166094456935077&id=683872625157265
Theresa Greenfield,,2019-09-09 12:10:23,"I'm a farm kid with farm kid values, which means I know how important it is to reach out to all Iowans. I'm committed to earning your trust and prioritizing our rural communities across our 99 counties.",130,113,1,14,,,2,12,1165070120370844,/story.php?story_fbid=1165070120370844&id=683872625157265
Theresa Greenfield,,2019-09-08 18:50:48,A great weekend out talking with Iowans! Thank you for taking the time to tell me what’s on your mind. I’m ready to fight for you in the Senate.,959,882,23,48,2,1,3,55,1164536450424211,/story.php?story_fbid=1164536450424211&id=683872625157265
Theresa Greenfield,,2019-09-06 12:57:18,"Troy and Joe showed me around the Ironworkers Local 89 facilities in Cedar Rapids where they train apprentices to continue building our infrastructure. They are 3rd and 4th generation Ironworkers, a testament to the pride our unions instill in the work they do.",1.1K,1K,8,73,13,,2,23,1162834270594429,/story.php?story_fbid=1162834270594429&id=683872625157265
Theresa Greenfield,,2019-09-05 16:07:53,"Iowans work hard for our earned benefits like Social Security. Joni Ernst wants to privatize the program.  I will not let anyone lay a finger on Social Security. If you're with me, join our team right now: greenfieldforiowa.com",200,72,,2,2,4,120,36,1162191250658731,/story.php?story_fbid=1162191250658731&id=683872625157265
Theresa Greenfield,,2019-09-04 17:35:18,The only people squealing from Joni Ernst's toxic record are Iowans who rely on Social Security. We work hard for these earned benefits and deserve better than a senator who plays games with retirement security.,3.4K,814,11,12,122,93,2.3K,534,1161501280727728,/story.php?story_fbid=1161501280727728&id=683872625157265
Theresa Greenfield,,2019-09-03 14:00:15,I’m a farm kid with farm kid values who understands the importance of Social Security and union benefits because they saved my family. That’s why I’m running for Senate – to make sure Iowans get the benefits they deserve.,178,157,2,19,,,,7,1160670570810799,/story.php?story_fbid=1160670570810799&id=683872625157265
Theresa Greenfield,,2019-09-02 18:48:50,,1.5K,1.4K,12,67,2,,3,,1160131517531371,/story.php?story_fbid=1160131517531371&id=683872625157265
Theresa Greenfield,,2019-09-01 18:36:07,Great to discuss how we can work to improve the lives of everyday Iowans with the Clinton County Democrats!,64,59,1,4,,,,,1159439190933937,/story.php?story_fbid=1159439190933937&id=683872625157265
Theresa Greenfield,,2019-08-29 21:31:34,"Iowa State Senator Zach Wahls always stands up for what he believes is right, and is a tireless champion for Iowans. I'm grateful to have his support on our campaign.",915,806,17,85,3,1,3,32,1157374807807042,/story.php?story_fbid=1157374807807042&id=683872625157265
Theresa Greenfield,,2019-08-29 18:06:52,"BIG NEWS: State Senate Minority Leader Janet Petersen is on Team Greenfield! She knows Iowans deserve a Senator who won't back down from fighting for what's best for Iowa, and I'm honored to have her support in the race for U. S. Senate.",1.2K,1.1K,29,78,5,2,2,64,1157288564482333,/story.php?story_fbid=1157288564482333&id=683872625157265
Theresa Greenfield,,2019-08-29 10:59:07,🚨Team Greenfield is growing! I’m proud to have earned the support of these public servants and community leaders who work on behalf of hardworking Iowans.,36,31,1,3,1,,,,1157085551169301,/story.php?story_fbid=1157085551169301&id=683872625157265
Theresa Greenfield,,2019-08-28 23:00:23,A perfect day spent with friends in Council Bluffs & Cass County. Listening to you talk about the issues on your mind and what you’re fighting for are the best parts of running for Senate.,65,60,1,4,,,,,1156695804541609,/story.php?story_fbid=1156695804541609&id=683872625157265
Theresa Greenfield,,2019-08-28 19:09:12,Iowans are ready for a Senator who will actually listen and take action on issues that hurt our farmers and our families. Great meeting so many passionate Siouxlanders!,156,136,1,18,1,,,4,1156594531218403,/story.php?story_fbid=1156594531218403&id=683872625157265
Theresa Greenfield,,2019-08-28 11:40:17,I'm running for Senate because Joni Ernst talks about privatizing and cutting programs like Social Security. I promise to work to sustain it because it helped save my family. I will never let anyone lay a finger on it.,215,179,,35,,1,,5,1156372761240580,/story.php?story_fbid=1156372761240580&id=683872625157265
Theresa Greenfield,,2019-08-27 11:59:48,"I'm honored to have the support of UFCW Local 431 members, a strong and diverse union that has been fighting for decades to ensure thousands of Iowa workers get the fair shot they deserve.  Standing up for fair wages, good benefits, and safe working conditions is a fight I’ll never back down from when I’m in the Senate.",86,77,1,8,,,,5,1155648174646372,/story.php?story_fbid=1155648174646372&id=683872625157265
Theresa Greenfield,,2019-08-27 09:29:41,"Thanks for having me last night Polk County Democrats, such a great group of people working for change!",77,76,,1,,,,3,1155564254654764,/story.php?story_fbid=1155564254654764&id=683872625157265
Theresa Greenfield,,2019-08-26 10:10:57,"Couldn't have asked for a better Sunday evening, a garden party with the !",94,93,,1,,,,4,1154783898066133,/GreenfieldForIowa/photos/a.699515050259689/1154783898066133
Theresa Greenfield,,2019-08-25 19:17:46,‪Loved spending time with Boone County Democrats of Iowa this weekend for the Brown Woodard Awards dinner. I’ll be back to Boone County! ‬,1.8K,1.6K,35,117,6,2,8,54,1154355434775646,/story.php?story_fbid=1154355434775646&id=683872625157265
Theresa Greenfield,,2019-08-23 13:28:56,"Another terrible idea from Joni Ernst, who voted to confirm Betsy DeVos as Education Secretary. Eliminating the Department of Education would jeopardize Pell grants and federal student aid for Iowans, as well as threaten funding for special education and job training. This irresponsible plan would be devastating for access to higher education and harm our public schools. Iowans can’t afford Joni Ernst in the Senate.",3.3K,647,38,9,62,227,2.3K,574,1152744908270032,/story.php?story_fbid=1152744908270032&id=683872625157265
