source,shared_from,date,text,reactions,likes,ahah,love,wow,sigh,grrr,comments,post_id,url
Theresa Greenfield,,2020-01-15 15:40:00,"Thanks to folks like you, we outraised Senator Ernst in the last half of 2019. But we have a lot of work ahead of us, and need this team to step up again so we can flip this Senate seat. Chip in right away:",24,21,,3,,,,1,1286640271547161,/story.php?story_fbid=1286640271547161&id=683872625157265
Theresa Greenfield,,2020-01-13 18:47:12,Senator Ernst votes time and time again to take away protections for folks with pre-existing conditions & stands idly by as the current administration works to dismantle them.  Time to flip the Senate:,57,55,,1,,1,,7,1284731621738026,/story.php?story_fbid=1284731621738026&id=683872625157265
Theresa Greenfield,,2020-01-12 22:14:22,Thank you Grundy County Democrats - Iowa for the warm welcome on this wintry Sunday! Had a great time meeting folks who are ready to elect Democrats up and down the ballot come November. And I got to try my hand at pie auctioneering — only in Iowa.,44,39,,5,,,,5,1283830545161467,/story.php?story_fbid=1283830545161467&id=683872625157265
Theresa Greenfield,,2020-01-09 17:58:03,"BIG news: thanks to this incredible team, we were able to raise more than $1.6 million last quarter! And what I’m most proud of? We did it with donations from all of Iowa’s 99 counties, and an average online gift of less than $18. 💪",83,72,,10,,,1,3,1280338795510642,/story.php?story_fbid=1280338795510642&id=683872625157265
Theresa Greenfield,,2020-01-09 10:17:16,"Thanks to folks like you and all your hard work, we were able to raise more than $1.6 million last quarter, a record-breaking haul for a Senate challenger in Iowa at this point in the race. We’re ready to win!",214,177,1,35,,,1,11,1279966752214513,/story.php?story_fbid=1279966752214513&id=683872625157265
Theresa Greenfield,,2020-01-08 20:11:29,Senator Ernst is urging the Supreme Court to reconsider Roe v. Wade.  I will always defend a woman’s right to make her own health care decisions.  This is what’s at stake in 2020. Join us:,35,26,2,7,,,,2,1279348195609702,/story.php?story_fbid=1279348195609702&id=683872625157265
Theresa Greenfield,,2020-01-07 14:41:59,"If the Republican lawsuit to dismantle the ACA is successful, 187,000 Iowans will lose their insurance. That’s an increase of 125%. We deserve leaders who will fight for our health care, not threaten it any chance they get.",106,39,,,6,15,46,10,1278024145742107,/story.php?story_fbid=1278024145742107&id=683872625157265
Theresa Greenfield,,2020-01-05 20:30:45,"Had a great time this afternoon with the Hardin County Democrats! Nothing better than a room full of Iowa Democrats who are ready to help us flip this seat, and flip the Senate. Want to join? Head to greenfieldforiowa.com to get involved.",89,81,,7,1,,,4,1276120385932483,/story.php?story_fbid=1276120385932483&id=683872625157265
Theresa Greenfield,,2020-01-04 16:21:37,"Iowa Republicans, including Senator Ernst, are urging the Supreme Court to reconsider Roe v. Wade. We have to stand up for women’s rights to make their own health care decisions.",210,49,,2,2,6,151,49,1274718492739339,/story.php?story_fbid=1274718492739339&id=683872625157265
Theresa Greenfield,,2019-12-31 16:06:46,"This is it – our FINAL deadline before it’s election year. Will you step up and pitch to help us hit our critical FEC deadline? Our numbers will be public, so we’re relying on folks like you to help us across the finish line. You can use this link:",6,5,,,1,,,2,1270237149854140,/story.php?story_fbid=1270237149854140&id=683872625157265
Theresa Greenfield,,2019-12-30 17:24:16,"Tomorrow is the end of the year and our critical FEC deadline, and we could use a boost before we have to report our numbers. Last quarter, this incredible team helped us outraise Senator Ernst. Can we do it again? Chip in right now!",8,8,,,,,,,1269027589975096,/story.php?story_fbid=1269027589975096&id=683872625157265
Theresa Greenfield,,2019-12-28 12:14:28,"Happy anniversary to my honey, Steve. These past 28 years have been filled with love and support – and I know 2020 will be our greatest adventure yet.",297,248,,49,,,,34,1266782590199596,/story.php?story_fbid=1266782590199596&id=683872625157265
Theresa Greenfield,,2019-12-27 11:05:58,"Senator Ernst has tried to distance herself from dark money groups in the past, only to now turn around and illegally coordinate with one set up by her top staff.  Iowans can see through this charade and we’re ready to vote her out.",170,61,3,1,2,7,96,20,1265680126976509,/story.php?story_fbid=1265680126976509&id=683872625157265
Theresa Greenfield,,2019-12-26 10:43:04,"We have a big, critical end-of-year goal to hit on the 31st, but we still have a lot of money to raise before the clock strikes midnight. If you can, pitch in right now using this link. Every dollar will go to flipping the seat – and the Senate!  https://secure.actblue.com/donate/tg-december-eoy2019?refcode=fb1226&amount=10.00",2,2,,,,,,,1264565337087988,/story.php?story_fbid=1264565337087988&id=683872625157265
Theresa Greenfield,,2019-12-25 14:14:14,Merry Christmas from my family to yours! I hope everyone has a joyful holiday — we enjoyed our Christmas walk in the woods with our dog Ringo 🎄,267,232,,35,,,,24,1263663500511505,/story.php?story_fbid=1263663500511505&id=683872625157265
Theresa Greenfield,,2019-12-24 12:16:38,"One thing we’re certain of: in 2020, Iowans are ready to vote for leaders who will actually fight for them. Join us to flip this seat and take back the Senate 👇",31,29,,2,,,,1,1262420883969100,/story.php?story_fbid=1262420883969100&id=683872625157265
Theresa Greenfield,,2019-12-23 18:25:56,"“Ernst also expressed displeasure with the explosion of dark money spending in Iowa … During her time in the Senate, Ernst has not endorsed any bills to require disclosure of dark money donors.” Not a good look.",164,44,4,,15,6,95,15,1261667190711136,/story.php?story_fbid=1261667190711136&id=683872625157265
Theresa Greenfield,,2019-12-22 16:56:16,“Iowa Sen. Joni Ernst faces a challenging path to her first reelection in 2020” You know what this is called? 💪Momentum 💪,286,221,18,45,1,,1,27,1260568920820963,/story.php?story_fbid=1260568920820963&id=683872625157265
Theresa Greenfield,,2019-12-20 13:55:54,"COOK POLITICAL REPORT: The majority is IN PLAY, and that means winning in Iowa is crucial if we want to take back the Senate. Chip in to help us win this #IASen race: https://secure.actblue.com/donate/tg-december-2019?refcode=fb1220&amount=10.00",93,82,,8,1,1,1,8,1258224857722036,/story.php?story_fbid=1258224857722036&id=683872625157265
Theresa Greenfield,,2019-12-18 12:00:01,"🚨🚨A new poll has our race for Iowa's Senate seat as a single digit race – and after voters hear about her illegal coordination with a dark money group, Sen. Ernst’s support drops to 40% while we take the lead.  We can win this, but we need your help. Chip in:",43,37,,5,1,,,1,1256078647936657,/story.php?story_fbid=1256078647936657&id=683872625157265
Theresa Greenfield,,2019-12-18 11:00:38,An evening spent with Democrats in Iowa is always a good time. Great talking with so many of you last night!,85,79,,6,,,,1,1256029414608247,/story.php?story_fbid=1256029414608247&id=683872625157265
Theresa Greenfield,,2019-12-17 16:18:32,“Illegal conduct is illegal regardless if anyone is watching.”  Not 1️⃣ but 2️⃣ watchdog groups have filed complaints against Senator Ernst following the AP report outlining her illegal coordination with a dark money group.,206,162,1,13,3,1,26,20,1255269614684227,/story.php?story_fbid=1255269614684227&id=683872625157265
Theresa Greenfield,,2019-12-17 11:13:10,"Two years ago this week, Sen. Ernst voted for the tax scam that lined the pockets of corporations and the ultra-wealthy while leaving everyday Iowans behind. We can vote her out & flip the Senate, but we need you with us. Join our campaign for #IASen →",47,47,,,,,,1,1255066338037888,/story.php?story_fbid=1255066338037888&id=683872625157265
Theresa Greenfield,,2019-12-16 14:49:15,Still thinking about last night’s holiday celebration in Tama County with the Tama County Democrats! Thanks to everyone who came out on a snowy evening and for such a warm welcome.,48,48,,,,,,,1254227138121808,/story.php?story_fbid=1254227138121808&id=683872625157265
Theresa Greenfield,,2019-12-15 19:03:17,"We’re getting bumper stickers, but we need your help! Vote for your favorite design now ➡️ http://bit.ly/TGbumpersticker",14,14,,,,,,2,1253372311540624,/story.php?story_fbid=1253372311540624&id=683872625157265
Theresa Greenfield,,2019-12-15 16:47:20,The holiday spirit was alive and well yesterday across Eastern Iowa! Great celebrating with old friends and new friends in Clinton and Muscatine Counties last night.,44,43,,1,,,,,1253285044882684,/story.php?story_fbid=1253285044882684&id=683872625157265
Theresa Greenfield,,2019-12-13 15:07:16,"This week, I had the opportunity to stop into the UAW Local 450 Retirees Chapter Meeting. Nothing better than seeing how unions continue to have a positive impact on their members.",53,48,,5,,,,2,1251074758437046,/story.php?story_fbid=1251074758437046&id=683872625157265
Theresa Greenfield,,2019-12-13 11:29:44,"The members of IBEW had my back after my first husband died in a tragic workplace accident, and I will always have their back in the Senate. Proud to be endorsed by the Iowa Conference in the race for #IASen. #UnionStrong",371,337,4,28,1,,1,12,1250914885119700,/story.php?story_fbid=1250914885119700&id=683872625157265
Theresa Greenfield,,2019-12-11 15:58:49,"After my first husband, Rod, died in a workplace accident, it was his fellow union members from @IBEW who helped get me back on my feet. They watched my kids while I got groceries, shoveled my driveway, and stopped by to share a meal. I’m  honored to have the support of the IBEW Iowa State Conference in the race for #IASen. I will never forget their help, and will fight for them in the Senate.",3.1K,2.5K,2,470,18,86,,47,1248985361979319,/story.php?story_fbid=1248985361979319&id=683872625157265
Theresa Greenfield,,2019-12-11 13:06:08,"I’m honored to have the support of Iowa’s electrical workers, and this endorsement is personal for me. IBEW members helped my young family after I lost my first husband. In the Senate, I will be proud to work with IBEW to strengthen workplace protections and champion workers’ rights on the job.",84,76,,7,1,,,3,1248869971990858,/story.php?story_fbid=1248869971990858&id=683872625157265
Theresa Greenfield,,2019-12-10 14:15:05,"In 2017, the FEC found Ernst’s first campaign for Senate broke the law by “knowingly accepting excessive and prohibited contributions, and by failing to timely refund excessive and prohibited contributions.” Yikes.",2.6K,1.4K,133,63,349,49,658,360,1247951198749402,/story.php?story_fbid=1247951198749402&id=683872625157265
Theresa Greenfield,,2019-12-09 19:27:10,"Great to be out on a farm yesterday, discussing sustainable farming practices with Matt. Matt told me his family has owned their farm in Bagley for four generations now. Always informative to hear the sustainable farming practices in use across Iowa – our farms are the backbone of our economy.",262,243,5,12,2,,,10,1247163675494821,/story.php?story_fbid=1247163675494821&id=683872625157265
Theresa Greenfield,,2019-12-09 17:00:52,"A watchdog group is urging the FEC ""to investigate allegations that members of Sen. Joni Ernst’s campaign violated election laws by coordinating with 'dark money' group Iowa Values.""",149,119,,9,2,,19,7,1247067045504484,/story.php?story_fbid=1247067045504484&id=683872625157265
Theresa Greenfield,,2019-12-09 11:39:39,"WATCH: ""Senator Joni Ernst is under the microscope, accused of having ties to dark money.""",102,53,2,,6,1,40,12,1246841698860352,/story.php?story_fbid=1246841698860352&id=683872625157265
Theresa Greenfield,,2019-12-08 20:37:54,"This spring, nine feet of water flooded the home of Fran and Jason in Pacific Junction. Today, they opened their home to me and other activists to discuss how the floods impacted their community.  Thank you for taking the time to talk with me. I am committed to working with Iowans to find solutions to the new challenges we face from climate change.",78,70,,5,,3,,3,1246140528930469,/story.php?story_fbid=1246140528930469&id=683872625157265
Theresa Greenfield,,2019-12-08 17:21:15,Senator Ernst “did not offer any evidence to contradict the AP report” – the report that laid out evidence her campaign is illegally coordinating with a dark money group here in Iowa.,185,66,3,1,6,3,106,22,1246004538944068,/story.php?story_fbid=1246004538944068&id=683872625157265
Theresa Greenfield,,2019-12-08 15:33:05,We had a great day yesterday in Floyd County and Winnebago County! Thank you to everyone who came out to tell me what’s on your mind.,48,47,,,1,,,1,1245905802287275,/story.php?story_fbid=1245905802287275&id=683872625157265
Theresa Greenfield,,2019-12-07 14:05:15,"If you're tired of the political corruption in Washington like I am, join us to flip this seat in Iowa  ➡️greenfieldforiowa.com",83,71,,12,,,,,1244750509069471,/story.php?story_fbid=1244750509069471&id=683872625157265
Theresa Greenfield,,2019-12-06 14:36:39,WATCH: Senator Ernst's illegal coordination with a dark money group set up by her top political aides is making the news across Iowa.,122,44,1,,11,2,64,21,1243744649170057,/story.php?story_fbid=1243744649170057&id=683872625157265
Theresa Greenfield,,2019-12-06 09:50:22,"This is political corruption, plain and simple, and Senator Ernst owes voters a thorough explanation for her illegal tactics. Iowans deserve a Senator they can trust.",3.2K,1.3K,83,16,318,86,1.3K,482,1243523079192214,/story.php?story_fbid=1243523079192214&id=683872625157265
Theresa Greenfield,,2019-12-05 12:32:11,"Senator Ernst, who is ""very proud"" of her work to defund Planned Parenthood, just voted for an unqualified judge with dangerous views on restricting women's rights to a lifetime position. Iowans deserve better – time to vote Ernst out. #IASen",3.4K,520,10,4,44,194,2.6K,409,1242604499284072,/story.php?story_fbid=1242604499284072&id=683872625157265
Theresa Greenfield,,2019-12-04 11:20:00,"1️⃣4️⃣new legislators from across Iowa are on Team Greenfield! Grateful for their support as we work to flip this Senate seat. If you're ready for new leadership in Washington, join us: greenfieldforiowa.com",727,647,13,62,2,1,2,30,1241564146054774,/story.php?story_fbid=1241564146054774&id=683872625157265
Theresa Greenfield,,2019-12-03 16:13:19,"Across the state, I've heard time and time again that folks are ready for new leadership in Washington and  I'm honored to have the support of such a great group of local leaders here in Iowa.",46,42,,4,,,,,1240754882802367,/story.php?story_fbid=1240754882802367&id=683872625157265
Theresa Greenfield,,2019-11-30 15:23:20,"‪Our end of month deadline is TONIGHT at midnight! And since we’re powered by folks like you, will you step up and help us finish November strong? 💪You can use this link: https://secure.actblue.com/donate/tg-november-eom-2019?refcode=fb1130‬",33,33,,,,,,,1237872603090595,/story.php?story_fbid=1237872603090595&id=683872625157265
Theresa Greenfield,,2019-11-27 12:58:57,Had a great time chatting with new friends in Poweshiek County last night! Thank you for coming out and meeting me this holiday week. #IASen,39,38,,1,,,,1,1234789356732253,/story.php?story_fbid=1234789356732253&id=683872625157265
Theresa Greenfield,,2019-11-26 17:57:37,Our end of month deadline is coming up quick and I’ll be honest: November has been a slower month for us. Will you chip in to help us get back on track? Our campaign relies on folks like you – our average online contribution is just $16!,20,18,,1,1,,,,1234034650141057,/story.php?story_fbid=1234034650141057&id=683872625157265
Theresa Greenfield,,2019-11-25 15:37:15,"When I’m in the Senate, I will work to protect our social safety net. They are bedrock agreements we’ve made, as Americans, to look out for one another. We can’t allow Washington to play political games with them any longer. #IASen",73,63,,9,1,,,4,1232990750245447,/story.php?story_fbid=1232990750245447&id=683872625157265
Theresa Greenfield,,2019-11-24 17:39:07,"When my first husband died, his union helped save me and my young family. They had my back, and I will always make sure to have the backs of unions in the Senate. I’m honored to have the support of this diverse group of unions who represent nearly 12,000 Iowans.",2.8K,2.4K,19,337,9,1,1,66,1232123963665459,/story.php?story_fbid=1232123963665459&id=683872625157265
Theresa Greenfield,,2019-11-24 12:51:56,"This morning, I joined the Polk City American Legion Riders Post 232 at their Holidays for Heroes event to help pack and deliver thanksgiving meals for veterans in our community. We are forever grateful for their service, and I’m glad we were able to show our gratitude today.",822,732,7,79,3,1,,24,1231942357016953,/story.php?story_fbid=1231942357016953&id=683872625157265
Theresa Greenfield,,2019-11-23 19:10:49,Nothing better than spending my Saturday out talking with Iowans — today in Cedar Rapids and Coralville. We’re building something special here and it’s time to get Iowans representation that will fight for us in the Senate again.,70,67,1,2,,,,2,1231240447087144,/story.php?story_fbid=1231240447087144&id=683872625157265
Theresa Greenfield,,2019-11-22 14:05:15,"I’m honored to have the trust and strong support of so many of our local unions who are dedicated to giving Iowa’s working families a voice in the workplace.  Teamsters Local 238, United Association of Plumbers & Pipefitters Local 125 of Eastern Iowa, Local 89 Ironworkers, SMART-Transportation Division Iowa, and the United Brotherhood of Carpenters represent a diverse workforce across Iowa. The work they do in communities across our state is vital.",77,74,,2,,1,,1,1230093133868542,/story.php?story_fbid=1230093133868542&id=683872625157265
Theresa Greenfield,,2019-11-21 22:26:50,"I had a great day talking with Iowans in Johnson County! Whether it’s fighting to ensure Social Security benefits remain intact or finding solutions to climate change, Iowans are ready for change and I’m ready to bring their concerns to Washington.",49,46,1,1,1,,,1,1229438357267353,/story.php?story_fbid=1229438357267353&id=683872625157265
Theresa Greenfield,,2019-11-21 14:32:26,Climate change is affecting our farmers at every turn of the season. Time to send a farm kid with farm kid values (who knows that climate change is real) to Washington to actually work to address these issues.,1.8K,676,11,11,165,956,57,80,1229124010632121,/story.php?story_fbid=1229124010632121&id=683872625157265
Theresa Greenfield,,2019-11-19 16:32:58,"Love seeing unions growing in Iowa, and I'm proud of the hotel workers in Dubuque for organizing and making sure their employer hears them. I wouldn't be here without the support of IBEW after my first husband died, and know they'll have a positive impact on their new members. #UnionStrong",115,108,,3,4,,,,1227381344139721,/story.php?story_fbid=1227381344139721&id=683872625157265
Theresa Greenfield,,2019-11-19 13:18:07,"Happy birthday, Senator Harkin! Iowa is lucky to have had your voice fighting for us in the Senate and we still benefit from your leadership today. We're working every day to carry your fights onward, from protecting retirement security to strengthening disability rights.",245,202,1,41,1,,,13,1227262000818322,/story.php?story_fbid=1227262000818322&id=683872625157265
Theresa Greenfield,,2019-11-18 12:30:27,"While big corporations pay $0 in taxes thanks to the tax scam Senator Ernst voted for, our families and farms are struggling here in Iowa. It’s time for new leadership in Washington who will put us first. Join us: GreenfieldforIowa.com",847,240,5,3,20,56,523,41,1226231357588053,/story.php?story_fbid=1226231357588053&id=683872625157265
Theresa Greenfield,,2019-11-16 18:31:48,Had a great time chatting with folks in Hamilton County yesterday. Thanks for coming out and telling me what’s on your mind!,235,224,6,4,1,,,6,1224558761088646,/story.php?story_fbid=1224558761088646&id=683872625157265
Theresa Greenfield,,2019-11-15 16:11:50,Thank you to Felicia with Carpenters Local 106 for the informative tour of your training facilities today! Love seeing how unions work to build a strong workforce here in Iowa. #UnionStrong,200,184,4,11,,,1,7,1223517671192755,/story.php?story_fbid=1223517671192755&id=683872625157265
Theresa Greenfield,,2019-11-15 11:09:21,Senator Ernst is no friend to farmers. And nothing gets me hot under the collar like watching our farmers suffer at the hands of this disastrous trade war. This must end.,847,383,10,3,14,226,211,95,1223280007883188,/story.php?story_fbid=1223280007883188&id=683872625157265
Theresa Greenfield,,2019-11-13 11:16:15,"Hey Iowa, ready to vote Senator Ernst out after watching her repeatedly vote to repeal the Affordable Care Act? Me too. Join our campaign for Senate → greenfieldforiowa.com",1.7K,1.5K,49,147,8,6,27,230,1221349228076266,/story.php?story_fbid=1221349228076266&id=683872625157265
Theresa Greenfield,,2019-11-12 18:07:17,I’m running for Senate because Iowans deserve a voice that puts us first. It means I get to talk with folks in all corners of the state – a privilege I don’t take for granted.,90,77,,12,1,,,,1220695111475011,/story.php?story_fbid=1220695111475011&id=683872625157265
Theresa Greenfield,,2019-11-11 09:11:17,"On this Veterans Day, I am sending my sincere gratitude to the brave men and women who have fought to protect our freedom, both here at home and abroad. Thank you for your service.",58,51,,7,,,,,1219339358277253,/story.php?story_fbid=1219339358277253&id=683872625157265
Theresa Greenfield,,2019-11-10 22:44:55,Enjoyed my discussion with the Dickinson County Democrats! What a warm reception on a chilly Iowa November night. Thanks for talking with me.,721,665,15,33,,1,7,21,1218902131654309,/story.php?story_fbid=1218902131654309&id=683872625157265
Theresa Greenfield,,2019-11-10 17:07:54,"Iowans deserve affordable health care, no matter what. I will always fight to expand access to the care Iowans need, not take it away.",4.5K,1.4K,43,49,91,326,2.5K,284,1218711885006667,/story.php?story_fbid=1218711885006667&id=683872625157265
Theresa Greenfield,,2019-11-10 10:49:04,"Meeting Iowans across the state to hear what’s on their mind is the best part about running for Senate. Thank you for talking with me, Benton County Democrats!",390,353,10,25,1,,1,18,1218464075031448,/story.php?story_fbid=1218464075031448&id=683872625157265
Theresa Greenfield,,2019-11-09 10:01:16,"Great to spend my evening last night with friends in Ottumwa! Loved meeting Iowans who are ready to flip this seat, and work to elect new leadership up and down the ticket.",64,61,,2,1,,,,1217437258467463,/story.php?story_fbid=1217437258467463&id=683872625157265
Theresa Greenfield,,2019-11-07 19:10:41,I will always advocate for a woman's right to make her own health care decisions. Thank you NARAL Pro-Choice America for your leadership and support as we work to flip this seat and the Senate.,3.3K,2.9K,8,410,10,4,30,101,1215936461950876,/story.php?story_fbid=1215936461950876&id=683872625157265
Theresa Greenfield,,2019-11-05 23:11:30,"Tonight makes it clear: we can win everywhere. If you're ready for a new senator from Iowa, we need you with us here to flip this Senate seat. Join us 👇",89,81,,8,,,,5,1214284435449412,/story.php?story_fbid=1214284435449412&id=683872625157265
Theresa Greenfield,,2019-11-05 12:56:11,"Happy Election Day, Iowa! Polls are open until 8 p.m. today. You can get registered at your polling place, and you can find where you vote here:",29,29,,,,,,,1213916255486230,/story.php?story_fbid=1213916255486230&id=683872625157265
Theresa Greenfield,,2019-11-04 12:17:31,"Our local elections in Iowa are tomorrow, and TODAY is the last day to vote early. I voted last week at the auditor's office, and you can today. Head on over to iwillvote.com to make sure you're registered, and for whatever other information you may need. Happy voting!  🗳",96,88,,7,1,,,1,1212992415578614,/story.php?story_fbid=1212992415578614&id=683872625157265
Theresa Greenfield,,2019-11-03 21:11:08,Great to be in Waterloo this afternoon at the inaugural Turn Iowa Blues Fest! No better way to spend my Sunday than being out meeting with Iowans and hearing what's on their minds. Getting to dance to some blues was an added bonus. Thank you for having me!,426,400,6,17,1,,2,13,1212408382303684,/story.php?story_fbid=1212408382303684&id=683872625157265
Theresa Greenfield,,2019-11-03 10:35:23,What an afternoon in Cedar Rapids at the Abby Finkenauer for Congress Fish Fry yesterday! Had a great time meeting Iowans who are ready to elect Democrats up and down the ticket 💪🏼,754,658,32,53,1,3,7,41,1211978679013321,/story.php?story_fbid=1211978679013321&id=683872625157265
Theresa Greenfield,,2019-11-02 14:25:23,Congressman Loebsack is right: the only way we're going to take back the Senate is if we take back Iowa.  Great to be with thousands of friends in Iowa last night who are working to make sure we have what it takes to win in November.,129,117,,11,,,1,1,1211173932427129,/story.php?story_fbid=1211173932427129&id=683872625157265
Theresa Greenfield,,2019-10-31 19:45:58,"Our October end-of-month deadline is coming up quick! And with the path to taking back the Senate running straight through Iowa, we gotta hit this goal out of the park. Pitch in:➡️",20,19,,1,,,,,1209556855922170,/story.php?story_fbid=1209556855922170&id=683872625157265
