source,shared_from,date,text,reactions,likes,ahah,love,wow,sigh,grrr,comments,post_id,url
Sarah Riggs Amico,,2019-10-21 14:22:56,"""According to those on strike, the strong growth is precisely the point. Autoworkers, teachers and other workers accepted austerity when the economy was in a free fall, expecting to share in the gains once the recovery took hold."" This is just it - too many people are being left out and shut out of the opportunities for economic growth, and they're struggling to make ends meet while the gap grows wider. We need to build an economy that works for everyone.",35,32,,3,,,,2,2793301140700356,/story.php?story_fbid=2793301140700356&id=1751850481512099
Sarah Riggs Amico,,2019-10-19 18:26:43,Thank you Democratic Party of Georgia for inviting me to say a few words about protecting women’s rights to their own bodies and workers’ rights to collectively bargain. If we keep this momentum going into 2020 there is no doubt that Democrats will win the US Senate.,88,73,,15,,,,2,2789064134457390,/story.php?story_fbid=2789064134457390&id=1751850481512099
Sarah Riggs Amico,,2019-10-19 08:40:59,"As the mother of two young girls, I am disappointed and concerned by the announcement of the Pickens County School Board to suspend their decision allowing transgender students to use restrooms that align with their gender identity; such actions undermine the health, safety, and well-being of all of their students. Parents and educators must stand together in refusing to cower to threats of any kind, and commit to protecting the safety, dignity, and rights of all of our children, including trans students, who are a loved and valued part of our community.",126,48,,7,2,24,45,5,2788062491224221,/story.php?story_fbid=2788062491224221&id=1751850481512099
Sarah Riggs Amico,,2019-10-15 13:35:06,"BREAKING: BAC LOCAL 8 SOUTHEAST of Atlanta, GA endorses Sarah for Senate! ""I am honored to receive the support of Georgia’s Bricklayers in this campaign. Retirement security isn’t just talk for me. When I’m in the Senate, I’ll work tirelessly to secure pension relief and prevent pension insolvencies —so that workers who’ve invested faithfully in their pensions all their lives won’t be left empty-handed at retirement. I’ll always fight for affordable health care and economic security for workers, unions, and retirees.""",75,66,,9,,,,1,2779719072058563,/story.php?story_fbid=2779719072058563&id=1751850481512099
Sarah Riggs Amico,,2019-10-13 15:14:16,Incredible time celebrating Atlanta P.R.I.D.E Festival - Piedmont Park and marching in solidarity with the LGBTQ community! Thank you to everyone standing up for equality and justice for all.,178,131,,47,,,,,2775644952465975,/story.php?story_fbid=2775644952465975&id=1751850481512099
Sarah Riggs Amico,,2019-10-13 12:41:03,,160,123,,37,,,,8,2350155198569117,/story.php?story_fbid=2350155198569117&id=1751850481512099
Sarah Riggs Amico,,2019-10-13 12:02:53,,81,66,,15,,,,2,542321656335189,/story.php?story_fbid=542321656335189&id=1751850481512099
Sarah Riggs Amico,,2019-10-12 21:12:56,"Happy 100th Birthday to IBEW Local 613 Atlanta, GA! 🥳🎂 You’ve done so much to build and strengthen our communities over the last century. Georgia is lucky to have you — and I’m so proud to have your support in the race to be Georgia’s next US Senator! #gapol #1u  ibew613.org/home",66,55,,11,,,,2,2773890039308133,/story.php?story_fbid=2773890039308133&id=1751850481512099
Sarah Riggs Amico,,2019-10-08 21:20:16,"Wishing all observing Yom Kippur an easy, meaningful fast. G’mar Chatima Tova.",27,23,,4,,,,,2765545343475936,/story.php?story_fbid=2765545343475936&id=1751850481512099
Sarah Riggs Amico,,2019-10-08 20:36:42,"As a business owner and a Christian, I am appalled that any business would seek to discriminate against anyone for who they are or who they love. No one should face the fear of discrimination -- not in their place of worship, not in their community, and certainly not at work. At my business, I’ve worked to ensure we have a workplace in which our employees can live and work free to be who they are. We’ve enacted policies to support those values, including paid leave for LGBTQ employees welcoming new children into their families. That’s how you run an inclusive and supportive business.   The highest court in the United States must decide whether it stands with the LGBTQ+ community and for workers' rights, or if we regress into intolerance. It is time to show our true colors -- the whole spectrum.",127,93,,30,3,1,,5,2765486450148492,/story.php?story_fbid=2765486450148492&id=1751850481512099
,,2019-09-27 20:06:25,,,,,,,,,,2743173572379780,/ufi/reaction/profile/browser/?ft_ent_identifier=2743172965713174&refid=17&_ft_=top_level_post_id.2743173572379780%3Atl_objid.2743173572379780%3Apage_id.1751850481512099%3Aphoto_attachments_list.%5B2743173312379806%2C2743173462379791%2C2743173692379768%2C2743177219046082%5D%3Aphoto_id.2743173312379806%3Astory_location.4%3Astory_attachment_style.new_album%3Atagged_locations.630259053979167%3Atds_flgs.3%3Apage_insights.%7B%221751850481512099%22%3A%7B%22page_id%22%3A1751850481512099%2C%22actor_id%22%3A1751850481512099%2C%22dm%22%3A%7B%22isShare%22%3A0%2C%22originalPostOwnerID%22%3A0%7D%2C%22psn%22%3A%22EntPhotoNodeBasedEdgeStory%22%2C%22post_context%22%3A%7B%22object_fbtype%22%3A22%2C%22publish_time%22%3A1569629185%2C%22story_name%22%3A%22EntPhotoNodeBasedEdgeStory%22%2C%22story_fbid%22%3A%5B2743173312379806%2C2743172965713174%5D%7D%2C%22role%22%3A1%2C%22sl%22%3A4%2C%22targets%22%3A%5B%7B%22actor_id%22%3A1751850481512099%2C%22page_id%22%3A1751850481512099%2C%22post_id%22%3A2743173312379806%2C%22role%22%3A1%2C%22share_id%22%3A0%7D%2C%7B%22actor_id%22%3A1751850481512099%2C%22page_id%22%3A1751850481512099%2C%22post_id%22%3A2743172965713174%2C%22role%22%3A1%2C%22share_id%22%3A0%7D%5D%7D%2C%22630259053979167%22%3A%7B%22page_id%22%3A630259053979167%2C%22actor_id%22%3A1751850481512099%2C%22dm%22%3A%7B%22isShare%22%3A0%2C%22originalPostOwnerID%22%3A0%7D%2C%22psn%22%3A%22EntPhotoNodeBasedEdgeStory%22%2C%22role%22%3A4%2C%22sl%22%3A4%2C%22targets%22%3A%5B%7B%22actor_id%22%3A1751850481512099%2C%22page_id%22%3A630259053979167%2C%22role%22%3A4%7D%5D%7D%7D%3Athid.1751850481512099%3A306061129499414%3A43%3A0%3A1585724399%3A-7850818775518492451&__tn__=%2AW-R#footer_action_list
Sarah Riggs Amico,,2019-10-08 15:58:07,,22,18,,4,,,,,697394747445421,/events/697394747445421?view=permalink&id=697485950769634
Sarah Riggs Amico,,2019-10-02 09:19:35,"BREAKING: IBEW Local 613 Atlanta, GA endorses Sarah for Senate!",139,112,,26,1,,,2,2752164264814044,/story.php?story_fbid=2752164264814044&id=1751850481512099
Sarah Riggs Amico,,2019-09-30 21:36:44,"I know it’s getting late, and I appreciate y’all staying up with me. The truth is that we’ve got just a few hours left before our very FIRST end of quarter fundraising deadline, and we’re still just shy of our goal.  Can you help chip in $5 before midnight? Every little bit helps fuel this winning campaign, and I’d be so grateful for your support.  https://secure.actblue.com/donate/sarahforgeorgia",24,21,,3,,,,,2749300588433745,/story.php?story_fbid=2749300588433745&id=1751850481512099
Sarah Riggs Amico,,2019-09-30 17:45:35,"It has been 43 years since the Hyde Amendment passed, which largely prohibits Medicaid and Medicare recipients from using their health insurance to access abortion care. This legislation is not only devastating to men and women who need medical attention, it is also blatantly racist in its targeting of those who are least likely to have access to care - women of color - and those who often need it the most. More than a million Georgians are covered by Medicaid - men and women who deserve the same access to reproductive health care and abortion services the rest of us have.  It is long past time to repeal the Hyde Amendment and end this unlawful discrimination #BeBoldEndHyde",34,30,,3,,,1,,2749028251794312,/story.php?story_fbid=2749028251794312&id=1751850481512099
Sarah Riggs Amico,,2019-09-30 10:28:57,"Shanah Tovah to all who are celebrating #RoshHashanah! May your new year be sweet, beautiful and peaceful.",26,26,,,,,,1,2748390341858103,/story.php?story_fbid=2748390341858103&id=1751850481512099
Sarah Riggs Amico,,2019-09-24 18:01:11,"On July 25th, President Trump spoke to Ukrainian President Volodymyr Zelensky. Related to President Trump’s actions and behavior on that call, on August 12, an unnamed intelligence officer filed a whistleblower complaint with Michael Atkinson, the Intelligence Community Inspector General. The IC IG found the complaint credible and deemed the matter of “urgent concern.” The contents of the whistleblower’s complaint have not yet been made public, nor have they been shared with the House Permanent Select Committee on Intelligence — the first time a credible whistleblower complaint has ever been withheld from the Committee, according to its Chairman Rep. Adam Schiff. Publications including The Wall Street Journal, The New York Times, and The Washington Post, however, are reporting that during their call President Trump repeatedly asked President Zelensky to work with President Trump’s personal attorney, Rudy Giuliani, to investigate former Vice President Joe Biden and his son. Despite initial denials, President Trump has now admitted he did discuss the former Vice President while speaking with President Zelensky. Further, President Trump has publicly acknowledged that he took actions to delay nearly $400 million in military aid to Ukraine — and that he did so mere days before his July 25th call with President Zelensky. Military aid, appropriated by Congress from taxpayer money, is frequently used to bolster America’s alliances, protect national security interests, and promote global stability. If the whistleblower’s reported allegations are true, they are extremely serious. It is unlawful and immoral for the President of the United States to dangle foreign aid as a political bribe in exchange for investigating his political opponents. Jeopardizing American national security interests and using American influence for the personal benefit of the President is more than unacceptable — it is the definition of corruption. The Inspector General should immediately release the full scope of the ‘credible and urgent’ whistleblower complaint as well as all corroborating evidence.  Further, Senator David Perdue should publicly state whether he supports a full investigation of the whistleblower complaint, so that members of Congress can fulfill their Constitutional oversight and investigation duties. The Trump administration’s chronic abuse of power continues to test the limits of our democracy. It’s time for Congress to act. It’s time to begin impeachment proceedings. Our founding fathers established a system of checks and balances to hold power accountable: And that’s exactly what needs to happen. It’s the job Congress was elected to do, frankly it’s the job that Senator Perdue was elected to do, no matter the party affiliation. The American people deserve accountability.  As such, I support the House of Representatives' move to begin formal impeachment proceedings.",117,96,,20,1,,,7,2736845383012599,/story.php?story_fbid=2736845383012599&id=1751850481512099
Sarah Riggs Amico,,2019-09-23 17:28:18,Fact.,204,156,,42,6,,,4,2734750649888739,/story.php?story_fbid=2734750649888739&id=1751850481512099
Sarah Riggs Amico,,2019-09-20 13:01:38,"Climate change is one of the greatest threats facing our world today. We've seen the effects firsthand here in Georgia, including from Hurricane Michael which swept through last year, leaving destruction and death in its wake. I want my daughters to inherit an earth that is beautiful and healthy and sustainable, which is one of many reasons I stand with all those calling for bold, large-scale action.",71,55,,16,,,,1,2728289700534834,/story.php?story_fbid=2728289700534834&id=1751850481512099
Sarah Riggs Amico,,2019-09-19 12:38:00,"More than 700,000 people who live in our nation's capital do not have fair representation in their federal government. We need #DCStatehood so that DC residents can have the same voting rights as everyone else, and the representation they deserve.",48,42,,5,,1,,2,2726283570735447,/story.php?story_fbid=2726283570735447&id=1751850481512099
Sarah Riggs Amico,,2019-09-18 19:58:00,"Georgia has never elected a woman to the United States Senate. If you agree its time for representation, chip in $5 or $10 to help fuel our campaign before our big September 30 deadline ⬇️",88,71,1,15,1,,,3,2724730570890747,/story.php?story_fbid=2724730570890747&id=1751850481512099
Sarah Riggs Amico,,2019-09-17 19:28:19,"My family was so proud the day my husband Andrea became a citizen. Today, he and I work hard to build a life and a country for our daughters that reflects the kind of American dream and opportunity he crossed an ocean for. Happy #CitizenshipDay to all those who have joined us - we welcome you, we honor you, and we appreciate you.",215,149,,66,,,,1,2722803997750071,/story.php?story_fbid=2722803997750071&id=1751850481512099
Sarah Riggs Amico,,2019-09-17 17:35:42,"""Mixtures of religion and politics aren’t exactly unusual in Georgia, a state situated squarely in the heart of the Bible Belt where asking someone where they go to church is a common icebreaker. But this year, no one is combining faith — however broadly defined — and politics as acutely as Sarah Riggs Amico, 40, a newly announced Democratic candidate for U.S. Senate, running to oppose incumbent Republican Sen. David Perdue.""",143,102,,40,1,,,11,2722679664429171,/story.php?story_fbid=2722679664429171&id=1751850481512099
Sarah Riggs Amico,,2019-09-15 20:43:19,The newest allegations against Brett Kavanaugh are deeply troubling. He should never have been confirmed to the Supreme Court without a thorough investigation. Senator David Perdue put partisan politics ahead of good judgement in supporting him. Brett Kavanaugh should be impeached.,199,176,,23,,,,12,2719084468122024,/story.php?story_fbid=2719084468122024&id=1751850481512099
Sarah Riggs Amico,,2019-09-15 09:01:01,"We need to make college and healthcare affordable in this country. It won't be an easy conversation to have, but we need to start moving towards creating an economy that works for everyone. My girls Ava and Sofia are a decade out from their college careers, but this conversation cannot wait. We need to think about the world we are creating for our children's future.",32,30,,2,,,,,2714965371867267,/story.php?story_fbid=2714965371867267&id=1751850481512099
Sarah Riggs Amico,,2019-09-15 00:08:16,Thank you Cobb County Democrats for a spectacular evening celebrating our successes and preparing for our wins in 2020!,171,130,,41,,,,4,2717435688286902,/story.php?story_fbid=2717435688286902&id=1751850481512099
Sarah Riggs Amico,,2019-09-14 09:47:00,"I am a strong believer in transforming our economy to tackle the challenges of man-made climate change. I'm also a strong believer in protecting the access to clean water for our most vulnerable communities and our future generations. We need to protect access to clean water as the human right that it is.  In the Senate, I won't back down against corrupt Republicans who want to recklessly pollute or plunder our environment.",72,41,,5,3,,23,3,2714969148533556,/story.php?story_fbid=2714969148533556&id=1751850481512099
Sarah Riggs Amico,,2019-09-13 16:12:10,"We cannot allow Trump and his enablers to have any more time at the steering wheel driving our country off a cliff.  ""The average tariff on Chinese imports has risen from 3.1% before Trump got tariff-happy, to 21.2% now, according to Chad Bown of the Petersen Institute for International Economics."" These tariffs are passed on to consumers from American importers. And when they can't pass those ever ratcheting price increases down to us, they absorb the cost by firing workers or lowering their standards. We cannot allow this to go on any longer. We need an economy that works for all Americans.",91,64,,,3,2,22,7,2714960765201061,/story.php?story_fbid=2714960765201061&id=1751850481512099
Sarah Riggs Amico,,2019-09-12 07:08:54,"As a business executive and a mother, I fully support expanding background checks and ensuring our families can be safe in their schools, their places of worship, their homes, and their communities. Doing nothing is simply unacceptable.",78,63,,15,,,,5,2712174028813068,/story.php?story_fbid=2712174028813068&id=1751850481512099
Sarah Riggs Amico,,2019-09-05 12:53:10,"“I think now more than ever it’s really important for us to show up as allies. It always is, but in this moment, the only way for people to remember there are more of us who still believe in right and wrong, who still believe that people should be able to live who they are and love who they love, is for us to show up frequently and consistently and stand shoulder to shoulder saying we’re tired of this rhetoric,” - Sarah Riggs Amico",102,78,,24,,,,5,2699182856778852,/story.php?story_fbid=2699182856778852&id=1751850481512099
,,2019-09-04 11:12:35,,,,,,,,,,2697137706983367,/ufi/reaction/profile/browser/?ft_ent_identifier=2697135470316924&refid=17&_ft_=top_level_post_id.2697137706983367%3Atl_objid.2697137706983367%3Apage_id.1751850481512099%3Aphoto_attachments_list.%5B2697137856983352%2C2697137500316721%2C2697137546983383%2C2697137476983390%5D%3Aphoto_id.2697137856983352%3Astory_location.4%3Astory_attachment_style.new_album%3Atds_flgs.3%3Apage_insights.%7B%221751850481512099%22%3A%7B%22page_id%22%3A1751850481512099%2C%22actor_id%22%3A1751850481512099%2C%22dm%22%3A%7B%22isShare%22%3A0%2C%22originalPostOwnerID%22%3A0%7D%2C%22psn%22%3A%22EntPhotoNodeBasedEdgeStory%22%2C%22post_context%22%3A%7B%22object_fbtype%22%3A22%2C%22publish_time%22%3A1567609955%2C%22story_name%22%3A%22EntPhotoNodeBasedEdgeStory%22%2C%22story_fbid%22%3A%5B2697137856983352%2C2697135470316924%5D%7D%2C%22role%22%3A1%2C%22sl%22%3A4%2C%22targets%22%3A%5B%7B%22actor_id%22%3A1751850481512099%2C%22page_id%22%3A1751850481512099%2C%22post_id%22%3A2697137856983352%2C%22role%22%3A1%2C%22share_id%22%3A0%7D%2C%7B%22actor_id%22%3A1751850481512099%2C%22page_id%22%3A1751850481512099%2C%22post_id%22%3A2697135470316924%2C%22role%22%3A1%2C%22share_id%22%3A0%7D%5D%7D%7D%3Athid.1751850481512099%3A306061129499414%3A43%3A0%3A1585724399%3A-1088306868760874387&__tn__=%2AW-R#footer_action_list
Sarah Riggs Amico,,2019-09-04 14:35:41,,27,23,,4,,,,2,1324524211037064,/events/1324524211037064?view=permalink&id=1324624187693733
Sarah Riggs Amico,,2019-09-02 14:56:43,"Proud to be with the North Georgia Labor Council celebrating #LaborDay! Glad to see so many friends and supporters of labor here today, and proud to stand with them every day.",84,72,,12,,,,,2693771687319969,/story.php?story_fbid=2693771687319969&id=1751850481512099
Sarah Riggs Amico,,2019-08-31 19:48:50,"Texas, my heart breaks for you. It breaks for the victims — and families — of another mass shooting in America. This gut-wrenching rollercoaster of gun violence must end.  #midlandshooting https://www.reuters.com/article/us-texas-shooting-idUSKCN1VL0SP",99,36,,2,,43,18,7,2690347790995692,/story.php?story_fbid=2690347790995692&id=1751850481512099
Sarah Riggs Amico,,2019-08-30 14:31:48,"""The red-clad AT&T workers on strike this week outside the company’s Midtown tower were joined by a familiar face on the picket line: Sarah Riggs Amico, a Democrat who hours earlier had launched her campaign for the U.S. Senate."" I've been a strong friend and ally to labor unions for years. When they asked me to join them on the picket line Tuesday, I was proud to stand with them in solidarity.",75,68,,7,,,,2,2688026857894452,/story.php?story_fbid=2688026857894452&id=1751850481512099
Sarah Riggs Amico,,2019-08-27 13:22:50,Standing in solidarity with striking CWA members!,84,64,,20,,,,2,389018338449361,/story.php?story_fbid=389018338449361&id=1751850481512099
Sarah Riggs Amico,,2019-08-27 07:48:54,,133,89,,44,,,,3,2681743008522837,/SarahforGeorgia/photos/a.1753451551351992/2681743008522837
Sarah Riggs Amico,,2019-08-26 23:26:00,"Too many Washington politicians aren’t worthy of the faith we’ve placed in them. They claim to share our values, but their actions betray us. I’m running for U.S. Senate in Georgia because we deserve leaders who will renew our faith in America. Join me at SarahforGeorgia.com today.",198,134,1,63,,,,14,683826192133890,/story.php?story_fbid=683826192133890&id=1751850481512099
"Sarah Riggs Amico,NPR",NPR,2019-07-24 11:33:06,"😢😢😢😢 We have to care for our planet, y’all. ❤️🌎The federal government spends about $8 billion a year subsidizing crop insurance for farmers. As climate change increasingly impacts their harvests, that number could get a lot bigger:",79,45,,2,3,24,5,8,2617139241649881,/story.php?story_fbid=2617139241649881&id=1751850481512099
Sarah Riggs Amico,,2019-07-04 20:45:13,"243 years since our 1st #IndependenceDay, but only: 4 since Obergefell 46 since RoevWade 50 since #Stonewall  55 since #CivilRights Act 100 since #19thAmendment 156 since Emancipation America’s a #democracy in progress. #July4th2019 we celebrate & work to continue that progress. #gapol",160,120,,40,,,,6,2580126948684444,/story.php?story_fbid=2580126948684444&id=1751850481512099
"Sarah Riggs Amico,Democratic Party of Georgia",Democratic Party of Georgia,2019-06-04 16:56:07,"See you there, y’all! 💙  #BattleGroundGA #gapol https://www.facebook.com/105791402802932/posts/2181460981902620?s=568188494&sfns=xmwaDid you hear the news? 😱 We’ve confirmed a number of special guests who are attending #BattlegroundGA.  If you haven’t grabbed your ticket you better hurry because they’re going FAST - you never know who might show up 🤷‍♀️. 🏀 We gave y’all the deets on this one yesterday, but Mayor Pete Buttigieg  will be in the building.  🍑 And our very own Mayor Keisha Lance Bottoms. 🚚 And another one, Sarah Riggs Amico has also confirmed that she will be joining us. 🥜 But wait - there’s more! Mayor Teresa Tomlinson is also coming to #BattleGroundGa Friends we don’t know who else is going to pop up, but at this rate it could be anyone! 🤷‍♀️ Just grab your tickets right now so you don’t miss out. Kay?  👉🏽 http://georgiadems.bsd.net/afterpartyannouncement **Ticket prices will go up at the door **",76,63,,13,,,,2,2523351584361981,/story.php?story_fbid=2523351584361981&id=1751850481512099
Sarah Riggs Amico,,2019-05-20 13:09:10,Thank you HILL TV for (another) good discussion on the latest in #Georgia politics! #gapol https://thehill.com/hilltv/rising/444544-ex-georgia-candidate-sarah-riggs-amico-discusses-states-new-abortion-law,78,69,,8,,,1,12,2495088137188326,/story.php?story_fbid=2495088137188326&id=1751850481512099
