source,shared_from,date,text,reactions,likes,ahah,love,wow,sigh,grrr,comments,post_id,url
Sarah Riggs Amico,,2019-05-16 14:44:26,"I’m proud to announce my endorsement of Senator Senator Ron Wyden’s election security bill, the PAVE Act. This bill would ensure secure & accurate federal elections by requiring paper ballots, which would be subject to the voter’s verification before counting. https://www.wyden.senate.gov/news/press-releases/wyden-and-bicameral-coalition-introduce-bill-to-require-states-to-secure-elections-  The PAVE Act would prohibit the use of paperless machines, like those used in the 2018 elections here in #Georgia, where election security experts found deeply flawed vote counts that could have had a dramatic impact on the outcome of our election. In my race for Lt. Governor, we saw a suspiciously large drop off of almost 160,000 votes, although those voters did cast ballots for remaining down ballot races. As has been reported by multiple data security experts & news outlets, this is highly unusual (see this AJC piece: https://ajc.com/blog/politics/time-solve-the-mystery-the-100-000-missing-votes/nEYXrcGW8et8esyVL6W4QM/) Drop off among absentee voters (#HandMarkedPaperBallots) was normal in the 2018 #Georgia Lt. Governor’s race.  In other words, the suspiciously high voter drop off occurred ONLY on ballots cast via Georgia’s touchscreen, DRE voting machines, which have been deemed vulnerable by cyber security experts.  Data scientists determined 2018 voter drop off from Gov to Lt Gov was highly unusual vs. recent Georgia elections. Additionally suspicious: drop off was disproportionately high in Democratic-leaning counties & African-American precincts. (See this article from The Root: https://www.theroot.com/exclusive-thousands-of-black-votes-in-georgia-disappea-1832472558?utm_source=share&amp;utm_medium=ios_app) Coincidence? What we do know is that, at a minimum, part of the blame falls on the notoriously faulty DRE voting machines and a flawed voting system. Experts and voters agree — these machines have got to go.  As I’ve said countless times, this isn’t just about the outcome of one election — it’s about the integrity of ALL our elections. It’s about the trust and faith the American people should have that their fundamental right to vote is being protected. The portions of the Mueller Report that have been made available to the public shed additional light on this issue — exposing the fact that in 2016, voting machines infrastructure in multiple states was hacked by foreign operatives with the intent of manipulating our elections. We can conclude that this is only the beginning, and that Russian cyberattacks on our #2020Elections are not only possible, but perhaps likely, if we do not take swift and dramatic action to counter their efforts and secure our votes.  Georgia Tech Professors Wenke Lee and Richard DeMillo have also endorsed the PAVE Act, even as their calls for #HandMarkedPaperBallots in Georgia have been willfully ignored by Governor Brian Kemp’s administration.  Brian Kemp (whose time as Secretary of State was rife w/accusations of voter suppression) denies the flaws of our voting systems. His Deputy Chief of Staff is a former lobbyist for ES&S, a voting machine company currently vying for a $150 million contract with the state of Georgia. (Press coverage: https://www.ajc.com/news/state--regional-govt--politics/firm-close-ties-georgia-stir-concerns-about-voting-system-purchase/HVK4wcNsEAKO0Xa0ptLLKM/) A recent exposé by The New Yorker highlights the corrupt nature of the ties between voting machine lobbyists and political operatives, like Brian Kemp’s employees. You can read the exposé here: https://www.newyorker.com/tech/annals-of-technology/how-voting-machine-lobbyists-undermine-the-democratic-process The bottom line: We cannot trust our fundamental rights — our very democracy — to hackable, insecure, inaccurate voting machines whose makers are in bed with politicians for the sake of huge contracts that put profits (and political power) over people.  Congress must take action to ensure the security of our votes in advance of the #2020Elections. The PAVE Act is the solution; it will correct the vast deficiencies of flawed voting machines, which leave us vulnerable to foreign interference such as we witnessed in 2016.  American voters deserve to have voter-verified paper ballots, so they can have confidence that their votes will be counted safely, securely and accurately. Thats the America we deserve, and that’s the America Sen. Ron Wyden’s PAVE Act is going to ensure.  Having met with Senator Wyden about his efforts to secure our elections, and having discussed the ways the PAVE Act can do just that, I am proud to support it.",71,57,2,11,1,,,1,2487998884563918,/story.php?story_fbid=2487998884563918&id=1751850481512099
Sarah Riggs Amico,,2019-05-09 18:57:10,"#TBT: In honor of #NursesAppreciationWeek, I’m sharing some photos of my beautiful mom as a neonatal #nurse, caring for some of the most vulnerable babies in NICU. Mom’s nursing experience helped shape my belief that every American has a right to affordable #healthcare. She also taught me that maternal health is critical to healthy families and children. In #Georgia, 79 of our 159 counties do not have an OB/GYN. Our state has the highest maternal mortality in America - a crisis that disproportionately affects African American women.  As the daughter of a former NICU nurse, I know that women, children and all Georgia families deserve better.",177,125,,51,,1,,8,2475111092519364,/story.php?story_fbid=2475111092519364&id=1751850481512099
Sarah Riggs Amico,,2019-05-05 20:19:31,"As #Ramadan  begins this evening, I’d like to wish our Muslim communities in Georgia — and around the world — #RamadanMubarak",213,167,,45,,1,,1,2468367009860439,/story.php?story_fbid=2468367009860439&id=1751850481512099
Sarah Riggs Amico,,2019-04-30 21:33:20,"The political dysfunction paralyzing Washington is actively harming Georgia workers and families, and we can’t allow it to go unchallenged. We deserve bold, inclusive policies that lift up and engage all communities across Georgia.  In the coming weeks, I’m going to be listening to Georgians from around the state to determine if I’m the candidate to drive that vision forward in Georgia’s 2020 election for the US Senate. I am truly grateful for the support and encouragement I have received as Andrea, the girls, and I, consider this remarkable opportunity to serve our state.  Finally, I want to thank Stacey Abrams for her leadership in the 2018 election. It was an honor to run alongside her last year as Stacey inspired voters across Georgia to turn out in record numbers. Our state needs that kind of bold leadership and I look forward to seeing the Democratic Party of Georgia build on that momentum in 2020.  The work Stacey has done - and is still doing at Fair Fight Action - will strengthen our state, our nation and our democracy for future generations. I am grateful for her work, her commitment to public service, and her friendship. #gapol https://www.ajc.com/blog/politics/the-jolt-with-stacey-abrams-out-democratic-race-for-senate-begins/wvj79aJZpMmmBBAhomdZeK/",294,205,,89,,,,34,2459869444043529,/story.php?story_fbid=2459869444043529&id=1751850481512099
Sarah Riggs Amico,,2019-04-27 14:51:29,Hope to see some folks on Monday! #gapol,15,14,,1,,,,,2454322704598203,/story.php?story_fbid=2454322704598203&id=1751850481512099
Sarah Riggs Amico,,2019-04-27 08:53:32,"Sharing this thread on maternal mortality - which is shamefully high across the country (worst of the developed world) and in Georgia (which ranks 50/50 states in the metric 😢). This crisis exposes vast racial inequity in our healthcare system: the risk of pregnancy-related death is 3-4 times higher for black women. If you have a story about Georgia’s maternal health crisis, please share it below or send me a message. These stories deserve to be heard.  During our campaign last year, I spoke often about the lack of access to pre-/post-natal care for women in the 79 counties without an OB/GYN and women who lack insurance (the problem so disturbed me that we included Georgia’s maternal health crisis in our general election commercial).  It’s critical that we engage on this issue and turn up the pressure for our state to cure what has become a crisis in maternal health. Our leader must take action; it’s literally a matter of life and death. https://twitter.com/sarahriggsamico/status/1122110380455682050?s=21",38,27,,,,8,3,,2453836337980173,/story.php?story_fbid=2453836337980173&id=1751850481512099
Sarah Riggs Amico,,2019-04-21 23:17:52,"For our family, Easter services & time with extended family today took on a new poignancy after the horrific events in Sri Lanka. We join people around the world in praying for the people of Sri Lanka, the victims of these vicious attacks, and their loved ones. The Easter story is a message of hope & light in some of the world’s darkest moments; it is a promise of redemption & restoration in times when they seem more elusive than ever. Tonight, I am particularly grateful for the blessed assurance of Easter. To all who celebrated, I hope Easter brought you joy. May the Easter story renew your commitment to the Gospel of peace and to Christ’s commandment that we love one another as He loved us (John 13:34-35). The world needs that kind of humble, selfless love - as much now as it ever has.",177,134,,43,,,,7,2444968978866909,/story.php?story_fbid=2444968978866909&id=1751850481512099
Sarah Riggs Amico,,2019-04-21 16:31:46,"My heart aches. Today, on Easter, we see houses of worship are yet again targets of terror. No one should fear for their life in the place where they worship their Creator - whether that’s churches in Sri Lanka, a synagogue in Pennsylvania, mosques in New Zealand, or a Sikh temple in Wisconsin.  The high cost of hate is too often paid by the innocent. People of good conscience from all walks of life must be unequivocal - and vocal - in condemning these vicious attacks.  I am praying for the people of Sri Lanka, the victims, and all who mourn them. May God’s peace that surpasses all understanding comfort them.  https://www.washingtonpost.com/world/coordinated-explosions-rock-three-churches-and-two-hotels-in-sri-lanka-on-easter-sunday/2019/04/21/a09002a0-63f6-11e9-9ff2-abc984dc9eec_story.html?utm_term=.a89bd19f23ac&tid=sm_fb",235,50,,1,,166,18,6,2444532485577225,/story.php?story_fbid=2444532485577225&id=1751850481512099
Sarah Riggs Amico,,2019-04-19 18:45:27,Wishing all who celebrate a #HappyPassover! May this time focused on faith & family be a blessing to you. #ChagSameach #Passover #Pesach,61,48,,13,,,,,2440845235945950,/story.php?story_fbid=2440845235945950&id=1751850481512099
