source,shared_from,date,text,reactions,likes,ahah,love,wow,sigh,grrr,comments,post_id,url
Senator Cindy Hyde-Smith,,2019-08-23 14:21:37,"Honored to help launch the new East Central Community College Diesel Equipment Technology workforce training program. I commend local parties for identifying an industry sector in need of qualified employees, and U.S. Department of Agriculture - Rural Development for their continued contributions to the future of rural Mississippi.",59,59,,,,,,2,643830089437025,/story.php?story_fbid=643830089437025&id=356016438218393
Senator Cindy Hyde-Smith,,2019-08-23 13:47:59,A great honor for another wonderful MS attraction:  the Tanglefoot Trail is formally inducted in the Rails-To-Trails Hall of Fame. This almost 44-mile rail-trail is in the Mississippi Hills National Heritage Area. #RailTrailHOF https://www.railstotrails.org/our-work/trail-promotion/rail-trail-hall-of-fame/,28,28,,,,,,1,643812786105422,/story.php?story_fbid=643812786105422&id=356016438218393
Senator Cindy Hyde-Smith,,2019-08-22 22:28:46,"Issaquena, Sharkey, Warren &Yazoo counties added to FEMA Federal Emergency Management Agency major disaster declaration. Good start for disaster recovery in Yazoo Backwater Flood region. Will keep working w/agencies for more.",195,170,,19,4,2,,30,643345739485460,/story.php?story_fbid=643345739485460&id=356016438218393
Senator Cindy Hyde-Smith,,2019-08-22 22:20:09,‪MS high school football is here. Hope everyone has a great and safe season. Happy to handle coin toss duties tonight for Brookhaven Academy vs. Sylva-Bay Academy at Copiah-Lincoln Community College. ‬,244,231,,13,,,,7,643341919485842,/story.php?story_fbid=643341919485842&id=356016438218393
Senator Cindy Hyde-Smith,,2019-08-22 13:22:15,"Look who I bumped into at Mississippi Farm Bureau Federation, catfish farmers hosted by the MS Catfish Institute. I’ve said it before, and I’ll say it again:  Nothing compares to Mississippi and U.S. farm-raised catfish.",131,125,,6,,,,8,643125322840835,/story.php?story_fbid=643125322840835&id=356016438218393
"Senator Cindy Hyde-Smith,SuperTalk Mississippi",SuperTalk Mississippi,2019-08-22 11:06:09,"Enjoyed catching up with JT on SuperTalk Mississippi this morning.  We discussed MS workforce, #finishthepumps, immigration, guns, and more.  Watch here.Senator Cindy Hyde-Smith joins us to talk Red Flag laws, ICE raids, workforce, Mississippi River flooding and more. Join us!",45,38,,7,,,,5,643107326175968,/story.php?story_fbid=643107326175968&id=356016438218393
Senator Cindy Hyde-Smith,,2019-08-21 17:18:20,"A new school year is underway, and I enjoyed meeting students and administrators at Brookhaven Elementary School. The visit included talk about the funding outlook for educational programs, including those for kids with special needs.",110,107,,2,1,,,6,642648206221880,/story.php?story_fbid=642648206221880&id=356016438218393
Senator Cindy Hyde-Smith,,2019-08-20 16:18:32,"I join the U.S. Department of Defense (DoD) in presenting Jay Blount of Greenville with the Defense of Freedom medal for the heroism demonstrated after an IED explosion destroyed his caravan in Iraq in 2004.  I was honored to join his family and friends in presenting him with the highest civilian defense medal. Thank you for your service and bravery, Jay.",136,122,,14,,,,6,642046059615428,/story.php?story_fbid=642046059615428&id=356016438218393
Senator Cindy Hyde-Smith,,2019-08-20 13:44:41,GREAT NEWS for Mississippi manufacturing! Avid Boats has a new home in Amory MS. Its new production facility will bring a $1.6 million investment and nearly 100 jobs to Monroe County.  Welcome!,150,142,,7,1,,,3,641984692954898,/story.php?story_fbid=641984692954898&id=356016438218393
Senator Cindy Hyde-Smith,,2019-08-17 11:35:28,"On August 17, 1969, Hurricane Camille made landfall, bringing much devastation to the Mississippi Gulf Coast. 50 years later the citizens of the Mississippi Gulf Coast repeatedly demonstrate just how to bounce back after terrible setbacks.",91,82,,6,1,2,,5,640144049805629,/story.php?story_fbid=640144049805629&id=356016438218393
Senator Cindy Hyde-Smith,,2019-08-16 17:00:31,"Illegal activity on our borders is a continuous challenge, and these helicopters are valuable tools used by Customs and Border Protection to secure the border. This contract will allow talented aircraft manufacturers in Mississippi to play a key role in recapitalizing the LEH fleet.",171,153,,17,1,,,17,639710996515601,/story.php?story_fbid=639710996515601&id=356016438218393
Senator Cindy Hyde-Smith,,2019-08-16 15:30:20,Earlier this week I joined my friends at the Gulfport Chamber of Commerce and the MS Gulf Coast Chamber of Commerce for their annual legislative luncheon. I commend them for the critical role they play in making the MS Gulf Coast an attractive place to live and work.,109,103,,6,,,,7,639676986519002,/story.php?story_fbid=639676986519002&id=356016438218393
Senator Cindy Hyde-Smith,,2019-08-14 17:16:55,It's always an honor to spend time with our veterans. Today I had the pleasure of meeting Mr. Charlie Jenkins at the Armed Forces Retirement Home. Thank you for your service in the U.S. Navy and for welcoming me to your home.,231,212,,18,,1,,6,638509236635777,/story.php?story_fbid=638509236635777&id=356016438218393
Senator Cindy Hyde-Smith,,2019-08-08 15:50:14,"Ending a busy day in North Mississippi, which started with a pleasant courtesy visit in Tupelo with U.S. District Court Judge Michael P. Mills. Our state is blessed to have dedicated jurists like him on the bench.",144,141,,3,,,,11,635011230318911,/story.php?story_fbid=635011230318911&id=356016438218393
Senator Cindy Hyde-Smith,,2019-08-08 15:06:27,"I also met with North Mississippi health professionals to discuss access to affordable prescription drugs and access to care, both issues of great interest in MS and DC.",84,83,,1,,,,7,634990766987624,/story.php?story_fbid=634990766987624&id=356016438218393
Senator Cindy Hyde-Smith,,2019-08-08 14:59:30,"In Corinth, I had breakaway meetings with great groups of law enforcement, fire and emergency responders. We discussed a range of topics regarding their ongoing work to protect residents.",61,61,,,,,,9,634987553654612,/story.php?story_fbid=634987553654612&id=356016438218393
Senator Cindy Hyde-Smith,,2019-08-08 14:32:58,"Enjoyed speaking to the Corinth Lions Club about some of my work in the Senate. Also a privilege to recognize the club's contributions and community engagement in Corinth, MS and Alcorn County.",54,54,,,,,,2,634977566988944,/story.php?story_fbid=634977566988944&id=356016438218393
Senator Cindy Hyde-Smith,,2019-08-07 16:44:32,This #NationalPurpleHeartDay we honor those brave men and women whose service to our country went above and beyond the call of duty. A grateful nation salutes your sacrifices.,48,45,,3,,,,9,634437307042970,/story.php?story_fbid=634437307042970&id=356016438218393
Senator Cindy Hyde-Smith,,2019-08-06 11:30:58,"This newly finalized rule will help Mississippi and other states reduce the shortfall of physicians serving the people who rely on rural hospitals. Rural health care is under a lot of strain, but this CMS rule represents true progress. We’ll continue our work to find sensible reforms that will have long-term benefits for rural communities.",84,80,,4,,,,7,633748257111875,/story.php?story_fbid=633748257111875&id=356016438218393
Senator Cindy Hyde-Smith,,2019-08-06 10:46:57,Enjoyed my visit to Vermeer MidSouth in Jackson.  Proud of their good work in the construction equipment industry over the last 32 years.,69,68,,1,,,,3,633727853780582,/story.php?story_fbid=633727853780582&id=356016438218393
Senator Cindy Hyde-Smith,,2019-08-01 12:33:20,,65,53,3,6,,1,2,21,630943684058999,/story.php?story_fbid=630943684058999&id=356016438218393
Senator Cindy Hyde-Smith,,2019-08-01 12:32:54,,59,51,2,3,,,3,13,630943344059033,/story.php?story_fbid=630943344059033&id=356016438218393
Senator Cindy Hyde-Smith,,2019-07-31 19:30:04,"The people of Mississippi are beyond ready to see this crisis resolved. It is time for the federal government to make good on its promises. It is time to construct the pumps. While we work toward that goal, this legislation proposes commonsense reforms to the laws governing the regulation of our nation’s waters and permitting process. https://www.hydesmith.senate.gov/hyde-smith-wicker-introduce-bill-rein-clean-water-act-veto-authority",336,303,1,32,,,,52,630509144102453,/story.php?story_fbid=630509144102453&id=356016438218393
Senator Cindy Hyde-Smith,,2019-07-31 19:19:49,"Almost 3 months ago, I went to the Senate floor to bring attention the catastrophic flooding happening in the South MS Delta. Today, I'm here again speaking on behalf of thousands of Mississippians still suffering from what has now turned into a 7-month flood w/ no end in sight.",305,266,,33,,6,,54,630502600769774,/story.php?story_fbid=630502600769774&id=356016438218393
Senator Cindy Hyde-Smith,,2019-07-31 17:26:47,Shortly I will speak on the Senate floor about the Yazoo Backwater Flood and my latest attempt for a solution. Watch here:,97,91,,6,,,,12,630464350773599,/story.php?story_fbid=630464350773599&id=356016438218393
Senator Cindy Hyde-Smith,,2019-07-30 14:59:20,Ethical science that respects the dignity of life is always the best science. Advances in stem cell research can be achieved without relying on the destruction of human embryos. This bill establishes scientifically-sound policies that protect the sanctity of life while promoting promising stem cell research on better treatments and cures for many diseases.,88,81,2,5,,,,12,629861744167193,/story.php?story_fbid=629861744167193&id=356016438218393
Senator Cindy Hyde-Smith,,2019-07-30 14:44:26,Mississippi would benefit from a federal grant program specifically for bridge repairs and replacements.  Committee acceptance of this bridge proposal is a good sign that we can move forward with a strong infrastructure package.  This bipartisan authorization certainly complements the FY2019 appropriations set aside to fund a bridge replacement and rehabilitation program.,60,59,,1,,,,6,629856204167747,/story.php?story_fbid=629856204167747&id=356016438218393
"Senator Cindy Hyde-Smith,Senator Mitch McConnell",Senator Mitch McConnell,2019-07-29 17:10:49,"Well said, Senator Mitch McConnell. This is worth everyone taking a few minutes to watch.🔈In the middle of the 20th century, the original McCarthyism hurt American strength and diminished our standing in the Cold War by dividing us against ourselves and letting lies, innuendo, and baseless accusations crowd out reasonable politics… Now here we are in 2019… Putin and the Russians seek to provoke fear and division in our country. To undermine faith in our institutions. To exacerbate our political differences until we tear ourselves apart. And, once again, it seems there are some who blindly take the bait. American pundits calling an American official treasonous because of a policy disagreement. If anything is an asset to the Russians, it is disgusting behavior like that. My full speech: https://bit.ly/2YpX3uN and video:",63,54,6,2,,,1,29,629367110883323,/story.php?story_fbid=629367110883323&id=356016438218393
Senator Cindy Hyde-Smith,,2019-07-29 13:44:04,"Rural communities benefit greatly from access to air service.  This FAA investment in small airports around Mississippi will help ensure residents, visitors and industry have reliable airport infrastructure to support economic vitality in these regions.",61,57,1,3,,,,10,629268197559881,/story.php?story_fbid=629268197559881&id=356016438218393
Senator Cindy Hyde-Smith,,2019-07-26 15:51:48,"Pontotoc, MS native Averi Berry is a sophomore at Louisiana State University. A political science major with a concentration in race and politics, Averi is also active in the Student Government Association. After graduation, she plans to attend law school and become a civil rights lawyer. Thank you for all your work this summer, Averi!",44,44,,,,,,15,627655881054446,/story.php?story_fbid=627655881054446&id=356016438218393
Senator Cindy Hyde-Smith,,2019-07-26 12:42:23,“A majority of the public (55%) says that national economic conditions are excellent or good. This is little changed since January but remains one of the most positive assessments of national economic conditions in nearly two decades.”,64,57,2,1,,,4,20,627578084395559,/story.php?story_fbid=627578084395559&id=356016438218393
"Senator Cindy Hyde-Smith,U.S. Department of Agriculture",U.S. Department of Agriculture,2019-07-25 11:45:57,"Appreciate President Trump and Secretary Perdue issuing new round of @USDA support for farmers affected by unfair retaliatory tariffs.  It will provide much-needed help for MS farmers, who planted approx. 3.45 million acres of soybeans, cotton, corn, rice, wheat and peanuts. Signup July 29 to Dec 6 for assistance based on single county payment rate times a farm’s total planted acreage of eligible crops.  Average county-per-acre payment rate across Mississippi’s 82 counties is $86.88 per acre.U.S. Secretary of Agriculture Sonny Perdue today announced further details of the support package for American agricultural producers. Details: https://go.usa.gov/xyAxb",39,35,,1,,,3,31,627118477774853,/story.php?story_fbid=627118477774853&id=356016438218393
Senator Cindy Hyde-Smith,,2019-07-25 16:09:42,"This is terrific news for Mississippi’s role in the Space Launch System program.  We’ve long advocated NASA's John C. Stennis Space Center as the best location for the next stage of engine propulsion testing, and it’s great that the leadership at NASA now agrees.  The decision continues the tradition of the saying that if you want to go to space, you’ve got to first go through Mississippi.",64,56,,4,,,4,18,627082954445072,/story.php?story_fbid=627082954445072&id=356016438218393
Senator Cindy Hyde-Smith,,2019-07-25 15:05:09,"Happy #NationalInternDay to a superb group of summer interns.  You’ve been a huge help to me, the staff, and the great people of Mississippi over the past few months.",99,90,,9,,,,20,627058391114195,/story.php?story_fbid=627058391114195&id=356016438218393
Senator Cindy Hyde-Smith,,2019-07-25 13:24:56,We’re still diligently working on a solution to catostrophic flooding in the South MS Delta. Glad my staff was present at this local town hall to receive the latest on-the-ground updates. #forgottenbackwaterflood #finishthepumps,162,147,,13,1,1,,31,627018621118172,/story.php?story_fbid=627018621118172&id=356016438218393
Senator Cindy Hyde-Smith,,2019-07-25 10:25:11,Senate Democrats tried to do the same thing last month. Didn't work then either.,227,196,2,12,,1,16,72,626934847793216,/story.php?story_fbid=626934847793216&id=356016438218393
Senator Cindy Hyde-Smith,,2019-07-25 10:10:46,Senate Democrats try to push partisan election bills without going through regular order right after the House hearings w/Mueller. Coincidence?  Nope. Just more political theater instead of working together to secure US elections.,67,48,2,,,1,16,26,626927517793949,/story.php?story_fbid=626927517793949&id=356016438218393
Senator Cindy Hyde-Smith,,2019-07-24 15:14:56,The U.S. Economic Development Administration recently approved a $1.4M grant to support infrastructure surrounding a new George County Enviva wood pellet plant. Today I met w/CEO John Keppler to discuss its role in the MS timber industry and the hundreds of jobs it will bring to South MS.,130,124,,5,,,1,21,626522181167816,/story.php?story_fbid=626522181167816&id=356016438218393
Senator Cindy Hyde-Smith,,2019-07-24 13:17:29,The House voted to reject the global boycott of Israel. Good.  Now Democrats need to let the House vote on the Senate-passed bipartisan Strengthening America’s Security in the Middle East Act. It backs up U.S. commitments to Israel & allies w/ substantive assistance.,78,71,4,3,,,,11,626472201172814,/story.php?story_fbid=626472201172814&id=356016438218393
Senator Cindy Hyde-Smith,,2019-07-24 11:46:07,I’ve cosponsored a bill to ensure U.S. Food and Drug Administration policies support greater availability of more affordable generic insulin. Wider availability of generic insulin could lower the cost of care for people in Mississippi who rely on insulin to treat their type 1 and type 2 diabetes.,137,120,,17,,,,26,626433011176733,/story.php?story_fbid=626433011176733&id=356016438218393
Senator Cindy Hyde-Smith,,2019-07-23 18:26:27,Had the pleasure of speaking with this bright group of young leaders from The University of Mississippi - Ole Miss Lott Leadership Institute Summer Program. They are in Washington learning about public service and American democracy.,46,44,,2,,,,5,626037911216243,/story.php?story_fbid=626037911216243&id=356016438218393
Senator Cindy Hyde-Smith,,2019-07-23 15:50:26,"Farmers and ranchers who experience serious losses have access to well-established USDA programs to help them survive down years.  Commercial fishermen, including aquaculture operations, do not have that option. Our domestic seafood industry starts with the fisherman—the harvester or producer, and without them we would be forced to depend on lower quality foreign imports.",81,76,,5,,,,6,625979387888762,/story.php?story_fbid=625979387888762&id=356016438218393
Senator Cindy Hyde-Smith,,2019-07-23 11:36:24,The U.S. Department of Agriculture and Secretary Perdue are publishing a SNAP rule that will close loopholes to help ensure benefits are reaching those in most need. This is a good rule to supersede the lax eligibility standards used by some states.,23,21,,2,,,,4,625870007899700,/story.php?story_fbid=625870007899700&id=356016438218393
Senator Cindy Hyde-Smith,,2019-07-22 12:37:25,"The deadline for 2019 Fall internship applications is swiftly approaching. Be sure to submit yours by Friday, Aug. 2. Look forward to hearing from you!",16,16,,,,,,1,625329024620465,/story.php?story_fbid=625329024620465&id=356016438218393
Senator Cindy Hyde-Smith,,2019-07-21 13:21:40,I was blessed to meet with the Wilson and Terrell families of Carriere and Columbia as they advocated for childhood cancer in memory of their children who bravely fought this terrible disease. I admire their dedication to fighting for a cure.,79,75,,3,,1,,5,624754961344538,/story.php?story_fbid=624754961344538&id=356016438218393
Senator Cindy Hyde-Smith,,2019-07-20 15:33:56,"Fifty years ago today, Americans celebrated as the Eagle landed and three brave souls changed the course of space exploration. They made America the first and only nation to successfully put men on the moon. It was a great achievement for all humankind.",39,33,,6,,,,3,624240218062679,/story.php?story_fbid=624240218062679&id=356016438218393
Senator Cindy Hyde-Smith,,2019-07-19 16:29:45,"Welcome USACE Memphis District Commander Zach Miller and thank you to outgoing Commander Ellicott.  I look forward to working with you on U.S. Army Corps of Engineers, Headquarters  projects important to this region.",23,23,,,,,,1,623674228119278,/story.php?story_fbid=623674228119278&id=356016438218393
Senator Cindy Hyde-Smith,,2019-07-19 16:16:44,"As the 50th anniversary celebration of the Apollo 11 mission anniversary continues, we can all be proud of Mississippi’s and NASA's John C. Stennis Space Center contributions to that giant historical achievement. Learn more about MS and America’s journey to the moon at the @Visit_InFINITY celebration. http://www.visitinfinity.com/programs-events/apollo-50th-anniversary-celebration/415/",18,17,,1,,,,2,623669221453112,/story.php?story_fbid=623669221453112&id=356016438218393
Senator Cindy Hyde-Smith,,2019-07-19 15:32:34,"Madison Franklin of Brookhaven, MS is a senior at Mississippi State University.  She is an accounting major and also works at Glo Cubes in Starkville. She also studied at Copiah-Lincoln Community College where she was a member of Phi Beta Lambda, Phi Theta Kappa, a Trailblazer, and was inducted into the Hall of Fame.",169,143,,26,,,,9,623652308121470,/story.php?story_fbid=623652308121470&id=356016438218393
Senator Cindy Hyde-Smith,,2019-12-19 18:56:52,You could walk from Ottawa to DC to Mexico City and back faster than it took House Democrats to free the US-Mexico-Canada Agreement from the clutches of impeachment mania. Pleased the path is finally clear for the Senate to pass it early 2020. #USMCANow,139,117,13,5,3,1,,20,732500277236672,/story.php?story_fbid=732500277236672&id=356016438218393
Senator Cindy Hyde-Smith,,2019-12-18 20:55:50,"Democrats have wanted to impeach President Trump since the day he was elected. I haven’t heard or read anything rising to the level of impeachable offenses. We don’t have a Senate trial protocol yet, but I am confident the President will be treated more fairly in the Senate.  https://www.hydesmith.senate.gov/hyde-smith-statement-house-votes-impeach-president-trump",330,305,4,18,,,3,51,731742023979164,/story.php?story_fbid=731742023979164&id=356016438218393
"Senator Cindy Hyde-Smith,Senate GOP",Senate GOP,2019-12-18 10:42:40,Keep this in mind as Democrats do their thing today.Democrats’ gift to American workers? Three years wasted obsessing over impeachment. Republicans’ gift to American workers? See for yourself! 👇,52,46,2,3,,,1,11,731586743994692,/story.php?story_fbid=731586743994692&id=356016438218393
Senator Cindy Hyde-Smith,,2019-12-13 16:13:54,"I’ve enjoyed having Mia Parker, Will Pickering, and William Garrard intern in my office this fall. Today is their last day before they head back home for the holidays! Visit my website to apply for spring and summer programs. https://www.hydesmith.senate.gov/internships",85,85,,,,,,13,727376057749094,/story.php?story_fbid=727376057749094&id=356016438218393
Senator Cindy Hyde-Smith,,2019-12-02 15:55:50,"Our heartfelt condolences go out to Connie and the entire Nielsen Cochran family. As we recall his service to Mississippi, we wish him eternal peace. https://www.clarionledger.com/story/news/2019/12/02/nielsen-cochran-former-public-service-commissioner-dies/2589046001/",63,47,,1,,15,,2,717925325360834,/story.php?story_fbid=717925325360834&id=356016438218393
Senator Cindy Hyde-Smith,,2019-11-19 18:59:25,"Congratulations to MS Farm Bureau President Mike McCormick, who has been named to the FCC Precision Agriculture Task Force. His experience gives him a good chance to be a key player on this panel.",192,182,,9,,,1,18,707079416445425,/story.php?story_fbid=707079416445425&id=356016438218393
Senator Cindy Hyde-Smith,,2019-11-19 12:14:09,"The US-South Korea rice agreement is another win for Mississippi agriculture. Along with China again accepting US poultry products, Mississippi producers will benefit directly from this good work by the Trump administration. Read my press release here: https://www.hydesmith.senate.gov/hyde-smith-welcomes-us-south-korea-rice-agreement-good-mississippi-producers",80,72,1,7,,,,10,706858029800897,/story.php?story_fbid=706858029800897&id=356016438218393
Senator Cindy Hyde-Smith,,2019-11-15 19:21:53,Mississippi is fortunate to have a strong Airbus presence. Today it celebrated its 50/15 USA & Miss. anniversary. Happy to be represented there.,39,37,,1,,,1,10,703760190110681,/story.php?story_fbid=703760190110681&id=356016438218393
Senator Cindy Hyde-Smith,,2019-11-06 16:43:29,"BUILD grants are highly competitive. Gulfport and Starkville will benefit from federal funding that will help them continue their economic growth through transportation, infrastructure, and safety improvements.",39,33,,6,,,,2,696603900826310,/story.php?story_fbid=696603900826310&id=356016438218393
Senator Cindy Hyde-Smith,,2019-10-30 13:15:20,,26,18,,7,1,,,13,2501722466578566,/story.php?story_fbid=2501722466578566&id=356016438218393
Senator Cindy Hyde-Smith,,2019-10-18 14:45:28,"U.S. Senator Cindy Hyde-Smith (R-Miss.), a member of the Senate Committee on Agriculture, Nutrition, and Forestry, is seeking assurances that the U.S. Forest Service will act in a timely manner to complete environmental reviews needed to transfer lands to the Scenic Rivers Development Alliance for economic development and related improvements at Okhissa Lake.",65,62,,3,,,,13,681278549025512,/story.php?story_fbid=681278549025512&id=356016438218393
Senator Cindy Hyde-Smith,,2019-10-18 14:43:23,"The U.S. Forest Service has worked well with the local sponsors, and things have been moving smoothly.  However, various studies, such as an environmental assessment, must take place before the transfer can occur.  My constituents are concerned about any potential unnecessary delays, as well as the costs of these requirements.",39,38,1,,,,,6,681277239025643,/story.php?story_fbid=681277239025643&id=356016438218393
Senator Cindy Hyde-Smith,,2019-10-18 12:00:10,‪Ran into Mississippi's own Ben and Erin Napier from HGTV’s Home Town! So proud of how they represent our state. ‬,523,481,,42,,,,21,681171129036254,/story.php?story_fbid=681171129036254&id=356016438218393
Senator Cindy Hyde-Smith,,2019-10-12 13:16:18,‪Grateful to join Mayor Cox and Brookhaven-Lincoln County Airport officials for a tour of the facility. They are beginning general aviation infrastructure improvements with the help of a recent FAA grant. ‬,82,79,,3,,,,6,676670299486337,/story.php?story_fbid=676670299486337&id=356016438218393
Senator Cindy Hyde-Smith,,2019-09-25 17:29:03,This resolution is just another effort to object to any significant work to control and secure our borders. It also dismisses the fact that the Supreme Court in July cleared the way for President Trump and his administration to take action to address the humanitarian and security crisis on the southern border.,62,56,2,4,,,,11,664919957328038,/story.php?story_fbid=664919957328038&id=356016438218393
