source,shared_from,date,text,reactions,likes,ahah,love,wow,sigh,grrr,comments,post_id,url
Senator Cindy Hyde-Smith,,2020-03-05 12:02:37,"Learn how to protect yourself. According to the Federal Trade Commission, the public reported $153M in losses to government-imposter scams, $37M of which are Social Security related. #NCPW2020 USAGov  https://www.usa.gov/state-consumer/mississippi",1,,1,,,,,,791329464687086,/story.php?story_fbid=791329464687086&id=356016438218393
Senator Cindy Hyde-Smith,,2020-03-04 18:25:46,Congress has before it a #coronavirus emergency funding package to confront the possibility of a broader #COVID19 outbreak. I’m pleased this bill includes a #telehealth provision I advocated to help protect Medicare beneficiaries.  https://www.hydesmith.senate.gov/hyde-smith-worked-include-telehealth-provision-coronavirus-emergency-funding-package,50,45,1,4,,,,7,790827748070591,/story.php?story_fbid=790827748070591&id=356016438218393
Senator Cindy Hyde-Smith,,2020-03-04 16:37:13,"Much more work needs to be done to restore Vicksburg National Military Park & National Cemetery. Grateful today to receive U.S. Department of the Interior Secretary Bernhardt's commitment to undertake urgent repairs. https://www.hydesmith.senate.gov/hyde-smith-gets-interior-sec-commitment-fix-vicksburg-national-military-park-damages Mayor George Flaggs, Jr. Vicksburg, Mississippi  Vicksburg-Warren County Chamber of Commerce",182,169,,5,5,3,,13,790784878074878,/story.php?story_fbid=790784878074878&id=356016438218393
Senator Cindy Hyde-Smith,,2020-03-04 09:06:21,Appreciated a good discussion yesterday with the Adams County Board of Supervisors regarding the county’s infrastructure needs and how we can work together to address those issues.,47,43,,4,,,,2,790554641431235,/story.php?story_fbid=790554641431235&id=356016438218393
Senator Cindy Hyde-Smith,,2020-03-03 20:31:05,Senator Roger Wicker and I are pleased Golden Triangle Region aircraft manufacturers have been awarded a $122.6 million contract to build more U-H Lakota Light Utility Helicopters for the U.S. Army.  https://www.hydesmith.senate.gov/miss-senators-announce-1226-million-army-contract-helicopter-production Airbus Airbus Helicopters Inc.,160,156,,4,,,,8,790201788133187,/story.php?story_fbid=790201788133187&id=356016438218393
Senator Cindy Hyde-Smith,,2020-03-03 14:30:05,Add to Mississippi’s & @NASAStennis long history with @NASA space program: #BeAnAstronaut. Applications accepted until March 31 for the next class of American astronauts to explore the moon & Mars. Requirements and more at www.nasa.gov/astronauts,12,12,,,,,,,790059034814129,/story.php?story_fbid=790059034814129&id=356016438218393
Senator Cindy Hyde-Smith,,2020-03-03 12:46:04,Joined Senator John Thune & others to remind the U.S. Department of Agriculture that due diligence is required to ensure Brazilian beef imports meet U.S. food safety standards. A complete verification process is needed before lifting the beef import ban.  https://www.hydesmith.senate.gov/hyde-smith-concerned-decision-lift-brazilian-beef-ban,48,48,,,,,,1,790006508152715,/story.php?story_fbid=790006508152715&id=356016438218393
Senator Cindy Hyde-Smith,,2020-03-02 17:21:06,"Congrats to Charlie Jennings of Greenville MS, the 2020 Southern Cotton Ginners Association's Ginner of the Year! Your good work & your family’s long history ginning cotton helps sustain an industry important to MS.  Farm Press National Cotton Council of America https://www.farmprogress.com/cotton-gins/charlie-jennings-2020-scga-ginner-year",18,18,,,,,,4,789461731540526,/story.php?story_fbid=789461731540526&id=356016438218393
Senator Cindy Hyde-Smith,,2020-03-02 15:11:40,Happy #ReadAcrossAmericaDay! Beloved author Dr. Seuss was born #OnThisDay in 1904. Pick up a good book to celebrate! Mississippi Library Commission Mississippi Library Association Barbara Bush Foundation,26,24,,2,,,,2,789406788212687,/story.php?story_fbid=789406788212687&id=356016438218393
Senator Cindy Hyde-Smith,,2020-02-28 19:25:05,Grateful to have Chief of Naval Operations Adm. Mike Gilday on the Mississippi Gulf Coast to see our world class shipbuilders and shipyards firsthand and all we’re doing to support the U.S. Navy.,76,74,1,1,,,,10,787517465068286,/story.php?story_fbid=787517465068286&id=356016438218393
"Senator Cindy Hyde-Smith,Chief of Naval Operations Adm. Mike Gilday",Chief of Naval Operations Adm. Mike Gilday,2020-02-28 17:48:03,Visited Huntington Ingalls Industries in #Pascagoula MS with Senator Roger Wicker Senator Cindy Hyde-Smith and Office of the Master Chief Petty Officer of the Navy today to see first-hand how our U.S. Navy #Sailors are building the world’s most ready and lethal fleet. #ForceToBeReckonedWith https://www.navy.mil/submit/display.asp?story_id=112240,31,30,,1,,,,,787515718401794,/story.php?story_fbid=787515718401794&id=356016438218393
Senator Cindy Hyde-Smith,,2020-02-28 17:09:56,"It was so nice to see National Association of State Departments of Agriculture (NASDA) friends from NY, Okla., Calif., & Ark. in the Capitol this week. NASDA and all of us dedicated to promoting US #agriculture.",47,44,,3,,,,2,787464158406950,/story.php?story_fbid=787464158406950&id=356016438218393
Senator Cindy Hyde-Smith,,2020-02-27 20:40:23,"So nice to receive the Mississippi Wing Civil Air Patrol group today to hear more about their good work for MS and the nation. Thank you for the commendation, too!  Learn more: https://mswg.cap.gov/ Mississippi Wing Civil Air Patrol",84,82,,2,,,,5,786887888464577,/story.php?story_fbid=786887888464577&id=356016438218393
Senator Cindy Hyde-Smith,,2020-02-27 19:40:23,"Very good news for Hattiesburg with $5.39M grant for downtown rail infrastructure project. Senator Roger Wicker, Congressman Steven Palazzo & I appreciate USDOT support for this worthy plan. https://www.hydesmith.senate.gov/wicker-hyde-smith-palazzo-announce-539-million-grant-improve-downtown-hattiesburg-rail-crossings",47,46,,1,,,,6,786862141800485,/story.php?story_fbid=786862141800485&id=356016438218393
"Senator Cindy Hyde-Smith,The White House",The White House,2020-02-26 20:30:52,"Congress must act responsibly on @realDonaldTrump's USA plan to address the coronavirus situation at home. On a personal level, #BePrepared as with any other potential emergency. @Readygov @CDCgov Visit: https://www.ready.gov/President Trump just held a news conference on the coronavirus:  ""The number-one priority from our standpoint is the health and safety of the American people.""",39,37,1,1,,,,17,786655335154499,/story.php?story_fbid=786655335154499&id=356016438218393
Senator Cindy Hyde-Smith,,2020-02-26 15:43:39,Wonderful story. Congratulations Kathryn Daniels for all your good work with the Petal School District,45,45,,,,,,,786103791876320,/story.php?story_fbid=786103791876320&id=356016438218393
Senator Cindy Hyde-Smith,,2020-02-26 14:28:48,"‪Infrastructure, telehealth and workforce development were among the priorities the Tunica County Board of Supervisors shared during their visit to Capitol Hill. Enjoyed our informative meeting on Tunica County and the Mississippi Delta. Visit the Mississippi Delta",63,61,,2,,,,6,786068885213144,/story.php?story_fbid=786068885213144&id=356016438218393
Senator Cindy Hyde-Smith,,2020-02-26 12:09:50,"Pleased to talk with U.S. Department of Health and Human Services Secretary Alex Azar about President Donald J. Trump budget requests for rural health care, including CONNECT for Health Act provisions to help expand telehealth at community health centers. This is important to MS.  https://www.hydesmith.senate.gov/hyde-smith-addresses-rural-health-care-needs-during-hhs-budget-review  UMMC Center for Telehealth University of Mississippi Medical Center",82,78,1,3,,,,14,785994985220534,/story.php?story_fbid=785994985220534&id=356016438218393
Senator Cindy Hyde-Smith,,2020-02-26 09:44:05,,92,90,,2,,,,10,785908261895873,/story.php?story_fbid=785908261895873&id=356016438218393
"Senator Cindy Hyde-Smith,Sen. Jacky Rosen",Sen. Jacky Rosen,2020-02-25 09:49:19,"‪Honored to join Senator James Lankford & Sen. Jacky Rosen’s resolution, which the Senate has passed unanimously. Especially in a period of rising anti-Semitism, commemoration of the liberation of Auschwitz will raise awareness about the horrors of the Holocaust.‬Proud that the Senate has passed my bipartisan resolution commemorating the 75th anniversary of the liberation of Auschwitz. We honor the millions lost and those who helped liberate survivors by making a pledge to ensure never again means never again for anyone.",46,41,,5,,,,5,785546585265374,/story.php?story_fbid=785546585265374&id=356016438218393
"Senator Cindy Hyde-Smith,Tate Reeves",Tate Reeves,2020-02-25 15:34:31,"This is great news. Very glad to see Keystone Electrical Manufacturing Company moving to my hometown of Brookhaven, creating 30 new jobs!Proud that Keystone Electrical Manufacturing Company is expanding to Brookhaven, investing $4 million and creating 30 new jobs! It's that kind of commitment to Mississippi—Fred Buie, a local man giving back to his hometown through job creation and investment—that keeps our communities thriving.",154,143,,11,,,,3,785507965269236,/story.php?story_fbid=785507965269236&id=356016438218393
Senator Cindy Hyde-Smith,,2020-02-25 18:40:27,"Pleased to cosponsor Senator Roger Wicker resolution honoring native Mississippian Hiram Revels, his extraordinary fight for equality, and his important place in American history as the first African American Senator. #blackhistorymonth",41,38,,3,,,,,785489671937732,/story.php?story_fbid=785489671937732&id=356016438218393
Senator Cindy Hyde-Smith,,2020-02-25 17:22:48,"It has always been my goal to protect and defend the unborn, and I will continue to do so despite today’s disappointing votes to block two important #ProLife bills.  Thank you to FRC Action for your recognition of this important and life-saving work.  https://www.hydesmith.senate.gov/hyde-smith-votes-protect-defend-unborn",186,168,2,14,,1,1,23,785460788607287,/story.php?story_fbid=785460788607287&id=356016438218393
Senator Cindy Hyde-Smith,,2020-02-25 16:46:52,"Mississippi plays a vital role in helping Department of Homeland Security, U.S. Coast Guard Yard fulfill its national security missions. I look forward to ensuring we provide the ships and other equipment our men and women in uniform desperately need.  https://www.hydesmith.senate.gov/hyde-smith-sees-continued-shipbuilding-needs-meet-growing-coast-guard-mission-responsibilities",36,34,,2,,,,3,785445161942183,/story.php?story_fbid=785445161942183&id=356016438218393
Senator Cindy Hyde-Smith,,2020-02-25 10:48:09,The EPSCoR/IDeA programs improve the research capacity of universities in MS and across the nation. This leads to better education/better jobs for our people. I'm proud to be an advocate for these important programs! Mississippi State University The University of Southern Mississippi,70,66,1,1,1,,1,1,785261448627221,/story.php?story_fbid=785261448627221&id=356016438218393
Senator Cindy Hyde-Smith,,2020-02-24 16:05:03,"Mississippi communities should consider applying for U.S. Department of Transportation 2020 BUILD infrastructure grant funds. Gulfport & Starkville won highly-competitive grants last year. $1B to be allotted this year, with 50% to rural areas.  May 18 filing deadline.  https://www.transportation.gov/BUILDgrants",30,28,,2,,,,2,784753882011311,/story.php?story_fbid=784753882011311&id=356016438218393
"Senator Cindy Hyde-Smith,LCI - Reach Your Highest Potential",LCI - Reach Your Highest Potential,2020-02-20 16:24:40,"Wrapping up a wonderful week traveling around MS. One terrific visit included meeting with the dedicated individuals at LCI in Hazlehurst. MS is proud to have companies that work to consistently protect and support Americans w/ #BVIThis week, we had the privilege of welcoming Senator Cindy Hyde-Smith to our Hazlehurst, MS manufacturing facility! She toured and met our employees including Tony Perek, a general assembler and member of the #BVI community. #Mississippi #EmploymentForTheBlind #AbilityOne",107,100,,6,,,1,6,783339468819419,/story.php?story_fbid=783339468819419&id=356016438218393
Senator Cindy Hyde-Smith,,2020-02-21 18:38:37,"Delighted to help dedicate the Thad Cochran Mississippi Center for Technology and Innovation which will help strengthen education at all levels, create a stronger STEM-proficient workforce, and an engine for economic growth. #MCITy  U.S. Army Engineer Research and Development Center (ERDC)",190,182,2,5,1,,,11,782642262222473,/story.php?story_fbid=782642262222473&id=356016438218393
Senator Cindy Hyde-Smith,,2020-02-21 16:21:25,A time to celebrate as Rear Admiral Mark “Buz” Busby presents a $15.7 million grant check for the Port of Gulfport Access Project. https://www.hydesmith.senate.gov/wicker-hyde-smith-palazzo-announce-1576-million-grant-port-gulfport   Mississippi Gulf Coast,43,41,,2,,,,3,782583258895040,/story.php?story_fbid=782583258895040&id=356016438218393
Senator Cindy Hyde-Smith,,2020-02-21 14:28:21,I’m thankful to the National Park Service & Friends of Vicksburg National Military Park for showing me firsthand the recent and significant storm damage to Vicksburg National Military Park and the National Cemetery. I hope we can work together to fully reopen the park ASAP.  Visit Vicksburg   City of Vicksburg,262,243,,3,,16,,14,782526808900685,/story.php?story_fbid=782526808900685&id=356016438218393
"Senator Cindy Hyde-Smith,n County Chamber of Commerce",n County Chamber of Commerce,2020-02-19 11:54:57,"Look forward to seeing everyone today!REMINDER - The Mississippi Center for Innovation & Technology’s Naming Ceremony is Friday!! Vicksburg keeps making big moves. MCITy, once known as the Mississippi Hardware building, is now a hub of innovation. A new economic model for Mississippi. Join federal, state, & local leaders in this important event. Presenting keynote speaker Senator Cindy Hyde-Smith.  This event will take place outside, please dress for cold weather. Starts at 10:00 AM 1622 Washington Street (In front of the Vicksburg Convention Center) Friday, February 21, 2020 Downtown Vicksburg Main Street Program City of Vicksburg  U.S. Army Engineer Research and Development Center (ERDC) ERDCWERX",49,46,1,1,,,1,6,782337802252919,/story.php?story_fbid=782337802252919&id=356016438218393
Senator Cindy Hyde-Smith,,2020-02-20 16:21:11,"Enjoyed a visit today with Camgian Microsystems in Mississippi State University Research Park. It’s inspiring to see the innovative, advanced technology created in MS in support of our national security. Keep up the good work! #TEAMNOQUITWIN",88,82,,6,,,,11,781839435636089,/story.php?story_fbid=781839435636089&id=356016438218393
Senator Cindy Hyde-Smith,,2020-02-19 19:07:46,"Had a great Wednesday in the Mississippi Delta. There is a lot of potential to improve the jobs and health outlook, particularly as we work together. Enjoyed talking at the Economic Development Workshop for Elected Officials. #DeltaStrong Delta Blues Museum - Clarksdale, Mississippi GRAMMY Museum Mississippi Visit Clarksdale Visit the Mississippi Delta Saf-T-Cart Delta State University",129,118,,11,,,,9,781233745696658,/story.php?story_fbid=781233745696658&id=356016438218393
"Senator Cindy Hyde-Smith,News Mississippi",News Mississippi,2020-02-18 14:03:37,"Please continue to put safety first as we work through this latest flooding disaster. Governor Tate Reeves, Mississippi Emergency Management Agency and other agencies are working diligently to stay on top of this emergency.If you have experienced damage during the Pearl River flood event, you are now able to self-report the damage.",30,30,,,,,,,780459725774060,/story.php?story_fbid=780459725774060&id=356016438218393
Senator Cindy Hyde-Smith,,2020-02-17 08:19:52,,82,74,,7,,1,,22,779551285864904,/story.php?story_fbid=779551285864904&id=356016438218393
Senator Cindy Hyde-Smith,,2020-02-16 13:36:00,‪February 16 kicks off #RandomActsofKindnessWeek. Mississippians are the most charitable people in the country. Let’s all commit to continuing to pull each other up after we've been knocked down. #MakeKindnessTheNorm‬,49,45,,4,,,,11,779049125915120,/story.php?story_fbid=779049125915120&id=356016438218393
Senator Cindy Hyde-Smith,,2020-02-15 13:30:15,"ICYMI, #PlannedParenthood is suing to keep people in the dark if their insurance payments support abortions. I fully support and fought for the final U.S. Department of Health and Human Services rule to stop hidden #Obamacare abortion surcharges. #ProLife   https://www.washingtonexaminer.com/news/planned-parenthood-and-aclu-sue-to-stop-trump-rule-requiring-obamacare-insurers-to-bill-separately-for-abortion",58,47,4,3,2,1,1,22,778371255982907,/story.php?story_fbid=778371255982907&id=356016438218393
"Senator Cindy Hyde-Smith,National Community Pharmacists Association",National Community Pharmacists Association,2020-02-12 10:39:47,"This report released this week is a reason I cosponsored the Phair Relief Act and why I continue to work to lower prescription drug costs.A new analysis released last night shows how pharmacy benefit managers are using pharmacy direct and indirect remuneration fees to rake in billions profits at the expense of patients and neighborhood pharmacies. View the analysis below, and share with your contacts to spread the word about the need to #FixDIR. ""XIL Consulting has an insider's perspective, which is why this report is so incriminating to the PBMs,"" said NCPA CEO Douglas Hoey. Read more of Hoey's reaction here: https://www.ncpanet.org/newsroom/news-releases/2020/02/12/analysis-blows-lid-off-$8.5-billion-pbm-scam-says-community-pharmacy",21,21,,,,,,12,778188512667848,/story.php?story_fbid=778188512667848&id=356016438218393
Senator Cindy Hyde-Smith,,2020-02-14 12:04:42,"In light of new and serious flooding threats in Central Mississippi, it’s worth being familiar with Flood Safety Tips. Keep your local radio/TV on for more updates on the  situation. #SafetyFirst  https://www.northsidesun.com/front-page-slideshow-news-breaking-news/flood-safety-tips#sthash.3e0E7HjK.6GdxCE2W.dpbs Mississippi Emergency Management Agency US National Weather Service Jackson Mississippi  Mississippi Department of Transportation",21,21,,,,,,5,777476712739028,/story.php?story_fbid=777476712739028&id=356016438218393
Senator Cindy Hyde-Smith,,2020-02-14 10:15:59,"#HappyValentinesDay from the Sweethearts from the Senate! Senator Loeffler, Ernst, Capito, Fischer, McSally, Collins and I are sending heartfelt messages with cards we made for the #WoundedWarriors at Walter Reed National Military Medical Center.",218,188,2,27,1,,,19,777360636083969,/story.php?story_fbid=777360636083969&id=356016438218393
Senator Cindy Hyde-Smith,,2020-02-13 17:16:05,Enjoyed yesterday’s visit with Chief Cyrus Ben and hearing the needs of Choctaw Indians.,228,222,,6,,,,6,776822829471083,/story.php?story_fbid=776822829471083&id=356016438218393
Senator Cindy Hyde-Smith,,2020-02-13 15:49:12,Pleased that Tennessee Valley Authority was in City of Oxford today for its Quarterly Meeting. Appreciate TVA’s storied importance to Mississippi and the surrounding region.,22,22,,,,,,,776785372808162,/story.php?story_fbid=776785372808162&id=356016438218393
Senator Cindy Hyde-Smith,,2020-02-12 12:12:40,"Today, we remember President #AbrahamLincoln, born #OnThisDay 211 years ago.",49,41,1,7,,,,12,776020312884668,/story.php?story_fbid=776020312884668&id=356016438218393
Senator Cindy Hyde-Smith,,2020-02-11 17:38:23,Great to meet Mississippi Farm Bureau Federation Young Farmers group today. MS agriculture is strong and new trade agreements mean opportunities. Senator Roger Wicker & I are promoting MS-grown rice for a new trade pact with the United Kingdom. USA Rice  https://www.hydesmith.senate.gov/miss-senators-promote-us-grown-rice-uk-trade-talks,244,215,,27,,,2,23,775476356272397,/story.php?story_fbid=775476356272397&id=356016438218393
Senator Cindy Hyde-Smith,,2020-02-11 16:24:20,My staff was on hand for Tennessee Valley Authority Chair Richard Howorth’s visit to Lafayette HS in Oxford to deliver a STEM grant to teacher Cory Burt and students. It is one of 14 education grants going to North Mississippi.  https://www.tva.gov/Newsroom/Press-Releases/TVA-Partnership-Awards-More-Than-55000-in-STEM-Grants-to-Mississippi-Schools,42,41,,1,,,,2,775447506275282,/story.php?story_fbid=775447506275282&id=356016438218393
Senator Cindy Hyde-Smith,,2020-02-11 15:48:59,"Recieved great news today from Secretary of Transportation Elaine L. Chao that the Port of Gulfport is getting critical infrastructure funds. Today, Senator Roger Wicker, Congressman Steven Palazzo, and I announced a $15.76M grant to continue making this a remarkable port of the future. City of Gulfport - Mayors Office Mississippi Gulf Coast  https://www.hydesmith.senate.gov/wicker-hyde-smith-palazzo-announce-1576-million-grant-port-gulfport",453,420,,31,,1,1,39,775433356276697,/story.php?story_fbid=775433356276697&id=356016438218393
Senator Cindy Hyde-Smith,,2020-02-11 11:57:08,"MS waterways, harbors, and flood control projects will benefit from U.S. Army Corps of Engineers, Headquarters 2020 Work Plan with $46.5M allotted for work in our state. This includes renewed attention to the Yazoo Backwater Area. https://www.hydesmith.senate.gov/hyde-smith-details-465-million-army-corps-work-miss-including-yazoo-backwater-area  Mississippi Valley Division (US Army Corps of Engineers)",74,70,2,2,,,,6,775318266288206,/story.php?story_fbid=775318266288206&id=356016438218393
Senator Cindy Hyde-Smith,,2020-02-11 10:17:58,"#BlackHistoryMonth focus: 20 MS women were part of the ‘Six Triple Eight,’ the only all African-American women’s unit to serve overseas in WWII. We recall their service and bravery as we work for a Congressional Gold Medal to honor them.   https://kmox.radio.com/articles/radiocom/honoring-us-army-s-all-black-all-female-wwii-battalion",24,20,,3,,,1,9,775251059628260,/story.php?story_fbid=775251059628260&id=356016438218393
Senator Cindy Hyde-Smith,,2020-02-10 17:11:08,Great to see Tennessee Valley Authority putting resources into Mississippi schools to promote more STEM education! https://www.tva.gov/Newsroom/Press-Releases/TVA-Partnership-Awards-More-Than-55000-in-STEM-Grants-to-Mississippi-Schools,54,50,,4,,,,11,774761923010507,/story.php?story_fbid=774761923010507&id=356016438218393
"Senator Cindy Hyde-Smith,The White House",The White House,2020-02-07 11:08:35,"Exceeding expectations, the U.S. economy added 225,000 jobs in January!  Our economy is strong and growing because of a Republican pro-growth agenda of regulatory relief, tax reform, and new trade deals.Today's jobs numbers are SMASHING expectations! 🔥",79,67,2,9,,1,,28,772613936558639,/story.php?story_fbid=772613936558639&id=356016438218393
Senator Cindy Hyde-Smith,,2020-02-06 13:28:14,I’ve asked U.S. Department of Agriculture FSIS to hone in on new efforts by foreign countries to export ineligible catfish products to the US.  Ready-to-eat snacks like ‘salted egg fish skins’ from Asia are illegal. U.S. Farm-Raised Catfish https://www.hydesmith.senate.gov/hyde-smith-asks-usda-stop-unlawful-catfish-snacks-asian-countries,39,34,,3,,,2,13,771896886630344,/story.php?story_fbid=771896886630344&id=356016438218393
"Senator Cindy Hyde-Smith,Senate GOP",Senate GOP,2020-02-05 17:04:57,"#Acquitted - Let's get back to work.They never believed he could win. They refused to accept it when he did. While they opened endless investigations, Republicans got to work. Now, America is thriving like never before. And, the best is yet to come. 🚨 NEW VIDEO:",189,138,4,45,1,1,,40,771369556683077,/story.php?story_fbid=771369556683077&id=356016438218393
Senator Cindy Hyde-Smith,,2020-02-05 13:55:01,I will cast my votes to acquit President Donald J. Trump on both Articles of Impeachment. The Senate has done its constitutional duty and justice will be served. It's time to move on and do the work the American people sent us here to do. https://www.hydesmith.senate.gov/hyde-smith-will-vote-acquit-president-trump,1.2K,1K,4,245,,2,14,220,771273370026029,/story.php?story_fbid=771273370026029&id=356016438218393
Senator Cindy Hyde-Smith,,2020-02-04 23:20:35,President Trump's #SOTU address reminded us that there is work yet to be done to continue the Great American Comeback! I will continue to work with the President & my colleagues to help create opportunities for American families to prosper. https://www.hydesmith.senate.gov/hyde-smith-statement-state-union-0,511,417,4,84,2,1,3,62,770835593403140,/story.php?story_fbid=770835593403140&id=356016438218393
"Senator Cindy Hyde-Smith,Senate GOP",Senate GOP,2020-02-04 19:42:16,Join us LIVE NOW as President Trump delivers the State of the Union!,71,54,1,16,,,,13,770774290075937,/story.php?story_fbid=770774290075937&id=356016438218393
Senator Cindy Hyde-Smith,,2020-02-04 20:46:31,"‪Tune in soon to hear what President Donald J. Trump has to say in the #SOTU Address. The USA is strong with much to be thankful for, but with challenges we can work on together, too. ‬",497,416,8,70,1,1,1,60,770767776743255,/story.php?story_fbid=770767776743255&id=356016438218393
Senator Cindy Hyde-Smith,,2020-02-01 10:49:36,Another reminder of MS aircraft manufacturing supporting defense and homeland security missions. We continued support for Department of Homeland Security aircraft procurement with FY2020 appropriations. https://www.hydesmith.senate.gov/hyde-smith-votes-send-president-solid-funding-bills-benefit-us-miss  https://www.airbus.com/newsroom/press-releases/en/2020/01/airbus-helicopters-to-deliver-16-new-h125s-to-customs-and-border-protection.html,103,92,1,9,,1,,39,768480880305278,/story.php?story_fbid=768480880305278&id=356016438218393
