source,shared_from,date,text,reactions,likes,ahah,love,wow,sigh,grrr,comments,post_id,url
Senator Cindy Hyde-Smith,,2019-10-01 16:03:12,Thank you Madison County Economic Development Authority and Madison County Business League and Foundation for the opportunity to speak with you about the work we’re doing in Washington to make sure the economy in Madison County and Mississippi continue to thrive.,61,61,,,,,,4,669065936913440,/story.php?story_fbid=669065936913440&id=356016438218393
Senator Cindy Hyde-Smith,,2019-10-01 15:35:59,It was great to spend time with U.S. Department of Housing and Urban Development Secretary Ben Carson before he joined the Southeastern Regional Opportunity Zone Summit. We’re glad to have you in Mississippi.,400,357,5,36,1,,1,17,669053990247968,/story.php?story_fbid=669053990247968&id=356016438218393
Senator Cindy Hyde-Smith,,2019-10-01 14:51:49,Enjoyed speaking to the Greater Jackson Chamber Partnership  at their Bringing Washington to You Breakfast.  We talked about a wide range of issues concerning the Metro Jackson area and Mississippi.,64,63,,1,,,,8,669033106916723,/story.php?story_fbid=669033106916723&id=356016438218393
Senator Cindy Hyde-Smith,,2019-09-30 17:33:29,"These grants will allow workforce development projects in Mississippi to ramp up their efforts to expand opportunities for individuals and create a work-ready workforce.  Industry has a vested interest in our workforce, and these grant awards will equip rural communities with the tools necessary to train skilled, qualified worker.",59,57,,2,,,,6,668428833643817,/story.php?story_fbid=668428833643817&id=356016438218393
"Senator Cindy Hyde-Smith,U.S. Secretary of Defense",U.S. Secretary of Defense,2019-09-29 12:27:59,On #GoldStarMothersDay we honor those who know the true cost of service. Each gold star represents a service member who died during a time of conflict. We recognize the loss these families have suffered & we mourn with them. We share their pride in remembering our nation’s heroes. #HonorThem,31,24,,6,1,,,3,667641020389265,/story.php?story_fbid=667641020389265&id=356016438218393
Senator Cindy Hyde-Smith,,2019-09-27 12:44:00,"Brain aneurysms take lives and threaten the well-being of too many people. Most people don’t realize that they have an aneurysm, but awareness and detection, in addition to more research on treatments, can help reduce the toll taken by this condition.",22,21,,,,1,,5,666208650532502,/story.php?story_fbid=666208650532502&id=356016438218393
Senator Cindy Hyde-Smith,,2019-09-26 16:59:13,"Congratulations to Bayou View Elementary School Northshore Elementary, St. Patrick Catholic High School, and Pineville Elementary School for being named U.S. Department of Education National Blue Ribbon Schools.  I commend your superb academic achievements. Keep up the good work!",26,25,,1,,,,2,665621540591213,/story.php?story_fbid=665621540591213&id=356016438218393
Senator Cindy Hyde-Smith,,2019-09-26 16:27:42,"For Mississippians affected by declared natural disasters from Feb 22–Mar 29, FEMA Federal Emergency Management Agency Disaster Recovery Centers will open tomorrow in Lowndes and Warren counties for one-on-one assistance.  For locations and registration information, visit: https://www.disasterassistance.gov/",6,6,,,,,,4,665608257259208,/story.php?story_fbid=665608257259208&id=356016438218393
Senator Cindy Hyde-Smith,,2019-09-26 15:39:59,"Accountability to taxpayers is my focus in overseeing the writing of the Legislative Branch bill. The American people want us to be good stewards of taxpayer dollars as we work on their behalf. This means we reject renewed efforts to lift the pay freeze for members of Congress, and instead direct our attention to more important matters.",68,67,,1,,,,8,665586420594725,/story.php?story_fbid=665586420594725&id=356016438218393
Senator Cindy Hyde-Smith,,2019-09-26 15:08:19,The border security and immigration enforcement funding in this bill reflects the need to address the serious problems we face on our borders. The wall funding and other resources would give agencies more capacity to deal with the overwhelming influx of illegal immigrants and asylum seekers trying to get into the country.,112,100,4,8,,,,19,665571617262872,/story.php?story_fbid=665571617262872&id=356016438218393
Senator Cindy Hyde-Smith,,2019-09-26 09:58:33,"Gregory Alston has proven himself to be a valued asset on my staff. He will bring his talents to the Leadership Institute, and I believe what he learns through this program will benefit the people of North Mississippi as he represents my office.",79,75,,3,1,,,7,665405987279435,/story.php?story_fbid=665405987279435&id=356016438218393
Senator Cindy Hyde-Smith,,2019-09-25 17:29:03,This resolution is just another effort to object to any significant work to control and secure our borders. It also dismisses the fact that the Supreme Court in July cleared the way for President Trump and his administration to take action to address the humanitarian and security crisis on the southern border.,62,56,2,4,,,,11,664919957328038,/story.php?story_fbid=664919957328038&id=356016438218393
Senator Cindy Hyde-Smith,,2019-09-25 12:18:50,,240,203,6,12,,6,13,49,664754174011283,/story.php?story_fbid=664754174011283&id=356016438218393
Senator Cindy Hyde-Smith,,2019-09-25 10:56:58,"Recovering from the damage caused to the Mississippi Sound this year will take time, but we’re fortunate that funding is already in place to implement disaster assistance.  U.S. Department of Commerce should use those funds to help us overcome the significant economic hardships experienced by Mississippi’s boating, tourism, fisheries, shrimp, and oyster industries.",21,21,,,,,,4,664706164016084,/story.php?story_fbid=664706164016084&id=356016438218393
Senator Cindy Hyde-Smith,,2019-09-25 10:05:16,BREAKING: Secretary of Commerce Wilbur Ross approves Gulf Coast disaster designation acknowledging the devastation to the Mississippi fishing and seafood industries this summer. I’m pleased resources are available now to be put to work on the MS Gulf Coast.,19,19,,,,,,1,664674887352545,/story.php?story_fbid=664674887352545&id=356016438218393
Senator Cindy Hyde-Smith,,2019-09-24 18:06:00,Mississippi’s barrier islands serve as our first line of defense.  The restoration of Ship Island as a protective barrier island is a significant project that can help improve the safety of the coast and the health of the Mississippi Sound. I’m pleased that work on the next two phases of this project should be completed in the coming year.,23,22,,1,,,,5,664259287394105,/story.php?story_fbid=664259287394105&id=356016438218393
Senator Cindy Hyde-Smith,,2019-09-24 16:52:54,"Senator Roger Wicker and I met with the Mississippi Levee Board to discuss continued strategies to address flood control in the Mississippi Delta. It is a key partner in protecting Mississippi communities, farms, and businesses.",122,118,1,3,,,,11,664229314063769,/story.php?story_fbid=664229314063769&id=356016438218393
Senator Cindy Hyde-Smith,,2019-09-24 15:07:05,"The care, dedication and compassion oncology nurses give cancer patients and their families is a blessing. Appreciated the chance to discuss cancer research funding with the Oncology Nursing Society and Emily Manuel from Mississippi Baptist Medical Center in Jackson.",43,43,,,,,,3,664185504068150,/story.php?story_fbid=664185504068150&id=356016438218393
Senator Cindy Hyde-Smith,,2019-09-24 12:33:17,"Another reminder of all the U.S. Coast Guard does to protect us—not just interdicting illicit trafficking, but saving lives. Keep up the good work!",31,28,,3,,,,2,664110740742293,/story.php?story_fbid=664110740742293&id=356016438218393
Senator Cindy Hyde-Smith,,2019-09-24 10:31:56,I was honored to meet Kristy DiDomenico and daughters Fiona & Gemma. They're among the many Gold Star Families who have lost a loved one in service to our country & the reason I introduced a resolution establishing “Gold Star Families Remembrance Week.”  https://www.hydesmith.senate.gov/hyde-smith-introduces-gold-star-week-resolution-honor-families-fallen,142,125,,17,,,,5,664048170748550,/story.php?story_fbid=664048170748550&id=356016438218393
Senator Cindy Hyde-Smith,,2019-09-23 10:59:41,"Mississippi is now engaged in a strong collaborative effort to improve education in rural school districts. The Consortium is already making good progress, and through this multi-year EIR grant, students in rural districts will be given more access to college-level STEM coursework. The grant also represents an acknowledgment by the U.S. Department of Education that more resources need to be invested in rural areas.",30,27,3,,,,,5,663421047477929,/story.php?story_fbid=663421047477929&id=356016438218393
Senator Cindy Hyde-Smith,,2019-09-21 11:19:49,"Today is Smithsonian #MuseumDay, and museums across the country are offering free admission. Check here for participating museums in Mississippi.",5,5,,,,,,1,662103800942987,/story.php?story_fbid=662103800942987&id=356016438218393
Senator Cindy Hyde-Smith,,2019-09-20 16:43:33,"On National POW/MIA Recognition Day, we pay homage to the servicemembers help captive and those who have yet to return home. #YouAreNotForgotten",29,28,,,,1,,5,661588540994513,/story.php?story_fbid=661588540994513&id=356016438218393
Senator Cindy Hyde-Smith,,2019-09-19 16:49:09,"Despite hurdles, we are making progress on FY2020 appropriations bills. I look forward to working in good faith with Senate Dems and the House to finish the remaining bills and to fund our military. Visit my website for more info. www.hydesmith.senate.gov",51,49,2,,,,,7,660845664402134,/story.php?story_fbid=660845664402134&id=356016438218393
Senator Cindy Hyde-Smith,,2019-09-18 19:22:51,"Fiscal year 2020 begins October 1, and an ‘aye’ vote was a vote for getting national security funding in place as soon as possible. I am disappointed that many Democrats seem satisfied with beating partisan drums rather than following a budget agreement to ensure we support our men and women in uniform, while also addressing many of the challenges facing our nation. I include consistent flood threats to Mississippi among those challenges.",55,40,,1,,7,7,10,660206477799386,/story.php?story_fbid=660206477799386&id=356016438218393
Senator Cindy Hyde-Smith,,2019-09-18 15:20:27,"Entire families share the grief and loss of a loved one, who has died while serving to defend us. This resolution recognizes that fact and asks the American people to honor the families affected by the loss of a loved one in service to our country.",47,41,,6,,,,6,660108094475891,/story.php?story_fbid=660108094475891&id=356016438218393
Senator Cindy Hyde-Smith,,2019-09-18 12:08:33,America's farmers and ranchers are unfairly targeted by China's retaliatory tariffs. The President and his administration have shown their commitment to protect the men and women who provide our food and fiber. Not the time or place for partisan politics.,33,26,4,2,,,1,5,660013897818644,/story.php?story_fbid=660013897818644&id=356016438218393
Senator Cindy Hyde-Smith,,2019-09-18 10:36:01,"Happy birthday United States Air Force! Thank you for 72 years of dedicated service and defense of the skies above. A special thank you to the airmen serving in Mississippi Keesler Air Force Base, Columbus Air Force Base, 172d Airlift Wing and Key Field Air National Guard Base  #AimHigh",31,30,,1,,,,1,659964874490213,/story.php?story_fbid=659964874490213&id=356016438218393
Senator Cindy Hyde-Smith,,2019-09-17 17:34:20,The Department of Homeland Security and FEMA Federal Emergency Management Agency administer these grants to support communities’ efforts to improve public safety through sufficiently staffed and well-equipped fire departments. I’m pleased these Mississippi cities successfully competed for this federal assistance.,35,34,,1,,,,2,659502984536402,/story.php?story_fbid=659502984536402&id=356016438218393
Senator Cindy Hyde-Smith,,2019-09-17 17:25:18,"Today I met with the Mississippi Automobile Dealers Association.  Like many hard working Americans, they’re depending on Congress to act now on USMCA. It’s time. #USMCANow",58,57,,1,,,,5,659499687870065,/story.php?story_fbid=659499687870065&id=356016438218393
Senator Cindy Hyde-Smith,,2019-09-17 14:19:27,Congratulations to SSgt. Gary G. Jeffry III on being named an Outstanding Airman of the Year by the Air Force Association. Read about his impressive leadership with the Keesler Air Force Base flu vaccine program here:,11,10,,1,,,,,659423691210998,/story.php?story_fbid=659423691210998&id=356016438218393
Senator Cindy Hyde-Smith,,2019-09-17 13:03:46,"On this day 232 years ago, Our Founding Fathers signed the United States Constitution, the enduring foundation for our present-day democracy.  May it always be our guide to “form a more perfect Union, establish Justice, insure domestic Tranquility, provide for the common defense, promote the general Welfare, and secure the Blessings of Liberty to ourselves and our Posterity.”",50,46,,4,,,,6,659388604547840,/story.php?story_fbid=659388604547840&id=356016438218393
Senator Cindy Hyde-Smith,,2019-09-13 14:52:30,Thank you DeSoto County Economic Development Council for the opportunity to visit with you. Keep up the good work as we continue to improve the future of DeSoto County and Mississippi.,63,61,,2,,,,5,656818604804840,/story.php?story_fbid=656818604804840&id=356016438218393
Senator Cindy Hyde-Smith,,2019-09-13 11:39:59,Look forward to joining DeSoto County Economic Development Council today for its quarterly membership luncheon. I admire the people of DeSoto County and their commitment to economic development and quality of life issues.,12,12,,,,,,2,656719874814713,/story.php?story_fbid=656719874814713&id=356016438218393
Senator Cindy Hyde-Smith,,2019-09-13 11:18:15,"I couldn’t be more pleased that President Trump and his administration are easing the regulatory burden on Americans by repealing the Obama WOTUS rule. From day one, Mississippi farmers, landowners, and community leaders recognized just what the Obama WOTUS rules represented—a violation of the constitutional and statutory limits of the Clean Water Act and more bureaucratic red tape for us.",93,89,1,3,,,,8,656707081482659,/story.php?story_fbid=656707081482659&id=356016438218393
Senator Cindy Hyde-Smith,,2019-09-12 17:31:51,"This Senate bill provides the U.S. Army Corps of Engineers, Headquarters with resources to continue work on flood control projects, ports, and waterways in Mississippi. We also are creating a new fund to fully dredge parts of the lower Mississippi River, which should improve navigation, increase the volume of the river channel, and lower upstream water levels to help lessen the need to open the Bonnet Carré Spillway",54,48,,6,,,,1,656229798197054,/story.php?story_fbid=656229798197054&id=356016438218393
Senator Cindy Hyde-Smith,,2019-09-11 16:07:45,Proud to see Major Leetch and Captain Carpenter joining these efforts to remember 9/11 victims. Thank you for your service to our nation and to the great state of Mississippi.,113,88,,22,3,,,,655546141598753,/story.php?story_fbid=655546141598753&id=356016438218393
Senator Cindy Hyde-Smith,,2019-09-11 16:06:44,,6,5,,1,,,,,655545648265469,/story.php?story_fbid=655545648265469&id=356016438218393
Senator Cindy Hyde-Smith,,2019-09-11 16:06:30,,13,12,,1,,,,,655545394932161,/story.php?story_fbid=655545394932161&id=356016438218393
Senator Cindy Hyde-Smith,,2019-09-11 16:05:02,I'm proud of how Mississippi is remembering and commemorating this 9/11 #PatriotDay.,103,83,,20,,,,,655544761598891,/story.php?story_fbid=655544761598891&id=356016438218393
Senator Cindy Hyde-Smith,,2019-09-11 10:08:52,"May we #NeverForget the heroism of first responders and the innocent men, women and children lost 18 years ago today in the deadliest terrorist attack on American soil. May we remain united in our love of country and in the fight against terrorism.",14,12,,,,2,,,655363721616995,/story.php?story_fbid=655363721616995&id=356016438218393
Senator Cindy Hyde-Smith,,2019-09-10 15:42:24,"This National Science Foundation (NSF) award showcases The University of Southern Mississippi leadership and expertise in marine and ocean sciences research. I look forward to the launch of this new vessel, which will enhance exploration capabilities and research important to our state and the Gulf of Mexico",22,20,,2,,,,1,654888141664553,/story.php?story_fbid=654888141664553&id=356016438218393
Senator Cindy Hyde-Smith,,2019-09-10 14:43:13,The formation of this statewide council represents a heightened effort to stop pervasive and sinister acts of human trafficking in Mississippi. The coordination and support provided by the council will strengthen ongoing work in our communities to stop traffickers and help victims.,32,31,,,1,,,8,654862045000496,/story.php?story_fbid=654862045000496&id=356016438218393
"Senator Cindy Hyde-Smith,WLBT 3 On Your Side",WLBT 3 On Your Side,2019-09-10 10:15:28,"My condolences to the family of this bus driver, and my prayers are for a speedy recovery for the students involved.BREAKING: A school bus driver was killed and 7 children were injured in a school bus crash in north Mississippi It's unclear what caused the crash, but the bus ended up rolled over on the side of the road>>https://buff.ly/32ttVVU",98,49,,1,2,46,,17,654779691675398,/story.php?story_fbid=654779691675398&id=356016438218393
Senator Cindy Hyde-Smith,,2019-09-10 11:36:59,"The Rural Health Task Force, through the Health Resources and Services Administration (HRSA), is seeking input from you on how the U.S. Department of Health and Human Services can improve access to rural health care. I encourage Mississippians to participate in this comment period to provide ideas and info on what is and isn't working in rural areas. #ruralhealth",14,14,,,,,,6,654774918342542,/story.php?story_fbid=654774918342542&id=356016438218393
Senator Cindy Hyde-Smith,,2019-09-10 10:13:10,"It’s past time for a fair trade agreement for American farmers, ranchers, businesses and workers. Congress needs to act to continue economic growth, add more jobs, boost exports, and increase wages. #USMCANow",19,19,,,,,,1,654729578347076,/story.php?story_fbid=654729578347076&id=356016438218393
Senator Cindy Hyde-Smith,,2019-09-06 15:02:45,"My staff joined incoming U.S. Army Engineer Research and Development Center (ERDC) commander Colonel Teresa A. Schlosser and her husband Tim for the Change of Command ceremony. I look forward to working with you on U.S. Army Corps of Engineers, Headquarters Vicksburg District - USACE priorities. Also, a huge thank you to outgoing commander Colonel Ivan Beckman for his service.",41,41,,,,,,6,652316618588372,/story.php?story_fbid=652316618588372&id=356016438218393
Senator Cindy Hyde-Smith,,2019-09-06 14:42:45,"Mississippi State has established a well-respected program to prepare students, who might not otherwise have the necessary support, for college studies.  This seven-year grant gives the University and its partners the capacity to reach more youth, which will benefit our state in the long run.",29,29,,,,,,4,652306461922721,/story.php?story_fbid=652306461922721&id=356016438218393
Senator Cindy Hyde-Smith,,2019-09-06 14:02:45,This highly respected program offers students a chance to learn more about our democracy and earn a scholarship.  I encourage Mississippi students to apply to be part of a program that will include their peers from across the nation.,33,33,,,,,,7,652289028591131,/story.php?story_fbid=652289028591131&id=356016438218393
Senator Cindy Hyde-Smith,,2019-09-05 19:45:51,"I commend the work of all those involved with making the Base Camp Coding Academy a success. I was honored to visit with students and teachers as @usda rural development state director John Rounsaville announced a grant award to help purchase computers and equipment for their rural education and innovation hub. Also great visiting Mississippi small businesses Sartains True Value and Valley Lumber, who have benefited from @usda RD grants.",46,46,,,,,,2,651785495308151,/story.php?story_fbid=651785495308151&id=356016438218393
Senator Cindy Hyde-Smith,,2019-09-04 13:17:42,"In observation of #SuicidePreventionMonth and the U.S. Department of Veterans Affairs #BeThere initiative, reach out to a veteran or servicemember in your life. Even seemingly small acts can make a world of difference for someone going through a challenging time.",12,12,,,,,,1,650933892059978,/story.php?story_fbid=650933892059978&id=356016438218393
Senator Cindy Hyde-Smith,,2019-09-04 12:18:32,"School is officially back in session! Wishing all students, teachers, administrators, and parents a productive year of educational achievement.",12,12,,,,,,2,650906418729392,/story.php?story_fbid=650906418729392&id=356016438218393
Senator Cindy Hyde-Smith,,2019-09-02 13:01:50,Thank you to workers like you who help our economy thrive and grow. Happy Labor Day!,12,12,,,,,,4,649721412181226,/story.php?story_fbid=649721412181226&id=356016438218393
Senator Cindy Hyde-Smith,,2019-08-30 15:41:56,"Flooding, particularly in the Yazoo Backwater, has undermined the integrity of roads and highways.  Federal emergency transportation relief money will help us repair and restore these important routes.  https://www.hydesmith.senate.gov/miss-senators-announce-186-million-help-repair-flood-damaged-federal-roadways",97,85,,3,,9,,20,647961239023910,/story.php?story_fbid=647961239023910&id=356016438218393
Senator Cindy Hyde-Smith,,2019-08-30 11:29:11,"A highlight this week was accepting NASA's John C. Stennis Space Center invitation to help celebrate its annual Women's Equality Day & the 19th Amendment. Granting women the right to vote opened so many opportunities for us to lead in science, medicine, business & public service. It was also great to be briefed on Stennis Space Center facilities and outlook for NASA - National Aeronautics and Space Administration SLS Green Run rocket testing. Thank you, Dr. Gilbrech & Maury Vander, for hosting me.",69,60,,8,1,,,3,647848312368536,/story.php?story_fbid=647848312368536&id=356016438218393
Senator Cindy Hyde-Smith,,2019-08-29 13:23:44,"US Transportation Dept. bridge replacement grants for MS focused on rural areas. Twelve bridges will be replaced in Attala, Jefferson Davis, Lincoln, Marion, Tallahatchie, Walthall, and Yalobusha counties. #USDOT #USDOTFHWA",17,17,,,,,,2,647320002421367,/story.php?story_fbid=647320002421367&id=356016438218393
Senator Cindy Hyde-Smith,,2019-08-29 13:16:48,Great to be with @USDOT Sec. Elaine Chao today at the Coastal Transportation Summit In Biloxi. Economic growth & basic quality of life in MS require better infrastructure. We’ll keep working for additional appropriations specifically for bridge replacement and rehabilitation.,40,37,,3,,,,6,647316845755016,/story.php?story_fbid=647316845755016&id=356016438218393
Senator Cindy Hyde-Smith,,2019-08-29 12:27:00,"#HurricaneKatrina made landfall in Mississippi 14 years ago today, claiming lives and destroying homes, businesses and communities. I'm amazed at the resiliency of the people of the Gulf Coast and all Mississippi. We’ve stood strong in overcoming that historic disaster.",57,47,,3,,7,,6,647292685757432,/story.php?story_fbid=647292685757432&id=356016438218393
Senator Cindy Hyde-Smith,,2019-08-27 13:01:04,This morning’s Simpson County Council of Governments quarterly breakfast was a good time to share ideas and learn priorities. The work they do at the local level is complementary to our work in Washington.,64,64,,,,,,3,646174402535927,/story.php?story_fbid=646174402535927&id=356016438218393
Senator Cindy Hyde-Smith,,2019-08-26 16:43:33,"Took the opportunity after the U.S. Army Corps of Engineers, Headquarters meeting today to see flood damage at Eagle Lake and some of the recovery work needed in the Yazoo Backwater area.",167,134,,10,1,22,,25,645681465918554,/story.php?story_fbid=645681465918554&id=356016438218393
Senator Cindy Hyde-Smith,,2019-08-26 14:42:51,"Appreciate Maj Gen Mark Toy and U.S. Army Corps of Engineers, Headquarters officials for engaging in meaningful discussions as we continue to press for a resolution to persistent Yazoo Backwater flooding. And thanks to the Lower Mississippi River Museum and Riverfront Interpretive Site for hosting us for our Yazoo Backwater flood talks. They offer a virtual reality demonstration of Eagle Lake flooding.",243,217,,25,1,,,54,645634139256620,/story.php?story_fbid=645634139256620&id=356016438218393
Senator Cindy Hyde-Smith,,2019-08-25 11:22:07,"Happy 103rd birthday to the National Park Service. To celebrate, visit one of these MS national park site free of charge! https://www.nps.gov/state/ms/index.htm",37,36,,1,,,,,644958325990868,/story.php?story_fbid=644958325990868&id=356016438218393
Senator Cindy Hyde-Smith,,2019-08-23 17:34:34,Pleased with U.S. Department of Agriculture - Rural Development support of the MS Band of Choctaw Indians.,102,98,,4,,,,6,643919939428040,/story.php?story_fbid=643919939428040&id=356016438218393
Senator Cindy Hyde-Smith,,2019-08-23 17:30:13,‪Enjoyed meeting with Chief Cyrus Ben and Choctaw Princess Alice Jimmie to learn more about priorities for the MS Band of Choctaw Indians. ‬,117,115,,2,,,,2,643918016094899,/story.php?story_fbid=643918016094899&id=356016438218393
Senator Cindy Hyde-Smith,,2019-08-23 15:19:59,"‪MS music legend Marty Stuart has a great collection. Fortunate to have a chance to see some of it in Philadelphia, MS. ‬",54,54,,,,,,,643856752767692,/story.php?story_fbid=643856752767692&id=356016438218393
