source,shared_from,date,text,reactions,likes,ahah,love,wow,sigh,grrr,comments,post_id,url
Senator Cindy Hyde-Smith,,2019-12-05 17:04:50,https://www.hydesmith.senate.gov/miss-delegation-requests-federal-disaster-declaration-october-storm-damage,109,100,,8,,,1,12,720469185106448,/story.php?story_fbid=720469185106448&id=356016438218393
Senator Cindy Hyde-Smith,,2019-12-04 17:25:08,Donald J. Trump and U.S. Department of Agriculture Secretary Sonny Perdue complete new SNAP rule to restore the original intent of these benefits as temporary assistance to save taxpayer dollars while ensuring that those truly in need get help. https://www.hydesmith.senate.gov/hyde-smith-supports-tighter-usda-snap-work-requirements,64,56,1,7,,,,9,719638335189533,/story.php?story_fbid=719638335189533&id=356016438218393
Senator Cindy Hyde-Smith,,2019-12-03 17:16:31,"Such a sweet and inspiring story. Congratulations, Aubrey!  University of Mississippi Medical Center  Children’s of Mississippi  Children's Miracle Network Hospitals https://umc.edu/news/News_Articles/2019/12/Aubrey-Armstrong-Childrens-Miracle-Network-Hospitals-National-Champion.html",48,40,,8,,,,2,718782761941757,/story.php?story_fbid=718782761941757&id=356016438218393
Senator Cindy Hyde-Smith,,2019-12-02 17:59:37,"Pleased to cast my vote to confirm Dan Brouillette to be our new Secretary of Energy. I look forward to working with him to promote U.S. energy, science, and national security.",115,111,,4,,,,11,717987112021322,/story.php?story_fbid=717987112021322&id=356016438218393
Senator Cindy Hyde-Smith,,2019-12-02 15:55:50,"Our heartfelt condolences go out to Connie and the entire Nielsen Cochran family. As we recall his service to Mississippi, we wish him eternal peace. https://www.clarionledger.com/story/news/2019/12/02/nielsen-cochran-former-public-service-commissioner-dies/2589046001/",63,47,,1,,15,,2,717925325360834,/story.php?story_fbid=717925325360834&id=356016438218393
Senator Cindy Hyde-Smith,,2019-11-28 08:41:24,Wishing everyone a safe and happy Thanksgiving. Let's reflect and thank God for all of our many blessings. https://youtu.be/ArVh7jGkPM0,218,184,,34,,,,32,714219719064728,/story.php?story_fbid=714219719064728&id=356016438218393
Senator Cindy Hyde-Smith,,2019-11-26 19:50:09,Thank you secAF Barbara Barrett for coming down to Keesler Air Force Base and taking the time to hear from military families. It was great to have you in Mississippi!,117,111,,6,,,,8,712985352521498,/story.php?story_fbid=712985352521498&id=356016438218393
"Senator Cindy Hyde-Smith,The University of Southern Mississippi",The University of Southern Mississippi,2019-11-25 11:33:04,"I hope the National Science Foundation (NSF) R/V Gilbert R. Mason will serve as an inspiration to a new generation of researchers who cherish the Gulf of Mexico and its importance to all.A Gulf Coast Civil Rights icon is being honored as the namesake of a new, $100 million National Science Foundation oceanographic research ship, to be operated by the Gulf – Caribbean Oceanographic Consortium, led by The University of Southern Mississippi and the Louisiana Universities Marine Consortium. The official name of the vessel will be the Research Vessel (R/V) Gilbert R. Mason. For decades until his death in 2006, Dr. Gilbert Rutledge Mason Sr. was a pioneering Civil Rights leader and physician to the mariner community along the Gulf Coast. The slogan for the ship will be aequa mari, meaning equal access to the sea, to honor his life’s work and legacy. Read the full story: https://bit.ly/2qzREXr",45,43,,2,,,,11,711931379293562,/story.php?story_fbid=711931379293562&id=356016438218393
Senator Cindy Hyde-Smith,,2019-11-23 15:44:37,Cross-contamination can occur anywhere from the grocery store to your kitchen table. When handling raw meat & poultry remember to keep them & their juices separate from already cooked or ready-to-eat foods & fresh produce.,20,18,1,1,,,,8,710313056122061,/story.php?story_fbid=710313056122061&id=356016438218393
Senator Cindy Hyde-Smith,,2019-11-21 17:54:21,"The final phase of the City of Gulfport Tram Bridge development gets USDOT funding. Its project is part of a dynamic transit plan that will benefit residents, tourists & commerce on the MS Gulf Coast. Senator Roger Wicker Congressman Steven Palazzo https://www.hydesmith.senate.gov/wicker-hyde-smith-palazzo-announce-535-million-grant-downtown-gulfport-bridge",26,25,,1,,,,6,708683056285061,/story.php?story_fbid=708683056285061&id=356016438218393
Senator Cindy Hyde-Smith,,2019-11-21 13:25:59,Is this news any real surprise?  House Democrats are more focused on going after President Donald J. Trump than working on what the country needs. #USMCANow https://www.agri-pulse.com/articles/12864-pelosi-usmca-vote-could-slip-into-2020?utm_source=Instant+Update&utm_campaign=4901e9e54f-EMAIL_CAMPAIGN_2017_02_23_COPY_1808&utm_medium=email&utm_term=0_288ff2b53a-4901e9e54f-49178617,113,44,3,3,,15,48,47,708531952966838,/story.php?story_fbid=708531952966838&id=356016438218393
Senator Cindy Hyde-Smith,,2019-11-20 17:53:53,Expanding the technological infrastructure to allow distance learning will create so many opportunities for rural Mississippians. Glad to have the U.S. Department of Agriculture Rural Development invest in distance learning across our state.,40,37,,3,,,,6,707855136367853,/story.php?story_fbid=707855136367853&id=356016438218393
Senator Cindy Hyde-Smith,,2019-11-20 14:46:20,"Great to spend lunch with the MS Farm Bureau members, their president Mike McCormick, and Senator Roger Wicker. Their annual DC fly-in gives them an opportunity to promote Mississippi agriculture in the nation’s capital.",127,122,1,3,,1,,11,707757863044247,/story.php?story_fbid=707757863044247&id=356016438218393
Senator Cindy Hyde-Smith,,2019-11-20 13:19:12,"November is National COPD Awareness Month. It’s time to learn more about risk factors, symptoms and the best treatments. COPD, the fourth leading cause of death in the U.S., affects 185,000 Mississippians. Join me in raising awareness so we can all @BreatheBetter. Learn more at copd.nhlbi.nih.gov",20,18,,,1,1,,6,707704619716238,/story.php?story_fbid=707704619716238&id=356016438218393
Senator Cindy Hyde-Smith,,2019-11-19 18:59:25,"Congratulations to MS Farm Bureau President Mike McCormick, who has been named to the FCC Precision Agriculture Task Force. His experience gives him a good chance to be a key player on this panel.",192,182,,9,,,1,18,707079416445425,/story.php?story_fbid=707079416445425&id=356016438218393
Senator Cindy Hyde-Smith,,2019-11-19 14:35:55,The COASTAL Act has my full support now that it includes my amendment to block GOMESA funding for noncoastal projects. U.S. Senator Bill Cassidy wrote this good bill to increase revenue sharing for energy-producing Gulf Coast states.,12,12,,,,,,,706937529792947,/story.php?story_fbid=706937529792947&id=356016438218393
Senator Cindy Hyde-Smith,,2019-11-19 12:14:09,"The US-South Korea rice agreement is another win for Mississippi agriculture. Along with China again accepting US poultry products, Mississippi producers will benefit directly from this good work by the Trump administration. Read my press release here: https://www.hydesmith.senate.gov/hyde-smith-welcomes-us-south-korea-rice-agreement-good-mississippi-producers",80,72,1,7,,,,10,706858029800897,/story.php?story_fbid=706858029800897&id=356016438218393
"Senator Cindy Hyde-Smith,Greenwood Commonwealth",Greenwood Commonwealth,2019-11-14 03:00:02,"Enjoyed this story of the faith community of Greenwood coming together to install an inspirational sign of faith in the Cotton Capital of the World.You’ve most likely seen them before — the white, towering crosses dotted along highways that run through Batesville, Eupora, Winona and other places in Mississippi.",65,57,2,4,1,,1,16,705098196643547,/story.php?story_fbid=705098196643547&id=356016438218393
"Senator Cindy Hyde-Smith,The Meridian Star",The Meridian Star,2019-11-15 10:18:54,"A warm congratulations to Temple Congregation Beth Israel for their 150th anniversary!In honor of this week's 150th Anniversary of Temple Congregation Beth Israel in Meridian, members from near and far are sharing their reflections on being a part of the congregation.",28,26,,1,,,1,5,704381600048540,/story.php?story_fbid=704381600048540&id=356016438218393
Senator Cindy Hyde-Smith,,2019-11-15 19:21:53,Mississippi is fortunate to have a strong Airbus presence. Today it celebrated its 50/15 USA & Miss. anniversary. Happy to be represented there.,39,37,,1,,,1,10,703760190110681,/story.php?story_fbid=703760190110681&id=356016438218393
Senator Cindy Hyde-Smith,,2019-11-15 11:51:11,Insulin Affordability Data Collection Act will help clear up why the market is out of whack.  Insulin affordability is important to MS and around the world.  https://www.hydesmith.senate.gov/wicker-hyde-smith-lead-effort-study-insulin-affordability Senator Roger Wicker Senator Kevin Cramer U.S. Senator Tina Smith American Diabetes Association JDRF,100,96,,2,,,2,25,703509516802415,/story.php?story_fbid=703509516802415&id=356016438218393
Senator Cindy Hyde-Smith,,2019-11-14 12:38:56,"It’s wonderful to have Diane Adkins of Coldwater selected as a 2019 “Angel in Adoption” from Mississippi. Her inspirational work on behalf of children in need is deserving of this Congressional Coalition on Adoption Institute Angels in Adoption honor. Congratulations, Diane, and thank you for all you do.",104,75,,25,,1,3,87,702696416883725,/story.php?story_fbid=702696416883725&id=356016438218393
"Senator Cindy Hyde-Smith,Huntington Ingalls Industries",Huntington Ingalls Industries,2019-11-13 12:30:13,Look forward to additional progress by our MS shipbuilders on the newest U.S. Coast Guard's National Security Cutter. These technologically advanced and versatile ships keep the US Coast Guard well equipped to protect the homeland and support national security missions.#IngallsShipbuilding officially started fabrication of the U.S. Coast Guard’s newest Legend-class national security cutter (NSC) Calhoun (WMSL 759) yesterday. #NSC10 Read the press release: http://ow.ly/n61k50x9VLR,59,55,,2,,,2,24,702574710229229,/story.php?story_fbid=702574710229229&id=356016438218393
Senator Cindy Hyde-Smith,,2019-11-13 16:24:41,Navy Secretary Spencer and the U.S. Department of Defense (DoD) will honor the late Senator Thad Cochran by naming a future guided-missile destroyer after him. A USS Thad Cochran destroyer is a fitting tribute to a man who was always a such a strong advocate for Mississippi and our nation’s defense. https://www.hydesmith.senate.gov/hyde-smith-us-navy-will-name-guided-missile-destroyer-us-senator-thad-cochran,193,177,,16,,,,17,702004910286209,/story.php?story_fbid=702004910286209&id=356016438218393
Senator Cindy Hyde-Smith,,2019-11-13 14:46:52,"Enjoyed visiting with Dan Brouillette, President Trump’s choice to lead U.S. Department of Energy, in an era where the US is the world’s leading energy producer. Look forward to hearing more from him at his confirmation hearing on Thursday.",157,148,,4,,,5,22,701956743624359,/story.php?story_fbid=701956743624359&id=356016438218393
Senator Cindy Hyde-Smith,,2019-11-12 16:04:49,Interested in interning in my office? We're currently accepting applications for spring semester and summer internships! You can find more details and the application at www.hydesmith.senate.gov/internships,115,112,,3,,,,19,701237077029659,/story.php?story_fbid=701237077029659&id=356016438218393
Senator Cindy Hyde-Smith,,2019-11-08 13:48:40,"On Veterans Day we take time to recognize that we all benefit from the sacrifices of our veterans.  The freedoms and liberties we enjoy every day are because of their courage and bravery.  They deserve our admiration and gratitude, not just on Veterans Day, but every day.",123,106,,17,,,,14,698063877346979,/story.php?story_fbid=698063877346979&id=356016438218393
Senator Cindy Hyde-Smith,,2019-11-07 16:53:03,"Ensuring homes, farms, and businesses in rural Mississippi and elsewhere have internet access won’t be easy.  Today’s testimony indicates that effective investment of taxpayer dollars on this challenge will require federal agencies to collaborate more effectively.  There’s no need to make this harder than it has to be.",31,29,,2,,,,10,697370127416354,/story.php?story_fbid=697370127416354&id=356016438218393
Senator Cindy Hyde-Smith,,2019-11-07 13:03:02,"Doug Davis has the legislative, political, and personal abilities needed to administer my Senate offices.  I believe he will serve me and all Mississippians well as my chief of staff.  I am also grateful to Brad White for his leadership and skills, which have been invaluable to me.",279,248,,31,,,,43,697257564094277,/story.php?story_fbid=697257564094277&id=356016438218393
Senator Cindy Hyde-Smith,,2019-11-06 16:43:29,"BUILD grants are highly competitive. Gulfport and Starkville will benefit from federal funding that will help them continue their economic growth through transportation, infrastructure, and safety improvements.",39,33,,6,,,,2,696603900826310,/story.php?story_fbid=696603900826310&id=356016438218393
Senator Cindy Hyde-Smith,,2019-11-06 13:47:40,I joined Sen. Wicker and Reps. Kelly and Guest in signing a letter encouraging the U.S. Fish and Wildlife Service to rewrite the federal rules that limit the ability of livestock producers and catfish farmers to fight losses due to predatory birds.,42,38,3,,,,1,10,696513974168636,/story.php?story_fbid=696513974168636&id=356016438218393
Senator Cindy Hyde-Smith,,2019-11-05 11:54:24,"Kudos to University of Southern Mississippi, Mississippi State University and The University of Mississippi - Ole Miss for their work to support veterans. Let’s continue making progress to ensure bright futures for those who fight to defend this great nation.",44,41,,3,,,,2,695689424251091,/story.php?story_fbid=695689424251091&id=356016438218393
Senator Cindy Hyde-Smith,,2019-11-01 15:09:15,"There’s a lot of joy in DC over the @Nationals #WorldSeries win! Proud it was also a win for University of Southern Mississippi, too. Wednesday night, fellow alum Brian Dozier became the first former USM player to win a MLB World Series. Congrats Brian! Mississippi is proud of you! #SMTTT",128,116,,12,,,,10,692716284548405,/story.php?story_fbid=692716284548405&id=356016438218393
Senator Cindy Hyde-Smith,,2019-11-01 14:47:04,"While Democrats obsessed over impeachment, Republicans focused on strengthening our economy for American families. 128,000 new jobs in October. Now let’s pass #USMCA to create more!",73,64,3,6,,,,21,692704777882889,/story.php?story_fbid=692704777882889&id=356016438218393
Senator Cindy Hyde-Smith,,2019-10-31 17:26:50,,90,69,5,6,,2,8,14,691994411287259,/story.php?story_fbid=691994411287259&id=356016438218393
Senator Cindy Hyde-Smith,,2019-10-31 17:26:37,,85,74,1,8,,1,1,21,691994197953947,/story.php?story_fbid=691994197953947&id=356016438218393
Senator Cindy Hyde-Smith,,2019-10-31 12:40:47,"For too long, Medicare rules have effectively held up research and innovation on new dialysis technologies, which has real consequences for many people in Mississippi and elsewhere who suffer from kidney disease.",31,28,,1,1,1,,5,691834374636596,/story.php?story_fbid=691834374636596&id=356016438218393
Senator Cindy Hyde-Smith,,2019-10-30 16:41:39,,25,22,,3,,,,2,691171931369507,/story.php?story_fbid=691171931369507&id=356016438218393
Senator Cindy Hyde-Smith,,2019-10-30 15:17:08,"The usefulness and value of telehealth technologies continues to grow as more people benefit from this affordable health care delivery option. This bipartisan bill would continue our work to tear down the barriers to telehealth.  Its enactment would help Mississippi, already a national leader in telemedicine outreach, deliver care to even more people, especially those in underserved and rural communities.",28,27,,1,,,,3,691131431373557,/story.php?story_fbid=691131431373557&id=356016438218393
Senator Cindy Hyde-Smith,,2019-10-30 13:15:20,,26,18,,7,1,,,13,2501722466578566,/story.php?story_fbid=2501722466578566&id=356016438218393
Senator Cindy Hyde-Smith,,2019-10-30 12:05:34,,3,3,,,,,,,691017511384949,/story.php?story_fbid=691017511384949&id=356016438218393
"Senator Cindy Hyde-Smith,The Hill",The Hill,2019-10-27 09:40:05,"‪The significance of taking out this evil ISIS leader can't be overstated. Proud of US Special Ops and our Commander in Chief @realdonaldtrump.‬BREAKING: Minutes ago, President Trump officially confirmed that ISIS leader Abu Bakr al-Baghdadi was killed in a US military raid. ""Last night, the United States brought the world’s number one terrorist leader to justice,"" Trump announced in a televised address Sunday morning.",297,256,1,39,1,,,16,688602561626444,/story.php?story_fbid=688602561626444&id=356016438218393
Senator Cindy Hyde-Smith,,2019-10-25 14:09:42,"Unsecured prescription drugs contribute to the opioid crisis in Mississippi. This Saturday be part of National Prescription Drug #TakeBackDay. Take your unwanted, expired, and unused prescriptions to a drop-off location near you. https://takebackday.dea.gov/?gclid=Cj0KCQjwl8XtBRDAARIsAKfwtxDSs8ySs1dIh8XU4lpH4sHPm-H0vk5DJmA3jZyyL90wTbegt-w4f-8aAqkOEALw_wcB#collection-locator",5,4,,1,,,,1,687198398433527,/story.php?story_fbid=687198398433527&id=356016438218393
Senator Cindy Hyde-Smith,,2019-10-24 17:56:19,,119,98,2,18,1,,,23,686518028501564,/story.php?story_fbid=686518028501564&id=356016438218393
Senator Cindy Hyde-Smith,,2019-10-24 17:55:55,,135,115,5,15,,,,23,686517765168257,/story.php?story_fbid=686517765168257&id=356016438218393
Senator Cindy Hyde-Smith,,2019-10-23 16:36:01,"President Trump and his administration wasted no time in working to rewrite NAFTA to reflect today’s economic realities. Those talks produced #USMCA, which was unveiled more than a year ago. Democrats’ inexcusable foot dragging is just hurting American consumers and businesses.",8,8,,,,,,3,685676198585747,/story.php?story_fbid=685676198585747&id=356016438218393
Senator Cindy Hyde-Smith,,2019-10-23 16:33:46,"There is no good reason for the House to have held up this 21st century trade agreement, and it is time to finally take a vote, send it to the Senate, and get it done. #USMCANow",51,48,2,,,1,,7,685675108585856,/story.php?story_fbid=685675108585856&id=356016438218393
Senator Cindy Hyde-Smith,,2019-10-23 16:13:21,Continued delays by Democrats to obstruct passage of  USMCA is hurting Mississippi and other states that sell agricultural and manufactured goods to America’s two largest trading partners.,106,96,4,4,,1,1,18,685664285253605,/story.php?story_fbid=685664285253605&id=356016438218393
Senator Cindy Hyde-Smith,,2019-10-22 17:24:41,Honored to be at the annual National Rural Lenders Association conference today to thank its members for their work to expand access to credit in rural communities to build up small-town businesses and rural hospitals.,68,63,1,4,,,,1,684863438667023,/story.php?story_fbid=684863438667023&id=356016438218393
Senator Cindy Hyde-Smith,,2019-10-22 14:15:26,,24,24,,,,,,1,684747155345318,/story.php?story_fbid=684747155345318&id=356016438218393
Senator Cindy Hyde-Smith,,2019-10-22 13:01:37,"“Community health centers provide affordable health care to our nation’s most vulnerable citizens.  If the CHCF expires, community health centers will lose seventy percent of their federal grant funding. According to the Health Resources and Services Administration, this would cause an estimated 2,400 site closures, 47,000 lost jobs, and threaten the health care of approximately 9 million Americans.""",21,21,,,,,,1,684700108683356,/story.php?story_fbid=684700108683356&id=356016438218393
Senator Cindy Hyde-Smith,,2019-10-18 14:45:28,"U.S. Senator Cindy Hyde-Smith (R-Miss.), a member of the Senate Committee on Agriculture, Nutrition, and Forestry, is seeking assurances that the U.S. Forest Service will act in a timely manner to complete environmental reviews needed to transfer lands to the Scenic Rivers Development Alliance for economic development and related improvements at Okhissa Lake.",65,62,,3,,,,13,681278549025512,/story.php?story_fbid=681278549025512&id=356016438218393
Senator Cindy Hyde-Smith,,2019-10-18 14:43:23,"The U.S. Forest Service has worked well with the local sponsors, and things have been moving smoothly.  However, various studies, such as an environmental assessment, must take place before the transfer can occur.  My constituents are concerned about any potential unnecessary delays, as well as the costs of these requirements.",39,38,1,,,,,6,681277239025643,/story.php?story_fbid=681277239025643&id=356016438218393
Senator Cindy Hyde-Smith,,2019-10-18 12:00:10,‪Ran into Mississippi's own Ben and Erin Napier from HGTV’s Home Town! So proud of how they represent our state. ‬,523,481,,42,,,,21,681171129036254,/story.php?story_fbid=681171129036254&id=356016438218393
Senator Cindy Hyde-Smith,,2019-10-17 11:28:13,These USDA funds will support water service system upgrades for rural water associations that might not otherwise have access to the capital necessary to provide reliable and safe water to residences and businesses. I appreciate that these water associations in Lamar and Copiah counties will benefit from this important USDA Rural Development program,27,27,,,,,,3,680308789122488,/story.php?story_fbid=680308789122488&id=356016438218393
Senator Cindy Hyde-Smith,,2019-10-16 17:36:14,"Congratulations, United States Air Force Secretary Barrett.  I look forward to working with you.",92,89,,3,,,,8,679755239177843,/story.php?story_fbid=679755239177843&id=356016438218393
Senator Cindy Hyde-Smith,,2019-10-16 15:27:04,Happy National Support Your Local Chamber Day. We appreciate our local chambers of commerce for all they do to support local businesses and economies. #ChamberProud,46,45,,1,,,,5,679693042517396,/story.php?story_fbid=679693042517396&id=356016438218393
Senator Cindy Hyde-Smith,,2019-10-15 10:20:42,"Living in a rural area with limited high-speed internet? Join Mississippi Rural Broadband Workshops in Raymond or Verona next week to learn more about solutions to broadband issues.  Register here by Wednesday, Oct. 16:  Raymond https://www.eventbrite.com/e/mississippi-rural-broadband-workshop-raymond-registration-72398761645 Verona https://www.eventbrite.com/e/mississippi-rural-broadband-workshop-verona-tickets-72599574281",19,19,,,,,,1,678752375944796,/story.php?story_fbid=678752375944796&id=356016438218393
Senator Cindy Hyde-Smith,,2019-10-12 13:32:11,Thank you to the farm families who work every day to clothe and feed us. Our family knows firsthand the time and commitment it takes. #NationalFarmersDay,133,118,2,12,1,,,9,676681706151863,/story.php?story_fbid=676681706151863&id=356016438218393
Senator Cindy Hyde-Smith,,2019-10-12 13:16:18,‪Grateful to join Mayor Cox and Brookhaven-Lincoln County Airport officials for a tour of the facility. They are beginning general aviation infrastructure improvements with the help of a recent FAA grant. ‬,82,79,,3,,,,6,676670299486337,/story.php?story_fbid=676670299486337&id=356016438218393
Senator Cindy Hyde-Smith,,2019-10-11 16:47:53,"During this #National4HWeek, I enjoyed seeing Mississippians display their 4H pride through their work to teach young leaders the skills necessary to reach their full potential. #InspireKidsToDo",33,31,,2,,,,5,676062722880428,/story.php?story_fbid=676062722880428&id=356016438218393
Senator Cindy Hyde-Smith,,2019-10-09 16:05:42,"On a visit to Golden Triangle Development LINK, I was pleased to learn more about ongoing work to keep making progress on economic development and job growth in the Golden Triangle Region.",29,29,,,,,,6,674667603019940,/story.php?story_fbid=674667603019940&id=356016438218393
Senator Cindy Hyde-Smith,,2019-10-09 15:00:03,"Appreciate SDI Steel Dynamics for showing me around its outstanding Columbus facility. President Trump's actions to promote US steel are helping but like many companies across Mississippi, they are awaiting action on USMCA. #USMCANow",37,37,,,,,,3,674637219689645,/story.php?story_fbid=674637219689645&id=356016438218393
Senator Cindy Hyde-Smith,,2019-10-07 13:44:42,"This year, Mississippi lost four firefighters in the line of duty. Please join in a memorial service tomorrow at the Mississippi Fire Academy to honor their lives and their service to protect our communities.",35,27,,,,8,,8,673181473168553,/story.php?story_fbid=673181473168553&id=356016438218393
Senator Cindy Hyde-Smith,,2019-10-04 13:48:30,My staff was in attendance for The Concourse groundbreaking in Panola County. This project recently received a joint U.S. Department of Labor Delta Regional Authority grant award to support a new workforce center.,43,42,,1,,,,10,671051603381540,/story.php?story_fbid=671051603381540&id=356016438218393
Senator Cindy Hyde-Smith,,2019-10-04 10:41:02,"The unemployment rate is at its lowest in 50 YEARS! American workers continue to see the benefit of pro-growth, pro-business polices.",30,27,1,2,,,,8,670943426725691,/story.php?story_fbid=670943426725691&id=356016438218393
Senator Cindy Hyde-Smith,,2019-10-03 11:03:23,"Praying for a speedy recovery for Alaska’s 4th Brigade Combat Team (Airborne), 25th Infantry Division. Thanks to paramedics, first responders and Forrest General Hospital for a quick response and treatment.",73,59,,3,,11,,6,670279053458795,/story.php?story_fbid=670279053458795&id=356016438218393
Senator Cindy Hyde-Smith,,2019-10-02 11:56:40,A reminder to submit your feedback to U.S. Department of Health and Human Services by Oct. 9 on how to improve health care in rural America. They want and need to hear from you.  Instructions are available here:,6,6,,,,,,2,669624353524265,/story.php?story_fbid=669624353524265&id=356016438218393
